| k3s version| Kubernetes | Kine | SQLite | Etcd | Containerd | Runc | Flannel | Metrics-server | Traefik | CoreDNS | Helm-controller | Local-path-provisioner  |
| ----- | ----- | ----- | ----- | ----- | ----- | ----- | ----- | ----- | ----- | ----- | ----- | -----  |
| v1.27.10+k3s2 | [v1.27.10](https://github.com/kubernetes/kubernetes/blob/master/CHANGELOG/CHANGELOG-1.27.md#v12710) | [v0.11.0](https://github.com/k3s-io/kine/releases/tag/v0.11.0) | [3.42.0](https://sqlite.org/releaselog/3_42_0.html) | [v3.5.9-k3s1](https://github.com/k3s-io/etcd/releases/tag/v3.5.9-k3s1) | [v1.7.11-k3s2.27](https://github.com/k3s-io/containerd/releases/tag/v1.7.11-k3s2.27) | [v1.1.12-k3s1](https://github.com/opencontainers/runc/releases/tag/v1.1.12-k3s1) | [v0.22.2](https://github.com/flannel-io/flannel/releases/tag/v0.22.2) | [v0.6.3](https://github.com/kubernetes-sigs/metrics-server/releases/tag/v0.6.3) | [v2.10.5](https://github.com/traefik/traefik/releases/tag/v2.10.5) | [v1.10.1](https://github.com/coredns/coredns/releases/tag/v1.10.1) | [v0.15.8](https://github.com/k3s-io/helm-controller/releases/tag/v0.15.8) | [v0.0.24](https://github.com/rancher/local-path-provisioner/releases/tag/v0.0.24)  |
| v1.27.9+k3s1 | [v1.27.9](https://github.com/kubernetes/kubernetes/blob/master/CHANGELOG/CHANGELOG-1.27.md#v1279) | [v0.11.0](https://github.com/k3s-io/kine/releases/tag/v0.11.0) | [3.42.0](https://sqlite.org/releaselog/3_42_0.html) | [v3.5.9-k3s1](https://github.com/k3s-io/etcd/releases/tag/v3.5.9-k3s1) | [v1.7.11-k3s2.27](https://github.com/k3s-io/containerd/releases/tag/v1.7.11-k3s2.27) | [v1.1.10](https://github.com/opencontainers/runc/releases/tag/v1.1.10) | [v0.22.2](https://github.com/flannel-io/flannel/releases/tag/v0.22.2) | [v0.6.3](https://github.com/kubernetes-sigs/metrics-server/releases/tag/v0.6.3) | [v2.10.5](https://github.com/traefik/traefik/releases/tag/v2.10.5) | [v1.10.1](https://github.com/coredns/coredns/releases/tag/v1.10.1) | [v0.15.4](https://github.com/k3s-io/helm-controller/releases/tag/v0.15.4) | [v0.0.24](https://github.com/rancher/local-path-provisioner/releases/tag/v0.0.24)  |
| v1.27.8+k3s2 | [v1.27.8](https://github.com/kubernetes/kubernetes/blob/master/CHANGELOG/CHANGELOG-1.27.md#v1278) | [v0.11.0](https://github.com/k3s-io/kine/releases/tag/v0.11.0) | [3.42.0](https://sqlite.org/releaselog/3_42_0.html) | [v3.5.9-k3s1](https://github.com/k3s-io/etcd/releases/tag/v3.5.9-k3s1) | [v1.7.7-k3s1.27](https://github.com/k3s-io/containerd/releases/tag/v1.7.7-k3s1.27) | [v1.1.8](https://github.com/opencontainers/runc/releases/tag/v1.1.8) | [v0.22.2](https://github.com/flannel-io/flannel/releases/tag/v0.22.2) | [v0.6.3](https://github.com/kubernetes-sigs/metrics-server/releases/tag/v0.6.3) | [v2.10.5](https://github.com/traefik/traefik/releases/tag/v2.10.5) | [v1.10.1](https://github.com/coredns/coredns/releases/tag/v1.10.1) | [v0.15.4](https://github.com/k3s-io/helm-controller/releases/tag/v0.15.4) | [v0.0.24](https://github.com/rancher/local-path-provisioner/releases/tag/v0.0.24)  |
| v1.27.7+k3s2 | [v1.27.7](https://github.com/kubernetes/kubernetes/blob/master/CHANGELOG/CHANGELOG-1.27.md#v1277) | [v0.10.3](https://github.com/k3s-io/kine/releases/tag/v0.10.3) | [3.42.0](https://sqlite.org/releaselog/3_42_0.html) | [v3.5.9-k3s1](https://github.com/k3s-io/etcd/releases/tag/v3.5.9-k3s1) | [v1.7.7-k3s1.27](https://github.com/k3s-io/containerd/releases/tag/v1.7.7-k3s1.27) | [v1.1.8](https://github.com/opencontainers/runc/releases/tag/v1.1.8) | [v0.22.2](https://github.com/flannel-io/flannel/releases/tag/v0.22.2) | [v0.6.3](https://github.com/kubernetes-sigs/metrics-server/releases/tag/v0.6.3) | [v2.10.5](https://github.com/traefik/traefik/releases/tag/v2.10.5) | [v1.10.1](https://github.com/coredns/coredns/releases/tag/v1.10.1) | [v0.15.4](https://github.com/k3s-io/helm-controller/releases/tag/v0.15.4) | [v0.0.24](https://github.com/rancher/local-path-provisioner/releases/tag/v0.0.24)  |
| v1.27.7+k3s1 | [v1.27.7](https://github.com/kubernetes/kubernetes/blob/master/CHANGELOG/CHANGELOG-1.27.md#v1277) | [v0.10.3](https://github.com/k3s-io/kine/releases/tag/v0.10.3) | [3.42.0](https://sqlite.org/releaselog/3_42_0.html) | [v3.5.9-k3s1](https://github.com/k3s-io/etcd/releases/tag/v3.5.9-k3s1) | [v1.7.7-k3s1.27](https://github.com/k3s-io/containerd/releases/tag/v1.7.7-k3s1.27) | [v1.1.8](https://github.com/opencontainers/runc/releases/tag/v1.1.8) | [v0.22.2](https://github.com/flannel-io/flannel/releases/tag/v0.22.2) | [v0.6.3](https://github.com/kubernetes-sigs/metrics-server/releases/tag/v0.6.3) | [v2.10.5](https://github.com/traefik/traefik/releases/tag/v2.10.5) | [v1.10.1](https://github.com/coredns/coredns/releases/tag/v1.10.1) | [v0.15.4](https://github.com/k3s-io/helm-controller/releases/tag/v0.15.4) | [v0.0.24](https://github.com/rancher/local-path-provisioner/releases/tag/v0.0.24)  |
| v1.27.6+k3s1 | [v1.27.6](https://github.com/kubernetes/kubernetes/blob/master/CHANGELOG/CHANGELOG-1.27.md#v1276) | [v0.10.3](https://github.com/k3s-io/kine/releases/tag/v0.10.3) | [3.42.0](https://sqlite.org/releaselog/3_42_0.html) | [v3.5.9-k3s1](https://github.com/k3s-io/etcd/releases/tag/v3.5.9-k3s1) | [v1.7.6-k3s1.27](https://github.com/k3s-io/containerd/releases/tag/v1.7.6-k3s1.27) | [v1.1.8](https://github.com/opencontainers/runc/releases/tag/v1.1.8) | [v0.22.2](https://github.com/flannel-io/flannel/releases/tag/v0.22.2) | [v0.6.3](https://github.com/kubernetes-sigs/metrics-server/releases/tag/v0.6.3) | [v2.9.10](https://github.com/traefik/traefik/releases/tag/v2.9.10) | [v1.10.1](https://github.com/coredns/coredns/releases/tag/v1.10.1) | [v0.15.4](https://github.com/k3s-io/helm-controller/releases/tag/v0.15.4) | [v0.0.24](https://github.com/rancher/local-path-provisioner/releases/tag/v0.0.24)  |
| v1.27.5+k3s1 | [v1.27.5](https://github.com/kubernetes/kubernetes/blob/master/CHANGELOG/CHANGELOG-1.27.md#v1275) | [v0.10.2](https://github.com/k3s-io/kine/releases/tag/v0.10.2) | [3.42.0](https://sqlite.org/releaselog/3_42_0.html) | [v3.5.9-k3s1](https://github.com/k3s-io/etcd/releases/tag/v3.5.9-k3s1) | [v1.7.3-k3s1](https://github.com/k3s-io/containerd/releases/tag/v1.7.3-k3s1) | [v1.1.8](https://github.com/opencontainers/runc/releases/tag/v1.1.8) | [v0.22.2](https://github.com/flannel-io/flannel/releases/tag/v0.22.2) | [v0.6.3](https://github.com/kubernetes-sigs/metrics-server/releases/tag/v0.6.3) | [v2.9.10](https://github.com/traefik/traefik/releases/tag/v2.9.10) | [v1.10.1](https://github.com/coredns/coredns/releases/tag/v1.10.1) | [v0.15.4](https://github.com/k3s-io/helm-controller/releases/tag/v0.15.4) | [v0.0.24](https://github.com/rancher/local-path-provisioner/releases/tag/v0.0.24)  |
| v1.27.4+k3s1 | [v1.27.4](https://github.com/kubernetes/kubernetes/blob/master/CHANGELOG/CHANGELOG-1.27.md#v1274) | [v0.10.1](https://github.com/k3s-io/kine/releases/tag/v0.10.1) | [3.39.2](https://sqlite.org/releaselog/3_39_2.html) | [v3.5.7-k3s1](https://github.com/k3s-io/etcd/releases/tag/v3.5.7-k3s1) | [v1.7.1-k3s1](https://github.com/k3s-io/containerd/releases/tag/v1.7.1-k3s1) | [v1.1.7](https://github.com/opencontainers/runc/releases/tag/v1.1.7) | [v0.22.0](https://github.com/flannel-io/flannel/releases/tag/v0.22.0) | [v0.6.3](https://github.com/kubernetes-sigs/metrics-server/releases/tag/v0.6.3) | [v2.9.10](https://github.com/traefik/traefik/releases/tag/v2.9.10) | [v1.10.1](https://github.com/coredns/coredns/releases/tag/v1.10.1) | [v0.15.2](https://github.com/k3s-io/helm-controller/releases/tag/v0.15.2) | [v0.0.24](https://github.com/rancher/local-path-provisioner/releases/tag/v0.0.24)  |
| v1.27.3+k3s1 | [v1.27.3](https://github.com/kubernetes/kubernetes/blob/master/CHANGELOG/CHANGELOG-1.27.md#v1273) | [v0.10.1](https://github.com/k3s-io/kine/releases/tag/v0.10.1) | [3.39.2](https://sqlite.org/releaselog/3_39_2.html) | [v3.5.7-k3s1](https://github.com/k3s-io/etcd/releases/tag/v3.5.7-k3s1) | [v1.7.1-k3s1](https://github.com/k3s-io/containerd/releases/tag/v1.7.1-k3s1) | [v1.1.7](https://github.com/opencontainers/runc/releases/tag/v1.1.7) | [v0.22.0](https://github.com/flannel-io/flannel/releases/tag/v0.22.0) | [v0.6.3](https://github.com/kubernetes-sigs/metrics-server/releases/tag/v0.6.3) | [v2.9.10](https://github.com/traefik/traefik/releases/tag/v2.9.10) | [v1.10.1](https://github.com/coredns/coredns/releases/tag/v1.10.1) | [v0.15.0](https://github.com/k3s-io/helm-controller/releases/tag/v0.15.0) | [v0.0.24](https://github.com/rancher/local-path-provisioner/releases/tag/v0.0.24)  |
| v1.27.2+k3s1 | [v1.27.2](https://github.com/kubernetes/kubernetes/blob/master/CHANGELOG/CHANGELOG-1.27.md#v1272) | [v0.10.1](https://github.com/k3s-io/kine/releases/tag/v0.10.1) | [3.39.2](https://sqlite.org/releaselog/3_39_2.html) | [v3.5.7-k3s1](https://github.com/k3s-io/etcd/releases/tag/v3.5.7-k3s1) | [v1.7.1-k3s1](https://github.com/k3s-io/containerd/releases/tag/v1.7.1-k3s1) | [v1.1.7](https://github.com/opencontainers/runc/releases/tag/v1.1.7) | [v0.21.4](https://github.com/flannel-io/flannel/releases/tag/v0.21.4) | [v0.6.2](https://github.com/kubernetes-sigs/metrics-server/releases/tag/v0.6.2) | [v2.9.10](https://github.com/traefik/traefik/releases/tag/v2.9.10) | [v1.10.1](https://github.com/coredns/coredns/releases/tag/v1.10.1) | [v0.14.0](https://github.com/k3s-io/helm-controller/releases/tag/v0.14.0) | [v0.0.24](https://github.com/rancher/local-path-provisioner/releases/tag/v0.0.24)  |
| v1.27.1+k3s1 | [v1.27.1](https://github.com/kubernetes/kubernetes/blob/master/CHANGELOG/CHANGELOG-1.27.md#v1271) | [v0.9.9](https://github.com/k3s-io/kine/releases/tag/v0.9.9) | [3.39.2](https://sqlite.org/releaselog/3_39_2.html) | [v3.5.7-k3s1](https://github.com/k3s-io/etcd/releases/tag/v3.5.7-k3s1) | [v1.6.19-k3s1](https://github.com/k3s-io/containerd/releases/tag/v1.6.19-k3s1) | [v1.1.5](https://github.com/opencontainers/runc/releases/tag/v1.1.5) | [v0.21.4](https://github.com/flannel-io/flannel/releases/tag/v0.21.4) | [v0.6.2](https://github.com/kubernetes-sigs/metrics-server/releases/tag/v0.6.2) | [v2.9.4](https://github.com/traefik/traefik/releases/tag/v2.9.4) | [v1.10.1](https://github.com/coredns/coredns/releases/tag/v1.10.1) | [v0.13.3](https://github.com/k3s-io/helm-controller/releases/tag/v0.13.3) | [v0.0.24](https://github.com/rancher/local-path-provisioner/releases/tag/v0.0.24)  |



| Version | Release date | US date | EU date | Upstream release date | US date | EU date | Days since upstream |
| ----- | ----- | ----- | ----- | ----- | ----- | ----- | ----- |
| [v1.27.10+k3s2](k3s-v1.27.md#release-v12710k3s2) | Feb 06 2024 | 02/06/24 | 2024-02-06 | Jan 17 2024 | 01/17/24 | 2024-01-17 | 20 days |
| [v1.27.9+k3s1](k3s-v1.27.md#release-v1279k3s1) | Dec 27 2023 | 12/27/23 | 2023-12-27 | Dec 20 2023 | 12/20/23 | 2023-12-20 | 7 days |
| [v1.27.8+k3s2](k3s-v1.27.md#release-v1278k3s2) | Dec 07 2023 | 12/07/23 | 2023-12-07 | Nov 15 2023 | 11/15/23 | 2023-11-15 | 22 days |
| [v1.27.7+k3s2](k3s-v1.27.md#release-v1277k3s2) | Nov 08 2023 | 11/08/23 | 2023-11-08 | Oct 18 2023 | 10/18/23 | 2023-10-18 | 21 days |
| [v1.27.7+k3s1](k3s-v1.27.md#release-v1277k3s1) | Oct 30 2023 | 10/30/23 | 2023-10-30 | Oct 18 2023 | 10/18/23 | 2023-10-18 | 12 days |
| [v1.27.6+k3s1](k3s-v1.27.md#release-v1276k3s1) | Sep 20 2023 | 09/20/23 | 2023-09-20 | Sep 13 2023 | 09/13/23 | 2023-09-13 | 7 days |
| [v1.27.5+k3s1](k3s-v1.27.md#release-v1275k3s1) | Sep 05 2023 | 09/05/23 | 2023-09-05 | Aug 24 2023 | 08/24/23 | 2023-08-24 | 12 days |
| [v1.27.4+k3s1](k3s-v1.27.md#release-v1274k3s1) | Jul 27 2023 | 07/27/23 | 2023-07-27 | Jul 19 2023 | 07/19/23 | 2023-07-19 | 8 days |
| [v1.27.3+k3s1](k3s-v1.27.md#release-v1273k3s1) | Jun 26 2023 | 06/26/23 | 2023-06-26 | Jun 14 2023 | 06/14/23 | 2023-06-14 | 12 days |
| [v1.27.2+k3s1](k3s-v1.27.md#release-v1272k3s1) | May 26 2023 | 05/26/23 | 2023-05-26 | May 17 2023 | 05/17/23 | 2023-05-17 | 9 days |
| [v1.27.1+k3s1](k3s-v1.27.md#release-v1271k3s1) | Apr 27 2023 | 04/27/23 | 2023-04-27 | Apr 14 2023 | 04/14/23 | 2023-04-14 | 13 days |



# Release v1.27.10+k3s2
<!-- v1.27.10+k3s2 -->

This release updates Kubernetes to v1.27.10, and fixes a number of issues.

For more details on what's new, see the [Kubernetes release notes](https://github.com/kubernetes/kubernetes/blob/master/CHANGELOG/CHANGELOG-1.27.md#changelog-since-v1279).

**Important Notes**

Addresses the runc CVE: [CVE-2024-21626](https://nvd.nist.gov/vuln/detail/CVE-2024-21626) by updating runc to v1.1.12.

## Changes since v1.27.9+k3s1:

* Add a retry around updating a secrets-encrypt node annotations [(#9124)](https://github.com/k3s-io/k3s/pull/9124)
* Added support for env *_PROXY variables for agent loadbalancer [(#9117)](https://github.com/k3s-io/k3s/pull/9117)
* Wait for taint to be gone in the node before starting the netpol controller [(#9176)](https://github.com/k3s-io/k3s/pull/9176)
* Etcd condition [(#9182)](https://github.com/k3s-io/k3s/pull/9182)
* Backports for 2024-01 [(#9211)](https://github.com/k3s-io/k3s/pull/9211)
* Move proxy dialer out of init() and fix crash [(#9220)](https://github.com/k3s-io/k3s/pull/9220)
* Pin opa version for missing dependency chain [(#9217)](https://github.com/k3s-io/k3s/pull/9217)
* Etcd node is nil [(#9229)](https://github.com/k3s-io/k3s/pull/9229)
* Update to v1.27.10 and Go 1.20.13 [(#9261)](https://github.com/k3s-io/k3s/pull/9261)
* Use `ipFamilyPolicy: RequireDualStack` for dual-stack kube-dns [(#9270)](https://github.com/k3s-io/k3s/pull/9270)
* Backports for 2024-01 k3s2 [(#9337)](https://github.com/k3s-io/k3s/pull/9337)
  * Bump runc to v1.1.12 and helm-controller to v0.15.7
  * Fix handling of bare hostname or IP as endpoint address in registries.yaml
* Bump helm-controller to fix issue with ChartContent [(#9347)](https://github.com/k3s-io/k3s/pull/9347)

## Embedded Component Versions
| Component | Version |
|---|---|
| Kubernetes | [v1.27.10](https://github.com/kubernetes/kubernetes/blob/master/CHANGELOG/CHANGELOG-1.27.md#v12710) |
| Kine | [v0.11.0](https://github.com/k3s-io/kine/releases/tag/v0.11.0) |
| SQLite | [3.42.0](https://sqlite.org/releaselog/3_42_0.html) |
| Etcd | [v3.5.9-k3s1](https://github.com/k3s-io/etcd/releases/tag/v3.5.9-k3s1) |
| Containerd | [v1.7.11-k3s2.27](https://github.com/k3s-io/containerd/releases/tag/v1.7.11-k3s2.27) |
| Runc | [v1.1.12-k3s1](https://github.com/opencontainers/runc/releases/tag/v1.1.12-k3s1) |
| Flannel | [v0.22.2](https://github.com/flannel-io/flannel/releases/tag/v0.22.2) | 
| Metrics-server | [v0.6.3](https://github.com/kubernetes-sigs/metrics-server/releases/tag/v0.6.3) |
| Traefik | [v2.10.5](https://github.com/traefik/traefik/releases/tag/v2.10.5) |
| CoreDNS | [v1.10.1](https://github.com/coredns/coredns/releases/tag/v1.10.1) | 
| Helm-controller | [v0.15.8](https://github.com/k3s-io/helm-controller/releases/tag/v0.15.8) |
| Local-path-provisioner | [v0.0.24](https://github.com/rancher/local-path-provisioner/releases/tag/v0.0.24) |

## Helpful Links
As always, we welcome and appreciate feedback from our community of users. Please feel free to:
- [Open issues here](https://github.com/rancher/k3s/issues/new/choose)
- [Join our Slack channel](https://slack.rancher.io/)
- [Check out our documentation](https://rancher.com/docs/k3s/latest/en/) for guidance on how to get started or to dive deep into K3s.
- [Read how you can contribute here](https://github.com/rancher/k3s/blob/master/CONTRIBUTING.md)
-----
# Release v1.27.9+k3s1
<!-- v1.27.9+k3s1 -->

This release updates Kubernetes to v1.27.9, and fixes a number of issues.

For more details on what's new, see the [Kubernetes release notes](https://github.com/kubernetes/kubernetes/blob/master/CHANGELOG/CHANGELOG-1.27.md#changelog-since-v1278).

## Changes since v1.27.8+k3s2:

* Bump containerd/runc to v1.7.10-k3s1/v1.1.10 [(#8963)](https://github.com/k3s-io/k3s/pull/8963)
* Fix overlapping address range [(#9018)](https://github.com/k3s-io/k3s/pull/9018)
* Runtimes backport [(#9013)](https://github.com/k3s-io/k3s/pull/9013)
  * Added runtime classes for wasm/nvidia/crun
  * Added default runtime flag for containerd
* Bump containerd to v1.7.11 [(#9041)](https://github.com/k3s-io/k3s/pull/9041)
* Update to v1.27.9-k3s1 [(#9078)](https://github.com/k3s-io/k3s/pull/9078)

## Embedded Component Versions
| Component | Version |
|---|---|
| Kubernetes | [v1.27.9](https://github.com/kubernetes/kubernetes/blob/master/CHANGELOG/CHANGELOG-1.27.md#v1279) |
| Kine | [v0.11.0](https://github.com/k3s-io/kine/releases/tag/v0.11.0) |
| SQLite | [3.42.0](https://sqlite.org/releaselog/3_42_0.html) |
| Etcd | [v3.5.9-k3s1](https://github.com/k3s-io/etcd/releases/tag/v3.5.9-k3s1) |
| Containerd | [v1.7.11-k3s2.27](https://github.com/k3s-io/containerd/releases/tag/v1.7.11-k3s2.27) |
| Runc | [v1.1.10](https://github.com/opencontainers/runc/releases/tag/v1.1.10) |
| Flannel | [v0.22.2](https://github.com/flannel-io/flannel/releases/tag/v0.22.2) | 
| Metrics-server | [v0.6.3](https://github.com/kubernetes-sigs/metrics-server/releases/tag/v0.6.3) |
| Traefik | [v2.10.5](https://github.com/traefik/traefik/releases/tag/v2.10.5) |
| CoreDNS | [v1.10.1](https://github.com/coredns/coredns/releases/tag/v1.10.1) | 
| Helm-controller | [v0.15.4](https://github.com/k3s-io/helm-controller/releases/tag/v0.15.4) |
| Local-path-provisioner | [v0.0.24](https://github.com/rancher/local-path-provisioner/releases/tag/v0.0.24) |

## Helpful Links
As always, we welcome and appreciate feedback from our community of users. Please feel free to:
- [Open issues here](https://github.com/rancher/k3s/issues/new/choose)
- [Join our Slack channel](https://slack.rancher.io/)
- [Check out our documentation](https://rancher.com/docs/k3s/latest/en/) for guidance on how to get started or to dive deep into K3s.
- [Read how you can contribute here](https://github.com/rancher/k3s/blob/master/CONTRIBUTING.md)


## What's Changed
* [Release-1.27] Only publish to code_cov on merged E2E builds by @dereknola in https://github.com/k3s-io/k3s/pull/9082


**Full Changelog**: https://github.com/k3s-io/k3s/compare/v1.27.9-rc1+k3s1...v1.27.9+k3s1
-----
# Release v1.27.8+k3s2
<!-- v1.27.8+k3s2 -->

This release updates Kubernetes to v1.27.8, and fixes a number of issues.

For more details on what's new, see the [Kubernetes release notes](https://github.com/kubernetes/kubernetes/blob/master/CHANGELOG/CHANGELOG-1.27.md#changelog-since-v1277).

## Changes since v1.27.7+k3s2:

* Etcd status condition [(#8821)](https://github.com/k3s-io/k3s/pull/8821)
* Add warning for removal of multiclustercidr flag [(#8759)](https://github.com/k3s-io/k3s/pull/8759)
* Backports for 2023-11 release [(#8878)](https://github.com/k3s-io/k3s/pull/8878)
  * New timezone info in Docker image allows the use of `spec.timeZone` in CronJobs
  * Bumped kine to v0.11.0 to resolve issues with postgres and NATS, fix performance of watch channels under heavy load, and improve compatibility with the reference implementation.
  * Containerd may now be configured to use rdt or blockio configuration by defining `rdt_config.yaml` or `blockio_config.yaml` files.
  * Add agent flag disable-apiserver-lb, agent will not start load balance proxy.
  * Improved ingress IP ordering from ServiceLB
  * Disable helm CRD installation for disable-helm-controller
  * Omit snapshot list configmap entries for snapshots without extra metadata
  * Add jitter to client config retry to avoid hammering servers when they are starting up
* Handle nil pointer when runtime core is not ready in etcd [(#8887)](https://github.com/k3s-io/k3s/pull/8887)
* Improve dualStack log [(#8828)](https://github.com/k3s-io/k3s/pull/8828)
* Bump dynamiclistener; reduce snapshot controller log spew [(#8902)](https://github.com/k3s-io/k3s/pull/8902)
  * Bumped dynamiclistener to address a race condition that could cause a server to fail to sync its certificates into the Kubernetes secret
  * Reduced etcd snapshot log spam during initial cluster startup
* Remove depends_on for e2e step; fix cert rotate e2e [(#8907)](https://github.com/k3s-io/k3s/pull/8907)
* Fix etcd snapshot S3 issues [(#8937)](https://github.com/k3s-io/k3s/pull/8937)
  * Don't apply S3 retention if S3 client failed to initialize
  * Don't request metadata when listing S3 snapshots
  * Print key instead of file path in snapshot metadata log message
* Update to v1.27.8 and Go to 1.20.11 [(#8921)](https://github.com/k3s-io/k3s/pull/8921)
* Remove s390x [(#8999)](https://github.com/k3s-io/k3s/pull/8999)

## Embedded Component Versions
| Component | Version |
|---|---|
| Kubernetes | [v1.27.8](https://github.com/kubernetes/kubernetes/blob/master/CHANGELOG/CHANGELOG-1.27.md#v1278) |
| Kine | [v0.11.0](https://github.com/k3s-io/kine/releases/tag/v0.11.0) |
| SQLite | [3.42.0](https://sqlite.org/releaselog/3_42_0.html) |
| Etcd | [v3.5.9-k3s1](https://github.com/k3s-io/etcd/releases/tag/v3.5.9-k3s1) |
| Containerd | [v1.7.7-k3s1.27](https://github.com/k3s-io/containerd/releases/tag/v1.7.7-k3s1.27) |
| Runc | [v1.1.8](https://github.com/opencontainers/runc/releases/tag/v1.1.8) |
| Flannel | [v0.22.2](https://github.com/flannel-io/flannel/releases/tag/v0.22.2) | 
| Metrics-server | [v0.6.3](https://github.com/kubernetes-sigs/metrics-server/releases/tag/v0.6.3) |
| Traefik | [v2.10.5](https://github.com/traefik/traefik/releases/tag/v2.10.5) |
| CoreDNS | [v1.10.1](https://github.com/coredns/coredns/releases/tag/v1.10.1) | 
| Helm-controller | [v0.15.4](https://github.com/k3s-io/helm-controller/releases/tag/v0.15.4) |
| Local-path-provisioner | [v0.0.24](https://github.com/rancher/local-path-provisioner/releases/tag/v0.0.24) |

## Helpful Links
As always, we welcome and appreciate feedback from our community of users. Please feel free to:
- [Open issues here](https://github.com/rancher/k3s/issues/new/choose)
- [Join our Slack channel](https://slack.rancher.io/)
- [Check out our documentation](https://rancher.com/docs/k3s/latest/en/) for guidance on how to get started or to dive deep into K3s.
- [Read how you can contribute here](https://github.com/rancher/k3s/blob/master/CONTRIBUTING.md)

-----
# Release v1.27.7+k3s2
<!-- v1.27.7+k3s2 -->

This release updates Kubernetes to v1.27.7, and fixes a number of issues.

For more details on what's new, see the [Kubernetes release notes](https://github.com/kubernetes/kubernetes/blob/master/CHANGELOG/CHANGELOG-1.27.md#changelog-since-v1277).

## Changes since v1.27.7+k3s1:

* Fix SystemdCgroup in templates_linux.go [(#8765)](https://github.com/k3s-io/k3s/pull/8765)
  * Fixed an issue with identifying additional container runtimes
* Update traefik chart to v25.0.0 [(#8775)](https://github.com/k3s-io/k3s/pull/8775)
* Update traefik to fix registry value [(#8789)](https://github.com/k3s-io/k3s/pull/8789)

## Embedded Component Versions
| Component | Version |
|---|---|
| Kubernetes | [v1.27.7](https://github.com/kubernetes/kubernetes/blob/master/CHANGELOG/CHANGELOG-1.27.md#v1277) |
| Kine | [v0.10.3](https://github.com/k3s-io/kine/releases/tag/v0.10.3) |
| SQLite | [3.42.0](https://sqlite.org/releaselog/3_42_0.html) |
| Etcd | [v3.5.9-k3s1](https://github.com/k3s-io/etcd/releases/tag/v3.5.9-k3s1) |
| Containerd | [v1.7.7-k3s1.27](https://github.com/k3s-io/containerd/releases/tag/v1.7.7-k3s1.27) |
| Runc | [v1.1.8](https://github.com/opencontainers/runc/releases/tag/v1.1.8) |
| Flannel | [v0.22.2](https://github.com/flannel-io/flannel/releases/tag/v0.22.2) | 
| Metrics-server | [v0.6.3](https://github.com/kubernetes-sigs/metrics-server/releases/tag/v0.6.3) |
| Traefik | [v2.10.5](https://github.com/traefik/traefik/releases/tag/v2.10.5) |
| CoreDNS | [v1.10.1](https://github.com/coredns/coredns/releases/tag/v1.10.1) | 
| Helm-controller | [v0.15.4](https://github.com/k3s-io/helm-controller/releases/tag/v0.15.4) |
| Local-path-provisioner | [v0.0.24](https://github.com/rancher/local-path-provisioner/releases/tag/v0.0.24) |

## Helpful Links
As always, we welcome and appreciate feedback from our community of users. Please feel free to:
- [Open issues here](https://github.com/rancher/k3s/issues/new/choose)
- [Join our Slack channel](https://slack.rancher.io/)
- [Check out our documentation](https://rancher.com/docs/k3s/latest/en/) for guidance on how to get started or to dive deep into K3s.
- [Read how you can contribute here](https://github.com/rancher/k3s/blob/master/CONTRIBUTING.md)

-----
# Release v1.27.7+k3s1
<!-- v1.27.7+k3s1 -->

This release updates Kubernetes to v1.27.7, and fixes a number of issues.

For more details on what's new, see the [Kubernetes release notes](https://github.com/kubernetes/kubernetes/blob/master/CHANGELOG/CHANGELOG-1.27.md#changelog-since-v1276).

## Changes since v1.27.6+k3s1:

* Fix error reporting [(#8411)](https://github.com/k3s-io/k3s/pull/8411)
* Add context to flannel errors [(#8419)](https://github.com/k3s-io/k3s/pull/8419)
* Include the interface name in the error message [(#8435)](https://github.com/k3s-io/k3s/pull/8435)
* Update kube-router [(#8443)](https://github.com/k3s-io/k3s/pull/8443)
* Add extraArgs to tailscale [(#8464)](https://github.com/k3s-io/k3s/pull/8464)
* Added error when cluster reset while using server flag [(#8455)](https://github.com/k3s-io/k3s/pull/8455)
  * The user will receive a error when --cluster-reset with the --server flag
* Cluster reset from non bootstrap nodes [(#8451)](https://github.com/k3s-io/k3s/pull/8451)
* Take IPFamily precedence based on order [(#8504)](https://github.com/k3s-io/k3s/pull/8504)
* Fix spellcheck problem [(#8509)](https://github.com/k3s-io/k3s/pull/8509)
* Network defaults are duplicated, remove one [(#8551)](https://github.com/k3s-io/k3s/pull/8551)
* Advertise address integration test [(#8516)](https://github.com/k3s-io/k3s/pull/8516)
* System agent push tags fix [(#8569)](https://github.com/k3s-io/k3s/pull/8569)
* Fixed tailscale node IP dualstack mode in case of IPv4 only node [(#8558)](https://github.com/k3s-io/k3s/pull/8558)
* Server Token Rotation [(#8576)](https://github.com/k3s-io/k3s/pull/8576)
  * Users can now rotate the server token using `k3s token rotate -t <OLD_TOKEN> --new-token <NEW_TOKEN>`. After command succeeds, all server nodes must be restarted with the new token.
* E2E Domain Drone Cleanup [(#8582)](https://github.com/k3s-io/k3s/pull/8582)
* Clear remove annotations on cluster reset [(#8587)](https://github.com/k3s-io/k3s/pull/8587)
  * Fixed an issue that could cause k3s to attempt to remove members from the etcd cluster immediately following a cluster-reset/restore, if they were queued for removal at the time the snapshot was taken.
* Use IPv6 in case is the first configured IP with dualstack [(#8597)](https://github.com/k3s-io/k3s/pull/8597)
* Backports for 2023-10 release [(#8615)](https://github.com/k3s-io/k3s/pull/8615)
* Update kube-router package in build script [(#8634)](https://github.com/k3s-io/k3s/pull/8634)
* Add etcd-only/control-plane-only server test and fix control-plane-only server crash [(#8642)](https://github.com/k3s-io/k3s/pull/8642)
* Use `version.Program` not K3s in token rotate logs [(#8656)](https://github.com/k3s-io/k3s/pull/8656)
* Windows agent support [(#8650)](https://github.com/k3s-io/k3s/pull/8650)
* Fix CloudDualStackNodeIPs feature-gate inconsistency [(#8669)](https://github.com/k3s-io/k3s/pull/8669)
* Add --image-service-endpoint flag (#8279) [(#8662)](https://github.com/k3s-io/k3s/pull/8662)
  * Add `--image-service-endpoint` flag to specify an external image service socket.
* Backport etcd fixes [(#8690)](https://github.com/k3s-io/k3s/pull/8690)
  * Re-enable etcd endpoint auto-sync 
  * Manually requeue configmap reconcile when no nodes have reconciled snapshots
* Update to v1.27.7 and Go to v1.20.10 [(#8681)](https://github.com/k3s-io/k3s/pull/8681)
* Fix s3 snapshot restore [(#8733)](https://github.com/k3s-io/k3s/pull/8733)

## Embedded Component Versions
| Component | Version |
|---|---|
| Kubernetes | [v1.27.7](https://github.com/kubernetes/kubernetes/blob/master/CHANGELOG/CHANGELOG-1.27.md#v1277) |
| Kine | [v0.10.3](https://github.com/k3s-io/kine/releases/tag/v0.10.3) |
| SQLite | [3.42.0](https://sqlite.org/releaselog/3_42_0.html) |
| Etcd | [v3.5.9-k3s1](https://github.com/k3s-io/etcd/releases/tag/v3.5.9-k3s1) |
| Containerd | [v1.7.7-k3s1.27](https://github.com/k3s-io/containerd/releases/tag/v1.7.7-k3s1.27) |
| Runc | [v1.1.8](https://github.com/opencontainers/runc/releases/tag/v1.1.8) |
| Flannel | [v0.22.2](https://github.com/flannel-io/flannel/releases/tag/v0.22.2) | 
| Metrics-server | [v0.6.3](https://github.com/kubernetes-sigs/metrics-server/releases/tag/v0.6.3) |
| Traefik | [v2.10.5](https://github.com/traefik/traefik/releases/tag/v2.10.5) |
| CoreDNS | [v1.10.1](https://github.com/coredns/coredns/releases/tag/v1.10.1) | 
| Helm-controller | [v0.15.4](https://github.com/k3s-io/helm-controller/releases/tag/v0.15.4) |
| Local-path-provisioner | [v0.0.24](https://github.com/rancher/local-path-provisioner/releases/tag/v0.0.24) |

## Helpful Links
As always, we welcome and appreciate feedback from our community of users. Please feel free to:
- [Open issues here](https://github.com/rancher/k3s/issues/new/choose)
- [Join our Slack channel](https://slack.rancher.io/)
- [Check out our documentation](https://rancher.com/docs/k3s/latest/en/) for guidance on how to get started or to dive deep into K3s.
- [Read how you can contribute here](https://github.com/rancher/k3s/blob/master/CONTRIBUTING.md)
-----
# Release v1.27.6+k3s1
<!-- v1.27.6+k3s1 -->

This release updates Kubernetes to v1.27.6, and fixes a number of issues.

For more details on what's new, see the [Kubernetes release notes](https://github.com/kubernetes/kubernetes/blob/master/CHANGELOG/CHANGELOG-1.27.md#changelog-since-v1275).

## Changes since v1.27.5+k3s1:

* Bump kine to v0.10.3 [(#8324)](https://github.com/k3s-io/k3s/pull/8324)
* Update to v1.27.6 and Go to 1.20.8 [(#8356)](https://github.com/k3s-io/k3s/pull/8356)
  * Bump embedded containerd to v1.7.6
  * Bump embedded stargz-snapshotter plugin to latest
  * Fixed intermittent drone CI failures due to race conditions in test environment setup scripts
  * Fixed CI failures due to changes to api discovery changes in Kubernetes 1.28

## Embedded Component Versions
| Component | Version |
|---|---|
| Kubernetes | [v1.27.6](https://github.com/kubernetes/kubernetes/blob/master/CHANGELOG/CHANGELOG-1.27.md#v1276) |
| Kine | [v0.10.3](https://github.com/k3s-io/kine/releases/tag/v0.10.3) |
| SQLite | [3.42.0](https://sqlite.org/releaselog/3_42_0.html) |
| Etcd | [v3.5.9-k3s1](https://github.com/k3s-io/etcd/releases/tag/v3.5.9-k3s1) |
| Containerd | [v1.7.6-k3s1.27](https://github.com/k3s-io/containerd/releases/tag/v1.7.6-k3s1.27) |
| Runc | [v1.1.8](https://github.com/opencontainers/runc/releases/tag/v1.1.8) |
| Flannel | [v0.22.2](https://github.com/flannel-io/flannel/releases/tag/v0.22.2) | 
| Metrics-server | [v0.6.3](https://github.com/kubernetes-sigs/metrics-server/releases/tag/v0.6.3) |
| Traefik | [v2.9.10](https://github.com/traefik/traefik/releases/tag/v2.9.10) |
| CoreDNS | [v1.10.1](https://github.com/coredns/coredns/releases/tag/v1.10.1) | 
| Helm-controller | [v0.15.4](https://github.com/k3s-io/helm-controller/releases/tag/v0.15.4) |
| Local-path-provisioner | [v0.0.24](https://github.com/rancher/local-path-provisioner/releases/tag/v0.0.24) |

## Helpful Links
As always, we welcome and appreciate feedback from our community of users. Please feel free to:
- [Open issues here](https://github.com/rancher/k3s/issues/new/choose)
- [Join our Slack channel](https://slack.rancher.io/)
- [Check out our documentation](https://rancher.com/docs/k3s/latest/en/) for guidance on how to get started or to dive deep into K3s.
- [Read how you can contribute here](https://github.com/rancher/k3s/blob/master/CONTRIBUTING.md)

-----
# Release v1.27.5+k3s1
<!-- v1.27.5+k3s1 -->
This release updates Kubernetes to v1.27.5, and fixes a number of issues.

⚠️ IMPORTANT: This release includes support for remediating CVE-2023-32187, a potential Denial of Service attack vector on K3s servers. See https://github.com/k3s-io/k3s/security/advisories/GHSA-m4hf-6vgr-75r2 for more information, including mandatory steps necessary to harden clusters against this vulnerability.

For more details on what's new, see the [Kubernetes release notes](https://github.com/kubernetes/kubernetes/blob/master/CHANGELOG/CHANGELOG-1.27.md#changelog-since-v1274).

## Changes since v1.27.4+k3s1:

* Update cni plugins version to v1.3.0 [(#8056)](https://github.com/k3s-io/k3s/pull/8056)
  * Upgraded cni-plugins to v1.3.0
* Update flannel to v0.22.1 [(#8057)](https://github.com/k3s-io/k3s/pull/8057)
  * Update flannel to v0.22.1
* ADR on secrets encryption v3 [(#7938)](https://github.com/k3s-io/k3s/pull/7938)
* Unit test for MustFindString [(#8013)](https://github.com/k3s-io/k3s/pull/8013)
* Add support for using base template in etc/containerd/config.toml.tmpl [(#7991)](https://github.com/k3s-io/k3s/pull/7991)
  * User-provided containerd config templates may now use `{{ template "base" . }}` to include the default K3s template content. This makes it easier to maintain user configuration if the only need is to add additional sections to the file.
* Make apiserver egress args conditional on egress-selector-mode [(#7972)](https://github.com/k3s-io/k3s/pull/7972)
  * K3s no longer enables the apiserver's `enable-aggregator-routing` flag when the egress proxy is not being used to route connections to in-cluster endpoints.
* Security bump to `docker/distribution` [(#8047)](https://github.com/k3s-io/k3s/pull/8047)
* Fix coreos multiple installs [(#8083)](https://github.com/k3s-io/k3s/pull/8083)
* Update stable channel to v1.27.4+k3s1 [(#8067)](https://github.com/k3s-io/k3s/pull/8067)
* Fix tailscale bug with ip modes [(#8077)](https://github.com/k3s-io/k3s/pull/8077)
* Consolidate CopyFile functions [(#8079)](https://github.com/k3s-io/k3s/pull/8079)
* E2E: Support GOCOVER for more tests + fixes [(#8080)](https://github.com/k3s-io/k3s/pull/8080)
* Fix typo in terraform/README.md [(#8090)](https://github.com/k3s-io/k3s/pull/8090)
* Add FilterCN function to prevent SAN Stuffing [(#8085)](https://github.com/k3s-io/k3s/pull/8085)
  * K3s's external apiserver listener now declines to add to its certificate any subject names not associated with the kubernetes apiserver service, server nodes, or values of the --tls-san option. This prevents the certificate's SAN list from being filled with unwanted entries.
* Bump docker/docker to master commit; cri-dockerd to 0.3.4 [(#8092)](https://github.com/k3s-io/k3s/pull/8092)
  * Bump docker/docker module version to fix issues with cri-dockerd caused by recent releases of golang rejecting invalid host headers sent by the docker client.
* Bump versions for etcd, containerd, runc [(#8109)](https://github.com/k3s-io/k3s/pull/8109)
  * Updated the embedded containerd to v1.7.3+k3s1
  * Updated the embedded runc to v1.1.8
  * Updated the embedded etcd to v3.5.9+k3s1
* Etcd snapshots retention when node name changes [(#8099)](https://github.com/k3s-io/k3s/pull/8099)
* Bump kine to v0.10.2 [(#8125)](https://github.com/k3s-io/k3s/pull/8125)
  * Updated kine to v0.10.2
* Remove terraform package [(#8136)](https://github.com/k3s-io/k3s/pull/8136)
* Fix etcd-snapshot delete when etcd-s3 is true [(#8110)](https://github.com/k3s-io/k3s/pull/8110)
* Add --disable-cloud-controller and --disable-kube-proxy test [(#8018)](https://github.com/k3s-io/k3s/pull/8018)
* Use `go list -m` instead of grep to look up versions [(#8138)](https://github.com/k3s-io/k3s/pull/8138)
* Use VERSION_K8S in tests instead of grep go.mod [(#8147)](https://github.com/k3s-io/k3s/pull/8147)
* Fix for Kubeflag Integration test [(#8154)](https://github.com/k3s-io/k3s/pull/8154)
* Fix for cluster-reset backup from s3 when etcd snapshots are disabled [(#8155)](https://github.com/k3s-io/k3s/pull/8155)
* Run integration test CI in parallel [(#8156)](https://github.com/k3s-io/k3s/pull/8156)
* Bump Trivy version [(#8150)](https://github.com/k3s-io/k3s/pull/8150)
* Bump Trivy version [(#8178)](https://github.com/k3s-io/k3s/pull/8178)
* Fixed the etcd retention to delete orphaned snapshots based on the date [(#8177)](https://github.com/k3s-io/k3s/pull/8177)
* Bump dynamiclistener [(#8193)](https://github.com/k3s-io/k3s/pull/8193)
  * Bumped dynamiclistener to address an issue that could cause the apiserver/supervisor listener on 6443 to stop serving requests on etcd-only nodes.
  * The K3s external apiserver/supervisor listener on 6443 now sends a complete certificate chain in the TLS handshake.
* Bump helm-controller/klipper-helm versions [(#8204)](https://github.com/k3s-io/k3s/pull/8204)
  * The version of `helm` used by the bundled helm controller's job image has been updated to v3.12.3
* E2E: Add test for `k3s token` [(#8184)](https://github.com/k3s-io/k3s/pull/8184)
* Move flannel to 0.22.2 [(#8219)](https://github.com/k3s-io/k3s/pull/8219)
  * Move flannel to v0.22.2
* Update to v1.27.5 [(#8236)](https://github.com/k3s-io/k3s/pull/8236)
* Add new CLI flag to enable TLS SAN CN filtering [(#8257)](https://github.com/k3s-io/k3s/pull/8257)
  * Added a new `--tls-san-security` option. This flag defaults to false, but can be set to true to disable automatically adding SANs to the server's TLS certificate to satisfy any hostname requested by a client.
* Add RWMutex to address controller [(#8273)](https://github.com/k3s-io/k3s/pull/8273)

## Embedded Component Versions
| Component | Version |
|---|---|
| Kubernetes | [v1.27.5](https://github.com/kubernetes/kubernetes/blob/master/CHANGELOG/CHANGELOG-1.27.md#v1275) |
| Kine | [v0.10.2](https://github.com/k3s-io/kine/releases/tag/v0.10.2) |
| SQLite | [3.42.0](https://sqlite.org/releaselog/3_42_0.html) |
| Etcd | [v3.5.9-k3s1](https://github.com/k3s-io/etcd/releases/tag/v3.5.9-k3s1) |
| Containerd | [v1.7.3-k3s1](https://github.com/k3s-io/containerd/releases/tag/v1.7.3-k3s1) |
| Runc | [v1.1.8](https://github.com/opencontainers/runc/releases/tag/v1.1.8) |
| Flannel | [v0.22.2](https://github.com/flannel-io/flannel/releases/tag/v0.22.2) | 
| Metrics-server | [v0.6.3](https://github.com/kubernetes-sigs/metrics-server/releases/tag/v0.6.3) |
| Traefik | [v2.9.10](https://github.com/traefik/traefik/releases/tag/v2.9.10) |
| CoreDNS | [v1.10.1](https://github.com/coredns/coredns/releases/tag/v1.10.1) | 
| Helm-controller | [v0.15.4](https://github.com/k3s-io/helm-controller/releases/tag/v0.15.4) |
| Local-path-provisioner | [v0.0.24](https://github.com/rancher/local-path-provisioner/releases/tag/v0.0.24) |

## Helpful Links
As always, we welcome and appreciate feedback from our community of users. Please feel free to:
- [Open issues here](https://github.com/rancher/k3s/issues/new/choose)
- [Join our Slack channel](https://slack.rancher.io/)
- [Check out our documentation](https://rancher.com/docs/k3s/latest/en/) for guidance on how to get started or to dive deep into K3s.
- [Read how you can contribute here](https://github.com/rancher/k3s/blob/master/CONTRIBUTING.md)
-----
# Release v1.27.4+k3s1
<!-- v1.27.4+k3s1 -->
This release updates Kubernetes to v1.27.4, and fixes a number of issues.    
​
For more details on what's new, see the [Kubernetes release notes](https://github.com/kubernetes/kubernetes/blob/master/CHANGELOG/CHANGELOG-1.27.md#changelog-since-v1273).
​
## Changes since v1.27.3+k3s1:
​
* Pkg imported more than once [(#7803)](https://github.com/k3s-io/k3s/pull/7803)
* Faster K3s Binary Build Option [(#7805)](https://github.com/k3s-io/k3s/pull/7805)
* Update stable channel to v1.27.3+k3s1 [(#7827)](https://github.com/k3s-io/k3s/pull/7827)
* Adding cli to custom klipper helm image [(#7682)](https://github.com/k3s-io/k3s/pull/7682)
  * The default helm-controller job image can now be overridden with the --helm-job-image CLI flag
* Check if we are on ipv4, ipv6 or dualStack when doing tailscale [(#7838)](https://github.com/k3s-io/k3s/pull/7838)
* Remove file_windows.go [(#7845)](https://github.com/k3s-io/k3s/pull/7845)
* Add a k3s data directory location specified by the cli [(#7791)](https://github.com/k3s-io/k3s/pull/7791)
* Fix e2e startup flaky test [(#7839)](https://github.com/k3s-io/k3s/pull/7839)
* Allow k3s to customize apiServerPort on helm-controller [(#7834)](https://github.com/k3s-io/k3s/pull/7834)
* Fall back to basic/bearer auth when node identity auth is rejected [(#7836)](https://github.com/k3s-io/k3s/pull/7836)
  * Resolved an issue that caused agents joined with kubeadm-style bootstrap tokens to fail to rejoin the cluster when their node object is deleted.
* Fix code spell check [(#7858)](https://github.com/k3s-io/k3s/pull/7858)
* Add e2e s3 test [(#7833)](https://github.com/k3s-io/k3s/pull/7833)
* Warn that v1.28 will deprecate reencrypt/prepare [(#7848)](https://github.com/k3s-io/k3s/pull/7848)
* Support setting control server URL for Tailscale [(#7807)](https://github.com/k3s-io/k3s/pull/7807)
  * Support connecting tailscale to a separate server (e.g. headscale)
* Improve for K3s release Docs [(#7864)](https://github.com/k3s-io/k3s/pull/7864)
* Fix rootless node password location [(#7887)](https://github.com/k3s-io/k3s/pull/7887)
* Bump google.golang.org/grpc from 1.51.0 to 1.53.0 in /tests/terraform [(#7879)](https://github.com/k3s-io/k3s/pull/7879)
* Add retry for clone step [(#7862)](https://github.com/k3s-io/k3s/pull/7862)
* Generation of certificates and keys for etcd gated if etcd is disabled. [(#6998)](https://github.com/k3s-io/k3s/pull/6998)
* Don't use zgrep in `check-config` if apparmor profile is enforced [(#7939)](https://github.com/k3s-io/k3s/pull/7939)
* Fix image_scan.sh script and download trivy version [(#7950)](https://github.com/k3s-io/k3s/pull/7950)
* Revert "Warn that v1.28 will deprecate reencrypt/prepare" [(#7977)](https://github.com/k3s-io/k3s/pull/7977)
* Adjust default kubeconfig file permissions [(#7978)](https://github.com/k3s-io/k3s/pull/7978)
* Fix update go version command on release documentation [(#8028)](https://github.com/k3s-io/k3s/pull/8028)
* Update to v1.27.4 [(#8014)](https://github.com/k3s-io/k3s/pull/8014)
​
## Embedded Component Versions
| Component | Version |
|---|---|
| Kubernetes | [v1.27.4](https://github.com/kubernetes/kubernetes/blob/master/CHANGELOG/CHANGELOG-1.27.md#v1274) |
| Kine | [v0.10.1](https://github.com/k3s-io/kine/releases/tag/v0.10.1) |
| SQLite | [3.39.2](https://sqlite.org/releaselog/3_39_2.html) |
| Etcd | [v3.5.7-k3s1](https://github.com/k3s-io/etcd/releases/tag/v3.5.7-k3s1) |
| Containerd | [v1.7.1-k3s1](https://github.com/k3s-io/containerd/releases/tag/v1.7.1-k3s1) |
| Runc | [v1.1.7](https://github.com/opencontainers/runc/releases/tag/v1.1.7) |
| Flannel | [v0.22.0](https://github.com/flannel-io/flannel/releases/tag/v0.22.0) | 
| Metrics-server | [v0.6.3](https://github.com/kubernetes-sigs/metrics-server/releases/tag/v0.6.3) |
| Traefik | [v2.9.10](https://github.com/traefik/traefik/releases/tag/v2.9.10) |
| CoreDNS | [v1.10.1](https://github.com/coredns/coredns/releases/tag/v1.10.1) | 
| Helm-controller | [v0.15.2](https://github.com/k3s-io/helm-controller/releases/tag/v0.15.2) |
| Local-path-provisioner | [v0.0.24](https://github.com/rancher/local-path-provisioner/releases/tag/v0.0.24) |

## Helpful Links
As always, we welcome and appreciate feedback from our community of users. Please feel free to:
- [Open issues here](https://github.com/rancher/k3s/issues/new/choose)
- [Join our Slack channel](https://slack.rancher.io/)
- [Check out our documentation](https://rancher.com/docs/k3s/latest/en/) for guidance on how to get started or to dive deep into K3s.
- [Read how you can contribute here](https://github.com/rancher/k3s/blob/master/CONTRIBUTING.md)
-----
# Release v1.27.3+k3s1
<!-- v1.27.3+k3s1 -->
This release updates Kubernetes to v1.27.3, and fixes a number of issues.

For more details on what's new, see the [Kubernetes release notes](https://github.com/kubernetes/kubernetes/blob/master/CHANGELOG/CHANGELOG-1.27.md#changelog-since-v1272).

## Changes since v1.27.2+k3s1:

* Update flannel version [(#7628)](https://github.com/k3s-io/k3s/pull/7628)
  * Update flannel to v0.22.0
* Add el9 selinux rpm [(#7635)](https://github.com/k3s-io/k3s/pull/7635)
* Update channels [(#7634)](https://github.com/k3s-io/k3s/pull/7634)
* Allow coredns override extensions [(#7583)](https://github.com/k3s-io/k3s/pull/7583)
  * The `coredns-custom` ConfigMap now allows for `*.override` sections to be included in the `.:53` default server block.
* Bump klipper-lb to v0.4.4 [(#7617)](https://github.com/k3s-io/k3s/pull/7617)
  * Bumped klipper-lb image to v0.4.4 to resolve an issue that prevented access to ServiceLB ports from localhost when the Service ExternalTrafficPolicy was set to Local.
* Bump metrics-server to v0.6.3 and update tls-cipher-suites [(#7564)](https://github.com/k3s-io/k3s/pull/7564)
  * The bundled metrics-server has been bumped to v0.6.3, and now uses only secure TLS ciphers by default.
* Do not use the admin kubeconfig for the supervisor and core controllers [(#7616)](https://github.com/k3s-io/k3s/pull/7616)
  * The K3s core controllers (supervisor, deploy, and helm) no longer use the admin kubeconfig. This makes it easier to determine from access and audit logs which actions are performed by the system, and which are performed by an administrative user.
* Bump golang:alpine image version [(#7619)](https://github.com/k3s-io/k3s/pull/7619)
* Make LB image configurable when compiling k3s [(#7626)](https://github.com/k3s-io/k3s/pull/7626)
* Bump vagrant libvirt with fix for plugin installs [(#7605)](https://github.com/k3s-io/k3s/pull/7605)
* Add format command on Makefile [(#7437)](https://github.com/k3s-io/k3s/pull/7437)
* Use el8 rpm for fedora 38 and 39 [(#7664)](https://github.com/k3s-io/k3s/pull/7664)
* Check variant before version to decide rpm target and packager closes #7666 [(#7667)](https://github.com/k3s-io/k3s/pull/7667)
* Test Coverage Reports for E2E tests [(#7526)](https://github.com/k3s-io/k3s/pull/7526)
* Soft-fail on node password verification if the secret cannot be created [(#7655)](https://github.com/k3s-io/k3s/pull/7655)
  * K3s now allows nodes to join the cluster even if the node password secret cannot be created at the time the node joins. The secret create will be retried in the background. This resolves a potential deadlock created by fail-closed validating webhooks that block secret creation, where the webhook is unavailable until new nodes join the cluster to run the webhook pod.
* Enable containerd aufs/devmapper/zfs snapshotter plugins [(#7661)](https://github.com/k3s-io/k3s/pull/7661)
  * The bundled containerd's aufs/devmapper/zfs snapshotter plugins have been restored. These were unintentionally omitted when moving containerd back into the k3s multicall binary in the previous release.
* Bump docker go.mod [(#7681)](https://github.com/k3s-io/k3s/pull/7681)
* Shortcircuit commands with version or help flags [(#7683)](https://github.com/k3s-io/k3s/pull/7683)
  * Non root users can now call `k3s --help` and `k3s --version` commands without running into permission errors over the default config file.
* Bump Trivy version [(#7672)](https://github.com/k3s-io/k3s/pull/7672)
* E2E: Capture coverage of K3s subcommands [(#7686)](https://github.com/k3s-io/k3s/pull/7686)
* Integrate tailscale into k3s [(#7352)](https://github.com/k3s-io/k3s/pull/7352)
  * Integration of tailscale VPN into k3s
* Add private registry e2e test [(#7653)](https://github.com/k3s-io/k3s/pull/7653)
* E2E: Remove unnecessary daemonset addition/deletion [(#7696)](https://github.com/k3s-io/k3s/pull/7696)
* Add issue template for OS validation [(#7695)](https://github.com/k3s-io/k3s/pull/7695)
* Fix spelling check [(#7740)](https://github.com/k3s-io/k3s/pull/7740)
* Remove useless libvirt config [(#7745)](https://github.com/k3s-io/k3s/pull/7745)
* Bump helm-controller to v0.15.0 for create-namespace support [(#7716)](https://github.com/k3s-io/k3s/pull/7716)
  * The embedded helm controller has been bumped to v0.15.0, and now supports creating the chart's target namespace if it does not exist.
* Fix error logging in tailscale [(#7776)](https://github.com/k3s-io/k3s/pull/7776)
* Add commands to remove advertised routes of tailscale in k3s-killall.sh [(#7777)](https://github.com/k3s-io/k3s/pull/7777)
* Update Kubernetes to v1.27.3 [(#7790)](https://github.com/k3s-io/k3s/pull/7790)

## Embedded Component Versions
| Component | Version |
|---|---|
| Kubernetes | [v1.27.3](https://github.com/kubernetes/kubernetes/blob/master/CHANGELOG/CHANGELOG-1.27.md#v1273) |
| Kine | [v0.10.1](https://github.com/k3s-io/kine/releases/tag/v0.10.1) |
| SQLite | [3.39.2](https://sqlite.org/releaselog/3_39_2.html) |
| Etcd | [v3.5.7-k3s1](https://github.com/k3s-io/etcd/releases/tag/v3.5.7-k3s1) |
| Containerd | [v1.7.1-k3s1](https://github.com/k3s-io/containerd/releases/tag/v1.7.1-k3s1) |
| Runc | [v1.1.7](https://github.com/opencontainers/runc/releases/tag/v1.1.7) |
| Flannel | [v0.22.0](https://github.com/flannel-io/flannel/releases/tag/v0.22.0) | 
| Metrics-server | [v0.6.3](https://github.com/kubernetes-sigs/metrics-server/releases/tag/v0.6.3) |
| Traefik | [v2.9.10](https://github.com/traefik/traefik/releases/tag/v2.9.10) |
| CoreDNS | [v1.10.1](https://github.com/coredns/coredns/releases/tag/v1.10.1) | 
| Helm-controller | [v0.15.0](https://github.com/k3s-io/helm-controller/releases/tag/v0.15.0) |
| Local-path-provisioner | [v0.0.24](https://github.com/rancher/local-path-provisioner/releases/tag/v0.0.24) |

## Helpful Links
As always, we welcome and appreciate feedback from our community of users. Please feel free to:
- [Open issues here](https://github.com/rancher/k3s/issues/new/choose)
- [Join our Slack channel](https://slack.rancher.io/)
- [Check out our documentation](https://rancher.com/docs/k3s/latest/en/) for guidance on how to get started or to dive deep into K3s.
- [Read how you can contribute here](https://github.com/rancher/k3s/blob/master/CONTRIBUTING.md)
-----
# Release v1.27.2+k3s1
<!-- v1.27.2+k3s1 -->
This release updates Kubernetes to v1.27.2, and fixes a number of issues.

For more details on what's new, see the [Kubernetes release notes](https://github.com/kubernetes/kubernetes/blob/master/CHANGELOG/CHANGELOG-1.27.md#changelog-since-v1271).

## Changes since v1.27.1+k3s1:

* Ensure that klog verbosity is set to the same level as logrus [(#7303)](https://github.com/k3s-io/k3s/pull/7303)
* Create CRDs with schema [(#7308)](https://github.com/k3s-io/k3s/pull/7308)
  * Fixed an issue where Addon, HelmChart, and HelmChartConfig CRDs were created without structural schema, allowing the creation of custom resources of these types with invalid content.
* Bump k3s-root for aarch64 page size fix [(#7364)](https://github.com/k3s-io/k3s/pull/7364)
  * K3s once again supports aarch64 nodes with page size > 4k
* Bump Runc and Containerd [(#7339)](https://github.com/k3s-io/k3s/pull/7339)
* Add integration tests for etc-snapshot server flags and refactor /tests/integration/integration.go/K3sStartServer [(#7300)](https://github.com/k3s-io/k3s/pull/7300)
* Bump traefik to v2.9.10 / chart 21.2.0 [(#7324)](https://github.com/k3s-io/k3s/pull/7324)
  * The packaged Traefik version has been bumped to v2.9.10 / chart 21.2.0
* Add longhorn storage test [(#6445)](https://github.com/k3s-io/k3s/pull/6445)
* Improve error message when CLI wrapper Exec fails [(#7373)](https://github.com/k3s-io/k3s/pull/7373)
  * K3s now prints a more meaningful error when attempting to run from a filesystem mounted `noexec`.
* Fix issues with `--disable-agent` and `--egress-selector-mode=pod|cluster` [(#7331)](https://github.com/k3s-io/k3s/pull/7331)
  * Servers started with the (experimental) --disable-agent flag no longer attempt to run the tunnel authorizer agent component.
  * Fixed an regression that prevented the pod and cluster egress-selector modes from working properly.
* Retry cluster join on "too many learners" error [(#7351)](https://github.com/k3s-io/k3s/pull/7351)
  * K3s now retries the cluster join operation when receiving a "too many learners" error from etcd. This most frequently occurred when attempting to add multiple servers at the same time.
* Fix MemberList error handling and incorrect etcd-arg passthrough [(#7371)](https://github.com/k3s-io/k3s/pull/7371)
  * K3s now correctly passes through etcd-args to the temporary etcd that is used to extract cluster bootstrap data when restarting managed etcd nodes.
  * K3s now properly handles errors obtaining the current etcd cluster member list when a new server is joining the managed etcd cluster.
* Bump Trivy version [(#7383)](https://github.com/k3s-io/k3s/pull/7383)
* Handle multiple arguments with StringSlice flags [(#7380)](https://github.com/k3s-io/k3s/pull/7380)
* Add v1.27 channel [(#7387)](https://github.com/k3s-io/k3s/pull/7387)
* Enable FindString to search dotD config files [(#7323)](https://github.com/k3s-io/k3s/pull/7323)
* Migrate netutil methods into /util/net.go [(#7422)](https://github.com/k3s-io/k3s/pull/7422)
* Local-storage: Fix permission [(#7217)](https://github.com/k3s-io/k3s/pull/7217)
* Bump cni plugins to v1.2.0-k3s1 [(#7425)](https://github.com/k3s-io/k3s/pull/7425)
  * The bundled CNI plugins have been upgraded to v1.2.0-k3s1. The bandwidth and firewall plugins are now included in the bundle.
* Add dependabot label and reviewer [(#7423)](https://github.com/k3s-io/k3s/pull/7423)
* E2E: Startup test cleanup + RunCommand Enhancement [(#7388)](https://github.com/k3s-io/k3s/pull/7388)
* Fail to validate server tokens that use bootstrap id/secret format [(#7389)](https://github.com/k3s-io/k3s/pull/7389)
  * K3s now exits with a proper error message when the server token uses a bootstrap token `id.secret` format.
* Fix token startup test [(#7442)](https://github.com/k3s-io/k3s/pull/7442)
* Bump kine to v0.10.1 [(#7414)](https://github.com/k3s-io/k3s/pull/7414)
  * The embedded kine version has been bumped to v0.10.1. This replaces the legacy `lib/pq` postgres driver with `pgx`.
* Add kube-* server flags integration tests [(#7416)](https://github.com/k3s-io/k3s/pull/7416)
* Add support for `-cover` + integration test code coverage [(#7415)](https://github.com/k3s-io/k3s/pull/7415)
* Bump kube-router version to fix a bug when a port name is used [(#7454)](https://github.com/k3s-io/k3s/pull/7454)
* Consistently use constant-time comparison of password hashes instead of bare password strings [(#7455)](https://github.com/k3s-io/k3s/pull/7455)
* Bump containerd to v1.7.0 and move back into multicall binary [(#7418)](https://github.com/k3s-io/k3s/pull/7418)
  * The embedded containerd version has been bumped to `v1.7.0-k3s1`, and has been reintegrated into the main k3s binary for a significant savings in release artifact size.
* Adding PITS and Getdeck Beiboot as adopters thanks to Schille and Miw… [(#7524)](https://github.com/k3s-io/k3s/pull/7524)
* Bump helm-controller version for repo auth/ca support [(#7525)](https://github.com/k3s-io/k3s/pull/7525)
  * The embedded Helm controller now supports authenticating to chart repositories via credentials stored in a Secret, as well as passing repo CAs via ConfigMap.
* Bump containerd/runc to v1.7.1-k3s1/v1.1.7 [(#7533)](https://github.com/k3s-io/k3s/pull/7533)
  * The bundled containerd and runc versions have been bumped to v1.7.1-k3s1/v1.1.7
* Wrap error stating that it is coming from netpol [(#7539)](https://github.com/k3s-io/k3s/pull/7539)
* Add Rotation certification Check, remove func to restart agents [(#7097)](https://github.com/k3s-io/k3s/pull/7097)
* Bump alpine from 3.17 to 3.18 in /package [(#7550)](https://github.com/k3s-io/k3s/pull/7550)
* Bump alpine from 3.17 to 3.18 in /conformance [(#7551)](https://github.com/k3s-io/k3s/pull/7551)
* Add '-all' flag to apply to inactive systemd units [(#7567)](https://github.com/k3s-io/k3s/pull/7567)
* Update to v1.27.2-k3s1 [(#7575)](https://github.com/k3s-io/k3s/pull/7575)
* Fix iptables rules clean during upgrade [(#7591)](https://github.com/k3s-io/k3s/pull/7591)
* Pin emicklei/go-restful to v3.9.0 [(#7597)](https://github.com/k3s-io/k3s/pull/7597)
* Add el9 selinux rpm [(#7443)](https://github.com/k3s-io/k3s/pull/7443)
* Revert "Add el9 selinux rpm (#7443)" [(#7608)](https://github.com/k3s-io/k3s/pull/7608)

## Embedded Component Versions
| Component | Version |
|---|---|
| Kubernetes | [v1.27.2](https://github.com/kubernetes/kubernetes/blob/master/CHANGELOG/CHANGELOG-1.27.md#v1272) |
| Kine | [v0.10.1](https://github.com/k3s-io/kine/releases/tag/v0.10.1) |
| SQLite | [3.39.2](https://sqlite.org/releaselog/3_39_2.html) |
| Etcd | [v3.5.7-k3s1](https://github.com/k3s-io/etcd/releases/tag/v3.5.7-k3s1) |
| Containerd | [v1.7.1-k3s1](https://github.com/k3s-io/containerd/releases/tag/v1.7.1-k3s1) |
| Runc | [v1.1.7](https://github.com/opencontainers/runc/releases/tag/v1.1.7) |
| Flannel | [v0.21.4](https://github.com/flannel-io/flannel/releases/tag/v0.21.4) | 
| Metrics-server | [v0.6.2](https://github.com/kubernetes-sigs/metrics-server/releases/tag/v0.6.2) |
| Traefik | [v2.9.10](https://github.com/traefik/traefik/releases/tag/v2.9.10) |
| CoreDNS | [v1.10.1](https://github.com/coredns/coredns/releases/tag/v1.10.1) | 
| Helm-controller | [v0.14.0](https://github.com/k3s-io/helm-controller/releases/tag/v0.14.0) |
| Local-path-provisioner | [v0.0.24](https://github.com/rancher/local-path-provisioner/releases/tag/v0.0.24) |

## Helpful Links
As always, we welcome and appreciate feedback from our community of users. Please feel free to:
- [Open issues here](https://github.com/rancher/k3s/issues/new/choose)
- [Join our Slack channel](https://slack.rancher.io/)
- [Check out our documentation](https://rancher.com/docs/k3s/latest/en/) for guidance on how to get started or to dive deep into K3s.
- [Read how you can contribute here](https://github.com/rancher/k3s/blob/master/CONTRIBUTING.md)

-----
# Release v1.27.1+k3s1
<!-- v1.27.1+k3s1 -->
This release is K3S's first in the v1.27 line. This release updates Kubernetes to v1.27.1.

Before upgrading from earlier releases, be sure to read the Kubernetes [Urgent Upgrade Notes](https://github.com/kubernetes/kubernetes/blob/master/CHANGELOG/CHANGELOG-1.27.md#urgent-upgrade-notes).

## Changes since v1.26.4+k3s1:

* Kubernetes 1.27.1 [(#7271)](https://github.com/k3s-io/k3s/pull/7271)
* V1.27.1 CLI Deprecation [(#7311)](https://github.com/k3s-io/k3s/pull/7311)
  * `--flannel-backed=wireguard` has been completely replaced with `--flannel-backend=wireguard-native`
  * The `k3s etcd-snapshot` command will now print a help message, to save a snapshot use: `k3s etcd-snapshot save`
  * The following flags will now cause fatal errors (with full removal coming in v1.28.0):
    * `--flannel-backed=ipsec`: replaced with `--flannel-backend=wireguard-native` [see docs for more info.](https://docs.k3s.io/installation/network-options#migrating-from-wireguard-or-ipsec-to-wireguard-native)
    * Supplying multiple `--flannel-backend` values is no longer valid. Use `--flannel-conf` instead.
* Changed command -v redirection for iptables bin check [(#7315)](https://github.com/k3s-io/k3s/pull/7315)
* Update channel server for april 2023 [(#7327)](https://github.com/k3s-io/k3s/pull/7327)
* Bump cri-dockerd [(#7347)](https://github.com/k3s-io/k3s/pull/7347)
* Cleanup help messages [(#7369)](https://github.com/k3s-io/k3s/pull/7369)

## Embedded Component Versions
| Component | Version |
|---|---|
| Kubernetes | [v1.27.1](https://github.com/kubernetes/kubernetes/blob/master/CHANGELOG/CHANGELOG-1.27.md#v1271) |
| Kine | [v0.9.9](https://github.com/k3s-io/kine/releases/tag/v0.9.9) |
| SQLite | [3.39.2](https://sqlite.org/releaselog/3_39_2.html) |
| Etcd | [v3.5.7-k3s1](https://github.com/k3s-io/etcd/releases/tag/v3.5.7-k3s1) |
| Containerd | [v1.6.19-k3s1](https://github.com/k3s-io/containerd/releases/tag/v1.6.19-k3s1) |
| Runc | [v1.1.5](https://github.com/opencontainers/runc/releases/tag/v1.1.5) |
| Flannel | [v0.21.4](https://github.com/flannel-io/flannel/releases/tag/v0.21.4) | 
| Metrics-server | [v0.6.2](https://github.com/kubernetes-sigs/metrics-server/releases/tag/v0.6.2) |
| Traefik | [v2.9.4](https://github.com/traefik/traefik/releases/tag/v2.9.4) |
| CoreDNS | [v1.10.1](https://github.com/coredns/coredns/releases/tag/v1.10.1) | 
| Helm-controller | [v0.13.3](https://github.com/k3s-io/helm-controller/releases/tag/v0.13.3) |
| Local-path-provisioner | [v0.0.24](https://github.com/rancher/local-path-provisioner/releases/tag/v0.0.24) |

## Helpful Links
As always, we welcome and appreciate feedback from our community of users. Please feel free to:
- [Open issues here](https://github.com/rancher/k3s/issues/new/choose)
- [Join our Slack channel](https://slack.rancher.io/)
- [Check out our documentation](https://rancher.com/docs/k3s/latest/en/) for guidance on how to get started or to dive deep into K3s.
- [Read how you can contribute here](https://github.com/rancher/k3s/blob/master/CONTRIBUTING.md)

-----
