| k3s version| Kubernetes | Kine | SQLite | Etcd | Containerd | Runc | Flannel | Metrics-server | Traefik | CoreDNS | Helm-controller | Local-path-provisioner  |
| ----- | ----- | ----- | ----- | ----- | ----- | ----- | ----- | ----- | ----- | ----- | ----- | -----  |
| v1.26.14+k3s1 | [v1.26.14](https://github.com/kubernetes/kubernetes/blob/master/CHANGELOG/CHANGELOG-1.26.md#v12614) | [v0.11.4](https://github.com/k3s-io/kine/releases/tag/v0.11.4) | [3.44.0](https://sqlite.org/releaselog/3_44_0.html) | [v3.5.9-k3s1](https://github.com/k3s-io/etcd/releases/tag/v3.5.9-k3s1) | [v1.7.11-k3s2.26](https://github.com/k3s-io/containerd/releases/tag/v1.7.11-k3s2.26) | [v1.1.12-k3s1](https://github.com/k3s-io/runc/releases/tag/v1.1.12-k3s1) | [v0.24.2](https://github.com/flannel-io/flannel/releases/tag/v0.24.2) | [v0.6.3](https://github.com/kubernetes-sigs/metrics-server/releases/tag/v0.6.3) | [v2.10.5](https://github.com/traefik/traefik/releases/tag/v2.10.5) | [v1.10.1](https://github.com/coredns/coredns/releases/tag/v1.10.1) | [v0.15.8](https://github.com/k3s-io/helm-controller/releases/tag/v0.15.8) | [v0.0.26](https://github.com/rancher/local-path-provisioner/releases/tag/v0.0.26)  |
| v1.26.13+k3s2 | [v1.26.13](https://github.com/kubernetes/kubernetes/blob/master/CHANGELOG/CHANGELOG-1.26.md#v12613) | [v0.11.0](https://github.com/k3s-io/kine/releases/tag/v0.11.0) | [3.42.0](https://sqlite.org/releaselog/3_42_0.html) | [v3.5.9-k3s1](https://github.com/k3s-io/etcd/releases/tag/v3.5.9-k3s1) | [v1.7.11-k3s2.26](https://github.com/k3s-io/containerd/releases/tag/v1.7.11-k3s2.26) | [v1.1.12-k3s1](https://github.com/opencontainers/runc/releases/tag/v1.1.12-k3s1) | [v0.22.2](https://github.com/flannel-io/flannel/releases/tag/v0.22.2) | [v0.6.3](https://github.com/kubernetes-sigs/metrics-server/releases/tag/v0.6.3) | [v2.10.5](https://github.com/traefik/traefik/releases/tag/v2.10.5) | [v1.10.1](https://github.com/coredns/coredns/releases/tag/v1.10.1) | [v0.15.8](https://github.com/k3s-io/helm-controller/releases/tag/v0.15.8) | [v0.0.24](https://github.com/rancher/local-path-provisioner/releases/tag/v0.0.24)  |
| v1.26.12+k3s1 | [v1.26.12](https://github.com/kubernetes/kubernetes/blob/master/CHANGELOG/CHANGELOG-1.26.md#v12612) | [v0.11.0](https://github.com/k3s-io/kine/releases/tag/v0.11.0) | [3.42.0](https://sqlite.org/releaselog/3_42_0.html) | [v3.5.9-k3s1](https://github.com/k3s-io/etcd/releases/tag/v3.5.9-k3s1) | [v1.7.11-k3s2.26](https://github.com/k3s-io/containerd/releases/tag/v1.7.11-k3s2.26) | [v1.1.10](https://github.com/opencontainers/runc/releases/tag/v1.1.10) | [v0.22.2](https://github.com/flannel-io/flannel/releases/tag/v0.22.2) | [v0.6.3](https://github.com/kubernetes-sigs/metrics-server/releases/tag/v0.6.3) | [v2.10.5](https://github.com/traefik/traefik/releases/tag/v2.10.5) | [v1.10.1](https://github.com/coredns/coredns/releases/tag/v1.10.1) | [v0.15.4](https://github.com/k3s-io/helm-controller/releases/tag/v0.15.4) | [v0.0.24](https://github.com/rancher/local-path-provisioner/releases/tag/v0.0.24)  |
| v1.26.11+k3s2 | [v1.26.11](https://github.com/kubernetes/kubernetes/blob/master/CHANGELOG/CHANGELOG-1.26.md#v12611) | [v0.11.0](https://github.com/k3s-io/kine/releases/tag/v0.11.0) | [3.42.0](https://sqlite.org/releaselog/3_42_0.html) | [v3.5.9-k3s1](https://github.com/k3s-io/etcd/releases/tag/v3.5.9-k3s1) | [v1.7.7-k3s1.26](https://github.com/k3s-io/containerd/releases/tag/v1.7.7-k3s1.26) | [v1.1.8](https://github.com/opencontainers/runc/releases/tag/v1.1.8) | [v0.22.2](https://github.com/flannel-io/flannel/releases/tag/v0.22.2) | [v0.6.3](https://github.com/kubernetes-sigs/metrics-server/releases/tag/v0.6.3) | [v2.10.5](https://github.com/traefik/traefik/releases/tag/v2.10.5) | [v1.10.1](https://github.com/coredns/coredns/releases/tag/v1.10.1) | [v0.15.4](https://github.com/k3s-io/helm-controller/releases/tag/v0.15.4) | [v0.0.24](https://github.com/rancher/local-path-provisioner/releases/tag/v0.0.24)  |
| v1.26.10+k3s2 | [v1.26.10](https://github.com/kubernetes/kubernetes/blob/master/CHANGELOG/CHANGELOG-1.26.md#v12610) | [v0.10.3](https://github.com/k3s-io/kine/releases/tag/v0.10.3) | [3.42.0](https://sqlite.org/releaselog/3_42_0.html) | [v3.5.9-k3s1](https://github.com/k3s-io/etcd/releases/tag/v3.5.9-k3s1) | [v1.7.7-k3s1.26](https://github.com/k3s-io/containerd/releases/tag/v1.7.7-k3s1.26) | [v1.1.8](https://github.com/opencontainers/runc/releases/tag/v1.1.8) | [v0.22.2](https://github.com/flannel-io/flannel/releases/tag/v0.22.2) | [v0.6.3](https://github.com/kubernetes-sigs/metrics-server/releases/tag/v0.6.3) | [v2.10.5](https://github.com/traefik/traefik/releases/tag/v2.10.5) | [v1.10.1](https://github.com/coredns/coredns/releases/tag/v1.10.1) | [v0.15.4](https://github.com/k3s-io/helm-controller/releases/tag/v0.15.4) | [v0.0.24](https://github.com/rancher/local-path-provisioner/releases/tag/v0.0.24)  |
| v1.26.10+k3s1 | [v1.26.10](https://github.com/kubernetes/kubernetes/blob/master/CHANGELOG/CHANGELOG-1.26.md#v12610) | [v0.10.3](https://github.com/k3s-io/kine/releases/tag/v0.10.3) | [3.42.0](https://sqlite.org/releaselog/3_42_0.html) | [v3.5.9-k3s1](https://github.com/k3s-io/etcd/releases/tag/v3.5.9-k3s1) | [v1.7.7-k3s1.26](https://github.com/k3s-io/containerd/releases/tag/v1.7.7-k3s1.26) | [v1.1.8](https://github.com/opencontainers/runc/releases/tag/v1.1.8) | [v0.22.2](https://github.com/flannel-io/flannel/releases/tag/v0.22.2) | [v0.6.3](https://github.com/kubernetes-sigs/metrics-server/releases/tag/v0.6.3) | [v2.10.5](https://github.com/traefik/traefik/releases/tag/v2.10.5) | [v1.10.1](https://github.com/coredns/coredns/releases/tag/v1.10.1) | [v0.15.4](https://github.com/k3s-io/helm-controller/releases/tag/v0.15.4) | [v0.0.24](https://github.com/rancher/local-path-provisioner/releases/tag/v0.0.24)  |
| v1.26.9+k3s1 | [v1.26.9](https://github.com/kubernetes/kubernetes/blob/master/CHANGELOG/CHANGELOG-1.26.md#v1269) | [v0.10.3](https://github.com/k3s-io/kine/releases/tag/v0.10.3) | [3.42.0](https://sqlite.org/releaselog/3_42_0.html) | [v3.5.9-k3s1](https://github.com/k3s-io/etcd/releases/tag/v3.5.9-k3s1) | [v1.7.6-k3s1.26](https://github.com/k3s-io/containerd/releases/tag/v1.7.6-k3s1.26) | [v1.1.8](https://github.com/opencontainers/runc/releases/tag/v1.1.8) | [v0.22.2](https://github.com/flannel-io/flannel/releases/tag/v0.22.2) | [v0.6.3](https://github.com/kubernetes-sigs/metrics-server/releases/tag/v0.6.3) | [v2.9.10](https://github.com/traefik/traefik/releases/tag/v2.9.10) | [v1.10.1](https://github.com/coredns/coredns/releases/tag/v1.10.1) | [v0.15.4](https://github.com/k3s-io/helm-controller/releases/tag/v0.15.4) | [v0.0.24](https://github.com/rancher/local-path-provisioner/releases/tag/v0.0.24)  |
| v1.26.8+k3s1 | [v1.26.8](https://github.com/kubernetes/kubernetes/blob/master/CHANGELOG/CHANGELOG-1.26.md#v1268) | [v0.10.2](https://github.com/k3s-io/kine/releases/tag/v0.10.2) | [3.42.0](https://sqlite.org/releaselog/3_42_0.html) | [v3.5.9-k3s1](https://github.com/k3s-io/etcd/releases/tag/v3.5.9-k3s1) | [v1.7.3-k3s1](https://github.com/k3s-io/containerd/releases/tag/v1.7.3-k3s1) | [v1.1.8](https://github.com/opencontainers/runc/releases/tag/v1.1.8) | [v0.22.2](https://github.com/flannel-io/flannel/releases/tag/v0.22.2) | [v0.6.3](https://github.com/kubernetes-sigs/metrics-server/releases/tag/v0.6.3) | [v2.9.10](https://github.com/traefik/traefik/releases/tag/v2.9.10) | [v1.10.1](https://github.com/coredns/coredns/releases/tag/v1.10.1) | [v0.15.4](https://github.com/k3s-io/helm-controller/releases/tag/v0.15.4) | [v0.0.24](https://github.com/rancher/local-path-provisioner/releases/tag/v0.0.24)  |
| v1.26.7+k3s1 | [v1.26.7](https://github.com/kubernetes/kubernetes/blob/master/CHANGELOG/CHANGELOG-1.26.md#v1267) | [v0.10.1](https://github.com/k3s-io/kine/releases/tag/v0.10.1) | [3.39.2](https://sqlite.org/releaselog/3_39_2.html) | [v3.5.7-k3s1](https://github.com/k3s-io/etcd/releases/tag/v3.5.7-k3s1) | [v1.7.1-k3s1](https://github.com/k3s-io/containerd/releases/tag/v1.7.1-k3s1) | [v1.1.7](https://github.com/opencontainers/runc/releases/tag/v1.1.7) | [v0.22.0](https://github.com/flannel-io/flannel/releases/tag/v0.22.0) | [v0.6.3](https://github.com/kubernetes-sigs/metrics-server/releases/tag/v0.6.3) | [v2.9.10](https://github.com/traefik/traefik/releases/tag/v2.9.10) | [v1.10.1](https://github.com/coredns/coredns/releases/tag/v1.10.1) | [v0.15.2](https://github.com/k3s-io/helm-controller/releases/tag/v0.15.2) | [v0.0.24](https://github.com/rancher/local-path-provisioner/releases/tag/v0.0.24)  |
| v1.26.6+k3s1 | [v1.26.6](https://github.com/kubernetes/kubernetes/blob/master/CHANGELOG/CHANGELOG-1.26.md#v1266) | [v0.10.1](https://github.com/k3s-io/kine/releases/tag/v0.10.1) | [3.39.2](https://sqlite.org/releaselog/3_39_2.html) | [v3.5.7-k3s1](https://github.com/k3s-io/etcd/releases/tag/v3.5.7-k3s1) | [v1.7.1-k3s1](https://github.com/k3s-io/containerd/releases/tag/v1.7.1-k3s1) | [v1.1.7](https://github.com/opencontainers/runc/releases/tag/v1.1.7) | [v0.22.0](https://github.com/flannel-io/flannel/releases/tag/v0.22.0) | [v0.6.3](https://github.com/kubernetes-sigs/metrics-server/releases/tag/v0.6.3) | [v2.9.10](https://github.com/traefik/traefik/releases/tag/v2.9.10) | [v1.10.1](https://github.com/coredns/coredns/releases/tag/v1.10.1) | [v0.15.0](https://github.com/k3s-io/helm-controller/releases/tag/v0.15.0) | [v0.0.24](https://github.com/rancher/local-path-provisioner/releases/tag/v0.0.24)  |
| v1.26.5+k3s1 | [v1.26.5](https://github.com/kubernetes/kubernetes/blob/master/CHANGELOG/CHANGELOG-1.26.md#v1265) | [v0.10.1](https://github.com/k3s-io/kine/releases/tag/v0.10.1) | [3.39.2](https://sqlite.org/releaselog/3_39_2.html) | [v3.5.7-k3s1](https://github.com/k3s-io/etcd/releases/tag/v3.5.7-k3s1) | [v1.7.1-k3s1](https://github.com/k3s-io/containerd/releases/tag/v1.7.1-k3s1) | [v1.1.7](https://github.com/opencontainers/runc/releases/tag/v1.1.7) | [v0.21.4](https://github.com/flannel-io/flannel/releases/tag/v0.21.4) | [v0.6.2](https://github.com/kubernetes-sigs/metrics-server/releases/tag/v0.6.2) | [v2.9.10](https://github.com/traefik/traefik/releases/tag/v2.9.10) | [v1.10.1](https://github.com/coredns/coredns/releases/tag/v1.10.1) | [v0.14.0](https://github.com/k3s-io/helm-controller/releases/tag/v0.14.0) | [v0.0.24](https://github.com/rancher/local-path-provisioner/releases/tag/v0.0.24)  |
| v1.26.4+k3s1 | [v1.26.4](https://github.com/kubernetes/kubernetes/blob/master/CHANGELOG/CHANGELOG-1.26.md#v1264) | [v0.9.9](https://github.com/k3s-io/kine/releases/tag/v0.9.9) | [3.39.2](https://sqlite.org/releaselog/3_39_2.html) | [v3.5.7-k3s1](https://github.com/k3s-io/etcd/releases/tag/v3.5.7-k3s1) | [v1.6.19-k3s1](https://github.com/k3s-io/containerd/releases/tag/v1.6.19-k3s1) | [v1.1.5](https://github.com/opencontainers/runc/releases/tag/v1.1.5) | [v0.21.4](https://github.com/flannel-io/flannel/releases/tag/v0.21.4) | [v0.6.2](https://github.com/kubernetes-sigs/metrics-server/releases/tag/v0.6.2) | [v2.9.4](https://github.com/traefik/traefik/releases/tag/v2.9.4) | [v1.10.1](https://github.com/coredns/coredns/releases/tag/v1.10.1) | [v0.13.3](https://github.com/k3s-io/helm-controller/releases/tag/v0.13.3) | [v0.0.24](https://github.com/rancher/local-path-provisioner/releases/tag/v0.0.24)  |
| v1.26.3+k3s1 | [v1.26.3](https://github.com/kubernetes/kubernetes/blob/master/CHANGELOG/CHANGELOG-1.26.md#v1263) | [v0.9.9](https://github.com/k3s-io/kine/releases/tag/v0.9.9) | [3.39.2](https://sqlite.org/releaselog/3_39_2.html) | [v3.5.5-k3s1](https://github.com/k3s-io/etcd/releases/tag/v3.5.5-k3s1) | [v1.6.19-k3s1](https://github.com/k3s-io/containerd/releases/tag/v1.6.19-k3s1) | [v1.1.4](https://github.com/opencontainers/runc/releases/tag/v1.1.4) | [v0.21.4](https://github.com/flannel-io/flannel/releases/tag/v0.21.4) | [v0.6.2](https://github.com/kubernetes-sigs/metrics-server/releases/tag/v0.6.2) | [v2.9.4](https://github.com/traefik/traefik/releases/tag/v2.9.4) | [v1.9.4](https://github.com/coredns/coredns/releases/tag/v1.9.4) | [v0.13.1](https://github.com/k3s-io/helm-controller/releases/tag/v0.13.1) | [v0.0.23](https://github.com/rancher/local-path-provisioner/releases/tag/v0.0.23)  |
| v1.26.2+k3s1 | [v1.26.2](https://github.com/kubernetes/kubernetes/blob/master/CHANGELOG/CHANGELOG-1.26.md#v1262) | [v0.9.9](https://github.com/k3s-io/kine/releases/tag/v0.9.9) | [3.39.2](https://sqlite.org/releaselog/3_39_2.html) | [v3.5.5-k3s1](https://github.com/k3s-io/etcd/releases/tag/v3.5.5-k3s1) | [v1.6.15-k3s1](https://github.com/k3s-io/containerd/releases/tag/v1.6.15-k3s1) | [v1.1.4](https://github.com/opencontainers/runc/releases/tag/v1.1.4) | [v0.21.1](https://github.com/flannel-io/flannel/releases/tag/v0.21.1) | [v0.6.2](https://github.com/kubernetes-sigs/metrics-server/releases/tag/v0.6.2) | [v2.9.4](https://github.com/traefik/traefik/releases/tag/v2.9.4) | [v1.9.4](https://github.com/coredns/coredns/releases/tag/v1.9.4) | [v0.13.1](https://github.com/k3s-io/helm-controller/releases/tag/v0.13.1) | [v0.0.23](https://github.com/rancher/local-path-provisioner/releases/tag/v0.0.23)  |
| v1.26.1+k3s1 | [v1.26.1](https://github.com/kubernetes/kubernetes/blob/master/CHANGELOG/CHANGELOG-1.26.md#v1261) | [v0.9.8](https://github.com/k3s-io/kine/releases/tag/v0.9.8) | [3.39.2](https://sqlite.org/releaselog/3_39_2.html) | [v3.5.5-k3s1](https://github.com/k3s-io/etcd/releases/tag/v3.5.5-k3s1) | [v1.6.15-k3s1](https://github.com/k3s-io/containerd/releases/tag/v1.6.15-k3s1) | [v1.1.4](https://github.com/opencontainers/runc/releases/tag/v1.1.4) | [v0.20.2](https://github.com/flannel-io/flannel/releases/tag/v0.20.2) | [v0.6.2](https://github.com/kubernetes-sigs/metrics-server/releases/tag/v0.6.2) | [v2.9.4](https://github.com/traefik/traefik/releases/tag/v2.9.4) | [v1.9.4](https://github.com/coredns/coredns/releases/tag/v1.9.4) | [v0.13.1](https://github.com/k3s-io/helm-controller/releases/tag/v0.13.1) | [v0.0.23](https://github.com/rancher/local-path-provisioner/releases/tag/v0.0.23)  |
| v1.26.0+k3s2 | [v1.26.0](https://github.com/kubernetes/kubernetes/blob/master/CHANGELOG/CHANGELOG-1.26.md#v1260) | [v0.9.8](https://github.com/k3s-io/kine/releases/tag/v0.9.8) | [3.39.2](https://sqlite.org/releaselog/3_39_2.html) | [v3.5.5-k3s1](https://github.com/k3s-io/etcd/releases/tag/v3.5.5-k3s1) | [v1.6.14-k3s1](https://github.com/k3s-io/containerd/releases/tag/v1.6.14-k3s1) | [v1.1.4](https://github.com/opencontainers/runc/releases/tag/v1.1.4) | [v0.20.2](https://github.com/flannel-io/flannel/releases/tag/v0.20.2) | [v0.6.2](https://github.com/kubernetes-sigs/metrics-server/releases/tag/v0.6.2) | [v2.9.4](https://github.com/traefik/traefik/releases/tag/v2.9.4) | [v1.9.4](https://github.com/coredns/coredns/releases/tag/v1.9.4) | [v0.13.1](https://github.com/k3s-io/helm-controller/releases/tag/v0.13.1) | [v0.0.23](https://github.com/rancher/local-path-provisioner/releases/tag/v0.0.23)  |
| v1.26.0+k3s1 | [v1.26.0](https://github.com/kubernetes/kubernetes/blob/master/CHANGELOG/CHANGELOG-1.26.md#v1260) | [v0.9.8](https://github.com/k3s-io/kine/releases/tag/v0.9.8) | [3.39.2](https://sqlite.org/releaselog/3_39_2.html) | [v3.5.5-k3s1](https://github.com/k3s-io/etcd/releases/tag/v3.5.5-k3s1) | [v1.6.12-k3s1](https://github.com/k3s-io/containerd/releases/tag/v1.6.12-k3s1) | [v1.1.4](https://github.com/opencontainers/runc/releases/tag/v1.1.4) | [v0.20.2](https://github.com/flannel-io/flannel/releases/tag/v0.20.2) | [v0.6.2](https://github.com/kubernetes-sigs/metrics-server/releases/tag/v0.6.2) | [v2.9.4](https://github.com/traefik/traefik/releases/tag/v2.9.4) | [v1.9.4](https://github.com/coredns/coredns/releases/tag/v1.9.4) | [v0.13.1](https://github.com/k3s-io/helm-controller/releases/tag/v0.13.1) | [v0.0.23](https://github.com/rancher/local-path-provisioner/releases/tag/v0.0.23)  |



| Version | Release date | US date | EU date | Upstream release date | US date | EU date | Days since upstream |
| ----- | ----- | ----- | ----- | ----- | ----- | ----- | ----- |
| [v1.26.14+k3s1](k3s-v1.26.md#release-v12614k3s1) | Feb 29 2024 | 02/29/24 | 2024-02-29 | Feb 14 2024 | 02/14/24 | 2024-02-14 | 15 days |
| [v1.26.13+k3s2](k3s-v1.26.md#release-v12613k3s2) | Feb 06 2024 | 02/06/24 | 2024-02-06 | Jan 17 2024 | 01/17/24 | 2024-01-17 | 20 days |
| [v1.26.12+k3s1](k3s-v1.26.md#release-v12612k3s1) | Dec 27 2023 | 12/27/23 | 2023-12-27 | Dec 20 2023 | 12/20/23 | 2023-12-20 | 7 days |
| [v1.26.11+k3s2](k3s-v1.26.md#release-v12611k3s2) | Dec 07 2023 | 12/07/23 | 2023-12-07 | Nov 15 2023 | 11/15/23 | 2023-11-15 | 22 days |
| [v1.26.10+k3s2](k3s-v1.26.md#release-v12610k3s2) | Nov 08 2023 | 11/08/23 | 2023-11-08 | Oct 18 2023 | 10/18/23 | 2023-10-18 | 21 days |
| [v1.26.10+k3s1](k3s-v1.26.md#release-v12610k3s1) | Oct 30 2023 | 10/30/23 | 2023-10-30 | Oct 18 2023 | 10/18/23 | 2023-10-18 | 12 days |
| [v1.26.9+k3s1](k3s-v1.26.md#release-v1269k3s1) | Sep 20 2023 | 09/20/23 | 2023-09-20 | Sep 13 2023 | 09/13/23 | 2023-09-13 | 7 days |
| [v1.26.8+k3s1](k3s-v1.26.md#release-v1268k3s1) | Sep 05 2023 | 09/05/23 | 2023-09-05 | Aug 24 2023 | 08/24/23 | 2023-08-24 | 12 days |
| [v1.26.7+k3s1](k3s-v1.26.md#release-v1267k3s1) | Jul 27 2023 | 07/27/23 | 2023-07-27 | Jul 19 2023 | 07/19/23 | 2023-07-19 | 8 days |
| [v1.26.6+k3s1](k3s-v1.26.md#release-v1266k3s1) | Jun 26 2023 | 06/26/23 | 2023-06-26 | Jun 14 2023 | 06/14/23 | 2023-06-14 | 12 days |
| [v1.26.5+k3s1](k3s-v1.26.md#release-v1265k3s1) | May 26 2023 | 05/26/23 | 2023-05-26 | May 17 2023 | 05/17/23 | 2023-05-17 | 9 days |
| [v1.26.4+k3s1](k3s-v1.26.md#release-v1264k3s1) | Apr 20 2023 | 04/20/23 | 2023-04-20 | Apr 12 2023 | 04/12/23 | 2023-04-12 | 8 days |
| [v1.26.3+k3s1](k3s-v1.26.md#release-v1263k3s1) | Mar 27 2023 | 03/27/23 | 2023-03-27 | Mar 17 2023 | 03/17/23 | 2023-03-17 | 10 days |
| [v1.26.2+k3s1](k3s-v1.26.md#release-v1262k3s1) | Mar 10 2023 | 03/10/23 | 2023-03-10 | Feb 28 2023 | 02/28/23 | 2023-02-28 | 10 days |
| [v1.26.1+k3s1](k3s-v1.26.md#release-v1261k3s1) | Jan 26 2023 | 01/26/23 | 2023-01-26 | Jan 18 2023 | 01/18/23 | 2023-01-18 | 8 days |
| [v1.26.0+k3s2](k3s-v1.26.md#release-v1260k3s2) | Jan 11 2023 | 01/11/23 | 2023-01-11 | Dec 09 2022 | 12/09/22 | 2022-12-09 | 33 days |
| [v1.26.0+k3s1](k3s-v1.26.md#release-v1260k3s1) | Dec 21 2022 | 12/21/22 | 2022-12-21 | Dec 09 2022 | 12/09/22 | 2022-12-09 | 12 days |



# Release v1.26.14+k3s1
<!-- v1.26.14+k3s1 -->

This release updates Kubernetes to v1.26.14, and fixes a number of issues.

For more details on what's new, see the [Kubernetes release notes](https://github.com/kubernetes/kubernetes/blob/master/CHANGELOG/CHANGELOG-1.26.md#changelog-since-v12613).

## Changes since v1.26.13+k3s2:

* Chore: bump Local Path Provisioner version [(#9428)](https://github.com/k3s-io/k3s/pull/9428)
* Bump cri-dockerd to fix compat with Docker Engine 25 [(#9292)](https://github.com/k3s-io/k3s/pull/9292)
* Auto Dependancy Bump [(#9421)](https://github.com/k3s-io/k3s/pull/9421)
* Runtimes refactor using exec.LookPath [(#9429)](https://github.com/k3s-io/k3s/pull/9429)
  * Directories containing runtimes need to be included in the $PATH environment variable for effective runtime detection.
* Changed how lastHeartBeatTime works in the etcd condition [(#9423)](https://github.com/k3s-io/k3s/pull/9423)
* Allow executors to define containerd and docker behavior [(#9252)](https://github.com/k3s-io/k3s/pull/9252)
* Update Kube-router to v2.0.1 [(#9406)](https://github.com/k3s-io/k3s/pull/9406)
* Backports for 2024-02 release cycle [(#9464)](https://github.com/k3s-io/k3s/pull/9464)
* Bump flannel version + remove multiclustercidr [(#9409)](https://github.com/k3s-io/k3s/pull/9409)
* Enable longer http timeout requests [(#9446)](https://github.com/k3s-io/k3s/pull/9446)
* Test_UnitApplyContainerdQoSClassConfigFileIfPresent [(#9442)](https://github.com/k3s-io/k3s/pull/9442)
* Support PR testing installs [(#9471)](https://github.com/k3s-io/k3s/pull/9471)
* Update Kubernetes to v1.26.14 [(#9490)](https://github.com/k3s-io/k3s/pull/9490)
* Fix drone publish for arm [(#9510)](https://github.com/k3s-io/k3s/pull/9510)
* Remove failing Drone step [(#9514)](https://github.com/k3s-io/k3s/pull/9514)
* Restore original order of agent startup functions [(#9547)](https://github.com/k3s-io/k3s/pull/9547)
* Fix netpol startup when flannel is disabled [(#9580)](https://github.com/k3s-io/k3s/pull/9580)

## Embedded Component Versions
| Component | Version |
|---|---|
| Kubernetes | [v1.26.14](https://github.com/kubernetes/kubernetes/blob/master/CHANGELOG/CHANGELOG-1.26.md#v12614) |
| Kine | [v0.11.4](https://github.com/k3s-io/kine/releases/tag/v0.11.4) |
| SQLite | [3.44.0](https://sqlite.org/releaselog/3_44_0.html) |
| Etcd | [v3.5.9-k3s1](https://github.com/k3s-io/etcd/releases/tag/v3.5.9-k3s1) |
| Containerd | [v1.7.11-k3s2.26](https://github.com/k3s-io/containerd/releases/tag/v1.7.11-k3s2.26) |
| Runc | [v1.1.12-k3s1](https://github.com/k3s-io/runc/releases/tag/v1.1.12-k3s1) |
| Flannel | [v0.24.2](https://github.com/flannel-io/flannel/releases/tag/v0.24.2) | 
| Metrics-server | [v0.6.3](https://github.com/kubernetes-sigs/metrics-server/releases/tag/v0.6.3) |
| Traefik | [v2.10.5](https://github.com/traefik/traefik/releases/tag/v2.10.5) |
| CoreDNS | [v1.10.1](https://github.com/coredns/coredns/releases/tag/v1.10.1) | 
| Helm-controller | [v0.15.8](https://github.com/k3s-io/helm-controller/releases/tag/v0.15.8) |
| Local-path-provisioner | [v0.0.26](https://github.com/rancher/local-path-provisioner/releases/tag/v0.0.26) |

## Helpful Links
As always, we welcome and appreciate feedback from our community of users. Please feel free to:
- [Open issues here](https://github.com/rancher/k3s/issues/new/choose)
- [Join our Slack channel](https://slack.rancher.io/)
- [Check out our documentation](https://rancher.com/docs/k3s/latest/en/) for guidance on how to get started or to dive deep into K3s.
- [Read how you can contribute here](https://github.com/rancher/k3s/blob/master/CONTRIBUTING.md)
-----
# Release v1.26.13+k3s2
<!-- v1.26.13+k3s2 -->

This release updates Kubernetes to v1.26.13, and fixes a number of issues.

For more details on what's new, see the [Kubernetes release notes](https://github.com/kubernetes/kubernetes/blob/master/CHANGELOG/CHANGELOG-1.26.md#changelog-since-v12612).

**Important Notes**

Addresses the runc CVE: [CVE-2024-21626](https://nvd.nist.gov/vuln/detail/CVE-2024-21626) by updating runc to v1.1.12.

## Changes since v1.26.12+k3s1:

* Add a retry around updating a secrets-encrypt node annotations [(#9123)](https://github.com/k3s-io/k3s/pull/9123)
* Added support for env *_PROXY variables for agent loadbalancer [(#9116)](https://github.com/k3s-io/k3s/pull/9116)
* Wait for taint to be gone in the node before starting the netpol controller [(#9177)](https://github.com/k3s-io/k3s/pull/9177)
* Etcd condition [(#9183)](https://github.com/k3s-io/k3s/pull/9183)
* Backports for 2024-01 [(#9212)](https://github.com/k3s-io/k3s/pull/9212)
* Move proxy dialer out of init() and fix crash [(#9221)](https://github.com/k3s-io/k3s/pull/9221)
* Pin opa version for missing dependency chain [(#9218)](https://github.com/k3s-io/k3s/pull/9218)
* Etcd node is nil [(#9230)](https://github.com/k3s-io/k3s/pull/9230)
* Update to v1.26.13 and Go 1.20.13 [(#9262)](https://github.com/k3s-io/k3s/pull/9262)
* Use `ipFamilyPolicy: RequireDualStack` for dual-stack kube-dns [(#9271)](https://github.com/k3s-io/k3s/pull/9271)
* Backports for 2024-01 k3s2 [(#9338)](https://github.com/k3s-io/k3s/pull/9338)
  * Bump runc to v1.1.12 and helm-controller to v0.15.7
  * Fix handling of bare hostname or IP as endpoint address in registries.yaml
* Bump helm-controller to fix issue with ChartContent [(#9348)](https://github.com/k3s-io/k3s/pull/9348)

## Embedded Component Versions
| Component | Version |
|---|---|
| Kubernetes | [v1.26.13](https://github.com/kubernetes/kubernetes/blob/master/CHANGELOG/CHANGELOG-1.26.md#v12613) |
| Kine | [v0.11.0](https://github.com/k3s-io/kine/releases/tag/v0.11.0) |
| SQLite | [3.42.0](https://sqlite.org/releaselog/3_42_0.html) |
| Etcd | [v3.5.9-k3s1](https://github.com/k3s-io/etcd/releases/tag/v3.5.9-k3s1) |
| Containerd | [v1.7.11-k3s2.26](https://github.com/k3s-io/containerd/releases/tag/v1.7.11-k3s2.26) |
| Runc | [v1.1.12-k3s1](https://github.com/opencontainers/runc/releases/tag/v1.1.12-k3s1) |
| Flannel | [v0.22.2](https://github.com/flannel-io/flannel/releases/tag/v0.22.2) | 
| Metrics-server | [v0.6.3](https://github.com/kubernetes-sigs/metrics-server/releases/tag/v0.6.3) |
| Traefik | [v2.10.5](https://github.com/traefik/traefik/releases/tag/v2.10.5) |
| CoreDNS | [v1.10.1](https://github.com/coredns/coredns/releases/tag/v1.10.1) | 
| Helm-controller | [v0.15.8](https://github.com/k3s-io/helm-controller/releases/tag/v0.15.8) |
| Local-path-provisioner | [v0.0.24](https://github.com/rancher/local-path-provisioner/releases/tag/v0.0.24) |

## Helpful Links
As always, we welcome and appreciate feedback from our community of users. Please feel free to:
- [Open issues here](https://github.com/rancher/k3s/issues/new/choose)
- [Join our Slack channel](https://slack.rancher.io/)
- [Check out our documentation](https://rancher.com/docs/k3s/latest/en/) for guidance on how to get started or to dive deep into K3s.
- [Read how you can contribute here](https://github.com/rancher/k3s/blob/master/CONTRIBUTING.md)
-----
# Release v1.26.12+k3s1
<!-- v1.26.12+k3s1 -->

This release updates Kubernetes to v1.26.12, and fixes a number of issues.

For more details on what's new, see the [Kubernetes release notes](https://github.com/kubernetes/kubernetes/blob/master/CHANGELOG/CHANGELOG-1.26.md#changelog-since-v12611).

## Changes since v1.26.11+k3s2:

* Runtimes backport [(#9014)](https://github.com/k3s-io/k3s/pull/9014)
  * Added runtime classes for wasm/nvidia/crun
  * Added default runtime flag for containerd
* Bump containerd/runc to v1.7.10-k3s1/v1.1.10 [(#8964)](https://github.com/k3s-io/k3s/pull/8964)
* Fix overlapping address range [(#9019)](https://github.com/k3s-io/k3s/pull/9019)
* Allow setting default-runtime on servers [(#9028)](https://github.com/k3s-io/k3s/pull/9028)
* Bump containerd to v1.7.11 [(#9042)](https://github.com/k3s-io/k3s/pull/9042)
* Update to v1.26.12-k3s1 [(#9077)](https://github.com/k3s-io/k3s/pull/9077)

## Embedded Component Versions
| Component | Version |
|---|---|
| Kubernetes | [v1.26.12](https://github.com/kubernetes/kubernetes/blob/master/CHANGELOG/CHANGELOG-1.26.md#v12612) |
| Kine | [v0.11.0](https://github.com/k3s-io/kine/releases/tag/v0.11.0) |
| SQLite | [3.42.0](https://sqlite.org/releaselog/3_42_0.html) |
| Etcd | [v3.5.9-k3s1](https://github.com/k3s-io/etcd/releases/tag/v3.5.9-k3s1) |
| Containerd | [v1.7.11-k3s2.26](https://github.com/k3s-io/containerd/releases/tag/v1.7.11-k3s2.26) |
| Runc | [v1.1.10](https://github.com/opencontainers/runc/releases/tag/v1.1.10) |
| Flannel | [v0.22.2](https://github.com/flannel-io/flannel/releases/tag/v0.22.2) | 
| Metrics-server | [v0.6.3](https://github.com/kubernetes-sigs/metrics-server/releases/tag/v0.6.3) |
| Traefik | [v2.10.5](https://github.com/traefik/traefik/releases/tag/v2.10.5) |
| CoreDNS | [v1.10.1](https://github.com/coredns/coredns/releases/tag/v1.10.1) | 
| Helm-controller | [v0.15.4](https://github.com/k3s-io/helm-controller/releases/tag/v0.15.4) |
| Local-path-provisioner | [v0.0.24](https://github.com/rancher/local-path-provisioner/releases/tag/v0.0.24) |

## Helpful Links
As always, we welcome and appreciate feedback from our community of users. Please feel free to:
- [Open issues here](https://github.com/rancher/k3s/issues/new/choose)
- [Join our Slack channel](https://slack.rancher.io/)
- [Check out our documentation](https://rancher.com/docs/k3s/latest/en/) for guidance on how to get started or to dive deep into K3s.
- [Read how you can contribute here](https://github.com/rancher/k3s/blob/master/CONTRIBUTING.md)


## What's Changed
* [Release-1.26] Runtimes backport by @vitorsavian in https://github.com/k3s-io/k3s/pull/9014
* [release-1.26] Bump containerd/runc to v1.7.10-k3s1/v1.1.10 by @brandond in https://github.com/k3s-io/k3s/pull/8964
* [Release 1.26] Fix overlapping address range by @manuelbuil in https://github.com/k3s-io/k3s/pull/9019
* [release-1.26] Allow setting default-runtime on servers by @brandond in https://github.com/k3s-io/k3s/pull/9028
* [release-1.26] Bump containerd to v1.7.11 by @brandond in https://github.com/k3s-io/k3s/pull/9042
* Update to v1.26.12-k3s1 by @Tashima42 in https://github.com/k3s-io/k3s/pull/9077


**Full Changelog**: https://github.com/k3s-io/k3s/compare/v1.26.11+k3s2...v1.26.12+k3s1
-----
# Release v1.26.11+k3s2
<!-- v1.26.11+k3s2 -->

This release updates Kubernetes to v1.26.11, and fixes a number of issues.

For more details on what's new, see the [Kubernetes release notes](https://github.com/kubernetes/kubernetes/blob/master/CHANGELOG/CHANGELOG-1.26.md#changelog-since-v12610).

## Changes since v1.26.10+k3s2:

* Etcd status condition [(#8820)](https://github.com/k3s-io/k3s/pull/8820)
* Backports for 2023-11 release [(#8879)](https://github.com/k3s-io/k3s/pull/8879)
  * New timezone info in Docker image allows the use of `spec.timeZone` in CronJobs
  * Bumped kine to v0.11.0 to resolve issues with postgres and NATS, fix performance of watch channels under heavy load, and improve compatibility with the reference implementation.
  * Containerd may now be configured to use rdt or blockio configuration by defining `rdt_config.yaml` or `blockio_config.yaml` files.
  * Add agent flag disable-apiserver-lb, agent will not start load balance proxy.
  * Improved ingress IP ordering from ServiceLB
  * Disable helm CRD installation for disable-helm-controller
  * Omit snapshot list configmap entries for snapshots without extra metadata
  * Add jitter to client config retry to avoid hammering servers when they are starting up
* Add warning for removal of multiclustercidr flag [(#8760)](https://github.com/k3s-io/k3s/pull/8760)
* Handle nil pointer when runtime core is not ready in etcd [(#8888)](https://github.com/k3s-io/k3s/pull/8888)
* Improve dualStack log [(#8829)](https://github.com/k3s-io/k3s/pull/8829)
* Bump dynamiclistener; reduce snapshot controller log spew [(#8903)](https://github.com/k3s-io/k3s/pull/8903)
  * Bumped dynamiclistener to address a race condition that could cause a server to fail to sync its certificates into the Kubernetes secret
  * Reduced etcd snapshot log spam during initial cluster startup
* Fix etcd snapshot S3 issues [(#8938)](https://github.com/k3s-io/k3s/pull/8938)
  * Don't apply S3 retention if S3 client failed to initialize
  * Don't request metadata when listing S3 snapshots
  * Print key instead of file path in snapshot metadata log message
* Update to v1.26.11 and Go to 1.20.11 [(#8922)](https://github.com/k3s-io/k3s/pull/8922)
* Remove s390x [(#9000)](https://github.com/k3s-io/k3s/pull/9000)

## Embedded Component Versions
| Component | Version |
|---|---|
| Kubernetes | [v1.26.11](https://github.com/kubernetes/kubernetes/blob/master/CHANGELOG/CHANGELOG-1.26.md#v12611) |
| Kine | [v0.11.0](https://github.com/k3s-io/kine/releases/tag/v0.11.0) |
| SQLite | [3.42.0](https://sqlite.org/releaselog/3_42_0.html) |
| Etcd | [v3.5.9-k3s1](https://github.com/k3s-io/etcd/releases/tag/v3.5.9-k3s1) |
| Containerd | [v1.7.7-k3s1.26](https://github.com/k3s-io/containerd/releases/tag/v1.7.7-k3s1.26) |
| Runc | [v1.1.8](https://github.com/opencontainers/runc/releases/tag/v1.1.8) |
| Flannel | [v0.22.2](https://github.com/flannel-io/flannel/releases/tag/v0.22.2) | 
| Metrics-server | [v0.6.3](https://github.com/kubernetes-sigs/metrics-server/releases/tag/v0.6.3) |
| Traefik | [v2.10.5](https://github.com/traefik/traefik/releases/tag/v2.10.5) |
| CoreDNS | [v1.10.1](https://github.com/coredns/coredns/releases/tag/v1.10.1) | 
| Helm-controller | [v0.15.4](https://github.com/k3s-io/helm-controller/releases/tag/v0.15.4) |
| Local-path-provisioner | [v0.0.24](https://github.com/rancher/local-path-provisioner/releases/tag/v0.0.24) |

## Helpful Links
As always, we welcome and appreciate feedback from our community of users. Please feel free to:
- [Open issues here](https://github.com/rancher/k3s/issues/new/choose)
- [Join our Slack channel](https://slack.rancher.io/)
- [Check out our documentation](https://rancher.com/docs/k3s/latest/en/) for guidance on how to get started or to dive deep into K3s.
- [Read how you can contribute here](https://github.com/rancher/k3s/blob/master/CONTRIBUTING.md)

-----
# Release v1.26.10+k3s2
<!-- v1.26.10+k3s2 -->

This release updates Kubernetes to v1.26.10, and fixes a number of issues.

For more details on what's new, see the [Kubernetes release notes](https://github.com/kubernetes/kubernetes/blob/master/CHANGELOG/CHANGELOG-1.26.md#changelog-since-v12610).

## Changes since v1.26.10+k3s1:

* Fix SystemdCgroup in templates_linux.go [(#8766)](https://github.com/k3s-io/k3s/pull/8766)
  * Fixed an issue with identifying additional container runtimes
* Update traefik chart to v25.0.0 [(#8776)](https://github.com/k3s-io/k3s/pull/8776)
* Update traefik to fix registry value [(#8790)](https://github.com/k3s-io/k3s/pull/8790)

## Embedded Component Versions
| Component | Version |
|---|---|
| Kubernetes | [v1.26.10](https://github.com/kubernetes/kubernetes/blob/master/CHANGELOG/CHANGELOG-1.26.md#v12610) |
| Kine | [v0.10.3](https://github.com/k3s-io/kine/releases/tag/v0.10.3) |
| SQLite | [3.42.0](https://sqlite.org/releaselog/3_42_0.html) |
| Etcd | [v3.5.9-k3s1](https://github.com/k3s-io/etcd/releases/tag/v3.5.9-k3s1) |
| Containerd | [v1.7.7-k3s1.26](https://github.com/k3s-io/containerd/releases/tag/v1.7.7-k3s1.26) |
| Runc | [v1.1.8](https://github.com/opencontainers/runc/releases/tag/v1.1.8) |
| Flannel | [v0.22.2](https://github.com/flannel-io/flannel/releases/tag/v0.22.2) | 
| Metrics-server | [v0.6.3](https://github.com/kubernetes-sigs/metrics-server/releases/tag/v0.6.3) |
| Traefik | [v2.10.5](https://github.com/traefik/traefik/releases/tag/v2.10.5) |
| CoreDNS | [v1.10.1](https://github.com/coredns/coredns/releases/tag/v1.10.1) | 
| Helm-controller | [v0.15.4](https://github.com/k3s-io/helm-controller/releases/tag/v0.15.4) |
| Local-path-provisioner | [v0.0.24](https://github.com/rancher/local-path-provisioner/releases/tag/v0.0.24) |

## Helpful Links
As always, we welcome and appreciate feedback from our community of users. Please feel free to:
- [Open issues here](https://github.com/rancher/k3s/issues/new/choose)
- [Join our Slack channel](https://slack.rancher.io/)
- [Check out our documentation](https://rancher.com/docs/k3s/latest/en/) for guidance on how to get started or to dive deep into K3s.
- [Read how you can contribute here](https://github.com/rancher/k3s/blob/master/CONTRIBUTING.md)

-----
# Release v1.26.10+k3s1
<!-- v1.26.10+k3s1 -->

This release updates Kubernetes to v1.26.10, and fixes a number of issues.

For more details on what's new, see the [Kubernetes release notes](https://github.com/kubernetes/kubernetes/blob/master/CHANGELOG/CHANGELOG-1.26.md#changelog-since-v1269).

## Changes since v1.26.9+k3s1:

* Fix error reporting [(#8412)](https://github.com/k3s-io/k3s/pull/8412)
* Add context to flannel errors [(#8420)](https://github.com/k3s-io/k3s/pull/8420)
* Testing Backports for September [(#8300)](https://github.com/k3s-io/k3s/pull/8300)
* Include the interface name in the error message [(#8436)](https://github.com/k3s-io/k3s/pull/8436)
* Update kube-router [(#8444)](https://github.com/k3s-io/k3s/pull/8444)
* Add extraArgs to tailscale [(#8465)](https://github.com/k3s-io/k3s/pull/8465)
* Added error when cluster reset while using server flag [(#8456)](https://github.com/k3s-io/k3s/pull/8456)
  * The user will receive a error when --cluster-reset with the --server flag
* Cluster reset from non bootstrap nodes [(#8453)](https://github.com/k3s-io/k3s/pull/8453)
* Fix spellcheck problem [(#8510)](https://github.com/k3s-io/k3s/pull/8510)
* Take IPFamily precedence based on order [(#8505)](https://github.com/k3s-io/k3s/pull/8505)
* Network defaults are duplicated, remove one [(#8552)](https://github.com/k3s-io/k3s/pull/8552)
* Advertise address integration test [(#8517)](https://github.com/k3s-io/k3s/pull/8517)
* System agent push tags fix [(#8570)](https://github.com/k3s-io/k3s/pull/8570)
* Fixed tailscale node IP dualstack mode in case of IPv4 only node [(#8559)](https://github.com/k3s-io/k3s/pull/8559)
* Server Token Rotation [(#8577)](https://github.com/k3s-io/k3s/pull/8577)
  * Users can now rotate the server token using `k3s token rotate -t <OLD_TOKEN> --new-token <NEW_TOKEN>`. After command succeeds, all server nodes must be restarted with the new token.
* Clear remove annotations on cluster reset [(#8590)](https://github.com/k3s-io/k3s/pull/8590)
  * Fixed an issue that could cause k3s to attempt to remove members from the etcd cluster immediately following a cluster-reset/restore, if they were queued for removal at the time the snapshot was taken.
* Use IPv6 in case is the first configured IP with dualstack [(#8598)](https://github.com/k3s-io/k3s/pull/8598)
* Backports for 2023-10 release [(#8616)](https://github.com/k3s-io/k3s/pull/8616)
* E2E Domain Drone Cleanup [(#8583)](https://github.com/k3s-io/k3s/pull/8583)
* Update kube-router package in build script [(#8635)](https://github.com/k3s-io/k3s/pull/8635)
* Add etcd-only/control-plane-only server test and fix control-plane-only server crash [(#8643)](https://github.com/k3s-io/k3s/pull/8643)
* Use `version.Program` not K3s in token rotate logs [(#8655)](https://github.com/k3s-io/k3s/pull/8655)
* Windows agent support [(#8647)](https://github.com/k3s-io/k3s/pull/8647)
* Add --image-service-endpoint flag (#8279) [(#8663)](https://github.com/k3s-io/k3s/pull/8663)
  * Add `--image-service-endpoint` flag to specify an external image service socket.
* Backport etcd fixes [(#8691)](https://github.com/k3s-io/k3s/pull/8691)
  * Re-enable etcd endpoint auto-sync 
  * Manually requeue configmap reconcile when no nodes have reconciled snapshots
* Update to v1.26.10 and Go to v1.20.10 [(#8680)](https://github.com/k3s-io/k3s/pull/8680)
* Fix s3 snapshot restore [(#8734)](https://github.com/k3s-io/k3s/pull/8734)

## Embedded Component Versions
| Component | Version |
|---|---|
| Kubernetes | [v1.26.10](https://github.com/kubernetes/kubernetes/blob/master/CHANGELOG/CHANGELOG-1.26.md#v12610) |
| Kine | [v0.10.3](https://github.com/k3s-io/kine/releases/tag/v0.10.3) |
| SQLite | [3.42.0](https://sqlite.org/releaselog/3_42_0.html) |
| Etcd | [v3.5.9-k3s1](https://github.com/k3s-io/etcd/releases/tag/v3.5.9-k3s1) |
| Containerd | [v1.7.7-k3s1.26](https://github.com/k3s-io/containerd/releases/tag/v1.7.7-k3s1.26) |
| Runc | [v1.1.8](https://github.com/opencontainers/runc/releases/tag/v1.1.8) |
| Flannel | [v0.22.2](https://github.com/flannel-io/flannel/releases/tag/v0.22.2) | 
| Metrics-server | [v0.6.3](https://github.com/kubernetes-sigs/metrics-server/releases/tag/v0.6.3) |
| Traefik | [v2.10.5](https://github.com/traefik/traefik/releases/tag/v2.10.5) |
| CoreDNS | [v1.10.1](https://github.com/coredns/coredns/releases/tag/v1.10.1) | 
| Helm-controller | [v0.15.4](https://github.com/k3s-io/helm-controller/releases/tag/v0.15.4) |
| Local-path-provisioner | [v0.0.24](https://github.com/rancher/local-path-provisioner/releases/tag/v0.0.24) |

## Helpful Links
As always, we welcome and appreciate feedback from our community of users. Please feel free to:
- [Open issues here](https://github.com/rancher/k3s/issues/new/choose)
- [Join our Slack channel](https://slack.rancher.io/)
- [Check out our documentation](https://rancher.com/docs/k3s/latest/en/) for guidance on how to get started or to dive deep into K3s.
- [Read how you can contribute here](https://github.com/rancher/k3s/blob/master/CONTRIBUTING.md)
-----
# Release v1.26.9+k3s1
<!-- v1.26.9+k3s1 -->

This release updates Kubernetes to v1.26.9, and fixes a number of issues.

For more details on what's new, see the [Kubernetes release notes](https://github.com/kubernetes/kubernetes/blob/master/CHANGELOG/CHANGELOG-1.26.md#changelog-since-v1268).

## Changes since v1.26.8+k3s1:

* Bump kine to v0.10.3 [(#8325)](https://github.com/k3s-io/k3s/pull/8325)
* Update to v1.26.9 and go to v1.20.8 [(#8357)](https://github.com/k3s-io/k3s/pull/8357)
  * Bump embedded containerd to v1.7.6
  * Bump embedded stargz-snapshotter plugin to latest
  * Fixed intermittent drone CI failures due to race conditions in test environment setup scripts
  * Fixed CI failures due to changes to api discovery changes in Kubernetes 1.28

## Embedded Component Versions
| Component | Version |
|---|---|
| Kubernetes | [v1.26.9](https://github.com/kubernetes/kubernetes/blob/master/CHANGELOG/CHANGELOG-1.26.md#v1269) |
| Kine | [v0.10.3](https://github.com/k3s-io/kine/releases/tag/v0.10.3) |
| SQLite | [3.42.0](https://sqlite.org/releaselog/3_42_0.html) |
| Etcd | [v3.5.9-k3s1](https://github.com/k3s-io/etcd/releases/tag/v3.5.9-k3s1) |
| Containerd | [v1.7.6-k3s1.26](https://github.com/k3s-io/containerd/releases/tag/v1.7.6-k3s1.26) |
| Runc | [v1.1.8](https://github.com/opencontainers/runc/releases/tag/v1.1.8) |
| Flannel | [v0.22.2](https://github.com/flannel-io/flannel/releases/tag/v0.22.2) | 
| Metrics-server | [v0.6.3](https://github.com/kubernetes-sigs/metrics-server/releases/tag/v0.6.3) |
| Traefik | [v2.9.10](https://github.com/traefik/traefik/releases/tag/v2.9.10) |
| CoreDNS | [v1.10.1](https://github.com/coredns/coredns/releases/tag/v1.10.1) | 
| Helm-controller | [v0.15.4](https://github.com/k3s-io/helm-controller/releases/tag/v0.15.4) |
| Local-path-provisioner | [v0.0.24](https://github.com/rancher/local-path-provisioner/releases/tag/v0.0.24) |

## Helpful Links
As always, we welcome and appreciate feedback from our community of users. Please feel free to:
- [Open issues here](https://github.com/rancher/k3s/issues/new/choose)
- [Join our Slack channel](https://slack.rancher.io/)
- [Check out our documentation](https://rancher.com/docs/k3s/latest/en/) for guidance on how to get started or to dive deep into K3s.
- [Read how you can contribute here](https://github.com/rancher/k3s/blob/master/CONTRIBUTING.md)

-----
# Release v1.26.8+k3s1
<!-- v1.26.8+k3s1 -->
This release updates Kubernetes to v1.26.8, and fixes a number of issues.

⚠️ IMPORTANT: This release includes support for remediating CVE-2023-32187, a potential Denial of Service attack vector on K3s servers. See https://github.com/k3s-io/k3s/security/advisories/GHSA-m4hf-6vgr-75r2 for more information, including mandatory steps necessary to harden clusters against this vulnerability.

For more details on what's new, see the [Kubernetes release notes](https://github.com/kubernetes/kubernetes/blob/master/CHANGELOG/CHANGELOG-1.26.md#changelog-since-v1267).

## Changes since v1.26.7+k3s1:

* Update flannel and plugins [(#8075)](https://github.com/k3s-io/k3s/pull/8075)
* Fix tailscale bug with ip modes [(#8097)](https://github.com/k3s-io/k3s/pull/8097)
* Etcd snapshots retention when node name changes [(#8122)](https://github.com/k3s-io/k3s/pull/8122)
* August Test Backports [(#8126)](https://github.com/k3s-io/k3s/pull/8126)
* Backports for 2023-08 release [(#8129)](https://github.com/k3s-io/k3s/pull/8129)
  * K3s's external apiserver listener now declines to add to its certificate any subject names not associated with the kubernetes apiserver service, server nodes, or values of the --tls-san option. This prevents the certificate's SAN list from being filled with unwanted entries.
  * K3s no longer enables the apiserver's `enable-aggregator-routing` flag when the egress proxy is not being used to route connections to in-cluster endpoints.
  * Updated the embedded containerd to v1.7.3+k3s1
  * Updated the embedded runc to v1.1.8
  * Updated the embedded etcd to v3.5.9+k3s1
  * User-provided containerd config templates may now use `{{ template "base" . }}` to include the default K3s template content. This makes it easier to maintain user configuration if the only need is to add additional sections to the file.
  * Bump docker/docker module version to fix issues with cri-dockerd caused by recent releases of golang rejecting invalid host headers sent by the docker client.
  * Updated kine to v0.10.2
* - K3s etcd-snapshot delete fail to delete local file when called with s3 flag [(#8144)](https://github.com/k3s-io/k3s/pull/8144)
* - Fix for cluster-reset backup from s3 when etcd snapshots are disabled [(#8170)](https://github.com/k3s-io/k3s/pull/8170)
* Fixed the etcd retention to delete orphaned snapshots based on the date [(#8189)](https://github.com/k3s-io/k3s/pull/8189)
* Additional backports for 2023-08 release [(#8212)](https://github.com/k3s-io/k3s/pull/8212)
  * The version of `helm` used by the bundled helm controller's job image has been updated to v3.12.3
  * Bumped dynamiclistener to address an issue that could cause the apiserver/supervisor listener on 6443 to stop serving requests on etcd-only nodes.
  * The K3s external apiserver/supervisor listener on 6443 now sends a complete certificate chain in the TLS handshake.
* Move flannel to 0.22.2 [(#8222)](https://github.com/k3s-io/k3s/pull/8222)
* Update to v1.26.8 [(#8235)](https://github.com/k3s-io/k3s/pull/8235)
* Add new CLI flag to enable TLS SAN CN filtering [(#8258)](https://github.com/k3s-io/k3s/pull/8258)
  * Added a new `--tls-san-security` option. This flag defaults to false, but can be set to true to disable automatically adding SANs to the server's TLS certificate to satisfy any hostname requested by a client.
* Add RWMutex to address controller [(#8274)](https://github.com/k3s-io/k3s/pull/8274)

## Embedded Component Versions
| Component | Version |
|---|---|
| Kubernetes | [v1.26.8](https://github.com/kubernetes/kubernetes/blob/master/CHANGELOG/CHANGELOG-1.26.md#v1268) |
| Kine | [v0.10.2](https://github.com/k3s-io/kine/releases/tag/v0.10.2) |
| SQLite | [3.42.0](https://sqlite.org/releaselog/3_42_0.html) |
| Etcd | [v3.5.9-k3s1](https://github.com/k3s-io/etcd/releases/tag/v3.5.9-k3s1) |
| Containerd | [v1.7.3-k3s1](https://github.com/k3s-io/containerd/releases/tag/v1.7.3-k3s1) |
| Runc | [v1.1.8](https://github.com/opencontainers/runc/releases/tag/v1.1.8) |
| Flannel | [v0.22.2](https://github.com/flannel-io/flannel/releases/tag/v0.22.2) | 
| Metrics-server | [v0.6.3](https://github.com/kubernetes-sigs/metrics-server/releases/tag/v0.6.3) |
| Traefik | [v2.9.10](https://github.com/traefik/traefik/releases/tag/v2.9.10) |
| CoreDNS | [v1.10.1](https://github.com/coredns/coredns/releases/tag/v1.10.1) | 
| Helm-controller | [v0.15.4](https://github.com/k3s-io/helm-controller/releases/tag/v0.15.4) |
| Local-path-provisioner | [v0.0.24](https://github.com/rancher/local-path-provisioner/releases/tag/v0.0.24) |

## Helpful Links
As always, we welcome and appreciate feedback from our community of users. Please feel free to:
- [Open issues here](https://github.com/rancher/k3s/issues/new/choose)
- [Join our Slack channel](https://slack.rancher.io/)
- [Check out our documentation](https://rancher.com/docs/k3s/latest/en/) for guidance on how to get started or to dive deep into K3s.
- [Read how you can contribute here](https://github.com/rancher/k3s/blob/master/CONTRIBUTING.md)
-----
# Release v1.26.7+k3s1
<!-- v1.26.7+k3s1 -->

This release updates Kubernetes to v1.26.7, and fixes a number of issues.
​
For more details on what's new, see the [Kubernetes release notes](https://github.com/kubernetes/kubernetes/blob/master/CHANGELOG/CHANGELOG-1.26.md#changelog-since-v1266).
​
## Changes since v1.26.6+k3s1:
​
* Remove file_windows.go [(#7855)](https://github.com/k3s-io/k3s/pull/7855)
* Fix code spell check [(#7859)](https://github.com/k3s-io/k3s/pull/7859)
* Allow k3s to customize apiServerPort on helm-controller [(#7874)](https://github.com/k3s-io/k3s/pull/7874)
* Check if we are on ipv4, ipv6 or dualStack when doing tailscale [(#7882)](https://github.com/k3s-io/k3s/pull/7882)
* Support setting control server URL for Tailscale. [(#7893)](https://github.com/k3s-io/k3s/pull/7893)
* S3 and Startup tests [(#7885)](https://github.com/k3s-io/k3s/pull/7885)
* Fix rootless node password [(#7901)](https://github.com/k3s-io/k3s/pull/7901)
* Backports for 2023-07 release [(#7908)](https://github.com/k3s-io/k3s/pull/7908)
  * Resolved an issue that caused agents joined with kubeadm-style bootstrap tokens to fail to rejoin the cluster when their node object is deleted.
  * The `k3s certificate rotate-ca` command now supports the data-dir flag.
* Adding cli to custom klipper helm image [(#7914)](https://github.com/k3s-io/k3s/pull/7914)
  * The default helm-controller job image can now be overridden with the --helm-job-image CLI flag
* Generation of certs and keys for etcd gated if etcd is disabled [(#7944)](https://github.com/k3s-io/k3s/pull/7944)
* Don't use zgrep in `check-config` if apparmor profile is enforced [(#7956)](https://github.com/k3s-io/k3s/pull/7956)
* Fix image_scan.sh script and download trivy version (#7950) [(#7968)](https://github.com/k3s-io/k3s/pull/7968)
* Adjust default kubeconfig file permissions [(#7983)](https://github.com/k3s-io/k3s/pull/7983)
* Update to v1.26.7 [(#8022)](https://github.com/k3s-io/k3s/pull/8022)
​
## Embedded Component Versions
| Component | Version |
|---|---|
| Kubernetes | [v1.26.7](https://github.com/kubernetes/kubernetes/blob/master/CHANGELOG/CHANGELOG-1.26.md#v1267) |
| Kine | [v0.10.1](https://github.com/k3s-io/kine/releases/tag/v0.10.1) |
| SQLite | [3.39.2](https://sqlite.org/releaselog/3_39_2.html) |
| Etcd | [v3.5.7-k3s1](https://github.com/k3s-io/etcd/releases/tag/v3.5.7-k3s1) |
| Containerd | [v1.7.1-k3s1](https://github.com/k3s-io/containerd/releases/tag/v1.7.1-k3s1) |
| Runc | [v1.1.7](https://github.com/opencontainers/runc/releases/tag/v1.1.7) |
| Flannel | [v0.22.0](https://github.com/flannel-io/flannel/releases/tag/v0.22.0) | 
| Metrics-server | [v0.6.3](https://github.com/kubernetes-sigs/metrics-server/releases/tag/v0.6.3) |
| Traefik | [v2.9.10](https://github.com/traefik/traefik/releases/tag/v2.9.10) |
| CoreDNS | [v1.10.1](https://github.com/coredns/coredns/releases/tag/v1.10.1) | 
| Helm-controller | [v0.15.2](https://github.com/k3s-io/helm-controller/releases/tag/v0.15.2) |
| Local-path-provisioner | [v0.0.24](https://github.com/rancher/local-path-provisioner/releases/tag/v0.0.24) |
​
## Helpful Links
As always, we welcome and appreciate feedback from our community of users. Please feel free to:
- [Open issues here](https://github.com/rancher/k3s/issues/new/choose)
- [Join our Slack channel](https://slack.rancher.io/)
- [Check out our documentation](https://rancher.com/docs/k3s/latest/en/) for guidance on how to get started or to dive deep into K3s.
- [Read how you can contribute here](https://github.com/rancher/k3s/blob/master/CONTRIBUTING.md)

-----
# Release v1.26.6+k3s1
<!-- v1.26.6+k3s1 -->
This release updates Kubernetes to v1.26.6, and fixes a number of issues.

For more details on what's new, see the [Kubernetes release notes](https://github.com/kubernetes/kubernetes/blob/master/CHANGELOG/CHANGELOG-1.26.md#changelog-since-v1265).

## Changes since v1.26.5+k3s1:

* Update flannel version [(#7648)](https://github.com/k3s-io/k3s/pull/7648)
* Bump vagrant libvirt with fix for plugin installs [(#7658)](https://github.com/k3s-io/k3s/pull/7658)
* E2E and Dep Backports - June [(#7693)](https://github.com/k3s-io/k3s/pull/7693)
  * Bump docker go.mod #7681
  * Shortcircuit commands with version or help flags #7683
  * Add Rotation certification Check, remove func to restart agents #7097
  * E2E: Sudo for RunCmdOnNode #7686
* VPN integration [(#7727)](https://github.com/k3s-io/k3s/pull/7727)
* E2e: Private registry test [(#7721)](https://github.com/k3s-io/k3s/pull/7721)
* Fix spelling check [(#7751)](https://github.com/k3s-io/k3s/pull/7751)
* Remove unused libvirt config [(#7757)](https://github.com/k3s-io/k3s/pull/7757)
* Backport version bumps and bugfixes [(#7717)](https://github.com/k3s-io/k3s/pull/7717)
  * The bundled metrics-server has been bumped to v0.6.3, and now uses only secure TLS ciphers by default.
  * The `coredns-custom` ConfigMap now allows for `*.override` sections to be included in the `.:53` default server block.
  * The K3s core controllers (supervisor, deploy, and helm) no longer use the admin kubeconfig. This makes it easier to determine from access and audit logs which actions are performed by the system, and which are performed by an administrative user.
  * Bumped klipper-lb image to v0.4.4 to resolve an issue that prevented access to ServiceLB ports from localhost when the Service ExternalTrafficPolicy was set to Local.
  * Make LB image configurable when compiling k3s
  * K3s now allows nodes to join the cluster even if the node password secret cannot be created at the time the node joins. The secret create will be retried in the background. This resolves a potential deadlock created by fail-closed validating webhooks that block secret creation, where the webhook is unavailable until new nodes join the cluster to run the webhook pod.
  * The bundled containerd's aufs/devmapper/zfs snapshotter plugins have been restored. These were unintentionally omitted when moving containerd back into the k3s multicall binary in the previous release.
  * The embedded helm controller has been bumped to v0.15.0, and now supports creating the chart's target namespace if it does not exist.
* Add format command on makefile [(#7762)](https://github.com/k3s-io/k3s/pull/7762)
* Fix logging and cleanup in Tailscale [(#7782)](https://github.com/k3s-io/k3s/pull/7782)
* Update Kubernetes to v1.26.6 [(#7789)](https://github.com/k3s-io/k3s/pull/7789)

## Embedded Component Versions
| Component | Version |
|---|---|
| Kubernetes | [v1.26.6](https://github.com/kubernetes/kubernetes/blob/master/CHANGELOG/CHANGELOG-1.26.md#v1266) |
| Kine | [v0.10.1](https://github.com/k3s-io/kine/releases/tag/v0.10.1) |
| SQLite | [3.39.2](https://sqlite.org/releaselog/3_39_2.html) |
| Etcd | [v3.5.7-k3s1](https://github.com/k3s-io/etcd/releases/tag/v3.5.7-k3s1) |
| Containerd | [v1.7.1-k3s1](https://github.com/k3s-io/containerd/releases/tag/v1.7.1-k3s1) |
| Runc | [v1.1.7](https://github.com/opencontainers/runc/releases/tag/v1.1.7) |
| Flannel | [v0.22.0](https://github.com/flannel-io/flannel/releases/tag/v0.22.0) | 
| Metrics-server | [v0.6.3](https://github.com/kubernetes-sigs/metrics-server/releases/tag/v0.6.3) |
| Traefik | [v2.9.10](https://github.com/traefik/traefik/releases/tag/v2.9.10) |
| CoreDNS | [v1.10.1](https://github.com/coredns/coredns/releases/tag/v1.10.1) | 
| Helm-controller | [v0.15.0](https://github.com/k3s-io/helm-controller/releases/tag/v0.15.0) |
| Local-path-provisioner | [v0.0.24](https://github.com/rancher/local-path-provisioner/releases/tag/v0.0.24) |

## Helpful Links
As always, we welcome and appreciate feedback from our community of users. Please feel free to:
- [Open issues here](https://github.com/rancher/k3s/issues/new/choose)
- [Join our Slack channel](https://slack.rancher.io/)
- [Check out our documentation](https://rancher.com/docs/k3s/latest/en/) for guidance on how to get started or to dive deep into K3s.
- [Read how you can contribute here](https://github.com/rancher/k3s/blob/master/CONTRIBUTING.md)
-----
# Release v1.26.5+k3s1
<!-- v1.26.5+k3s1 -->
This release updates Kubernetes to v1.26.5, and fixes a number of issues.

For more details on what's new, see the [Kubernetes release notes](https://github.com/kubernetes/kubernetes/blob/master/CHANGELOG/CHANGELOG-1.26.md#changelog-since-v1264).

## Changes since v1.26.4+k3s1:

* Ensure that klog verbosity is set to the same level as logrus [(#7360)](https://github.com/k3s-io/k3s/pull/7360)
* Prepend release branch to dependabot [(#7374)](https://github.com/k3s-io/k3s/pull/7374)
* Add integration tests for etc-snapshot server flags [(#7377)](https://github.com/k3s-io/k3s/pull/7377)
* Bump Runc and Containerd [(#7399)](https://github.com/k3s-io/k3s/pull/7399)
* CLI + Config Enhancement [(#7403)](https://github.com/k3s-io/k3s/pull/7403)
  * `--Tls-sans` now accepts multiple arguments: `--tls-sans="foo,bar"`
  * `Prefer-bundled-bin: true` now works properly when set in `config.yaml.d` files
* Migrate netutil methods into /utils/net.go [(#7432)](https://github.com/k3s-io/k3s/pull/7432)
* Bump kube-router version to fix a bug when a port name is used [(#7460)](https://github.com/k3s-io/k3s/pull/7460)
* Kube flags and longhorn storage tests [(#7465)](https://github.com/k3s-io/k3s/pull/7465)
* Local-storage: Fix permission [(#7474)](https://github.com/k3s-io/k3s/pull/7474)
* Bump containerd to v1.7.0 and move back into multicall binary [(#7444)](https://github.com/k3s-io/k3s/pull/7444)
  * The embedded containerd version has been bumped to `v1.7.0-k3s1`, and has been reintegrated into the main k3s binary for a significant savings in release artifact size.
* Backport version bumps and bugfixes [(#7514)](https://github.com/k3s-io/k3s/pull/7514)
  * K3s now retries the cluster join operation when receiving a "too many learners" error from etcd. This most frequently occurred when attempting to add multiple servers at the same time.
  * K3s once again supports aarch64 nodes with page size > 4k
  * The packaged Traefik version has been bumped to v2.9.10 / chart 21.2.0
  * K3s now prints a more meaningful error when attempting to run from a filesystem mounted `noexec`.
  * K3s now exits with a proper error message when the server token uses a bootstrap token `id.secret` format.
  * Fixed an issue where Addon, HelmChart, and HelmChartConfig CRDs were created without structural schema, allowing the creation of custom resources of these types with invalid content.
  * Servers started with the (experimental) --disable-agent flag no longer attempt to run the tunnel authorizer agent component.
  * Fixed an regression that prevented the pod and cluster egress-selector modes from working properly.
  * K3s now correctly passes through etcd-args to the temporary etcd that is used to extract cluster bootstrap data when restarting managed etcd nodes.
  * K3s now properly handles errors obtaining the current etcd cluster member list when a new server is joining the managed etcd cluster.
  * The embedded kine version has been bumped to v0.10.1. This replaces the legacy `lib/pq` postgres driver with `pgx`.
  * The bundled CNI plugins have been upgraded to v1.2.0-k3s1. The bandwidth and firewall plugins are now included in the bundle.
  * The embedded Helm controller now supports authenticating to chart repositories via credentials stored in a Secret, as well as passing repo CAs via ConfigMap.
* Bump containerd/runc to v1.7.1-k3s1/v1.1.7 [(#7534)](https://github.com/k3s-io/k3s/pull/7534)
  * The bundled containerd and runc versions have been bumped to v1.7.1-k3s1/v1.1.7
* Wrap error stating that it is coming from netpol [(#7547)](https://github.com/k3s-io/k3s/pull/7547)
* Add '-all' flag to apply to inactive units [(#7573)](https://github.com/k3s-io/k3s/pull/7573)
* Update to v1.26.5-k3s1 [(#7576)](https://github.com/k3s-io/k3s/pull/7576)
* Pin emicklei/go-restful to v3.9.0 [(#7598)](https://github.com/k3s-io/k3s/pull/7598)

## Embedded Component Versions
| Component | Version |
|---|---|
| Kubernetes | [v1.26.5](https://github.com/kubernetes/kubernetes/blob/master/CHANGELOG/CHANGELOG-1.26.md#v1265) |
| Kine | [v0.10.1](https://github.com/k3s-io/kine/releases/tag/v0.10.1) |
| SQLite | [3.39.2](https://sqlite.org/releaselog/3_39_2.html) |
| Etcd | [v3.5.7-k3s1](https://github.com/k3s-io/etcd/releases/tag/v3.5.7-k3s1) |
| Containerd | [v1.7.1-k3s1](https://github.com/k3s-io/containerd/releases/tag/v1.7.1-k3s1) |
| Runc | [v1.1.7](https://github.com/opencontainers/runc/releases/tag/v1.1.7) |
| Flannel | [v0.21.4](https://github.com/flannel-io/flannel/releases/tag/v0.21.4) | 
| Metrics-server | [v0.6.2](https://github.com/kubernetes-sigs/metrics-server/releases/tag/v0.6.2) |
| Traefik | [v2.9.10](https://github.com/traefik/traefik/releases/tag/v2.9.10) |
| CoreDNS | [v1.10.1](https://github.com/coredns/coredns/releases/tag/v1.10.1) | 
| Helm-controller | [v0.14.0](https://github.com/k3s-io/helm-controller/releases/tag/v0.14.0) |
| Local-path-provisioner | [v0.0.24](https://github.com/rancher/local-path-provisioner/releases/tag/v0.0.24) |

## Helpful Links
As always, we welcome and appreciate feedback from our community of users. Please feel free to:
- [Open issues here](https://github.com/rancher/k3s/issues/new/choose)
- [Join our Slack channel](https://slack.rancher.io/)
- [Check out our documentation](https://rancher.com/docs/k3s/latest/en/) for guidance on how to get started or to dive deep into K3s.
- [Read how you can contribute here](https://github.com/rancher/k3s/blob/master/CONTRIBUTING.md)

-----
# Release v1.26.4+k3s1
<!-- v1.26.4+k3s1 -->
This release updates Kubernetes to v1.26.4, and fixes a number of issues.

For more details on what's new, see the [Kubernetes release notes](https://github.com/kubernetes/kubernetes/blob/master/CHANGELOG/CHANGELOG-1.26.md#changelog-since-v1263).

## Changes since v1.26.3+k3s1:

* Enhance `k3s check-config` [(#7091)](https://github.com/k3s-io/k3s/pull/7091)
* Update stable channel to v1.25.8+k3s1 [(#7161)](https://github.com/k3s-io/k3s/pull/7161)
* Drone Pipelines enhancement [(#7169)](https://github.com/k3s-io/k3s/pull/7169)
* Fix_get_sha_url [(#7187)](https://github.com/k3s-io/k3s/pull/7187)
* Improve Updatecli local-path-provisioner pipeline [(#7181)](https://github.com/k3s-io/k3s/pull/7181)
* Improve workflow [(#7142)](https://github.com/k3s-io/k3s/pull/7142)
* Improve Trivy configuration [(#7154)](https://github.com/k3s-io/k3s/pull/7154)
* Bump Local Path Provisioner version [(#7167)](https://github.com/k3s-io/k3s/pull/7167)
  * The bundled local-path-provisioner version has been bumped to v0.0.24
* Bump etcd to v3.5.7 [(#7170)](https://github.com/k3s-io/k3s/pull/7170)
  * The embedded etcd version has been bumped to v3.5.7
* Bump runc to v1.1.5 [(#7171)](https://github.com/k3s-io/k3s/pull/7171)
  * The bundled runc version has been bumped to v1.1.5
* Fix race condition caused by etcd advertising addresses that it does not listen on [(#7147)](https://github.com/k3s-io/k3s/pull/7147)
  * Fixed a race condition during cluster reset that could cause the operation to hang and time out.
* Bump coredns to v1.10.1 [(#7168)](https://github.com/k3s-io/k3s/pull/7168)
  * The bundled coredns version has been bumped to v1.10.1
* Don't apply hardened args to agent [(#7089)](https://github.com/k3s-io/k3s/pull/7089)
* Upgrade helm-controller to v0.13.3 [(#7209)](https://github.com/k3s-io/k3s/pull/7209)
* Improve Klipper Helm and Helm controller bumps [(#7146)](https://github.com/k3s-io/k3s/pull/7146)
* Fix issue with stale connections to removed LB server [(#7194)](https://github.com/k3s-io/k3s/pull/7194)
  * The client load-balancer that maintains connections to active server nodes now closes connections to servers when they are removed from the cluster. This ensures that agent components immediately reconnect to a current cluster member.
* Bump actions/setup-go from 3 to 4 [(#7111)](https://github.com/k3s-io/k3s/pull/7111)
* Lock bootstrap data with empty key to prevent conflicts [(#7215)](https://github.com/k3s-io/k3s/pull/7215)
  * When using an external datastore, K3s now locks the bootstrap key while creating initial cluster bootstrap data, preventing a race condition when multiple servers attempted to initialize the cluster simultaneously.
* Updated kube-router to move the default ACCEPT rule at the end of the chain [(#7218)](https://github.com/k3s-io/k3s/pull/7218)
  * The embedded kube-router controller has been updated to fix a regression that caused traffic from pods to be blocked by any default drop/deny rules present on the host. Users should still confirm that any externally-managed firewall rules explicitly allow traffic to/from pod and service networks, but this returns the old behavior that was relied upon by some users.
* Add make commands to terraform automation and fix external dbs related issue [(#7159)](https://github.com/k3s-io/k3s/pull/7159)
* Update klipper lb to v0.4.2 [(#7210)](https://github.com/k3s-io/k3s/pull/7210)
* Add coreos and sle micro to selinux support [(#6945)](https://github.com/k3s-io/k3s/pull/6945)
* Fix call for k3s-selinux versions in airgapped environments [(#7264)](https://github.com/k3s-io/k3s/pull/7264)
* Update Kube-router ACCEPT rule insertion and install script to clean rules before start [(#7274)](https://github.com/k3s-io/k3s/pull/7274)
  * The embedded kube-router controller has been updated to fix a regression that caused traffic from pods to be blocked by any default drop/deny rules present on the host. Users should still confirm that any externally-managed firewall rules explicitly allow traffic to/from pod and service networks, but this returns the old behavior that was relied upon by some users.
* Update to v1.26.4-k3s1 [(#7282)](https://github.com/k3s-io/k3s/pull/7282)
* Bump golang:alpine image version [(#7292)](https://github.com/k3s-io/k3s/pull/7292)
* Bump Sonobuoy version [(#7256)](https://github.com/k3s-io/k3s/pull/7256)
* Bump Trivy version [(#7257)](https://github.com/k3s-io/k3s/pull/7257)

## Embedded Component Versions
| Component | Version |
|---|---|
| Kubernetes | [v1.26.4](https://github.com/kubernetes/kubernetes/blob/master/CHANGELOG/CHANGELOG-1.26.md#v1264) |
| Kine | [v0.9.9](https://github.com/k3s-io/kine/releases/tag/v0.9.9) |
| SQLite | [3.39.2](https://sqlite.org/releaselog/3_39_2.html) |
| Etcd | [v3.5.7-k3s1](https://github.com/k3s-io/etcd/releases/tag/v3.5.7-k3s1) |
| Containerd | [v1.6.19-k3s1](https://github.com/k3s-io/containerd/releases/tag/v1.6.19-k3s1) |
| Runc | [v1.1.5](https://github.com/opencontainers/runc/releases/tag/v1.1.5) |
| Flannel | [v0.21.4](https://github.com/flannel-io/flannel/releases/tag/v0.21.4) | 
| Metrics-server | [v0.6.2](https://github.com/kubernetes-sigs/metrics-server/releases/tag/v0.6.2) |
| Traefik | [v2.9.4](https://github.com/traefik/traefik/releases/tag/v2.9.4) |
| CoreDNS | [v1.10.1](https://github.com/coredns/coredns/releases/tag/v1.10.1) | 
| Helm-controller | [v0.13.3](https://github.com/k3s-io/helm-controller/releases/tag/v0.13.3) |
| Local-path-provisioner | [v0.0.24](https://github.com/rancher/local-path-provisioner/releases/tag/v0.0.24) |

## Helpful Links
As always, we welcome and appreciate feedback from our community of users. Please feel free to:
- [Open issues here](https://github.com/rancher/k3s/issues/new/choose)
- [Join our Slack channel](https://slack.rancher.io/)
- [Check out our documentation](https://rancher.com/docs/k3s/latest/en/) for guidance on how to get started or to dive deep into K3s.
- [Read how you can contribute here](https://github.com/rancher/k3s/blob/master/CONTRIBUTING.md)
-----
# Release v1.26.3+k3s1
<!-- v1.26.3+k3s1 -->
This release updates Kubernetes to v1.26.3, and fixes a number of issues.

For more details on what's new, see the [Kubernetes release notes](https://github.com/kubernetes/kubernetes/blob/master/CHANGELOG/CHANGELOG-1.26.md#changelog-since-v1262).

## Changes since v1.26.2+k3s1:

* Add E2E to Drone [(#6890)](https://github.com/k3s-io/k3s/pull/6890)
* Add flannel adr [(#6973)](https://github.com/k3s-io/k3s/pull/6973)
* Update flannel and kube-router [(#7039)](https://github.com/k3s-io/k3s/pull/7039)
* Bump various dependencies for CVEs [(#7044)](https://github.com/k3s-io/k3s/pull/7044)
* Adds a warning about editing to the containerd config.toml file [(#7057)](https://github.com/k3s-io/k3s/pull/7057)
* Update stable version in channel server [(#7066)](https://github.com/k3s-io/k3s/pull/7066)
* Wait for kubelet port to be ready before setting [(#7041)](https://github.com/k3s-io/k3s/pull/7041)
  * The agent tunnel authorizer now waits for the kubelet to be ready before reading the kubelet port from the node object.
* Improve support for rotating the default self-signed certs [(#7032)](https://github.com/k3s-io/k3s/pull/7032)
  * The `k3s certificate rotate-ca` checks now support rotating self-signed certificates without the `--force` option.
* Skip all pipelines based on what is in the PR [(#6996)](https://github.com/k3s-io/k3s/pull/6996)
* Add missing kernel config checks [(#6946)](https://github.com/k3s-io/k3s/pull/6946)
* Remove deprecated nodeSelector label beta.kubernetes.io/os [(#6970)](https://github.com/k3s-io/k3s/pull/6970)
* MultiClusterCIDR for v1.26 [(#6885)](https://github.com/k3s-io/k3s/pull/6885)
  * MultiClusterCIDR feature
* Remove Nikolai from MAINTAINERS list [(#7088)](https://github.com/k3s-io/k3s/pull/7088)
* Add automation for Restart command for K3s [(#7002)](https://github.com/k3s-io/k3s/pull/7002)
* Fix to Rotate CA e2e test [(#7101)](https://github.com/k3s-io/k3s/pull/7101)
* Drone: Cleanup E2E VMs on test panic [(#7104)](https://github.com/k3s-io/k3s/pull/7104)
* Update to v1.26.3-k3s1 [(#7108)](https://github.com/k3s-io/k3s/pull/7108)
* Pin golangci-lint version to v1.51.2 [(#7113)](https://github.com/k3s-io/k3s/pull/7113)
* Clean E2E VMs before testing [(#7109)](https://github.com/k3s-io/k3s/pull/7109)
* Update flannel to fix NAT issue with old iptables version [(#7136)](https://github.com/k3s-io/k3s/pull/7136)

## Embedded Component Versions
| Component | Version |
|---|---|
| Kubernetes | [v1.26.3](https://github.com/kubernetes/kubernetes/blob/master/CHANGELOG/CHANGELOG-1.26.md#v1263) |
| Kine | [v0.9.9](https://github.com/k3s-io/kine/releases/tag/v0.9.9) |
| SQLite | [3.39.2](https://sqlite.org/releaselog/3_39_2.html) |
| Etcd | [v3.5.5-k3s1](https://github.com/k3s-io/etcd/releases/tag/v3.5.5-k3s1) |
| Containerd | [v1.6.19-k3s1](https://github.com/k3s-io/containerd/releases/tag/v1.6.19-k3s1) |
| Runc | [v1.1.4](https://github.com/opencontainers/runc/releases/tag/v1.1.4) |
| Flannel | [v0.21.4](https://github.com/flannel-io/flannel/releases/tag/v0.21.4) | 
| Metrics-server | [v0.6.2](https://github.com/kubernetes-sigs/metrics-server/releases/tag/v0.6.2) |
| Traefik | [v2.9.4](https://github.com/traefik/traefik/releases/tag/v2.9.4) |
| CoreDNS | [v1.9.4](https://github.com/coredns/coredns/releases/tag/v1.9.4) | 
| Helm-controller | [v0.13.1](https://github.com/k3s-io/helm-controller/releases/tag/v0.13.1) |
| Local-path-provisioner | [v0.0.23](https://github.com/rancher/local-path-provisioner/releases/tag/v0.0.23) |

## Helpful Links
As always, we welcome and appreciate feedback from our community of users. Please feel free to:
- [Open issues here](https://github.com/rancher/k3s/issues/new/choose)
- [Join our Slack channel](https://slack.rancher.io/)
- [Check out our documentation](https://rancher.com/docs/k3s/latest/en/) for guidance on how to get started or to dive deep into K3s.
- [Read how you can contribute here](https://github.com/rancher/k3s/blob/master/CONTRIBUTING.md)
-----
# Release v1.26.2+k3s1
<!-- v1.26.2+k3s1 -->
This release updates Kubernetes to v1.26.2, and fixes a number of issues.

For more details on what's new, see the [Kubernetes release notes](https://github.com/kubernetes/kubernetes/blob/master/CHANGELOG/CHANGELOG-1.26.md#changelog-since-v1261).

## Changes since v1.26.1+k3s1:

* Add build tag to disable cri-dockerd [(#6760)](https://github.com/k3s-io/k3s/pull/6760)
* Bump cri-dockerd [(#6797)](https://github.com/k3s-io/k3s/pull/6797)
  * The embedded cri-dockerd has been updated to v0.3.1
* Update stable channel to v1.25.6+k3s1 [(#6828)](https://github.com/k3s-io/k3s/pull/6828)
* E2E Rancher and Hardened script improvements [(#6778)](https://github.com/k3s-io/k3s/pull/6778)
* Add Ayedo to Adopters [(#6801)](https://github.com/k3s-io/k3s/pull/6801)
* Consolidate E2E tests and GH Actions [(#6772)](https://github.com/k3s-io/k3s/pull/6772)
* Allow ServiceLB to honor `ExternalTrafficPolicy=Local` [(#6726)](https://github.com/k3s-io/k3s/pull/6726)
  * ServiceLB now honors the Service's ExternalTrafficPolicy. When set to Local, the LoadBalancer will only advertise addresses of Nodes with a Pod for the Service, and will not forward traffic to other cluster members.
* Fix cronjob example [(#6707)](https://github.com/k3s-io/k3s/pull/6707)
* Bump vagrant boxes to fedora37 [(#6832)](https://github.com/k3s-io/k3s/pull/6832)
* Ensure flag type consistency [(#6852)](https://github.com/k3s-io/k3s/pull/6852)
* E2E: Consoldiate docker and prefer bundled tests into new startup test [(#6851)](https://github.com/k3s-io/k3s/pull/6851)
* Fix reference to documentation [(#6860)](https://github.com/k3s-io/k3s/pull/6860)
* Bump deps: trivy, sonobuoy, dapper, golangci-lint, gopls [(#6807)](https://github.com/k3s-io/k3s/pull/6807)
* Fix check for (open)SUSE version [(#6791)](https://github.com/k3s-io/k3s/pull/6791)
* Add support for user-provided CA certificates [(#6615)](https://github.com/k3s-io/k3s/pull/6615)
  * K3s now functions properly when the cluster CA certificates are signed by an existing root or intermediate CA. You can find a sample script for generating such certificates before K3s starts in the github repo at [contrib/util/certs.sh](https://github.com/k3s-io/k3s/blob/master/contrib/util/certs.sh).
* Ignore value conflicts when reencrypting secrets [(#6850)](https://github.com/k3s-io/k3s/pull/6850)
* Add `kubeadm` style bootstrap token secret support [(#6663)](https://github.com/k3s-io/k3s/pull/6663)
  * K3s now supports `kubeadm` style join tokens. `k3s token create` now creates join token secrets, optionally with a limited TTL.
  * K3s agents joined with an expired or deleted token stay in the cluster using existing client certificates via the NodeAuthorization admission plugin, unless their Node object is deleted from the cluster.
* Add NATS to the list of supported data stores [(#6876)](https://github.com/k3s-io/k3s/pull/6876)
* Use default address family when adding kubernetes service address to SAN list [(#6857)](https://github.com/k3s-io/k3s/pull/6857)
  * The apiserver advertised address and IP SAN entry are now set correctly on clusters that use IPv6 as the default IP family.
* Fix issue with servicelb startup failure when validating webhooks block creation [(#6911)](https://github.com/k3s-io/k3s/pull/6911)
  * The embedded cloud controller manager will no longer attempt to unconditionally re-create its namespace and serviceaccount on startup. This resolves an issue that could cause a deadlocked cluster when fail-closed webhooks are in use.
* Fix access to hostNetwork port on NodeIP when egress-selector-mode=agent [(#6829)](https://github.com/k3s-io/k3s/pull/6829)
  * Fixed an issue that would cause the apiserver egress proxy to attempt to use the agent tunnel to connect to service endpoints even in agent or disabled mode.
* Wait for server to become ready before creating token [(#6932)](https://github.com/k3s-io/k3s/pull/6932)
* Allow for multiple sets of leader-elected controllers [(#6922)](https://github.com/k3s-io/k3s/pull/6922)
  * Fixed an issue where leader-elected controllers for managed etcd did not run on etcd-only nodes
* Update Flannel to v0.21.1 [(#6944)](https://github.com/k3s-io/k3s/pull/6944)
* Fix Nightly E2E tests [(#6950)](https://github.com/k3s-io/k3s/pull/6950)
* Fix etcd and ca-cert rotate issues [(#6952)](https://github.com/k3s-io/k3s/pull/6952)
* Fix ServiceLB dual-stack ingress IP listing [(#6979)](https://github.com/k3s-io/k3s/pull/6979)
  * Resolved an issue with ServiceLB that would cause it to advertise node IPv6 addresses, even if the cluster or service was not enabled for dual-stack operation.
* Bump kine to v0.9.9 [(#6974)](https://github.com/k3s-io/k3s/pull/6974)
  * The embedded kine version has been bumped to v0.9.9. Compaction log messages are now omitted at `info` level for increased visibility.
* Update to v1.26.2-k3s1 [(#7011)](https://github.com/k3s-io/k3s/pull/7011)

## Embedded Component Versions
| Component | Version |
|---|---|
| Kubernetes | [v1.26.2](https://github.com/kubernetes/kubernetes/blob/master/CHANGELOG/CHANGELOG-1.26.md#v1262) |
| Kine | [v0.9.9](https://github.com/k3s-io/kine/releases/tag/v0.9.9) |
| SQLite | [3.39.2](https://sqlite.org/releaselog/3_39_2.html) |
| Etcd | [v3.5.5-k3s1](https://github.com/k3s-io/etcd/releases/tag/v3.5.5-k3s1) |
| Containerd | [v1.6.15-k3s1](https://github.com/k3s-io/containerd/releases/tag/v1.6.15-k3s1) |
| Runc | [v1.1.4](https://github.com/opencontainers/runc/releases/tag/v1.1.4) |
| Flannel | [v0.21.1](https://github.com/flannel-io/flannel/releases/tag/v0.21.1) | 
| Metrics-server | [v0.6.2](https://github.com/kubernetes-sigs/metrics-server/releases/tag/v0.6.2) |
| Traefik | [v2.9.4](https://github.com/traefik/traefik/releases/tag/v2.9.4) |
| CoreDNS | [v1.9.4](https://github.com/coredns/coredns/releases/tag/v1.9.4) | 
| Helm-controller | [v0.13.1](https://github.com/k3s-io/helm-controller/releases/tag/v0.13.1) |
| Local-path-provisioner | [v0.0.23](https://github.com/rancher/local-path-provisioner/releases/tag/v0.0.23) |

## Helpful Links
As always, we welcome and appreciate feedback from our community of users. Please feel free to:
- [Open issues here](https://github.com/rancher/k3s/issues/new/choose)
- [Join our Slack channel](https://slack.rancher.io/)
- [Check out our documentation](https://rancher.com/docs/k3s/latest/en/) for guidance on how to get started or to dive deep into K3s.
- [Read how you can contribute here](https://github.com/rancher/k3s/blob/master/CONTRIBUTING.md)
-----
# Release v1.26.1+k3s1
<!-- v1.26.1+k3s1 -->
This release updates Kubernetes to v1.26.1, and fixes a number of issues.

For more details on what's new, see the [Kubernetes release notes](https://github.com/kubernetes/kubernetes/blob/master/CHANGELOG/CHANGELOG-1.26.md#changelog-since-v1260).

## Changes since v1.26.0+k3s2:

* Add jitter to scheduled snapshots and retry harder on conflicts [(#6715)](https://github.com/k3s-io/k3s/pull/6715)
  * Scheduled etcd snapshots are now offset by a short random delay of up to several seconds. This should prevent multi-server clusters from executing pathological behavior when attempting to simultaneously update the snapshot list ConfigMap. The snapshot controller will also be more persistent in attempting to update the snapshot list.
* Adjust e2e test run script and fixes [(#6718)](https://github.com/k3s-io/k3s/pull/6718)
* RIP Codespell [(#6701)](https://github.com/k3s-io/k3s/pull/6701)
* Bump alpine from 3.16 to 3.17 in /package [(#6688)](https://github.com/k3s-io/k3s/pull/6688)
* Bump alpine from 3.16 to 3.17 in /conformance [(#6687)](https://github.com/k3s-io/k3s/pull/6687)
* Bump containerd to v1.6.15-k3s1 [(#6722)](https://github.com/k3s-io/k3s/pull/6722)
  * The embedded containerd version has been bumped to v1.6.15-k3s1
* Containerd restart testlet [(#6696)](https://github.com/k3s-io/k3s/pull/6696)
* Bump ubuntu from 20.04 to 22.04 in /tests/e2e/scripts [(#6686)](https://github.com/k3s-io/k3s/pull/6686)
* Add explicit read permissions to workflows [(#6700)](https://github.com/k3s-io/k3s/pull/6700)
* Pass through default tls-cipher-suites [(#6725)](https://github.com/k3s-io/k3s/pull/6725)
  * The K3s default cipher suites are now explicitly passed in to kube-apiserver, ensuring that all listeners use these values.
* Bump golang:alpine image version [(#6683)](https://github.com/k3s-io/k3s/pull/6683)
* Bugfix: do not break cert-manager when pprof is enabled [(#6635)](https://github.com/k3s-io/k3s/pull/6635)
* Fix CI tests on Alpine 3.17 [(#6744)](https://github.com/k3s-io/k3s/pull/6744)
* Update Stable to 1.25.5+k3s2 [(#6753)](https://github.com/k3s-io/k3s/pull/6753)
* Bump action/download-artifact to v3 [(#6746)](https://github.com/k3s-io/k3s/pull/6746)
* Generate report and upload test results [(#6737)](https://github.com/k3s-io/k3s/pull/6737)
* Slow dependency CI to weekly [(#6764)](https://github.com/k3s-io/k3s/pull/6764)
* Fix Drone plugins/docker tag for 32 bit arm [(#6769)](https://github.com/k3s-io/k3s/pull/6769)
* Update to v1.26.1-k3s1 [(#6774)](https://github.com/k3s-io/k3s/pull/6774)

## Embedded Component Versions
| Component | Version |
|---|---|
| Kubernetes | [v1.26.1](https://github.com/kubernetes/kubernetes/blob/master/CHANGELOG/CHANGELOG-1.26.md#v1261) |
| Kine | [v0.9.8](https://github.com/k3s-io/kine/releases/tag/v0.9.8) |
| SQLite | [3.39.2](https://sqlite.org/releaselog/3_39_2.html) |
| Etcd | [v3.5.5-k3s1](https://github.com/k3s-io/etcd/releases/tag/v3.5.5-k3s1) |
| Containerd | [v1.6.15-k3s1](https://github.com/k3s-io/containerd/releases/tag/v1.6.15-k3s1) |
| Runc | [v1.1.4](https://github.com/opencontainers/runc/releases/tag/v1.1.4) |
| Flannel | [v0.20.2](https://github.com/flannel-io/flannel/releases/tag/v0.20.2) | 
| Metrics-server | [v0.6.2](https://github.com/kubernetes-sigs/metrics-server/releases/tag/v0.6.2) |
| Traefik | [v2.9.4](https://github.com/traefik/traefik/releases/tag/v2.9.4) |
| CoreDNS | [v1.9.4](https://github.com/coredns/coredns/releases/tag/v1.9.4) | 
| Helm-controller | [v0.13.1](https://github.com/k3s-io/helm-controller/releases/tag/v0.13.1) |
| Local-path-provisioner | [v0.0.23](https://github.com/rancher/local-path-provisioner/releases/tag/v0.0.23) |

## Helpful Links
As always, we welcome and appreciate feedback from our community of users. Please feel free to:
- [Open issues here](https://github.com/rancher/k3s/issues/new/choose)
- [Join our Slack channel](https://slack.rancher.io/)
- [Check out our documentation](https://rancher.com/docs/k3s/latest/en/) for guidance on how to get started or to dive deep into K3s.
- [Read how you can contribute here](https://github.com/rancher/k3s/blob/master/CONTRIBUTING.md)
-----
# Release v1.26.0+k3s2
<!-- v1.26.0+k3s2 -->

This release updates containerd to v1.6.14 to resolve an issue where pods would lose their CNI information when containerd was restarted, as well as a number of other stability and administrative changes.

Before upgrading from earlier releases, be sure to read the Kubernetes [Urgent Upgrade Notes](https://github.com/kubernetes/kubernetes/blob/master/CHANGELOG/CHANGELOG-1.26.md#urgent-upgrade-notes).

## Changes since v1.26.0+k3s1:

* Current status badges [(#6653)](https://github.com/k3s-io/k3s/pull/6653)
* Add initial Updatecli ADR automation [(#6583)](https://github.com/k3s-io/k3s/pull/6583)
* December 2022 channels update [(#6618)](https://github.com/k3s-io/k3s/pull/6618)
* Change Updatecli GH action reference branch [(#6682)](https://github.com/k3s-io/k3s/pull/6682)
* Fix OpenRC init script error 'openrc-run.sh: source: not found' [(#6614)](https://github.com/k3s-io/k3s/pull/6614)
* Add Dependabot config for security ADR [(#6560)](https://github.com/k3s-io/k3s/pull/6560)
* Bump containerd to v1.6.14-k3s1 [(#6693)](https://github.com/k3s-io/k3s/pull/6693)
  * The embedded containerd version has been bumped to v1.6.14-k3s1. This includes a backported fix for [containerd/7843](https://github.com/containerd/containerd/issues/7843) which caused pods to lose their CNI info when containerd was restarted, which in turn caused the kubelet to recreate the pod.
* Exclude December r1 releases from channel server [(#6706)](https://github.com/k3s-io/k3s/pull/6706)

## Embedded Component Versions
| Component | Version |
|---|---|
| Kubernetes | [v1.26.0](https://github.com/kubernetes/kubernetes/blob/master/CHANGELOG/CHANGELOG-1.26.md#v1260) |
| Kine | [v0.9.8](https://github.com/k3s-io/kine/releases/tag/v0.9.8) |
| SQLite | [3.39.2](https://sqlite.org/releaselog/3_39_2.html) |
| Etcd | [v3.5.5-k3s1](https://github.com/k3s-io/etcd/releases/tag/v3.5.5-k3s1) |
| Containerd | [v1.6.14-k3s1](https://github.com/k3s-io/containerd/releases/tag/v1.6.14-k3s1) |
| Runc | [v1.1.4](https://github.com/opencontainers/runc/releases/tag/v1.1.4) |
| Flannel | [v0.20.2](https://github.com/flannel-io/flannel/releases/tag/v0.20.2) |
| Metrics-server | [v0.6.2](https://github.com/kubernetes-sigs/metrics-server/releases/tag/v0.6.2) |
| Traefik | [v2.9.4](https://github.com/traefik/traefik/releases/tag/v2.9.4) |
| CoreDNS | [v1.9.4](https://github.com/coredns/coredns/releases/tag/v1.9.4) |
| Helm-controller | [v0.13.1](https://github.com/k3s-io/helm-controller/releases/tag/v0.13.1) |
| Local-path-provisioner | [v0.0.23](https://github.com/rancher/local-path-provisioner/releases/tag/v0.0.23) |

## Helpful Links
As always, we welcome and appreciate feedback from our community of users. Please feel free to:
- [Open issues here](https://github.com/rancher/k3s/issues/new/choose)
- [Join our Slack channel](https://slack.rancher.io/)
- [Check out our documentation](https://rancher.com/docs/k3s/latest/en/) for guidance on how to get started or to dive deep into K3s.
- [Read how you can contribute here](https://github.com/rancher/k3s/blob/master/CONTRIBUTING.md)
-----
# Release v1.26.0+k3s1
<!-- v1.26.0+k3s1 -->

> ## ⚠️ WARNING
> This release is affected by https://github.com/containerd/containerd/issues/7843, which causes the kubelet to restart all pods whenever K3s is restarted. For this reason, we have removed this K3s release from the channel server. Please use `v1.26.0+k3s2` instead.

This release is K3S's first in the v1.26 line. This release updates Kubernetes to v1.26.0.

Before upgrading from earlier releases, be sure to read the Kubernetes [Urgent Upgrade Notes](https://github.com/kubernetes/kubernetes/blob/master/CHANGELOG/CHANGELOG-1.26.md#urgent-upgrade-notes).

## Changes since v1.25.5+k3s1:

* Remove deprecated flags in v1.26 [(#6574)](https://github.com/k3s-io/k3s/pull/6574)
* Using "etcd-snapshot" for saving snapshots is now deprecated, use "etcd-snapshot save" instead. [(#6575)](https://github.com/k3s-io/k3s/pull/6575)
* Update to v1.26.0-k3s1
 * * Update kubernetes to v1.26.0-k3s1
 * * Update cri-tools to  v1.26.0-rc.0-k3s1
 * * Update helm controller to v0.13.1
 * * Update etcd to v3.5.5-k3s1
 * * Update cri-dockerd to the latest 1.26.0
 * * Update cadvisor
 * * Update containerd to v1.6.12-k3s1 [(#6370)](https://github.com/k3s-io/k3s/pull/6370)
* Preload iptable_filter/ip6table_filter [(#6645)](https://github.com/k3s-io/k3s/pull/6645)
* Bump k3s-root version to v0.12.1 [(#6651)](https://github.com/k3s-io/k3s/pull/6651)

## Embedded Component Versions
| Component | Version |
|---|---|
| Kubernetes | [v1.26.0](https://github.com/kubernetes/kubernetes/blob/master/CHANGELOG/CHANGELOG-1.26.md#v1260) |
| Kine | [v0.9.8](https://github.com/k3s-io/kine/releases/tag/v0.9.8) |
| SQLite | [3.39.2](https://sqlite.org/releaselog/3_39_2.html) |
| Etcd | [v3.5.5-k3s1](https://github.com/k3s-io/etcd/releases/tag/v3.5.5-k3s1) |
| Containerd | [v1.6.12-k3s1](https://github.com/k3s-io/containerd/releases/tag/v1.6.12-k3s1) |
| Runc | [v1.1.4](https://github.com/opencontainers/runc/releases/tag/v1.1.4) |
| Flannel | [v0.20.2](https://github.com/flannel-io/flannel/releases/tag/v0.20.2) | 
| Metrics-server | [v0.6.2](https://github.com/kubernetes-sigs/metrics-server/releases/tag/v0.6.2) |
| Traefik | [v2.9.4](https://github.com/traefik/traefik/releases/tag/v2.9.4) |
| CoreDNS | [v1.9.4](https://github.com/coredns/coredns/releases/tag/v1.9.4) | 
| Helm-controller | [v0.13.1](https://github.com/k3s-io/helm-controller/releases/tag/v0.13.1) |
| Local-path-provisioner | [v0.0.23](https://github.com/rancher/local-path-provisioner/releases/tag/v0.0.23) |

## Helpful Links
As always, we welcome and appreciate feedback from our community of users. Please feel free to:
- [Open issues here](https://github.com/rancher/k3s/issues/new/choose)
- [Join our Slack channel](https://slack.rancher.io/)
- [Check out our documentation](https://rancher.com/docs/k3s/latest/en/) for guidance on how to get started or to dive deep into K3s.
- [Read how you can contribute here](https://github.com/rancher/k3s/blob/master/CONTRIBUTING.md)
-----
