| k3s version| Kubernetes | Kine | SQLite | Etcd | Containerd | Runc | Flannel | Metrics-server | Traefik | CoreDNS | Helm-controller | Local-path-provisioner  |
| ----- | ----- | ----- | ----- | ----- | ----- | ----- | ----- | ----- | ----- | ----- | ----- | -----  |
| v1.29.8+k3s1 | [v1.29.8](https://github.com/kubernetes/kubernetes/blob/master/CHANGELOG/CHANGELOG-1.29.md#v1298) | [v0.11.11](https://github.com/k3s-io/kine/releases/tag/v0.11.11) | [3.44.0](https://sqlite.org/releaselog/3_44_0.html) | [v3.5.13-k3s1](https://github.com/k3s-io/etcd/releases/tag/v3.5.13-k3s1) | [v1.7.20-k3s1](https://github.com/k3s-io/containerd/releases/tag/v1.7.20-k3s1) | [v1.1.12](https://github.com/opencontainers/runc/releases/tag/v1.1.12) | [v0.25.4](https://github.com/flannel-io/flannel/releases/tag/v0.25.4) | [v0.7.0](https://github.com/kubernetes-sigs/metrics-server/releases/tag/v0.7.0) | [v2.10.7](https://github.com/traefik/traefik/releases/tag/v2.10.7) | [v1.10.1](https://github.com/coredns/coredns/releases/tag/v1.10.1) | [v0.15.10](https://github.com/k3s-io/helm-controller/releases/tag/v0.15.10) | [v0.0.28](https://github.com/rancher/local-path-provisioner/releases/tag/v0.0.28)  |
| v1.29.7+k3s1 | [v1.29.7](https://github.com/kubernetes/kubernetes/blob/master/CHANGELOG/CHANGELOG-1.29.md#v1297) | [v0.11.11](https://github.com/k3s-io/kine/releases/tag/v0.11.11) | [3.44.0](https://sqlite.org/releaselog/3_44_0.html) | [v3.5.13-k3s1](https://github.com/k3s-io/etcd/releases/tag/v3.5.13-k3s1) | [v1.7.17-k3s1](https://github.com/k3s-io/containerd/releases/tag/v1.7.17-k3s1) | [v1.1.12](https://github.com/opencontainers/runc/releases/tag/v1.1.12) | [v0.25.4](https://github.com/flannel-io/flannel/releases/tag/v0.25.4) | [v0.7.0](https://github.com/kubernetes-sigs/metrics-server/releases/tag/v0.7.0) | [v2.10.7](https://github.com/traefik/traefik/releases/tag/v2.10.7) | [v1.10.1](https://github.com/coredns/coredns/releases/tag/v1.10.1) | [v0.15.10](https://github.com/k3s-io/helm-controller/releases/tag/v0.15.10) | [v0.0.28](https://github.com/rancher/local-path-provisioner/releases/tag/v0.0.28)  |
| v1.29.6+k3s2 | [v1.29.6](https://github.com/kubernetes/kubernetes/blob/master/CHANGELOG/CHANGELOG-1.29.md#v1296) | [v0.11.9](https://github.com/k3s-io/kine/releases/tag/v0.11.9) | [3.44.0](https://sqlite.org/releaselog/3_44_0.html) | [v3.5.13-k3s1](https://github.com/k3s-io/etcd/releases/tag/v3.5.13-k3s1) | [v1.7.17-k3s1](https://github.com/k3s-io/containerd/releases/tag/v1.7.17-k3s1) | [v1.1.12-](https://github.com/opencontainers/runc/releases/tag/v1.1.12) | [v0.25.4](https://github.com/flannel-io/flannel/releases/tag/v0.25.4) | [v0.7.0](https://github.com/kubernetes-sigs/metrics-server/releases/tag/v0.7.0) | [v2.10.7](https://github.com/traefik/traefik/releases/tag/v2.10.7) | [v1.10.1](https://github.com/coredns/coredns/releases/tag/v1.10.1) | [v0.15.10](https://github.com/k3s-io/helm-controller/releases/tag/v0.15.10) | [v0.0.27](https://github.com/rancher/local-path-provisioner/releases/tag/v0.0.27)  |
| v1.29.6+k3s1 | [v1.29.6](https://github.com/kubernetes/kubernetes/blob/master/CHANGELOG/CHANGELOG-1.29.md#v1296) | [v0.11.9](https://github.com/k3s-io/kine/releases/tag/v0.11.9) | [3.44.0](https://sqlite.org/releaselog/3_44_0.html) | [v3.5.13-k3s1](https://github.com/k3s-io/etcd/releases/tag/v3.5.13-k3s1) | [v1.7.17-k3s1](https://github.com/k3s-io/containerd/releases/tag/v1.7.17-k3s1) | [v1.1.12](https://github.com/opencontainers/runc/releases/tag/v1.1.12) | [v0.25.2](https://github.com/flannel-io/flannel/releases/tag/v0.25.2) | [v0.7.0](https://github.com/kubernetes-sigs/metrics-server/releases/tag/v0.7.0) | [v2.10.7](https://github.com/traefik/traefik/releases/tag/v2.10.7) | [v1.10.1](https://github.com/coredns/coredns/releases/tag/v1.10.1) | [v0.15.10](https://github.com/k3s-io/helm-controller/releases/tag/v0.15.10) | [v0.0.27](https://github.com/rancher/local-path-provisioner/releases/tag/v0.0.27)  |
| v1.29.5+k3s1 | [v1.29.5](https://github.com/kubernetes/kubernetes/blob/master/CHANGELOG/CHANGELOG-1.29.md#v1295) | [v0.11.7](https://github.com/k3s-io/kine/releases/tag/v0.11.7) | [3.44.0](https://sqlite.org/releaselog/3_44_0.html) | [v3.5.9-k3s1](https://github.com/k3s-io/etcd/releases/tag/v3.5.9-k3s1) | [v1.7.15-k3s1](https://github.com/k3s-io/containerd/releases/tag/v1.7.15-k3s1) | [v1.1.12-k3s1](https://github.com/opencontainers/runc/releases/tag/v1.1.12-k3s1) | [v0.24.2](https://github.com/flannel-io/flannel/releases/tag/v0.24.2) | [v0.7.0](https://github.com/kubernetes-sigs/metrics-server/releases/tag/v0.7.0) | [v2.10.7](https://github.com/traefik/traefik/releases/tag/v2.10.7) | [v1.10.1](https://github.com/coredns/coredns/releases/tag/v1.10.1) | [v0.15.9](https://github.com/k3s-io/helm-controller/releases/tag/v0.15.9) | [v0.0.26](https://github.com/rancher/local-path-provisioner/releases/tag/v0.0.26)  |
| v1.29.4+k3s1 | [v1.29.4](https://github.com/kubernetes/kubernetes/blob/master/CHANGELOG/CHANGELOG-1.29.md#v1294) | [v0.11.7](https://github.com/k3s-io/kine/releases/tag/v0.11.7) | [3.44.0](https://sqlite.org/releaselog/3_44_0.html) | [v3.5.9-k3s1](https://github.com/k3s-io/etcd/releases/tag/v3.5.9-k3s1) | [v1.7.15-k3s1](https://github.com/k3s-io/containerd/releases/tag/v1.7.15-k3s1) | [v1.1.12](https://github.com/opencontainers/runc/releases/tag/v1.1.12) | [v0.24.2](https://github.com/flannel-io/flannel/releases/tag/v0.24.2) | [v0.7.0](https://github.com/kubernetes-sigs/metrics-server/releases/tag/v0.7.0) | [v2.10.7](https://github.com/traefik/traefik/releases/tag/v2.10.7) | [v1.10.1](https://github.com/coredns/coredns/releases/tag/v1.10.1) | [v0.15.9](https://github.com/k3s-io/helm-controller/releases/tag/v0.15.9) | [v0.0.26](https://github.com/rancher/local-path-provisioner/releases/tag/v0.0.26)  |
| v1.29.3+k3s1 | [v1.29.3](https://github.com/kubernetes/kubernetes/blob/master/CHANGELOG/CHANGELOG-1.29.md#v1293) | [v0.11.4](https://github.com/k3s-io/kine/releases/tag/v0.11.4) | [3.44.0](https://sqlite.org/releaselog/3_44_0.html) | [v3.5.9-k3s1](https://github.com/k3s-io/etcd/releases/tag/v3.5.9-k3s1) | [v1.7.11-k3s2](https://github.com/k3s-io/containerd/releases/tag/v1.7.11-k3s2) | [v1.1.12-k3s1](https://github.com/opencontainers/runc/releases/tag/v1.1.12-k3s1) | [v0.24.2](https://github.com/flannel-io/flannel/releases/tag/v0.24.2) | [v0.7.0](https://github.com/kubernetes-sigs/metrics-server/releases/tag/v0.7.0) | [v2.10.5](https://github.com/traefik/traefik/releases/tag/v2.10.5) | [v1.10.1](https://github.com/coredns/coredns/releases/tag/v1.10.1) | [v0.15.9](https://github.com/k3s-io/helm-controller/releases/tag/v0.15.9) | [v0.0.26](https://github.com/rancher/local-path-provisioner/releases/tag/v0.0.26)  |
| v1.29.2+k3s1 | [v1.29.2](https://github.com/kubernetes/kubernetes/blob/master/CHANGELOG/CHANGELOG-1.29.md#v1292) | [v0.11.4](https://github.com/k3s-io/kine/releases/tag/v0.11.4) | [3.44.0](https://sqlite.org/releaselog/3_44_0.html) | [v3.5.9-k3s1](https://github.com/k3s-io/etcd/releases/tag/v3.5.9-k3s1) | [v1.7.11-k3s2](https://github.com/k3s-io/containerd/releases/tag/v1.7.11-k3s2) | [v1.1.12-k3s1](https://github.com/k3s-io/runc/releases/tag/v1.1.12-k3s1) | [v0.24.2](https://github.com/flannel-io/flannel/releases/tag/v0.24.2) | [v0.6.3](https://github.com/kubernetes-sigs/metrics-server/releases/tag/v0.6.3) | [v2.10.5](https://github.com/traefik/traefik/releases/tag/v2.10.5) | [v1.10.1](https://github.com/coredns/coredns/releases/tag/v1.10.1) | [v0.15.8](https://github.com/k3s-io/helm-controller/releases/tag/v0.15.8) | [v0.0.26](https://github.com/rancher/local-path-provisioner/releases/tag/v0.0.26)  |
| v1.29.1+k3s2 | [v1.29.1](https://github.com/kubernetes/kubernetes/blob/master/CHANGELOG/CHANGELOG-1.29.md#v1291) | [v0.11.0](https://github.com/k3s-io/kine/releases/tag/v0.11.0) | [3.42.0](https://sqlite.org/releaselog/3_42_0.html) | [v3.5.9-k3s1](https://github.com/k3s-io/etcd/releases/tag/v3.5.9-k3s1) | [v1.7.11-k3s2](https://github.com/k3s-io/containerd/releases/tag/v1.7.11-k3s2) | [v1.1.12-k3s1](https://github.com/opencontainers/runc/releases/tag/v1.1.12-k3s1) | [v0.24.0](https://github.com/flannel-io/flannel/releases/tag/v0.24.0) | [v0.6.3](https://github.com/kubernetes-sigs/metrics-server/releases/tag/v0.6.3) | [v2.10.5](https://github.com/traefik/traefik/releases/tag/v2.10.5) | [v1.10.1](https://github.com/coredns/coredns/releases/tag/v1.10.1) | [v0.15.8](https://github.com/k3s-io/helm-controller/releases/tag/v0.15.8) | [v0.0.24](https://github.com/rancher/local-path-provisioner/releases/tag/v0.0.24)  |
| v1.29.0+k3s1 | [v1.29.0](https://github.com/kubernetes/kubernetes/blob/master/CHANGELOG/CHANGELOG-1.29.md#v1290) | [v0.11.0](https://github.com/k3s-io/kine/releases/tag/v0.11.0) | [3.42.0](https://sqlite.org/releaselog/3_42_0.html) | [v3.5.9-k3s1](https://github.com/k3s-io/etcd/releases/tag/v3.5.9-k3s1) | [v1.7.11-k3s2](https://github.com/k3s-io/containerd/releases/tag/v1.7.11-k3s2) | [v1.1.10](https://github.com/opencontainers/runc/releases/tag/v1.1.10) | [v0.24.0](https://github.com/flannel-io/flannel/releases/tag/v0.24.0) | [v0.6.3](https://github.com/kubernetes-sigs/metrics-server/releases/tag/v0.6.3) | [v2.10.5](https://github.com/traefik/traefik/releases/tag/v2.10.5) | [v1.10.1](https://github.com/coredns/coredns/releases/tag/v1.10.1) | [v0.15.4](https://github.com/k3s-io/helm-controller/releases/tag/v0.15.4) | [v0.0.24](https://github.com/rancher/local-path-provisioner/releases/tag/v0.0.24)  |



| Version | Release date | US date | EU date | Upstream release date | US date | EU date | Days since upstream |
| ----- | ----- | ----- | ----- | ----- | ----- | ----- | ----- |
| [v1.29.8+k3s1](k3s-v1.29.md#release-v1298k3s1) | Aug 21 2024 | 08/21/24 | 2024-08-21 | Aug 15 2024 | 08/15/24 | 2024-08-15 | 6 days |
| [v1.29.7+k3s1](k3s-v1.29.md#release-v1297k3s1) | Jul 31 2024 | 07/31/24 | 2024-07-31 | Jul 17 2024 | 07/17/24 | 2024-07-17 | 14 days |
| [v1.29.6+k3s2](k3s-v1.29.md#release-v1296k3s2) | Jul 03 2024 | 07/03/24 | 2024-07-03 | Jun 12 2024 | 06/12/24 | 2024-06-12 | 21 days |
| [v1.29.6+k3s1](k3s-v1.29.md#release-v1296k3s1) | Jun 25 2024 | 06/25/24 | 2024-06-25 | Jun 12 2024 | 06/12/24 | 2024-06-12 | 13 days |
| [v1.29.5+k3s1](k3s-v1.29.md#release-v1295k3s1) | May 22 2024 | 05/22/24 | 2024-05-22 | May 15 2024 | 05/15/24 | 2024-05-15 | 7 days |
| [v1.29.4+k3s1](k3s-v1.29.md#release-v1294k3s1) | Apr 25 2024 | 04/25/24 | 2024-04-25 | Apr 16 2024 | 04/16/24 | 2024-04-16 | 9 days |
| [v1.29.3+k3s1](k3s-v1.29.md#release-v1293k3s1) | Mar 25 2024 | 03/25/24 | 2024-03-25 | Mar 15 2024 | 03/15/24 | 2024-03-15 | 10 days |
| [v1.29.2+k3s1](k3s-v1.29.md#release-v1292k3s1) | Feb 29 2024 | 02/29/24 | 2024-02-29 | Feb 14 2024 | 02/14/24 | 2024-02-14 | 15 days |
| [v1.29.1+k3s2](k3s-v1.29.md#release-v1291k3s2) | Feb 06 2024 | 02/06/24 | 2024-02-06 | Jan 17 2024 | 01/17/24 | 2024-01-17 | 20 days |
| [v1.29.0+k3s1](k3s-v1.29.md#release-v1290k3s1) | Dec 22 2023 | 12/22/23 | 2023-12-22 | Dec 13 2023 | 12/13/23 | 2023-12-13 | 9 days |



# Release v1.29.8+k3s1
<!-- v1.29.8+k3s1 -->

This release updates Kubernetes to v1.29.8, and fixes a number of issues.

For more details on what's new, see the [Kubernetes release notes](https://github.com/kubernetes/kubernetes/blob/master/CHANGELOG/CHANGELOG-1.29.md#changelog-since-v1297).

## Changes since v1.29.7+k3s1:

* Fixing setproctitle function [(#10623)](https://github.com/k3s-io/k3s/pull/10623)
* Bump docker/docker to v25.0.6 [(#10650)](https://github.com/k3s-io/k3s/pull/10650)
* Backports for 2024-08 release cycle [(#10665)](https://github.com/k3s-io/k3s/pull/10665)
  * Use pagination when listing large numbers of resources
  * Fix multiple issues with servicelb
  * Remove deprecated use of wait. functions
  * Wire lasso metrics up to metrics endpoint
* Backports for August 2024 [(#10672)](https://github.com/k3s-io/k3s/pull/10672)
* Bump containerd to v1.7.20 [(#10661)](https://github.com/k3s-io/k3s/pull/10661)
* Add tolerations support for DaemonSet pods [(#10704)](https://github.com/k3s-io/k3s/pull/10704)
  * **New Feature**: Users can now define Kubernetes tolerations for ServiceLB DaemonSet directly in the `svccontroller.k3s.cattle.io/tolerations` annotation on services.
* Update to v1.29.8-k3s1 and Go 1.22.5 [(#10720)](https://github.com/k3s-io/k3s/pull/10720)

## Embedded Component Versions
| Component | Version |
|---|---|
| Kubernetes | [v1.29.8](https://github.com/kubernetes/kubernetes/blob/master/CHANGELOG/CHANGELOG-1.29.md#v1298) |
| Kine | [v0.11.11](https://github.com/k3s-io/kine/releases/tag/v0.11.11) |
| SQLite | [3.44.0](https://sqlite.org/releaselog/3_44_0.html) |
| Etcd | [v3.5.13-k3s1](https://github.com/k3s-io/etcd/releases/tag/v3.5.13-k3s1) |
| Containerd | [v1.7.20-k3s1](https://github.com/k3s-io/containerd/releases/tag/v1.7.20-k3s1) |
| Runc | [v1.1.12](https://github.com/opencontainers/runc/releases/tag/v1.1.12) |
| Flannel | [v0.25.4](https://github.com/flannel-io/flannel/releases/tag/v0.25.4) | 
| Metrics-server | [v0.7.0](https://github.com/kubernetes-sigs/metrics-server/releases/tag/v0.7.0) |
| Traefik | [v2.10.7](https://github.com/traefik/traefik/releases/tag/v2.10.7) |
| CoreDNS | [v1.10.1](https://github.com/coredns/coredns/releases/tag/v1.10.1) | 
| Helm-controller | [v0.15.10](https://github.com/k3s-io/helm-controller/releases/tag/v0.15.10) |
| Local-path-provisioner | [v0.0.28](https://github.com/rancher/local-path-provisioner/releases/tag/v0.0.28) |

## Helpful Links
As always, we welcome and appreciate feedback from our community of users. Please feel free to:
- [Open issues here](https://github.com/rancher/k3s/issues/new/choose)
- [Join our Slack channel](https://slack.rancher.io/)
- [Check out our documentation](https://rancher.com/docs/k3s/latest/en/) for guidance on how to get started or to dive deep into K3s.
- [Read how you can contribute here](https://github.com/rancher/k3s/blob/master/CONTRIBUTING.md)
-----
# Release v1.29.7+k3s1
<!-- v1.29.7+k3s1 -->

This release updates Kubernetes to v1.29.7, and fixes a number of issues.

For more details on what's new, see the [Kubernetes release notes](https://github.com/kubernetes/kubernetes/blob/master/CHANGELOG/CHANGELOG-1.29.md#changelog-since-v1296).

## Changes since v1.29.6+k3s2:

* Backports for 2024-07 release cycle [(#10498)](https://github.com/k3s-io/k3s/pull/10498)
  * Bump k3s-root to v0.14.0
  * Bump github.com/hashicorp/go-retryablehttp from 0.7.4 to 0.7.7
  * Bump Local Path Provisioner version
  * Ensure remotedialer kubelet connections use kubelet bind address
  * Chore: Bump Trivy version
  * Add etcd s3 config secret implementation
* July Test Backports [(#10508)](https://github.com/k3s-io/k3s/pull/10508)
* Update to v1.29.7-k3s1 and Go 1.22.5 [(#10539)](https://github.com/k3s-io/k3s/pull/10539)
* Fix issues loading data-dir value from env vars or dropping config files [(#10597)](https://github.com/k3s-io/k3s/pull/10597)

## Embedded Component Versions
| Component | Version |
|---|---|
| Kubernetes | [v1.29.7](https://github.com/kubernetes/kubernetes/blob/master/CHANGELOG/CHANGELOG-1.29.md#v1297) |
| Kine | [v0.11.11](https://github.com/k3s-io/kine/releases/tag/v0.11.11) |
| SQLite | [3.44.0](https://sqlite.org/releaselog/3_44_0.html) |
| Etcd | [v3.5.13-k3s1](https://github.com/k3s-io/etcd/releases/tag/v3.5.13-k3s1) |
| Containerd | [v1.7.17-k3s1](https://github.com/k3s-io/containerd/releases/tag/v1.7.17-k3s1) |
| Runc | [v1.1.12](https://github.com/opencontainers/runc/releases/tag/v1.1.12) |
| Flannel | [v0.25.4](https://github.com/flannel-io/flannel/releases/tag/v0.25.4) | 
| Metrics-server | [v0.7.0](https://github.com/kubernetes-sigs/metrics-server/releases/tag/v0.7.0) |
| Traefik | [v2.10.7](https://github.com/traefik/traefik/releases/tag/v2.10.7) |
| CoreDNS | [v1.10.1](https://github.com/coredns/coredns/releases/tag/v1.10.1) | 
| Helm-controller | [v0.15.10](https://github.com/k3s-io/helm-controller/releases/tag/v0.15.10) |
| Local-path-provisioner | [v0.0.28](https://github.com/rancher/local-path-provisioner/releases/tag/v0.0.28) |

## Helpful Links
As always, we welcome and appreciate feedback from our community of users. Please feel free to:
- [Open issues here](https://github.com/rancher/k3s/issues/new/choose)
- [Join our Slack channel](https://slack.rancher.io/)
- [Check out our documentation](https://rancher.com/docs/k3s/latest/en/) for guidance on how to get started or to dive deep into K3s.
- [Read how you can contribute here](https://github.com/rancher/k3s/blob/master/CONTRIBUTING.md)

-----
# Release v1.29.6+k3s2
<!-- v1.29.6+k3s2 -->

This release updates Kubernetes to v1.29.6, and fixes a number of issues.

For more details on what's new, see the [Kubernetes release notes](https://github.com/kubernetes/kubernetes/blob/master/CHANGELOG/CHANGELOG-1.29.md#changelog-since-v1296).

## Changes since v1.29.6+k3s1:

* Update flannel to v0.25.4 and fixed issue with IPv6 mask [(#10427)](https://github.com/k3s-io/k3s/pull/10427)

## Embedded Component Versions
| Component | Version |
|---|---|
| Kubernetes | [v1.29.6](https://github.com/kubernetes/kubernetes/blob/master/CHANGELOG/CHANGELOG-1.29.md#v1296) |
| Kine | [v0.11.9](https://github.com/k3s-io/kine/releases/tag/v0.11.9) |
| SQLite | [3.44.0](https://sqlite.org/releaselog/3_44_0.html) |
| Etcd | [v3.5.13-k3s1](https://github.com/k3s-io/etcd/releases/tag/v3.5.13-k3s1) |
| Containerd | [v1.7.17-k3s1](https://github.com/k3s-io/containerd/releases/tag/v1.7.17-k3s1) |
| Runc | [v1.1.12-](https://github.com/opencontainers/runc/releases/tag/v1.1.12) |
| Flannel | [v0.25.4](https://github.com/flannel-io/flannel/releases/tag/v0.25.4) | 
| Metrics-server | [v0.7.0](https://github.com/kubernetes-sigs/metrics-server/releases/tag/v0.7.0) |
| Traefik | [v2.10.7](https://github.com/traefik/traefik/releases/tag/v2.10.7) |
| CoreDNS | [v1.10.1](https://github.com/coredns/coredns/releases/tag/v1.10.1) | 
| Helm-controller | [v0.15.10](https://github.com/k3s-io/helm-controller/releases/tag/v0.15.10) |
| Local-path-provisioner | [v0.0.27](https://github.com/rancher/local-path-provisioner/releases/tag/v0.0.27) |

## Helpful Links
As always, we welcome and appreciate feedback from our community of users. Please feel free to:
- [Open issues here](https://github.com/rancher/k3s/issues/new/choose)
- [Join our Slack channel](https://slack.rancher.io/)
- [Check out our documentation](https://rancher.com/docs/k3s/latest/en/) for guidance on how to get started or to dive deep into K3s.
- [Read how you can contribute here](https://github.com/rancher/k3s/blob/master/CONTRIBUTING.md)
-----
# Release v1.29.6+k3s1
<!-- v1.29.6+k3s1 -->

This release updates Kubernetes to v1.29.6, and fixes a number of issues.

For more details on what's new, see the [Kubernetes release notes](https://github.com/kubernetes/kubernetes/blob/master/CHANGELOG/CHANGELOG-1.29.md#changelog-since-v1295).

## Changes since v1.29.5+k3s1:

* Fix bug when using tailscale config by file [(#10142)](https://github.com/k3s-io/k3s/pull/10142)
* Bump flannel version to v0.25.2 [(#10220)](https://github.com/k3s-io/k3s/pull/10220)
* Update kube-router version to v2.1.2 [(#10181)](https://github.com/k3s-io/k3s/pull/10181)
* Improve tailscale test & add extra log in e2e tests [(#10212)](https://github.com/k3s-io/k3s/pull/10212)
* Backports for 2024-06 release cycle [(#10249)](https://github.com/k3s-io/k3s/pull/10249)
  * Add WithSkipMissing to not fail import on missing blobs
  * Use fixed stream server bind address for cri-dockerd
  * Switch stargz over to cri registry config_path
  * Bump to containerd v1.7.17, etcd v3.5.13
  * Bump spegel version
  * Fix issue with externalTrafficPolicy: Local for single-stack services on dual-stack nodes
  * ServiceLB now sets the priorityClassName on svclb pods to `system-node-critical` by default. This can be overridden on a per-service basis via the `svccontroller.k3s.cattle.io/priorityclassname` annotation.
  * Bump minio-go to v7.0.70
  * Bump kine to v0.11.9 to fix pagination
  * Update valid resolv conf
  * Add missing kernel config check
  * Symlinked sub-directories are now respected when scanning Auto-Deploying Manifests (AddOns) 
  * Fix bug: allow helm controller set owner reference
  * Bump klipper-helm image for tls secret support
  * Fix issue with k3s-etcd informers not starting
  * `--Enable-pprof` can now be set on agents to enable the debug/pprof endpoints. When set, agents will listen on the supervisor port.
  * `--Supervisor-metrics` can now be set on servers to enable serving internal metrics on the supervisor endpoint; when set agents will listen on the supervisor port.
  * Fix netpol crash when node remains tainted uninitialized
  * The embedded load-balancer will now fall back to trying all servers with health-checks ignored, if all servers have been marked unavailable due to failed health checks.
* More backports for 2024-06 release cycle [(#10288)](https://github.com/k3s-io/k3s/pull/10288)
* Add snapshot retention etcd-s3-folder fix [(#10316)](https://github.com/k3s-io/k3s/pull/10316)
* Add test for `isValidResolvConf` (#10302) [(#10329)](https://github.com/k3s-io/k3s/pull/10329)
* Fix race condition panic in loadbalancer.nextServer [(#10322)](https://github.com/k3s-io/k3s/pull/10322)
* Fix typo, use `rancher/permissions` [(#10298)](https://github.com/k3s-io/k3s/pull/10298)
* Expand GHA go caching to include newest release branch [(#10334)](https://github.com/k3s-io/k3s/pull/10334)
* Update Kubernetes to v1.29.6 [(#10348)](https://github.com/k3s-io/k3s/pull/10348)
* Fix agent supervisor port using apiserver port instead [(#10354)](https://github.com/k3s-io/k3s/pull/10354)
* Fix issue that allowed multiple simultaneous snapshots to be allowed [(#10376)](https://github.com/k3s-io/k3s/pull/10376)

## Embedded Component Versions
| Component | Version |
|---|---|
| Kubernetes | [v1.29.6](https://github.com/kubernetes/kubernetes/blob/master/CHANGELOG/CHANGELOG-1.29.md#v1296) |
| Kine | [v0.11.9](https://github.com/k3s-io/kine/releases/tag/v0.11.9) |
| SQLite | [3.44.0](https://sqlite.org/releaselog/3_44_0.html) |
| Etcd | [v3.5.13-k3s1](https://github.com/k3s-io/etcd/releases/tag/v3.5.13-k3s1) |
| Containerd | [v1.7.17-k3s1](https://github.com/k3s-io/containerd/releases/tag/v1.7.17-k3s1) |
| Runc | [v1.1.12](https://github.com/opencontainers/runc/releases/tag/v1.1.12) |
| Flannel | [v0.25.2](https://github.com/flannel-io/flannel/releases/tag/v0.25.2) | 
| Metrics-server | [v0.7.0](https://github.com/kubernetes-sigs/metrics-server/releases/tag/v0.7.0) |
| Traefik | [v2.10.7](https://github.com/traefik/traefik/releases/tag/v2.10.7) |
| CoreDNS | [v1.10.1](https://github.com/coredns/coredns/releases/tag/v1.10.1) | 
| Helm-controller | [v0.15.10](https://github.com/k3s-io/helm-controller/releases/tag/v0.15.10) |
| Local-path-provisioner | [v0.0.27](https://github.com/rancher/local-path-provisioner/releases/tag/v0.0.27) |

## Helpful Links
As always, we welcome and appreciate feedback from our community of users. Please feel free to:
- [Open issues here](https://github.com/rancher/k3s/issues/new/choose)
- [Join our Slack channel](https://slack.rancher.io/)
- [Check out our documentation](https://rancher.com/docs/k3s/latest/en/) for guidance on how to get started or to dive deep into K3s.
- [Read how you can contribute here](https://github.com/rancher/k3s/blob/master/CONTRIBUTING.md)

-----
# Release v1.29.5+k3s1
<!-- v1.29.5+k3s1 -->

This release updates Kubernetes to v1.29.5, and fixes a number of issues.

For more details on what's new, see the [Kubernetes release notes](https://github.com/kubernetes/kubernetes/blob/master/CHANGELOG/CHANGELOG-1.29.md#changelog-since-v1294).

## Changes since v1.29.4+k3s1:

* Update stable channel to v1.29.4+k3s1 [(#10031)](https://github.com/k3s-io/k3s/pull/10031)
* Add E2E Split Server to Drone, support parallel testing in Drone [(#9940)](https://github.com/k3s-io/k3s/pull/9940)
* Bump E2E opensuse leap to 15.6, fix btrfs test [(#10057)](https://github.com/k3s-io/k3s/pull/10057)
* Replace deprecated ruby function [(#10091)](https://github.com/k3s-io/k3s/pull/10091)
* Set correct release channel for e2e upgrade test [(#10106)](https://github.com/k3s-io/k3s/pull/10106)
* Windows changes [(#10115)](https://github.com/k3s-io/k3s/pull/10115)
* Update to v1.29.5-k3s1 and Go 1.21.9 [(#10108)](https://github.com/k3s-io/k3s/pull/10108)

## Embedded Component Versions
| Component | Version |
|---|---|
| Kubernetes | [v1.29.5](https://github.com/kubernetes/kubernetes/blob/master/CHANGELOG/CHANGELOG-1.29.md#v1295) |
| Kine | [v0.11.7](https://github.com/k3s-io/kine/releases/tag/v0.11.7) |
| SQLite | [3.44.0](https://sqlite.org/releaselog/3_44_0.html) |
| Etcd | [v3.5.9-k3s1](https://github.com/k3s-io/etcd/releases/tag/v3.5.9-k3s1) |
| Containerd | [v1.7.15-k3s1](https://github.com/k3s-io/containerd/releases/tag/v1.7.15-k3s1) |
| Runc | [v1.1.12-k3s1](https://github.com/opencontainers/runc/releases/tag/v1.1.12-k3s1) |
| Flannel | [v0.24.2](https://github.com/flannel-io/flannel/releases/tag/v0.24.2) | 
| Metrics-server | [v0.7.0](https://github.com/kubernetes-sigs/metrics-server/releases/tag/v0.7.0) |
| Traefik | [v2.10.7](https://github.com/traefik/traefik/releases/tag/v2.10.7) |
| CoreDNS | [v1.10.1](https://github.com/coredns/coredns/releases/tag/v1.10.1) | 
| Helm-controller | [v0.15.9](https://github.com/k3s-io/helm-controller/releases/tag/v0.15.9) |
| Local-path-provisioner | [v0.0.26](https://github.com/rancher/local-path-provisioner/releases/tag/v0.0.26) |

## Helpful Links
As always, we welcome and appreciate feedback from our community of users. Please feel free to:
- [Open issues here](https://github.com/rancher/k3s/issues/new/choose)
- [Join our Slack channel](https://slack.rancher.io/)
- [Check out our documentation](https://rancher.com/docs/k3s/latest/en/) for guidance on how to get started or to dive deep into K3s.
- [Read how you can contribute here](https://github.com/rancher/k3s/blob/master/CONTRIBUTING.md)


## What's Changed
* Update stable channel to v1.29.4+k3s1 by @tashima42 in https://github.com/k3s-io/k3s/pull/10031
* Add E2E Split Server to Drone, support parallel testing in Drone by @dereknola in https://github.com/k3s-io/k3s/pull/9940
* Bump E2E opensuse leap to 15.6, fix btrfs test by @dereknola in https://github.com/k3s-io/k3s/pull/10057
* [Release 1.29] Replace deprecated ruby function by @manuelbuil in https://github.com/k3s-io/k3s/pull/10091
* [release-1.29] Set correct release channel for e2e upgrade test by @dereknola in https://github.com/k3s-io/k3s/pull/10106
* [1.29] windows changes by @HarrisonWAffel in https://github.com/k3s-io/k3s/pull/10115
* Update to v1.29.5-k3s1 and Go 1.21.9 by @briandowns in https://github.com/k3s-io/k3s/pull/10108


**Full Changelog**: https://github.com/k3s-io/k3s/compare/v1.29.4+k3s1...v1.29.5+k3s1
-----
# Release v1.29.4+k3s1
<!-- v1.29.4+k3s1 -->

This release updates Kubernetes to v1.29.4, and fixes a number of issues.

For more details on what's new, see the [Kubernetes release notes](https://github.com/kubernetes/kubernetes/blob/master/CHANGELOG/CHANGELOG-1.29.md#changelog-since-v1293).

## Changes since v1.29.3+k3s1:

* Send error response if member list cannot be retrieved [(#9722)](https://github.com/k3s-io/k3s/pull/9722)
* Respect cloud-provider fields set by kubelet [(#9721)](https://github.com/k3s-io/k3s/pull/9721)
  * The k3s stub cloud provider now respects the kubelet's requested provider-id, instance type, and topology labels
* Fix error when image has already been pulled [(#9770)](https://github.com/k3s-io/k3s/pull/9770)
* Add a new error when kine is with disable apiserver or disable etcd [(#9766)](https://github.com/k3s-io/k3s/pull/9766)
* Bump k3s-root to v0.13.0 [(#9718)](https://github.com/k3s-io/k3s/pull/9718)
* Use ubuntu latest for better golang caching keys [(#9711)](https://github.com/k3s-io/k3s/pull/9711)
* Bump Trivy version [(#9780)](https://github.com/k3s-io/k3s/pull/9780)
* Move to ubuntu 23.10 for E2E tests [(#9755)](https://github.com/k3s-io/k3s/pull/9755)
* Update channel server [(#9808)](https://github.com/k3s-io/k3s/pull/9808)
* Add /etc/passwd and /etc/group to k3s docker image [(#9784)](https://github.com/k3s-io/k3s/pull/9784)
* Fix etcd snapshot reconcile for agentless servers [(#9809)](https://github.com/k3s-io/k3s/pull/9809)
* Add health-check support to loadbalancer [(#9757)](https://github.com/k3s-io/k3s/pull/9757)
* Add tls for kine [(#9572)](https://github.com/k3s-io/k3s/pull/9572)
  * Kine is now able to use TLS
* Transition from deprecated pointer library to ptr [(#9801)](https://github.com/k3s-io/k3s/pull/9801)
* Remove old pinned dependencies [(#9806)](https://github.com/k3s-io/k3s/pull/9806)
* Several E2E Matrix improvements [(#9802)](https://github.com/k3s-io/k3s/pull/9802)
* Add certificate expiry check, events, and metrics [(#9772)](https://github.com/k3s-io/k3s/pull/9772)
* Add updatecli policy to update k3s-root [(#9844)](https://github.com/k3s-io/k3s/pull/9844)
* Bump Trivy version [(#9840)](https://github.com/k3s-io/k3s/pull/9840)
* Add workaround for containerd hosts.toml bug when passing config for default registry endpoint [(#9853)](https://github.com/k3s-io/k3s/pull/9853)
* Fix: agent volume in example docker compose [(#9838)](https://github.com/k3s-io/k3s/pull/9838)
* Bump spegel to v0.0.20-k3s1 [(#9863)](https://github.com/k3s-io/k3s/pull/9863)
* Add supervisor cert/key to rotate list [(#9832)](https://github.com/k3s-io/k3s/pull/9832)
* Add quotes to avoid useless updatecli updates [(#9877)](https://github.com/k3s-io/k3s/pull/9877)
* Bump containerd and cri-dockerd [(#9886)](https://github.com/k3s-io/k3s/pull/9886)
  * The embedded containerd has been bumped to v1.7.15
  * The embedded cri-dockerd has been bumped to v0.3.12
* Move etcd snapshot management CLI to request/response [(#9816)](https://github.com/k3s-io/k3s/pull/9816)
  * The `k3s etcd-snapshot` command has been reworked for improved consistency. All snapshots operations are now performed by the server process, with the CLI acting as a client to initiate and report results. As a side effect, the CLI is now less noisy when managing snapshots.
* Improve etcd load-balancer startup behavior [(#9883)](https://github.com/k3s-io/k3s/pull/9883)
* Actually fix agent certificate rotation [(#9902)](https://github.com/k3s-io/k3s/pull/9902)
* Bump latest to v1.29.3+k3s1 [(#9909)](https://github.com/k3s-io/k3s/pull/9909)
* Update packaged manifests [(#9920)](https://github.com/k3s-io/k3s/pull/9920)
  * Traefik has been bumped to v2.10.7.
  * Traefik pod annotations are now set properly in the default chart values.
  * The system-default-registry value now supports RFC2732 IPv6 literals.
  * The local-path provisioner now defaults to creating `local` volumes, instead of `hostPath`.
* Allow Local path provisioner to read helper logs [(#9835)](https://github.com/k3s-io/k3s/pull/9835)
* Update kube-router to v2.1.0 [(#9926)](https://github.com/k3s-io/k3s/pull/9926)
* Match setup-go caching key in GitHub Actions [(#9890)](https://github.com/k3s-io/k3s/pull/9890)
* Add startup testlet on preloaded images [(#9941)](https://github.com/k3s-io/k3s/pull/9941)
* Update to v1.29.4-k3s1 and Go 1.21.9 [(#9960)](https://github.com/k3s-io/k3s/pull/9960)
* Fix on-demand snapshots timing out; not honoring folder [(#9984)](https://github.com/k3s-io/k3s/pull/9984)
* Make `/db/info` available anonymously from localhost [(#10001)](https://github.com/k3s-io/k3s/pull/10001)

## Embedded Component Versions
| Component | Version |
|---|---|
| Kubernetes | [v1.29.4](https://github.com/kubernetes/kubernetes/blob/master/CHANGELOG/CHANGELOG-1.29.md#v1294) |
| Kine | [v0.11.7](https://github.com/k3s-io/kine/releases/tag/v0.11.7) |
| SQLite | [3.44.0](https://sqlite.org/releaselog/3_44_0.html) |
| Etcd | [v3.5.9-k3s1](https://github.com/k3s-io/etcd/releases/tag/v3.5.9-k3s1) |
| Containerd | [v1.7.15-k3s1](https://github.com/k3s-io/containerd/releases/tag/v1.7.15-k3s1) |
| Runc | [v1.1.12](https://github.com/opencontainers/runc/releases/tag/v1.1.12) |
| Flannel | [v0.24.2](https://github.com/flannel-io/flannel/releases/tag/v0.24.2) | 
| Metrics-server | [v0.7.0](https://github.com/kubernetes-sigs/metrics-server/releases/tag/v0.7.0) |
| Traefik | [v2.10.7](https://github.com/traefik/traefik/releases/tag/v2.10.7) |
| CoreDNS | [v1.10.1](https://github.com/coredns/coredns/releases/tag/v1.10.1) | 
| Helm-controller | [v0.15.9](https://github.com/k3s-io/helm-controller/releases/tag/v0.15.9) |
| Local-path-provisioner | [v0.0.26](https://github.com/rancher/local-path-provisioner/releases/tag/v0.0.26) |

## Helpful Links
As always, we welcome and appreciate feedback from our community of users. Please feel free to:
- [Open issues here](https://github.com/rancher/k3s/issues/new/choose)
- [Join our Slack channel](https://slack.rancher.io/)
- [Check out our documentation](https://rancher.com/docs/k3s/latest/en/) for guidance on how to get started or to dive deep into K3s.
- [Read how you can contribute here](https://github.com/rancher/k3s/blob/master/CONTRIBUTING.md)
-----
# Release v1.29.3+k3s1
<!-- v1.29.3+k3s1 -->

This release updates Kubernetes to v1.29.3, and fixes a number of issues.

For more details on what's new, see the [Kubernetes release notes](https://github.com/kubernetes/kubernetes/blob/master/CHANGELOG/CHANGELOG-1.29.md#changelog-since-v1292).

## Changes since v1.29.2+k3s1:

* Testing ADR [(#9562)](https://github.com/k3s-io/k3s/pull/9562)
* Unit Testing Matrix and Actions bump [(#9479)](https://github.com/k3s-io/k3s/pull/9479)
* Update install test OS matrix [(#9480)](https://github.com/k3s-io/k3s/pull/9480)
* Update klipper-lb image version [(#9488)](https://github.com/k3s-io/k3s/pull/9488)
* Add an integration test for flannel-backend=none [(#9582)](https://github.com/k3s-io/k3s/pull/9582)
* Better GitHub CI caching strategy for golang [(#9495)](https://github.com/k3s-io/k3s/pull/9495)
* Correct formatting of GH PR sha256sum artifact [(#9472)](https://github.com/k3s-io/k3s/pull/9472)
* Rootless mode also bind service nodePort to host for LoadBalancer type [(#9512)](https://github.com/k3s-io/k3s/pull/9512)
  * Rootless mode should also bind service nodePort to host for LoadBalancer type, matching UX of rootful mode.
* Fix coredns NodeHosts on dual-stack clusters [(#9584)](https://github.com/k3s-io/k3s/pull/9584)
* Tweak netpol node wait logs [(#9581)](https://github.com/k3s-io/k3s/pull/9581)
* Fix issue with etcd node name missing hostname [(#9522)](https://github.com/k3s-io/k3s/pull/9522)
* Bump helm-controller/klipper-helm versions [(#9595)](https://github.com/k3s-io/k3s/pull/9595)
* Update stable channel to v1.28.7+k3s1 [(#9615)](https://github.com/k3s-io/k3s/pull/9615)
* Reenable Install and Snapshotter Testing [(#9601)](https://github.com/k3s-io/k3s/pull/9601)
* Move docker tests into tests folder [(#9555)](https://github.com/k3s-io/k3s/pull/9555)
* Fix setup-go typo [(#9634)](https://github.com/k3s-io/k3s/pull/9634)
* Fix additional corner cases in registries handling [(#9556)](https://github.com/k3s-io/k3s/pull/9556)
* Fix snapshot prune [(#9502)](https://github.com/k3s-io/k3s/pull/9502)
* Use and version flannel/cni-plugin properly [(#9635)](https://github.com/k3s-io/k3s/pull/9635)
  * The embedded flannel cni-plugin binary is now built and versioned separate from the rest of the cni plugins and the embedded flannel controller.
* Bump spegel [(#9599)](https://github.com/k3s-io/k3s/pull/9599)
  * Bump spegel to v0.0.18-k3s3
  * Adds wildcard registry support
  * Fixes issue with excessive CPU utilization while waiting for containerd to start
  * Add env var to allow spegel mirroring of latest tag
* Chore(deps): Remediating CVEs found by trivy;  CVE-2023-45142 on otelrestful and CVE-2023-48795 on golang.org/x/crypto [(#9513)](https://github.com/k3s-io/k3s/pull/9513)
* Fix: use correct wasm shims names [(#9519)](https://github.com/k3s-io/k3s/pull/9519)
* Fix wildcard with embedded registry test [(#9649)](https://github.com/k3s-io/k3s/pull/9649)
* Disable color outputs using `NO_COLOR` env var [(#9357)](https://github.com/k3s-io/k3s/pull/9357)
  * To enable raw output for the `check-config` subcommand, you may now set NO_COLOR=1
* Improve tailscale e2e test [(#9586)](https://github.com/k3s-io/k3s/pull/9586)
* Adjust first node-ip based on configured clusterCIDR [(#9520)](https://github.com/k3s-io/k3s/pull/9520)
* Bump Trivy version [(#9528)](https://github.com/k3s-io/k3s/pull/9528)
* Include flannel version in flannel cni plugin version [(#9648)](https://github.com/k3s-io/k3s/pull/9648)
  * The flannel controller version is now reported as build metadata on the flannel cni plugin version.
* Enable E2E tests on GitHub Actions [(#9660)](https://github.com/k3s-io/k3s/pull/9660)
* Bump metrics-server to v0.7.0 [(#9673)](https://github.com/k3s-io/k3s/pull/9673)
* Bump upload and download actions to v4 [(#9666)](https://github.com/k3s-io/k3s/pull/9666)
* Warn and suppress duplicate registry mirror endpoints [(#9697)](https://github.com/k3s-io/k3s/pull/9697)
  * K3s will now warn and suppress duplicate entries in the mirror endpoint list for a registry. Containerd does not support listing the same endpoint multiple times as a mirror for a single upstream registry.
* Remove repetitive words [(#9671)](https://github.com/k3s-io/k3s/pull/9671)
* Run Subset of Docker tests in GitHub Actions [(#9698)](https://github.com/k3s-io/k3s/pull/9698)
* Fix wildcard entry upstream fallback [(#9729)](https://github.com/k3s-io/k3s/pull/9729)
* Update to v1.29.3-k3s1 and Go 1.21.8 [(#9747)](https://github.com/k3s-io/k3s/pull/9747)

## Embedded Component Versions
| Component | Version |
|---|---|
| Kubernetes | [v1.29.3](https://github.com/kubernetes/kubernetes/blob/master/CHANGELOG/CHANGELOG-1.29.md#v1293) |
| Kine | [v0.11.4](https://github.com/k3s-io/kine/releases/tag/v0.11.4) |
| SQLite | [3.44.0](https://sqlite.org/releaselog/3_44_0.html) |
| Etcd | [v3.5.9-k3s1](https://github.com/k3s-io/etcd/releases/tag/v3.5.9-k3s1) |
| Containerd | [v1.7.11-k3s2](https://github.com/k3s-io/containerd/releases/tag/v1.7.11-k3s2) |
| Runc | [v1.1.12-k3s1](https://github.com/opencontainers/runc/releases/tag/v1.1.12-k3s1) |
| Flannel | [v0.24.2](https://github.com/flannel-io/flannel/releases/tag/v0.24.2) | 
| Metrics-server | [v0.7.0](https://github.com/kubernetes-sigs/metrics-server/releases/tag/v0.7.0) |
| Traefik | [v2.10.5](https://github.com/traefik/traefik/releases/tag/v2.10.5) |
| CoreDNS | [v1.10.1](https://github.com/coredns/coredns/releases/tag/v1.10.1) | 
| Helm-controller | [v0.15.9](https://github.com/k3s-io/helm-controller/releases/tag/v0.15.9) |
| Local-path-provisioner | [v0.0.26](https://github.com/rancher/local-path-provisioner/releases/tag/v0.0.26) |

## Helpful Links
As always, we welcome and appreciate feedback from our community of users. Please feel free to:
- [Open issues here](https://github.com/rancher/k3s/issues/new/choose)
- [Join our Slack channel](https://slack.rancher.io/)
- [Check out our documentation](https://rancher.com/docs/k3s/latest/en/) for guidance on how to get started or to dive deep into K3s.
- [Read how you can contribute here](https://github.com/rancher/k3s/blob/master/CONTRIBUTING.md)

-----
# Release v1.29.2+k3s1
<!-- v1.29.2+k3s1 -->

This release updates Kubernetes to v1.29.2, and fixes a number of issues.

For more details on what's new, see the [Kubernetes release notes](https://github.com/kubernetes/kubernetes/blob/master/CHANGELOG/CHANGELOG-1.29.md#changelog-since-v1291).

## Changes since v1.29.1+k3s2:

* Bump Local Path Provisioner version [(#8953)](https://github.com/k3s-io/k3s/pull/8953)
* Add ability to install K3s PR Artifact from GitHub [(#9185)](https://github.com/k3s-io/k3s/pull/9185)
  * Adds `INSTALL_K3S_PR` option to install a build of K3s from any open PR with CI approval
* Bump Trivy version [(#9237)](https://github.com/k3s-io/k3s/pull/9237)
* Bump codecov/codecov-action from 3 to 4 [(#9353)](https://github.com/k3s-io/k3s/pull/9353)
* Update stable channel [(#9388)](https://github.com/k3s-io/k3s/pull/9388)
* Fix snapshot reconcile retry [(#9318)](https://github.com/k3s-io/k3s/pull/9318)
* Add check for etcd-snapshot-dir and fix panic in Walk [(#9317)](https://github.com/k3s-io/k3s/pull/9317)
* Bump CNI plugins to v1.4.0 [(#9249)](https://github.com/k3s-io/k3s/pull/9249)
* Fix issue with coredns node hosts controller [(#9354)](https://github.com/k3s-io/k3s/pull/9354)
  * Fixed issue that could cause coredns pods to fail to start when the embedded helm controller is disabled, due to the configmap not being updated with node hosts entries.
* Fix on-demand snapshots on ipv6-only nodes [(#9247)](https://github.com/k3s-io/k3s/pull/9247)
* Bump flannel version [(#9395)](https://github.com/k3s-io/k3s/pull/9395)
  * Bumped flannel to v0.24.2
* Build: Align drone base images [(#8959)](https://github.com/k3s-io/k3s/pull/8959)
* Changed how lastHeartBeatTime works in the etcd condition [(#9263)](https://github.com/k3s-io/k3s/pull/9263)
* Runtimes refactor using exec.LookPath [(#9311)](https://github.com/k3s-io/k3s/pull/9311)
  * Directories containing runtimes need to be included in the $PATH environment variable for effective runtime detection.
* Bump cri-dockerd to fix compat with Docker Engine 25 [(#9290)](https://github.com/k3s-io/k3s/pull/9290)
* Add codcov secret for integration tests on Push [(#9422)](https://github.com/k3s-io/k3s/pull/9422)
* Allow executors to define `containerd` and `cridockerd` behavior [(#9184)](https://github.com/k3s-io/k3s/pull/9184)
* Update Kube-router to v2.0.1 [(#9396)](https://github.com/k3s-io/k3s/pull/9396)
* : Test_UnitApplyContainerdQoSClassConfigFileIfPresent (Created) [(#8945)](https://github.com/k3s-io/k3s/pull/8945)
* Readd `k3s secrets-encrypt rotate-keys` with correct support for KMSv2 GA [(#9340)](https://github.com/k3s-io/k3s/pull/9340)
* Fix iptables check when sbin isn't in user PATH [(#9344)](https://github.com/k3s-io/k3s/pull/9344)
* Don't create NodePasswordValidationFailed event if agent is disabled [(#9312)](https://github.com/k3s-io/k3s/pull/9312)
  * The `NodePasswordValidationFailed` Events will no longer be emitted, if the agent is disabled.
* Expose rootless state dir under ~/.rancher/k3s/rootless [(#9308)](https://github.com/k3s-io/k3s/pull/9308)
  * When running k3s in rootless mode, expose rootlesskit's state directory as `~/.rancher/k3s/rootless`
* Expose rootless containerd socket directories for external access [(#9309)](https://github.com/k3s-io/k3s/pull/9309)
  * Mount k3s rootless containerd & cri-dockerd socket directories to `$XDG_RUNTIME_DIR/k3s/containerd` and `$XDG_RUNTIME_DIR/k3s/cri-dockerd` respectively.
* Bump kine and set NotifyInterval to what the apiserver expects [(#9349)](https://github.com/k3s-io/k3s/pull/9349)
* Update Kubernetes to v1.29.2 [(#9493)](https://github.com/k3s-io/k3s/pull/9493)
* Fix drone publish for arm [(#9503)](https://github.com/k3s-io/k3s/pull/9503)
* Remove failing Drone step [(#9517)](https://github.com/k3s-io/k3s/pull/9517)
* Restore original order of agent startup functions [(#9539)](https://github.com/k3s-io/k3s/pull/9539)
* Fix netpol startup when flannel is disabled [(#9571)](https://github.com/k3s-io/k3s/pull/9571)

## Embedded Component Versions
| Component | Version |
|---|---|
| Kubernetes | [v1.29.2](https://github.com/kubernetes/kubernetes/blob/master/CHANGELOG/CHANGELOG-1.29.md#v1292) |
| Kine | [v0.11.4](https://github.com/k3s-io/kine/releases/tag/v0.11.4) |
| SQLite | [3.44.0](https://sqlite.org/releaselog/3_44_0.html) |
| Etcd | [v3.5.9-k3s1](https://github.com/k3s-io/etcd/releases/tag/v3.5.9-k3s1) |
| Containerd | [v1.7.11-k3s2](https://github.com/k3s-io/containerd/releases/tag/v1.7.11-k3s2) |
| Runc | [v1.1.12-k3s1](https://github.com/k3s-io/runc/releases/tag/v1.1.12-k3s1) |
| Flannel | [v0.24.2](https://github.com/flannel-io/flannel/releases/tag/v0.24.2) | 
| Metrics-server | [v0.6.3](https://github.com/kubernetes-sigs/metrics-server/releases/tag/v0.6.3) |
| Traefik | [v2.10.5](https://github.com/traefik/traefik/releases/tag/v2.10.5) |
| CoreDNS | [v1.10.1](https://github.com/coredns/coredns/releases/tag/v1.10.1) | 
| Helm-controller | [v0.15.8](https://github.com/k3s-io/helm-controller/releases/tag/v0.15.8) |
| Local-path-provisioner | [v0.0.26](https://github.com/rancher/local-path-provisioner/releases/tag/v0.0.26) |

## Helpful Links
As always, we welcome and appreciate feedback from our community of users. Please feel free to:
- [Open issues here](https://github.com/rancher/k3s/issues/new/choose)
- [Join our Slack channel](https://slack.rancher.io/)
- [Check out our documentation](https://rancher.com/docs/k3s/latest/en/) for guidance on how to get started or to dive deep into K3s.
- [Read how you can contribute here](https://github.com/rancher/k3s/blob/master/CONTRIBUTING.md)
-----
# Release v1.29.1+k3s2
<!-- v1.29.1+k3s2 -->

This release updates Kubernetes to v1.29.1, and fixes a number of issues.

For more details on what's new, see the [Kubernetes release notes](https://github.com/kubernetes/kubernetes/blob/master/CHANGELOG/CHANGELOG-1.29.md#changelog-since-v1290).

**Important Notes**

Addresses the runc CVE: [CVE-2024-21626](https://nvd.nist.gov/vuln/detail/CVE-2024-21626) by updating runc to v1.1.12.

## Changes since v1.29.0+k3s1:

* Bump Sonobuoy version [(#8910)](https://github.com/k3s-io/k3s/pull/8910)
* Bump actions/setup-go from 4 to 5 [(#9036)](https://github.com/k3s-io/k3s/pull/9036)
* Chore: Update Code of Conduct to Redirect to CNCF CoC [(#9104)](https://github.com/k3s-io/k3s/pull/9104)
  * NONE
* Update stable channel to v1.28.5+k3s1 and add v1.29 channel [(#9110)](https://github.com/k3s-io/k3s/pull/9110)
* Added support for env *_PROXY variables for agent loadbalancer [(#9070)](https://github.com/k3s-io/k3s/pull/9070)
  * HTTP_PROXY, HTTPS_PROXY and NO_PROXY environment variables are now taken into account by the agent loadbalancer if K3S_AGENT_HTTP_PROXY_ALLOWED env variable is set to true.
  * This however doesn't affect local requests as the function used prevents that: https://pkg.go.dev/net/http#ProxyFromEnvironment.
* Add a retry around updating a secrets-encrypt node annotations [(#9039)](https://github.com/k3s-io/k3s/pull/9039)
* Silence SELinux warning on INSTALL_K3S_SKIP_SELINUX_RPM [(#8703)](https://github.com/k3s-io/k3s/pull/8703)
* Add ServiceLB support for PodHostIPs FeatureGate [(#8917)](https://github.com/k3s-io/k3s/pull/8917)
* Added support for env *_PROXY variables for agent loadbalancer [(#9118)](https://github.com/k3s-io/k3s/pull/9118)
* Redirect error stream to null when checking nm-cloud systemd unit [(#8815)](https://github.com/k3s-io/k3s/pull/8815)
  * Remove confusing "nm-cloud-setup.service: No such file or directory" journalctl log
* Dockerfile.dapper: set $HOME properly [(#9090)](https://github.com/k3s-io/k3s/pull/9090)
* Add system-agent-installer-k3s step to GA release instructions [(#9153)](https://github.com/k3s-io/k3s/pull/9153)
* Fix install script checksum [(#9159)](https://github.com/k3s-io/k3s/pull/9159)
* Fix the OTHER etcd snapshot s3 log message that prints the wrong variable [(#8944)](https://github.com/k3s-io/k3s/pull/8944)
* Handle logging flags when parsing kube-proxy args [(#8916)](https://github.com/k3s-io/k3s/pull/8916)
* Fix nil map in full snapshot configmap reconcile [(#9049)](https://github.com/k3s-io/k3s/pull/9049)
* Add support for containerd cri registry config_path [(#8973)](https://github.com/k3s-io/k3s/pull/8973)
* Add more paths to crun runtime detection [(#9086)](https://github.com/k3s-io/k3s/pull/9086)
* Add runtime checking of golang version [(#9054)](https://github.com/k3s-io/k3s/pull/9054)
* Fix OS PRETTY_NAME on tagged releases [(#9062)](https://github.com/k3s-io/k3s/pull/9062)
* Print error when downloading file error inside install script [(#6874)](https://github.com/k3s-io/k3s/pull/6874)
* Wait for cloud-provider taint to be gone before starting the netpol controller [(#9076)](https://github.com/k3s-io/k3s/pull/9076)
* Bump Trivy version [(#8812)](https://github.com/k3s-io/k3s/pull/8812)
* Use `ipFamilyPolicy: RequireDualStack` for dual-stack kube-dns [(#8984)](https://github.com/k3s-io/k3s/pull/8984)
* Handle etcd status condition when node is not ready and disable etcd [(#9084)](https://github.com/k3s-io/k3s/pull/9084)
* Update s3 e2e test [(#9025)](https://github.com/k3s-io/k3s/pull/9025)
* Add e2e startup test for rootless k3s [(#8383)](https://github.com/k3s-io/k3s/pull/8383)
* Add spegel distributed registry mirror [(#8977)](https://github.com/k3s-io/k3s/pull/8977)
* Bump quic-go for CVE-2023-49295 [(#9208)](https://github.com/k3s-io/k3s/pull/9208)
* Enable network policy controller metrics [(#9195)](https://github.com/k3s-io/k3s/pull/9195)
  * Kube-router network policy controller metrics are now exposed via the default node metrics endpoint
* Fix nonexistent dependency repositories [(#9213)](https://github.com/k3s-io/k3s/pull/9213)
* Move proxy dialer out of init() and fix crash when using `K3S_AGENT_HTTP_PROXY_ALLOWED=true` [(#9219)](https://github.com/k3s-io/k3s/pull/9219)
* Error getting node in setEtcdStatusCondition [(#9210)](https://github.com/k3s-io/k3s/pull/9210)
* Update to v1.29.1 and Go 1.21.6 [(#9259)](https://github.com/k3s-io/k3s/pull/9259)
* New stale action [(#9278)](https://github.com/k3s-io/k3s/pull/9278)
* Fix handling of bare hostname or IP as endpoint address in registries.yaml [(#9323)](https://github.com/k3s-io/k3s/pull/9323)
* Bump runc to v1.1.12 and helm-controller to v0.15.7 [(#9332)](https://github.com/k3s-io/k3s/pull/9332)
* Bump helm-controller to fix issue with ChartContent [(#9345)](https://github.com/k3s-io/k3s/pull/9345)

## Embedded Component Versions
| Component | Version |
|---|---|
| Kubernetes | [v1.29.1](https://github.com/kubernetes/kubernetes/blob/master/CHANGELOG/CHANGELOG-1.29.md#v1291) |
| Kine | [v0.11.0](https://github.com/k3s-io/kine/releases/tag/v0.11.0) |
| SQLite | [3.42.0](https://sqlite.org/releaselog/3_42_0.html) |
| Etcd | [v3.5.9-k3s1](https://github.com/k3s-io/etcd/releases/tag/v3.5.9-k3s1) |
| Containerd | [v1.7.11-k3s2](https://github.com/k3s-io/containerd/releases/tag/v1.7.11-k3s2) |
| Runc | [v1.1.12-k3s1](https://github.com/opencontainers/runc/releases/tag/v1.1.12-k3s1) |
| Flannel | [v0.24.0](https://github.com/flannel-io/flannel/releases/tag/v0.24.0) | 
| Metrics-server | [v0.6.3](https://github.com/kubernetes-sigs/metrics-server/releases/tag/v0.6.3) |
| Traefik | [v2.10.5](https://github.com/traefik/traefik/releases/tag/v2.10.5) |
| CoreDNS | [v1.10.1](https://github.com/coredns/coredns/releases/tag/v1.10.1) | 
| Helm-controller | [v0.15.8](https://github.com/k3s-io/helm-controller/releases/tag/v0.15.8) |
| Local-path-provisioner | [v0.0.24](https://github.com/rancher/local-path-provisioner/releases/tag/v0.0.24) |

## Helpful Links
As always, we welcome and appreciate feedback from our community of users. Please feel free to:
- [Open issues here](https://github.com/rancher/k3s/issues/new/choose)
- [Join our Slack channel](https://slack.rancher.io/)
- [Check out our documentation](https://rancher.com/docs/k3s/latest/en/) for guidance on how to get started or to dive deep into K3s.
- [Read how you can contribute here](https://github.com/rancher/k3s/blob/master/CONTRIBUTING.md)
-----
# Release v1.29.0+k3s1
<!-- v1.29.0+k3s1 -->

This release is K3S's first in the v1.29 line. This release updates Kubernetes to v1.29.0.

Before upgrading from earlier releases, be sure to read the Kubernetes [Urgent Upgrade Notes](https://github.com/kubernetes/kubernetes/blob/master/CHANGELOG/CHANGELOG-1.29.md#urgent-upgrade-notes).

 IMPORTANT: This release removes the experimental `rotate-keys` subcommand due to changes in Kubernetes upstream for [KMSv2](https://github.com/kubernetes/kubernetes/issues/117728), the subcommand should be added back in future releases.

 IMPORTANT: This release also removes the `multi-cluster-cidr` flag, since the support for this alpha feature has been removed completely from [Kubernetes upstream](https://groups.google.com/g/kubernetes-sig-network/c/nts1xEZ--gQ/m/2aTOUNFFAAAJ), this flag should be removed from the configuration before upgrade.


## Changes since v1.28.4+k3s2:

* Fix overlapping address range [(#8913)](https://github.com/k3s-io/k3s/pull/8913)
* Modify CONTRIBUTING.md guide [(#8954)](https://github.com/k3s-io/k3s/pull/8954)
* Nov 2023 stable channel update [(#9022)](https://github.com/k3s-io/k3s/pull/9022)
* Default runtime and runtime classes for wasm/nvidia/crun [(#8936)](https://github.com/k3s-io/k3s/pull/8936)
  * Added runtime classes for wasm/nvidia/crun
  * Added default runtime flag for containerd
* Bump containerd/runc to v1.7.10-k3s1/v1.1.10 [(#8962)](https://github.com/k3s-io/k3s/pull/8962)
* Allow setting default-runtime on servers [(#9027)](https://github.com/k3s-io/k3s/pull/9027)
* Bump containerd to v1.7.11 [(#9040)](https://github.com/k3s-io/k3s/pull/9040)
* Remove GA feature-gates [(#8970)](https://github.com/k3s-io/k3s/pull/8970)
* Only publish to code_cov on merged E2E builds [(#9051)](https://github.com/k3s-io/k3s/pull/9051)
* Update Kubernetes to v1.29.0+k3s1 [(#9052)](https://github.com/k3s-io/k3s/pull/9052)
* Update flannel to v0.24.0 and remove multiclustercidr flag [(#9075)](https://github.com/k3s-io/k3s/pull/9075)
* Remove rotate-keys subcommand [(#9079)](https://github.com/k3s-io/k3s/pull/9079)

## Embedded Component Versions
| Component | Version |
|---|---|
| Kubernetes | [v1.29.0](https://github.com/kubernetes/kubernetes/blob/master/CHANGELOG/CHANGELOG-1.29.md#v1290) |
| Kine | [v0.11.0](https://github.com/k3s-io/kine/releases/tag/v0.11.0) |
| SQLite | [3.42.0](https://sqlite.org/releaselog/3_42_0.html) |
| Etcd | [v3.5.9-k3s1](https://github.com/k3s-io/etcd/releases/tag/v3.5.9-k3s1) |
| Containerd | [v1.7.11-k3s2](https://github.com/k3s-io/containerd/releases/tag/v1.7.11-k3s2) |
| Runc | [v1.1.10](https://github.com/opencontainers/runc/releases/tag/v1.1.10) |
| Flannel | [v0.24.0](https://github.com/flannel-io/flannel/releases/tag/v0.24.0) | 
| Metrics-server | [v0.6.3](https://github.com/kubernetes-sigs/metrics-server/releases/tag/v0.6.3) |
| Traefik | [v2.10.5](https://github.com/traefik/traefik/releases/tag/v2.10.5) |
| CoreDNS | [v1.10.1](https://github.com/coredns/coredns/releases/tag/v1.10.1) | 
| Helm-controller | [v0.15.4](https://github.com/k3s-io/helm-controller/releases/tag/v0.15.4) |
| Local-path-provisioner | [v0.0.24](https://github.com/rancher/local-path-provisioner/releases/tag/v0.0.24) |

## Helpful Links
As always, we welcome and appreciate feedback from our community of users. Please feel free to:
- [Open issues here](https://github.com/rancher/k3s/issues/new/choose)
- [Join our Slack channel](https://slack.rancher.io/)
- [Check out our documentation](https://rancher.com/docs/k3s/latest/en/) for guidance on how to get started or to dive deep into K3s.
- [Read how you can contribute here](https://github.com/rancher/k3s/blob/master/CONTRIBUTING.md)
-----
