| k3s version| Kubernetes | Kine | SQLite | Etcd | Containerd | Runc | Flannel | Metrics-server | Traefik | CoreDNS | Helm-controller | Local-path-provisioner  |
| ----- | ----- | ----- | ----- | ----- | ----- | ----- | ----- | ----- | ----- | ----- | ----- | -----  |
| v1.31.4+k3s1 | [v1.31.4](https://github.com/kubernetes/kubernetes/blob/master/CHANGELOG/CHANGELOG-1.31.md#v1314) | [v0.13.5](https://github.com/k3s-io/kine/releases/tag/v0.13.5) | [3.46.1](https://sqlite.org/releaselog/3_46_1.html) | [v3.5.16-k3s1](https://github.com/k3s-io/etcd/releases/tag/v3.5.16-k3s1) | [v1.7.23-k3s2](https://github.com/k3s-io/containerd/releases/tag/v1.7.23-k3s2) | [v1.2.1](https://github.com/opencontainers/runc/releases/tag/v1.2.1) | [v0.25.7](https://github.com/flannel-io/flannel/releases/tag/v0.25.7) | [v0.7.2](https://github.com/kubernetes-sigs/metrics-server/releases/tag/v0.7.2) | [v2.11.10](https://github.com/traefik/traefik/releases/tag/v2.11.10) | [v1.12.0](https://github.com/coredns/coredns/releases/tag/v1.12.0) | [v0.16.5](https://github.com/k3s-io/helm-controller/releases/tag/v0.16.5) | [v0.0.30](https://github.com/rancher/local-path-provisioner/releases/tag/v0.0.30)  |
| v1.31.3+k3s1 | [v1.31.3](https://github.com/kubernetes/kubernetes/blob/master/CHANGELOG/CHANGELOG-1.31.md#v1313) | [v0.13.5](https://github.com/k3s-io/kine/releases/tag/v0.13.5) | [3.46.1](https://sqlite.org/releaselog/3_46_1.html) | [v3.5.16-k3s1](https://github.com/k3s-io/etcd/releases/tag/v3.5.16-k3s1) | [v1.7.23-k3s2](https://github.com/k3s-io/containerd/releases/tag/v1.7.23-k3s2) | [v1.2.1](https://github.com/opencontainers/runc/releases/tag/v1.2.1) | [v0.25.7](https://github.com/flannel-io/flannel/releases/tag/v0.25.7) | [v0.7.2](https://github.com/kubernetes-sigs/metrics-server/releases/tag/v0.7.2) | [v2.11.10](https://github.com/traefik/traefik/releases/tag/v2.11.10) | [v1.11.3](https://github.com/coredns/coredns/releases/tag/v1.11.3) | [v0.16.5](https://github.com/k3s-io/helm-controller/releases/tag/v0.16.5) | [v0.0.30](https://github.com/rancher/local-path-provisioner/releases/tag/v0.0.30)  |
| v1.31.2+k3s1 | [v1.31.2](https://github.com/kubernetes/kubernetes/blob/master/CHANGELOG/CHANGELOG-1.31.md#v1312) | [v0.13.2](https://github.com/k3s-io/kine/releases/tag/v0.13.2) | [3.46.1](https://sqlite.org/releaselog/3_46_1.html) | [v3.5.13-k3s1](https://github.com/k3s-io/etcd/releases/tag/v3.5.13-k3s1) | [v1.7.22-k3s1](https://github.com/k3s-io/containerd/releases/tag/v1.7.22-k3s1) | [v1.1.14](https://github.com/opencontainers/runc/releases/tag/v1.1.14) | [v0.25.6](https://github.com/flannel-io/flannel/releases/tag/v0.25.6) | [v0.7.2](https://github.com/kubernetes-sigs/metrics-server/releases/tag/v0.7.2) | [v2.11.10](https://github.com/traefik/traefik/releases/tag/v2.11.10) | [v1.11.3](https://github.com/coredns/coredns/releases/tag/v1.11.3) | [v0.16.5](https://github.com/k3s-io/helm-controller/releases/tag/v0.16.5) | [v0.0.30](https://github.com/rancher/local-path-provisioner/releases/tag/v0.0.30)  |
| v1.31.1+k3s1 | [v1.31.1](https://github.com/kubernetes/kubernetes/blob/master/CHANGELOG/CHANGELOG-1.31.md#v1311) | [v0.12.0](https://github.com/k3s-io/kine/releases/tag/v0.12.0) | [3.44.0](https://sqlite.org/releaselog/3_44_0.html) | [v3.5.13-k3s1](https://github.com/k3s-io/etcd/releases/tag/v3.5.13-k3s1) | [v1.7.21-k3s2](https://github.com/k3s-io/containerd/releases/tag/v1.7.21-k3s2) | [v1.1.14](https://github.com/opencontainers/runc/releases/tag/v1.1.14) | [v0.25.6](https://github.com/flannel-io/flannel/releases/tag/v0.25.6) | [v0.7.2](https://github.com/kubernetes-sigs/metrics-server/releases/tag/v0.7.2) | [v2.11.8](https://github.com/traefik/traefik/releases/tag/v2.11.8) | [v1.11.3](https://github.com/coredns/coredns/releases/tag/v1.11.3) | [v0.16.4](https://github.com/k3s-io/helm-controller/releases/tag/v0.16.4) | [v0.0.28](https://github.com/rancher/local-path-provisioner/releases/tag/v0.0.28)  |
| v1.31.0+k3s1 | [v1.31.0](https://github.com/kubernetes/kubernetes/blob/master/CHANGELOG/CHANGELOG-1.31.md#v1310) | [v0.12.0](https://github.com/k3s-io/kine/releases/tag/v0.12.0) | [3.44.0](https://sqlite.org/releaselog/3_44_0.html) | [v3.5.13-k3s1](https://github.com/k3s-io/etcd/releases/tag/v3.5.13-k3s1) | [v1.7.20-k3s1](https://github.com/k3s-io/containerd/releases/tag/v1.7.20-k3s1) | [v1.1.12](https://github.com/opencontainers/runc/releases/tag/v1.1.12) | [v0.25.4](https://github.com/flannel-io/flannel/releases/tag/v0.25.4) | [v0.7.0](https://github.com/kubernetes-sigs/metrics-server/releases/tag/v0.7.0) | [v2.10.7](https://github.com/traefik/traefik/releases/tag/v2.10.7) | [v1.10.1](https://github.com/coredns/coredns/releases/tag/v1.10.1) | [v0.16.3](https://github.com/k3s-io/helm-controller/releases/tag/v0.16.3) | [v0.0.28](https://github.com/rancher/local-path-provisioner/releases/tag/v0.0.28)  |



| Version | Release date | US date | EU date | Upstream release date | US date | EU date | Days since upstream |
| ----- | ----- | ----- | ----- | ----- | ----- | ----- | ----- |
| [v1.31.4+k3s1](k3s-v1.31.md#release-v1314k3s1) | Dec 18 2024 | 12/18/24 | 2024-12-18 | Dec 10 2024 | 12/10/24 | 2024-12-10 | 8 days |
| [v1.31.3+k3s1](k3s-v1.31.md#release-v1313k3s1) | Dec 04 2024 | 12/04/24 | 2024-12-04 | Nov 21 2024 | 11/21/24 | 2024-11-21 | 13 days |
| [v1.31.2+k3s1](k3s-v1.31.md#release-v1312k3s1) | Oct 26 2024 | 10/26/24 | 2024-10-26 | Oct 23 2024 | 10/23/24 | 2024-10-23 | 3 days |
| [v1.31.1+k3s1](k3s-v1.31.md#release-v1311k3s1) | Sep 19 2024 | 09/19/24 | 2024-09-19 | Sep 12 2024 | 09/12/24 | 2024-09-12 | 7 days |
| [v1.31.0+k3s1](k3s-v1.31.md#release-v1310k3s1) | Sep 02 2024 | 09/02/24 | 2024-09-02 | Aug 13 2024 | 08/13/24 | 2024-08-13 | 20 days |



# Release v1.31.4+k3s1
<!-- v1.31.4+k3s1 -->

This release updates Kubernetes to v1.31.4, and fixes a number of issues.

For more details on what's new, see the [Kubernetes release notes](https://github.com/kubernetes/kubernetes/blob/master/CHANGELOG/CHANGELOG-1.31.md#changelog-since-v1313).

## Changes since v1.31.3+k3s1:

* Fix secrets-encrypt reencrypt timeout error [(#11442)](https://github.com/k3s-io/k3s/pull/11442)
* Remove experimental from embedded-registry flag [(#11444)](https://github.com/k3s-io/k3s/pull/11444)
* Rework loadbalancer server selection logic [(#11457)](https://github.com/k3s-io/k3s/pull/11457)
  * The embedded client loadbalancer that handles connectivity to control-plane elements has been extensively reworked for improved performance, reliability, and observability.
* Update coredns to 1.12.0 [(#11454)](https://github.com/k3s-io/k3s/pull/11454)
* Add node-internal-dns/node-external-dns address pass-through support … [(#11464)](https://github.com/k3s-io/k3s/pull/11464)
* Update to v1.31.4-k3s1 and Go 1.22.9 [(#11462)](https://github.com/k3s-io/k3s/pull/11462)

## Embedded Component Versions
| Component | Version |
|---|---|
| Kubernetes | [v1.31.4](https://github.com/kubernetes/kubernetes/blob/master/CHANGELOG/CHANGELOG-1.31.md#v1314) |
| Kine | [v0.13.5](https://github.com/k3s-io/kine/releases/tag/v0.13.5) |
| SQLite | [3.46.1](https://sqlite.org/releaselog/3_46_1.html) |
| Etcd | [v3.5.16-k3s1](https://github.com/k3s-io/etcd/releases/tag/v3.5.16-k3s1) |
| Containerd | [v1.7.23-k3s2](https://github.com/k3s-io/containerd/releases/tag/v1.7.23-k3s2) |
| Runc | [v1.2.1](https://github.com/opencontainers/runc/releases/tag/v1.2.1) |
| Flannel | [v0.25.7](https://github.com/flannel-io/flannel/releases/tag/v0.25.7) | 
| Metrics-server | [v0.7.2](https://github.com/kubernetes-sigs/metrics-server/releases/tag/v0.7.2) |
| Traefik | [v2.11.10](https://github.com/traefik/traefik/releases/tag/v2.11.10) |
| CoreDNS | [v1.12.0](https://github.com/coredns/coredns/releases/tag/v1.12.0) | 
| Helm-controller | [v0.16.5](https://github.com/k3s-io/helm-controller/releases/tag/v0.16.5) |
| Local-path-provisioner | [v0.0.30](https://github.com/rancher/local-path-provisioner/releases/tag/v0.0.30) |

## Helpful Links
As always, we welcome and appreciate feedback from our community of users. Please feel free to:
- [Open issues here](https://github.com/rancher/k3s/issues/new/choose)
- [Join our Slack channel](https://slack.rancher.io/)
- [Check out our documentation](https://rancher.com/docs/k3s/latest/en/) for guidance on how to get started or to dive deep into K3s.
- [Read how you can contribute here](https://github.com/rancher/k3s/blob/master/CONTRIBUTING.md)
-----
# Release v1.31.3+k3s1
<!-- v1.31.3+k3s1 -->

This release updates Kubernetes to v1.31.3, and fixes a number of issues.

For more details on what's new, see the [Kubernetes release notes](https://github.com/kubernetes/kubernetes/blob/master/CHANGELOG/CHANGELOG-1.31.md#changelog-since-v1312).

## Changes since v1.31.2+k3s1:

* Backport E2E GHA fixes [(#11230)](https://github.com/k3s-io/k3s/pull/11230)
* Backports for 2024-11 [(#11261)](https://github.com/k3s-io/k3s/pull/11261)
* Update flannel and base cni plugins version [(#11247)](https://github.com/k3s-io/k3s/pull/11247)
* Bump to latest k3s-root version in scripts/version.sh [(#11302)](https://github.com/k3s-io/k3s/pull/11302)
* More backports for 2024-11 [(#11307)](https://github.com/k3s-io/k3s/pull/11307)
* Fix issue with loadbalancer failover to default server [(#11324)](https://github.com/k3s-io/k3s/pull/11324)
* Update Kubernetes to v1.31.3-k3s1 [(#11372)](https://github.com/k3s-io/k3s/pull/11372)
* Bump containerd to -k3s2 to fix rewrites [(#11403)](https://github.com/k3s-io/k3s/pull/11403)

## Embedded Component Versions
| Component | Version |
|---|---|
| Kubernetes | [v1.31.3](https://github.com/kubernetes/kubernetes/blob/master/CHANGELOG/CHANGELOG-1.31.md#v1313) |
| Kine | [v0.13.5](https://github.com/k3s-io/kine/releases/tag/v0.13.5) |
| SQLite | [3.46.1](https://sqlite.org/releaselog/3_46_1.html) |
| Etcd | [v3.5.16-k3s1](https://github.com/k3s-io/etcd/releases/tag/v3.5.16-k3s1) |
| Containerd | [v1.7.23-k3s2](https://github.com/k3s-io/containerd/releases/tag/v1.7.23-k3s2) |
| Runc | [v1.2.1](https://github.com/opencontainers/runc/releases/tag/v1.2.1) |
| Flannel | [v0.25.7](https://github.com/flannel-io/flannel/releases/tag/v0.25.7) | 
| Metrics-server | [v0.7.2](https://github.com/kubernetes-sigs/metrics-server/releases/tag/v0.7.2) |
| Traefik | [v2.11.10](https://github.com/traefik/traefik/releases/tag/v2.11.10) |
| CoreDNS | [v1.11.3](https://github.com/coredns/coredns/releases/tag/v1.11.3) | 
| Helm-controller | [v0.16.5](https://github.com/k3s-io/helm-controller/releases/tag/v0.16.5) |
| Local-path-provisioner | [v0.0.30](https://github.com/rancher/local-path-provisioner/releases/tag/v0.0.30) |

## Helpful Links
As always, we welcome and appreciate feedback from our community of users. Please feel free to:
- [Open issues here](https://github.com/rancher/k3s/issues/new/choose)
- [Join our Slack channel](https://slack.rancher.io/)
- [Check out our documentation](https://rancher.com/docs/k3s/latest/en/) for guidance on how to get started or to dive deep into K3s.
- [Read how you can contribute here](https://github.com/rancher/k3s/blob/master/CONTRIBUTING.md)

-----
# Release v1.31.2+k3s1
<!-- v1.31.2+k3s1 -->

This release updates Kubernetes to v1.31.2, and fixes a number of issues.

For more details on what's new, see the [Kubernetes release notes](https://github.com/kubernetes/kubernetes/blob/master/CHANGELOG/CHANGELOG-1.31.md#changelog-since-v1311).

## Changes since v1.31.1+k3s1:

* Add int test for flannel-ipv6masq [(#10904)](https://github.com/k3s-io/k3s/pull/10904)
* Bump Wharfie to v0.6.7 [(#10974)](https://github.com/k3s-io/k3s/pull/10974)
* Add user path to runtimes search [(#11002)](https://github.com/k3s-io/k3s/pull/11002)
* Add e2e test for advanced fields in services [(#11023)](https://github.com/k3s-io/k3s/pull/11023)
* Launch private registry with init [(#11048)](https://github.com/k3s-io/k3s/pull/11048)
* Backports for 2024-10 [(#11054)](https://github.com/k3s-io/k3s/pull/11054)
* Allow additional Rootless CopyUpDirs through K3S_ROOTLESS_COPYUPDIRS [(#11041)](https://github.com/k3s-io/k3s/pull/11041)
* Bump containerd to v1.7.22 [(#11072)](https://github.com/k3s-io/k3s/pull/11072)
* Simplify svclb ds [(#11079)](https://github.com/k3s-io/k3s/pull/11079)
* Add the nvidia runtime cdi [(#11093)](https://github.com/k3s-io/k3s/pull/11093)
* Revert "Make svclb as simple as possible" [(#11118)](https://github.com/k3s-io/k3s/pull/11118)
* Fixes "file exists" error from CNI bins when upgrading k3s [(#11125)](https://github.com/k3s-io/k3s/pull/11125)
* Update Kubernetes to v1.31.2 [(#11155)](https://github.com/k3s-io/k3s/pull/11155)

## Embedded Component Versions
| Component | Version |
|---|---|
| Kubernetes | [v1.31.2](https://github.com/kubernetes/kubernetes/blob/master/CHANGELOG/CHANGELOG-1.31.md#v1312) |
| Kine | [v0.13.2](https://github.com/k3s-io/kine/releases/tag/v0.13.2) |
| SQLite | [3.46.1](https://sqlite.org/releaselog/3_46_1.html) |
| Etcd | [v3.5.13-k3s1](https://github.com/k3s-io/etcd/releases/tag/v3.5.13-k3s1) |
| Containerd | [v1.7.22-k3s1](https://github.com/k3s-io/containerd/releases/tag/v1.7.22-k3s1) |
| Runc | [v1.1.14](https://github.com/opencontainers/runc/releases/tag/v1.1.14) |
| Flannel | [v0.25.6](https://github.com/flannel-io/flannel/releases/tag/v0.25.6) | 
| Metrics-server | [v0.7.2](https://github.com/kubernetes-sigs/metrics-server/releases/tag/v0.7.2) |
| Traefik | [v2.11.10](https://github.com/traefik/traefik/releases/tag/v2.11.10) |
| CoreDNS | [v1.11.3](https://github.com/coredns/coredns/releases/tag/v1.11.3) | 
| Helm-controller | [v0.16.5](https://github.com/k3s-io/helm-controller/releases/tag/v0.16.5) |
| Local-path-provisioner | [v0.0.30](https://github.com/rancher/local-path-provisioner/releases/tag/v0.0.30) |

## Helpful Links
As always, we welcome and appreciate feedback from our community of users. Please feel free to:
- [Open issues here](https://github.com/rancher/k3s/issues/new/choose)
- [Join our Slack channel](https://slack.rancher.io/)
- [Check out our documentation](https://rancher.com/docs/k3s/latest/en/) for guidance on how to get started or to dive deep into K3s.
- [Read how you can contribute here](https://github.com/rancher/k3s/blob/master/CONTRIBUTING.md)

-----
# Release v1.31.1+k3s1
<!-- v1.31.1+k3s1 -->

This release updates Kubernetes to v1.31.1, and fixes a number of issues.

For more details on what's new, see the [Kubernetes release notes](https://github.com/kubernetes/kubernetes/blob/master/CHANGELOG/CHANGELOG-1.31.md#changelog-since-v1310).

## Changes since v1.31.0+k3s1:

* Testing And Secrets-Encryption Backports for 2024-09 [(#10802)](https://github.com/k3s-io/k3s/pull/10802)
  * Remove secrets encryption controller
  * Cover edge case when on new minor release for E2E upgrade test
* Update CNI plugins version [(#10817)](https://github.com/k3s-io/k3s/pull/10817)
* Backports for 2024-09 [(#10842)](https://github.com/k3s-io/k3s/pull/10842)
* Fix hosts.toml header var [(#10871)](https://github.com/k3s-io/k3s/pull/10871)
* Update Kubernetes to v1.31.1 [(#10895)](https://github.com/k3s-io/k3s/pull/10895)
* Update Kubernetes to v1.31.1-k3s3 [(#10910)](https://github.com/k3s-io/k3s/pull/10910)

## Embedded Component Versions
| Component | Version |
|---|---|
| Kubernetes | [v1.31.1](https://github.com/kubernetes/kubernetes/blob/master/CHANGELOG/CHANGELOG-1.31.md#v1311) |
| Kine | [v0.12.0](https://github.com/k3s-io/kine/releases/tag/v0.12.0) |
| SQLite | [3.44.0](https://sqlite.org/releaselog/3_44_0.html) |
| Etcd | [v3.5.13-k3s1](https://github.com/k3s-io/etcd/releases/tag/v3.5.13-k3s1) |
| Containerd | [v1.7.21-k3s2](https://github.com/k3s-io/containerd/releases/tag/v1.7.21-k3s2) |
| Runc | [v1.1.14](https://github.com/opencontainers/runc/releases/tag/v1.1.14) |
| Flannel | [v0.25.6](https://github.com/flannel-io/flannel/releases/tag/v0.25.6) |
| Metrics-server | [v0.7.2](https://github.com/kubernetes-sigs/metrics-server/releases/tag/v0.7.2) |
| Traefik | [v2.11.8](https://github.com/traefik/traefik/releases/tag/v2.11.8) |
| CoreDNS | [v1.11.3](https://github.com/coredns/coredns/releases/tag/v1.11.3) | 
| Helm-controller | [v0.16.4](https://github.com/k3s-io/helm-controller/releases/tag/v0.16.4) |
| Local-path-provisioner | [v0.0.28](https://github.com/rancher/local-path-provisioner/releases/tag/v0.0.28) |

## Helpful Links
As always, we welcome and appreciate feedback from our community of users. Please feel free to:
- [Open issues here](https://github.com/rancher/k3s/issues/new/choose)
- [Join our Slack channel](https://slack.rancher.io/)
- [Check out our documentation](https://rancher.com/docs/k3s/latest/en/) for guidance on how to get started or to dive deep into K3s.
- [Read how you can contribute here](https://github.com/rancher/k3s/blob/master/CONTRIBUTING.md)

-----
# Release v1.31.0+k3s1
<!-- v1.31.0+k3s1 -->

This release is K3S's first in the v1.31 line. This release updates Kubernetes to v1.31.0.

For more details on what's new, see the [Kubernetes release notes](https://github.com/kubernetes/kubernetes/blob/master/CHANGELOG/CHANGELOG-1.31.md#changelog-since-v1300).

## Changes since v1.30.4+k3s1:

* Move test-compat docker test to GHA [(#10414)](https://github.com/k3s-io/k3s/pull/10414)
* Check for bad token permissions when install via PR [(#10387)](https://github.com/k3s-io/k3s/pull/10387)
* Bump k3s-root to v0.14.0 [(#10466)](https://github.com/k3s-io/k3s/pull/10466)
  * The k3s bundled userspace has been bumped to a release based on buildroot 2024.02.3, addressing several CVEs in busybox and coreutils.
* Fix INSTALL_K3S_PR support [(#10472)](https://github.com/k3s-io/k3s/pull/10472)
* Add `data-dir` to uninstall and killall scripts [(#10473)](https://github.com/k3s-io/k3s/pull/10473)
* Bump github.com/hashicorp/go-retryablehttp from 0.7.4 to 0.7.7 [(#10400)](https://github.com/k3s-io/k3s/pull/10400)
* Bump golang:alpine image version [(#10359)](https://github.com/k3s-io/k3s/pull/10359)
* Bump Local Path Provisioner version [(#10394)](https://github.com/k3s-io/k3s/pull/10394)
* Ensure remotedialer kubelet connections use kubelet bind address [(#10480)](https://github.com/k3s-io/k3s/pull/10480)
  * Fixed an issue where setting the `--bind-address` flag to a non-loopback or wildcard address would prevent `kubectl logs` from working properly.
* Bump Trivy version [(#10339)](https://github.com/k3s-io/k3s/pull/10339)
* Add etcd s3 config secret implementation [(#10340)](https://github.com/k3s-io/k3s/pull/10340)
  * A proxy can now be configured for use when uploading etcd snapshots to a s3-compatible storage service. This overrides any proxy settings passed via environment variables.
  * Credentials and endpoint configuration for storing etcd snapshots on a s3-compatible storage service can now be read from a Secret, instead of passing them via the CLI or config file. See https://github.com/k3s-io/k3s/blob/master/docs/adrs/etcd-s3-secret.md for more information.
* For E2E upgrade test, automatically determine the channel to use [(#10461)](https://github.com/k3s-io/k3s/pull/10461)
* Bump kine to v0.11.11 [(#10494)](https://github.com/k3s-io/k3s/pull/10494)
* Fix loadbalancer reentrant rlock [(#10511)](https://github.com/k3s-io/k3s/pull/10511)
  * Fixed an issue that could cause the agent loadbalancer to deadlock when the currently in-use server goes down.
* Don't use server value from config file for etcd-snapshot commands [(#10514)](https://github.com/k3s-io/k3s/pull/10514)
  * The `--server` and `--token` flags for the `k3s etcd-snapshot` command have been renamed to `--etcd-server` and `--etcd-token`, to avoid unintentionally running snapshot management commands against a remote node when the cluster join address or token are present in a config file.
* Use pagination when listing large numbers of resources [(#10527)](https://github.com/k3s-io/k3s/pull/10527)
* Fix multiple issues with servicelb [(#10552)](https://github.com/k3s-io/k3s/pull/10552)
  * Fixed issue that caused ServiceLB to fail to create a daemonset for services with long names
  * Fixed issue that caused ServiceLB pods to crashloop on nodes with ipv6 disabled at the kernel level
* Enhance E2E Hardened option [(#10558)](https://github.com/k3s-io/k3s/pull/10558)
* Allow Pprof and Superisor metrics in standalone mode [(#10576)](https://github.com/k3s-io/k3s/pull/10576)
* Use higher QPS for secrets reencryption [(#10571)](https://github.com/k3s-io/k3s/pull/10571)
* Fix issues loading data-dir value from env vars or dropin config files [(#10591)](https://github.com/k3s-io/k3s/pull/10591)
* Remove deprecated use of wait. functions [(#10546)](https://github.com/k3s-io/k3s/pull/10546)
* Wire lasso metrics up to metrics endpoint [(#10528)](https://github.com/k3s-io/k3s/pull/10528)
* Update stable channel to v1.30.3+k3s1 [(#10647)](https://github.com/k3s-io/k3s/pull/10647)
* Bump docker/docker to v25.0.6 [(#10642)](https://github.com/k3s-io/k3s/pull/10642)
* Add a change for killall to not unmount server and agent directory [(#10403)](https://github.com/k3s-io/k3s/pull/10403)
* Allow edge case OS rpm installs [(#10680)](https://github.com/k3s-io/k3s/pull/10680)
* Bump containerd to v1.7.20 [(#10659)](https://github.com/k3s-io/k3s/pull/10659)
* Update to newer OS images for install testing [(#10681)](https://github.com/k3s-io/k3s/pull/10681)
* Bump helm-controller to v0.16.3 to drop Helm v2 support [(#10628)](https://github.com/k3s-io/k3s/pull/10628)
* Add toleration support to ServiceLB DaemonSet [(#10687)](https://github.com/k3s-io/k3s/pull/10687)
  * - **New Feature**: Users can now define Kubernetes tolerations for ServiceLB DaemonSet directly in the `svccontroller.k3s.cattle.io/tolerations` annotation on services.
* Fix: Add $SUDO prefix to transactional-update commands in install script [(#10531)](https://github.com/k3s-io/k3s/pull/10531)
* Update to v1.30.3-k3s1 and Go 1.22.5 [(#10707)](https://github.com/k3s-io/k3s/pull/10707)
* Fix caching name for e2e vagrant box [(#10695)](https://github.com/k3s-io/k3s/pull/10695)
* Fix k3s-killall.sh support for custom data dir [(#10709)](https://github.com/k3s-io/k3s/pull/10709)
* Adding MariaDB to README.md [(#10717)](https://github.com/k3s-io/k3s/pull/10717)
* Bump Trivy version [(#10670)](https://github.com/k3s-io/k3s/pull/10670)
* V1.31.0-k3s1 [(#10715)](https://github.com/k3s-io/k3s/pull/10715)
* Update kubernetes to v1.31.0-k3s3 [(#10780)](https://github.com/k3s-io/k3s/pull/10780)

## Embedded Component Versions
| Component | Version |
|---|---|
| Kubernetes | [v1.31.0](https://github.com/kubernetes/kubernetes/blob/master/CHANGELOG/CHANGELOG-1.31.md#v1310) |
| Kine | [v0.12.0](https://github.com/k3s-io/kine/releases/tag/v0.12.0) |
| SQLite | [3.44.0](https://sqlite.org/releaselog/3_44_0.html) |
| Etcd | [v3.5.13-k3s1](https://github.com/k3s-io/etcd/releases/tag/v3.5.13-k3s1) |
| Containerd | [v1.7.20-k3s1](https://github.com/k3s-io/containerd/releases/tag/v1.7.20-k3s1) |
| Runc | [v1.1.12](https://github.com/opencontainers/runc/releases/tag/v1.1.12) |
| Flannel | [v0.25.4](https://github.com/flannel-io/flannel/releases/tag/v0.25.4) |
| Metrics-server | [v0.7.0](https://github.com/kubernetes-sigs/metrics-server/releases/tag/v0.7.0) |
| Traefik | [v2.10.7](https://github.com/traefik/traefik/releases/tag/v2.10.7) |
| CoreDNS | [v1.10.1](https://github.com/coredns/coredns/releases/tag/v1.10.1) |
| Helm-controller | [v0.16.3](https://github.com/k3s-io/helm-controller/releases/tag/v0.16.3) |
| Local-path-provisioner | [v0.0.28](https://github.com/rancher/local-path-provisioner/releases/tag/v0.0.28) |

## Helpful Links
As always, we welcome and appreciate feedback from our community of users. Please feel free to:
- [Open issues here](https://github.com/rancher/k3s/issues/new/choose)
- [Join our Slack channel](https://slack.rancher.io/)
- [Check out our documentation](https://rancher.com/docs/k3s/latest/en/) for guidance on how to get started or to dive deep into K3s.
- [Read how you can contribute here](https://github.com/rancher/k3s/blob/master/CONTRIBUTING.md)

-----
