| k3s version| Kubernetes | Kine | SQLite | Etcd | Containerd | Runc | Flannel | Metrics-server | Traefik | CoreDNS | Helm-controller | Local-path-provisioner  |
| ----- | ----- | ----- | ----- | ----- | ----- | ----- | ----- | ----- | ----- | ----- | ----- | -----  |
| v1.28.8+k3s1 | [v1.28.8](https://github.com/kubernetes/kubernetes/blob/master/CHANGELOG/CHANGELOG-1.28.md#v1288) | [v0.11.4](https://github.com/k3s-io/kine/releases/tag/v0.11.4) | [3.44.0](https://sqlite.org/releaselog/3_44_0.html) | [v3.5.9-k3s1](https://github.com/k3s-io/etcd/releases/tag/v3.5.9-k3s1) | [v1.7.11-k3s2](https://github.com/k3s-io/containerd/releases/tag/v1.7.11-k3s2) | [v1.1.12-k3s1](https://github.com/opencontainers/runc/releases/tag/v1.1.12-k3s1) | [v0.24.2](https://github.com/flannel-io/flannel/releases/tag/v0.24.2) | [v0.7.0](https://github.com/kubernetes-sigs/metrics-server/releases/tag/v0.7.0) | [v2.10.5](https://github.com/traefik/traefik/releases/tag/v2.10.5) | [v1.10.1](https://github.com/coredns/coredns/releases/tag/v1.10.1) | [v0.15.9](https://github.com/k3s-io/helm-controller/releases/tag/v0.15.9) | [v0.0.26](https://github.com/rancher/local-path-provisioner/releases/tag/v0.0.26)  |
| v1.28.7+k3s1 | [v1.28.7](https://github.com/kubernetes/kubernetes/blob/master/CHANGELOG/CHANGELOG-1.28.md#v1287) | [v0.11.4](https://github.com/k3s-io/kine/releases/tag/v0.11.4) | [3.44.0](https://sqlite.org/releaselog/3_44_0.html) | [v3.5.9-k3s1](https://github.com/k3s-io/etcd/releases/tag/v3.5.9-k3s1) | [v1.7.11-k3s2](https://github.com/k3s-io/containerd/releases/tag/v1.7.11-k3s2) | [v1.1.12-k3s1](https://github.com/k3s-io/runc/releases/tag/v1.1.12-k3s1) | [v0.24.2](https://github.com/flannel-io/flannel/releases/tag/v0.24.2) | [v0.6.3](https://github.com/kubernetes-sigs/metrics-server/releases/tag/v0.6.3) | [v2.10.5](https://github.com/traefik/traefik/releases/tag/v2.10.5) | [v1.10.1](https://github.com/coredns/coredns/releases/tag/v1.10.1) | [v0.15.8](https://github.com/k3s-io/helm-controller/releases/tag/v0.15.8) | [v0.0.26](https://github.com/rancher/local-path-provisioner/releases/tag/v0.0.26)  |
| v1.28.6+k3s2 | [v1.28.6](https://github.com/kubernetes/kubernetes/blob/master/CHANGELOG/CHANGELOG-1.28.md#v1286) | [v0.11.0](https://github.com/k3s-io/kine/releases/tag/v0.11.0) | [3.42.0](https://sqlite.org/releaselog/3_42_0.html) | [v3.5.9-k3s1](https://github.com/k3s-io/etcd/releases/tag/v3.5.9-k3s1) | [v1.7.11-k3s2](https://github.com/k3s-io/containerd/releases/tag/v1.7.11-k3s2) | [v1.1.12-k3s1](https://github.com/opencontainers/runc/releases/tag/v1.1.12-k3s1) | [v0.22.2](https://github.com/flannel-io/flannel/releases/tag/v0.22.2) | [v0.6.3](https://github.com/kubernetes-sigs/metrics-server/releases/tag/v0.6.3) | [v2.10.5](https://github.com/traefik/traefik/releases/tag/v2.10.5) | [v1.10.1](https://github.com/coredns/coredns/releases/tag/v1.10.1) | [v0.15.8](https://github.com/k3s-io/helm-controller/releases/tag/v0.15.8) | [v0.0.24](https://github.com/rancher/local-path-provisioner/releases/tag/v0.0.24)  |
| v1.28.5+k3s1 | [v1.28.5](https://github.com/kubernetes/kubernetes/blob/master/CHANGELOG/CHANGELOG-1.28.md#v1285) | [v0.11.0](https://github.com/k3s-io/kine/releases/tag/v0.11.0) | [3.42.0](https://sqlite.org/releaselog/3_42_0.html) | [v3.5.9-k3s1](https://github.com/k3s-io/etcd/releases/tag/v3.5.9-k3s1) | [v1.7.11-k3s2](https://github.com/k3s-io/containerd/releases/tag/v1.7.11-k3s2) | [v1.1.10](https://github.com/opencontainers/runc/releases/tag/v1.1.10) | [v0.22.2](https://github.com/flannel-io/flannel/releases/tag/v0.22.2) | [v0.6.3](https://github.com/kubernetes-sigs/metrics-server/releases/tag/v0.6.3) | [v2.10.5](https://github.com/traefik/traefik/releases/tag/v2.10.5) | [v1.10.1](https://github.com/coredns/coredns/releases/tag/v1.10.1) | [v0.15.4](https://github.com/k3s-io/helm-controller/releases/tag/v0.15.4) | [v0.0.24](https://github.com/rancher/local-path-provisioner/releases/tag/v0.0.24)  |
| v1.28.4+k3s2 | [v1.28.4](https://github.com/kubernetes/kubernetes/blob/master/CHANGELOG/CHANGELOG-1.28.md#v1284) | [v0.11.0](https://github.com/k3s-io/kine/releases/tag/v0.11.0) | [3.42.0](https://sqlite.org/releaselog/3_42_0.html) | [v3.5.9-k3s1](https://github.com/k3s-io/etcd/releases/tag/v3.5.9-k3s1) | [v1.7.7-k3s1](https://github.com/k3s-io/containerd/releases/tag/v1.7.7-k3s1) | [v1.1.8](https://github.com/opencontainers/runc/releases/tag/v1.1.8) | [v0.22.2](https://github.com/flannel-io/flannel/releases/tag/v0.22.2) | [v0.6.3](https://github.com/kubernetes-sigs/metrics-server/releases/tag/v0.6.3) | [v2.10.5](https://github.com/traefik/traefik/releases/tag/v2.10.5) | [v1.10.1](https://github.com/coredns/coredns/releases/tag/v1.10.1) | [v0.15.4](https://github.com/k3s-io/helm-controller/releases/tag/v0.15.4) | [v0.0.24](https://github.com/rancher/local-path-provisioner/releases/tag/v0.0.24)  |
| v1.28.3+k3s2 | [v1.28.3](https://github.com/kubernetes/kubernetes/blob/master/CHANGELOG/CHANGELOG-1.28.md#v1283) | [v0.10.3](https://github.com/k3s-io/kine/releases/tag/v0.10.3) | [3.42.0](https://sqlite.org/releaselog/3_42_0.html) | [v3.5.9-k3s1](https://github.com/k3s-io/etcd/releases/tag/v3.5.9-k3s1) | [v1.7.7-k3s1](https://github.com/k3s-io/containerd/releases/tag/v1.7.7-k3s1) | [v1.1.8](https://github.com/opencontainers/runc/releases/tag/v1.1.8) | [v0.22.2](https://github.com/flannel-io/flannel/releases/tag/v0.22.2) | [v0.6.3](https://github.com/kubernetes-sigs/metrics-server/releases/tag/v0.6.3) | [v2.10.5](https://github.com/traefik/traefik/releases/tag/v2.10.5) | [v1.10.1](https://github.com/coredns/coredns/releases/tag/v1.10.1) | [v0.15.4](https://github.com/k3s-io/helm-controller/releases/tag/v0.15.4) | [v0.0.24](https://github.com/rancher/local-path-provisioner/releases/tag/v0.0.24)  |
| v1.28.3+k3s1 | [v1.28.3](https://github.com/kubernetes/kubernetes/blob/master/CHANGELOG/CHANGELOG-1.28.md#v1283) | [v0.10.3](https://github.com/k3s-io/kine/releases/tag/v0.10.3) | [3.42.0](https://sqlite.org/releaselog/3_42_0.html) | [v3.5.9-k3s1](https://github.com/k3s-io/etcd/releases/tag/v3.5.9-k3s1) | [v1.7.7-k3s1](https://github.com/k3s-io/containerd/releases/tag/v1.7.7-k3s1) | [v1.1.8](https://github.com/opencontainers/runc/releases/tag/v1.1.8) | [v0.22.2](https://github.com/flannel-io/flannel/releases/tag/v0.22.2) | [v0.6.3](https://github.com/kubernetes-sigs/metrics-server/releases/tag/v0.6.3) | [v2.10.5](https://github.com/traefik/traefik/releases/tag/v2.10.5) | [v1.10.1](https://github.com/coredns/coredns/releases/tag/v1.10.1) | [v0.15.4](https://github.com/k3s-io/helm-controller/releases/tag/v0.15.4) | [v0.0.24](https://github.com/rancher/local-path-provisioner/releases/tag/v0.0.24)  |
| v1.28.2+k3s1 | [v1.28.2](https://github.com/kubernetes/kubernetes/blob/master/CHANGELOG/CHANGELOG-1.28.md#v1282) | [v0.10.3](https://github.com/k3s-io/kine/releases/tag/v0.10.3) | [3.42.0](https://sqlite.org/releaselog/3_42_0.html) | [v3.5.9-k3s1](https://github.com/k3s-io/etcd/releases/tag/v3.5.9-k3s1) | [v1.7.6-k3s1](https://github.com/k3s-io/containerd/releases/tag/v1.7.6-k3s1) | [v1.1.8](https://github.com/opencontainers/runc/releases/tag/v1.1.8) | [v0.22.2](https://github.com/flannel-io/flannel/releases/tag/v0.22.2) | [v0.6.3](https://github.com/kubernetes-sigs/metrics-server/releases/tag/v0.6.3) | [v2.9.10](https://github.com/traefik/traefik/releases/tag/v2.9.10) | [v1.10.1](https://github.com/coredns/coredns/releases/tag/v1.10.1) | [v0.15.4](https://github.com/k3s-io/helm-controller/releases/tag/v0.15.4) | [v0.0.24](https://github.com/rancher/local-path-provisioner/releases/tag/v0.0.24)  |
| v1.28.1+k3s1 | [v1.28.1](https://github.com/kubernetes/kubernetes/blob/master/CHANGELOG/CHANGELOG-1.28.md#v1281) | [v0.10.3](https://github.com/k3s-io/kine/releases/tag/v0.10.3) | [3.42.0](https://sqlite.org/releaselog/3_42_0.html) | [v3.5.9-k3s1](https://github.com/k3s-io/etcd/releases/tag/v3.5.9-k3s1) | [v1.7.3-k3s2](https://github.com/k3s-io/containerd/releases/tag/v1.7.3-k3s2) | [v1.1.8](https://github.com/opencontainers/runc/releases/tag/v1.1.8) | [v0.22.2](https://github.com/flannel-io/flannel/releases/tag/v0.22.2) | [v0.6.3](https://github.com/kubernetes-sigs/metrics-server/releases/tag/v0.6.3) | [v2.9.10](https://github.com/traefik/traefik/releases/tag/v2.9.10) | [v1.10.1](https://github.com/coredns/coredns/releases/tag/v1.10.1) | [v0.15.4](https://github.com/k3s-io/helm-controller/releases/tag/v0.15.4) | [v0.0.24](https://github.com/rancher/local-path-provisioner/releases/tag/v0.0.24)  |



| Version | Release date | US date | EU date | Upstream release date | US date | EU date | Days since upstream |
| ----- | ----- | ----- | ----- | ----- | ----- | ----- | ----- |
| [v1.28.8+k3s1](k3s-v1.28.md#release-v1288k3s1) | Mar 25 2024 | 03/25/24 | 2024-03-25 | Mar 15 2024 | 03/15/24 | 2024-03-15 | 10 days |
| [v1.28.7+k3s1](k3s-v1.28.md#release-v1287k3s1) | Feb 29 2024 | 02/29/24 | 2024-02-29 | Feb 14 2024 | 02/14/24 | 2024-02-14 | 15 days |
| [v1.28.6+k3s2](k3s-v1.28.md#release-v1286k3s2) | Feb 06 2024 | 02/06/24 | 2024-02-06 | Jan 17 2024 | 01/17/24 | 2024-01-17 | 20 days |
| [v1.28.5+k3s1](k3s-v1.28.md#release-v1285k3s1) | Dec 27 2023 | 12/27/23 | 2023-12-27 | Dec 20 2023 | 12/20/23 | 2023-12-20 | 7 days |
| [v1.28.4+k3s2](k3s-v1.28.md#release-v1284k3s2) | Dec 06 2023 | 12/06/23 | 2023-12-06 | Nov 15 2023 | 11/15/23 | 2023-11-15 | 21 days |
| [v1.28.3+k3s2](k3s-v1.28.md#release-v1283k3s2) | Nov 08 2023 | 11/08/23 | 2023-11-08 | Oct 18 2023 | 10/18/23 | 2023-10-18 | 21 days |
| [v1.28.3+k3s1](k3s-v1.28.md#release-v1283k3s1) | Oct 30 2023 | 10/30/23 | 2023-10-30 | Oct 18 2023 | 10/18/23 | 2023-10-18 | 12 days |
| [v1.28.2+k3s1](k3s-v1.28.md#release-v1282k3s1) | Sep 20 2023 | 09/20/23 | 2023-09-20 | Sep 13 2023 | 09/13/23 | 2023-09-13 | 7 days |
| [v1.28.1+k3s1](k3s-v1.28.md#release-v1281k3s1) | Sep 08 2023 | 09/08/23 | 2023-09-08 | Aug 24 2023 | 08/24/23 | 2023-08-24 | 15 days |



# Release v1.28.8+k3s1
<!-- v1.28.8+k3s1 -->

This release updates Kubernetes to v1.28.8, and fixes a number of issues.

For more details on what's new, see the [Kubernetes release notes](https://github.com/kubernetes/kubernetes/blob/master/CHANGELOG/CHANGELOG-1.28.md#changelog-since-v1287).

## Changes since v1.28.7+k3s1:

* Add an integration test for flannel-backend=none [(#9608)](https://github.com/k3s-io/k3s/pull/9608)
* Install and Unit test backports [(#9641)](https://github.com/k3s-io/k3s/pull/9641)
* Update klipper-lb image version [(#9605)](https://github.com/k3s-io/k3s/pull/9605)
* Chore(deps): Remediating CVE-2023-45142  CVE-2023-48795 [(#9647)](https://github.com/k3s-io/k3s/pull/9647)
* Adjust first node-ip based on configured clusterCIDR [(#9631)](https://github.com/k3s-io/k3s/pull/9631)
* Improve tailscale e2e test [(#9653)](https://github.com/k3s-io/k3s/pull/9653)
* Backports for 2024-03 release cycle [(#9669)](https://github.com/k3s-io/k3s/pull/9669)
  * Fix: use correct wasm shims names
  * The embedded flannel cni-plugin binary is now built and versioned separate from the rest of the cni plugins and the embedded flannel controller.
  * Bump spegel to v0.0.18-k3s3
  * Adds wildcard registry support
  * Fixes issue with excessive CPU utilization while waiting for containerd to start
  * Add env var to allow spegel mirroring of latest tag
  * Tweak netpol node wait logs
  * Fix coredns NodeHosts on dual-stack clusters
  * Bump helm-controller/klipper-helm versions
  * Fix snapshot prune
  * Fix issue with etcd node name missing hostname
  * Rootless mode should also bind service nodePort to host for LoadBalancer type, matching UX of rootful mode.
  * To enable raw output for the `check-config` subcommand, you may now set NO_COLOR=1
  * Fix additional corner cases in registries handling
  * Bump metrics-server to v0.7.0
  * K3s will now warn and suppress duplicate entries in the mirror endpoint list for a registry. Containerd does not support listing the same endpoint multiple times as a mirror for a single upstream registry.
* Docker and E2E Test Backports [(#9707)](https://github.com/k3s-io/k3s/pull/9707)
* Fix wildcard entry upstream fallback [(#9733)](https://github.com/k3s-io/k3s/pull/9733)
* Update to v1.28.8-k3s1 and Go 1.21.8 [(#9746)](https://github.com/k3s-io/k3s/pull/9746)

## Embedded Component Versions
| Component | Version |
|---|---|
| Kubernetes | [v1.28.8](https://github.com/kubernetes/kubernetes/blob/master/CHANGELOG/CHANGELOG-1.28.md#v1288) |
| Kine | [v0.11.4](https://github.com/k3s-io/kine/releases/tag/v0.11.4) |
| SQLite | [3.44.0](https://sqlite.org/releaselog/3_44_0.html) |
| Etcd | [v3.5.9-k3s1](https://github.com/k3s-io/etcd/releases/tag/v3.5.9-k3s1) |
| Containerd | [v1.7.11-k3s2](https://github.com/k3s-io/containerd/releases/tag/v1.7.11-k3s2) |
| Runc | [v1.1.12-k3s1](https://github.com/opencontainers/runc/releases/tag/v1.1.12-k3s1) |
| Flannel | [v0.24.2](https://github.com/flannel-io/flannel/releases/tag/v0.24.2) | 
| Metrics-server | [v0.7.0](https://github.com/kubernetes-sigs/metrics-server/releases/tag/v0.7.0) |
| Traefik | [v2.10.5](https://github.com/traefik/traefik/releases/tag/v2.10.5) |
| CoreDNS | [v1.10.1](https://github.com/coredns/coredns/releases/tag/v1.10.1) | 
| Helm-controller | [v0.15.9](https://github.com/k3s-io/helm-controller/releases/tag/v0.15.9) |
| Local-path-provisioner | [v0.0.26](https://github.com/rancher/local-path-provisioner/releases/tag/v0.0.26) |

## Helpful Links
As always, we welcome and appreciate feedback from our community of users. Please feel free to:
- [Open issues here](https://github.com/rancher/k3s/issues/new/choose)
- [Join our Slack channel](https://slack.rancher.io/)
- [Check out our documentation](https://rancher.com/docs/k3s/latest/en/) for guidance on how to get started or to dive deep into K3s.
- [Read how you can contribute here](https://github.com/rancher/k3s/blob/master/CONTRIBUTING.md)

-----
# Release v1.28.7+k3s1
<!-- v1.28.7+k3s1 -->

This release updates Kubernetes to v1.28.7, and fixes a number of issues.

For more details on what's new, see the [Kubernetes release notes](https://github.com/kubernetes/kubernetes/blob/master/CHANGELOG/CHANGELOG-1.28.md#changelog-since-v1286).

## Changes since v1.28.6+k3s2:

* Chore: bump Local Path Provisioner version [(#9426)](https://github.com/k3s-io/k3s/pull/9426)
* Bump cri-dockerd to fix compat with Docker Engine 25 [(#9293)](https://github.com/k3s-io/k3s/pull/9293)
* Auto Dependency Bump [(#9419)](https://github.com/k3s-io/k3s/pull/9419)
* Runtimes refactor using exec.LookPath [(#9431)](https://github.com/k3s-io/k3s/pull/9431)
  * Directories containing runtimes need to be included in the $PATH environment variable for effective runtime detection.
* Changed how lastHeartBeatTime works in the etcd condition [(#9424)](https://github.com/k3s-io/k3s/pull/9424)
* Bump Flannel v0.24.2 + remove multiclustercidr [(#9401)](https://github.com/k3s-io/k3s/pull/9401)
* Allow executors to define containerd and docker behavior [(#9254)](https://github.com/k3s-io/k3s/pull/9254)
* Update Kube-router to v2.0.1 [(#9404)](https://github.com/k3s-io/k3s/pull/9404)
* Backports for 2024-02 release cycle [(#9462)](https://github.com/k3s-io/k3s/pull/9462)
* Enable longer http timeout requests [(#9444)](https://github.com/k3s-io/k3s/pull/9444)
* Test_UnitApplyContainerdQoSClassConfigFileIfPresent [(#9440)](https://github.com/k3s-io/k3s/pull/9440)
* Support PR testing installs [(#9469)](https://github.com/k3s-io/k3s/pull/9469)
* Update Kubernetes to v1.28.7 [(#9492)](https://github.com/k3s-io/k3s/pull/9492)
* Fix drone publish for arm [(#9508)](https://github.com/k3s-io/k3s/pull/9508)
* Remove failing Drone step [(#9516)](https://github.com/k3s-io/k3s/pull/9516)
* Restore original order of agent startup functions [(#9545)](https://github.com/k3s-io/k3s/pull/9545)
* Fix netpol startup when flannel is disabled [(#9578)](https://github.com/k3s-io/k3s/pull/9578)

## Embedded Component Versions
| Component | Version |
|---|---|
| Kubernetes | [v1.28.7](https://github.com/kubernetes/kubernetes/blob/master/CHANGELOG/CHANGELOG-1.28.md#v1287) |
| Kine | [v0.11.4](https://github.com/k3s-io/kine/releases/tag/v0.11.4) |
| SQLite | [3.44.0](https://sqlite.org/releaselog/3_44_0.html) |
| Etcd | [v3.5.9-k3s1](https://github.com/k3s-io/etcd/releases/tag/v3.5.9-k3s1) |
| Containerd | [v1.7.11-k3s2](https://github.com/k3s-io/containerd/releases/tag/v1.7.11-k3s2) |
| Runc | [v1.1.12-k3s1](https://github.com/k3s-io/runc/releases/tag/v1.1.12-k3s1) |
| Flannel | [v0.24.2](https://github.com/flannel-io/flannel/releases/tag/v0.24.2) | 
| Metrics-server | [v0.6.3](https://github.com/kubernetes-sigs/metrics-server/releases/tag/v0.6.3) |
| Traefik | [v2.10.5](https://github.com/traefik/traefik/releases/tag/v2.10.5) |
| CoreDNS | [v1.10.1](https://github.com/coredns/coredns/releases/tag/v1.10.1) | 
| Helm-controller | [v0.15.8](https://github.com/k3s-io/helm-controller/releases/tag/v0.15.8) |
| Local-path-provisioner | [v0.0.26](https://github.com/rancher/local-path-provisioner/releases/tag/v0.0.26) |

## Helpful Links
As always, we welcome and appreciate feedback from our community of users. Please feel free to:
- [Open issues here](https://github.com/rancher/k3s/issues/new/choose)
- [Join our Slack channel](https://slack.rancher.io/)
- [Check out our documentation](https://rancher.com/docs/k3s/latest/en/) for guidance on how to get started or to dive deep into K3s.
- [Read how you can contribute here](https://github.com/rancher/k3s/blob/master/CONTRIBUTING.md)
-----
# Release v1.28.6+k3s2
<!-- v1.28.6+k3s2 -->

This release updates Kubernetes to v1.28.6, and fixes a number of issues.

For more details on what's new, see the [Kubernetes release notes](https://github.com/kubernetes/kubernetes/blob/master/CHANGELOG/CHANGELOG-1.28.md#changelog-since-v1285).

**Important Notes**

Addresses the runc CVE: [CVE-2024-21626](https://nvd.nist.gov/vuln/detail/CVE-2024-21626) by updating runc to v1.1.12.

## Changes since v1.28.5+k3s1:

* Add a retry around updating a secrets-encrypt node annotations [(#9125)](https://github.com/k3s-io/k3s/pull/9125)
* Wait for taint to be gone in the node before starting the netpol controller [(#9175)](https://github.com/k3s-io/k3s/pull/9175)
* Etcd condition [(#9181)](https://github.com/k3s-io/k3s/pull/9181)
* Backports for 2024-01 [(#9203)](https://github.com/k3s-io/k3s/pull/9203)
* Pin opa version for missing dependency chain [(#9216)](https://github.com/k3s-io/k3s/pull/9216)
* Added support for env *_PROXY variables for agent loadbalancer [(#9206)](https://github.com/k3s-io/k3s/pull/9206)
* Etcd node is nil [(#9228)](https://github.com/k3s-io/k3s/pull/9228)
* Update to v1.28.6 and Go 1.20.13 [(#9260)](https://github.com/k3s-io/k3s/pull/9260)
* Use `ipFamilyPolicy: RequireDualStack` for dual-stack kube-dns [(#9269)](https://github.com/k3s-io/k3s/pull/9269)
* Backports for 2024-01 k3s2 [(#9336)](https://github.com/k3s-io/k3s/pull/9336)
  * Bump runc to v1.1.12 and helm-controller to v0.15.7
  * Fix handling of bare hostname or IP as endpoint address in registries.yaml
* Bump helm-controller to fix issue with ChartContent [(#9346)](https://github.com/k3s-io/k3s/pull/9346)

## Embedded Component Versions
| Component | Version |
|---|---|
| Kubernetes | [v1.28.6](https://github.com/kubernetes/kubernetes/blob/master/CHANGELOG/CHANGELOG-1.28.md#v1286) |
| Kine | [v0.11.0](https://github.com/k3s-io/kine/releases/tag/v0.11.0) |
| SQLite | [3.42.0](https://sqlite.org/releaselog/3_42_0.html) |
| Etcd | [v3.5.9-k3s1](https://github.com/k3s-io/etcd/releases/tag/v3.5.9-k3s1) |
| Containerd | [v1.7.11-k3s2](https://github.com/k3s-io/containerd/releases/tag/v1.7.11-k3s2) |
| Runc | [v1.1.12-k3s1](https://github.com/opencontainers/runc/releases/tag/v1.1.12-k3s1) |
| Flannel | [v0.22.2](https://github.com/flannel-io/flannel/releases/tag/v0.22.2) | 
| Metrics-server | [v0.6.3](https://github.com/kubernetes-sigs/metrics-server/releases/tag/v0.6.3) |
| Traefik | [v2.10.5](https://github.com/traefik/traefik/releases/tag/v2.10.5) |
| CoreDNS | [v1.10.1](https://github.com/coredns/coredns/releases/tag/v1.10.1) | 
| Helm-controller | [v0.15.8](https://github.com/k3s-io/helm-controller/releases/tag/v0.15.8) |
| Local-path-provisioner | [v0.0.24](https://github.com/rancher/local-path-provisioner/releases/tag/v0.0.24) |

## Helpful Links
As always, we welcome and appreciate feedback from our community of users. Please feel free to:
- [Open issues here](https://github.com/rancher/k3s/issues/new/choose)
- [Join our Slack channel](https://slack.rancher.io/)
- [Check out our documentation](https://rancher.com/docs/k3s/latest/en/) for guidance on how to get started or to dive deep into K3s.
- [Read how you can contribute here](https://github.com/rancher/k3s/blob/master/CONTRIBUTING.md)
-----
# Release v1.28.5+k3s1
<!-- v1.28.5+k3s1 -->

This release updates Kubernetes to v1.28.5, and fixes a number of issues.

For more details on what's new, see the [Kubernetes release notes](https://github.com/kubernetes/kubernetes/blob/master/CHANGELOG/CHANGELOG-1.28.md#changelog-since-v1284).

## Changes since v1.28.4+k3s1:

* Remove s390x steps temporarily since runners are disabled [(#8983)](https://github.com/k3s-io/k3s/pull/8983)
* Remove s390x from manifest [(#8998)](https://github.com/k3s-io/k3s/pull/8998)
* Fix overlapping address range [(#8913)](https://github.com/k3s-io/k3s/pull/8913)
* Modify CONTRIBUTING.md guide [(#8954)](https://github.com/k3s-io/k3s/pull/8954)
* Nov 2023 stable channel update [(#9022)](https://github.com/k3s-io/k3s/pull/9022)
* Default runtime and runtime classes for wasm/nvidia/crun [(#8936)](https://github.com/k3s-io/k3s/pull/8936)
  * Added runtime classes for wasm/nvidia/crun
  * Added default runtime flag for containerd
* Bump containerd/runc to v1.7.10-k3s1/v1.1.10 [(#8962)](https://github.com/k3s-io/k3s/pull/8962)
* Allow setting default-runtime on servers [(#9027)](https://github.com/k3s-io/k3s/pull/9027)
* Bump containerd to v1.7.11 [(#9040)](https://github.com/k3s-io/k3s/pull/9040)
* Update to v1.28.5-k3s1 [(#9081)](https://github.com/k3s-io/k3s/pull/9081)

## Embedded Component Versions
| Component | Version |
|---|---|
| Kubernetes | [v1.28.5](https://github.com/kubernetes/kubernetes/blob/master/CHANGELOG/CHANGELOG-1.28.md#v1285) |
| Kine | [v0.11.0](https://github.com/k3s-io/kine/releases/tag/v0.11.0) |
| SQLite | [3.42.0](https://sqlite.org/releaselog/3_42_0.html) |
| Etcd | [v3.5.9-k3s1](https://github.com/k3s-io/etcd/releases/tag/v3.5.9-k3s1) |
| Containerd | [v1.7.11-k3s2](https://github.com/k3s-io/containerd/releases/tag/v1.7.11-k3s2) |
| Runc | [v1.1.10](https://github.com/opencontainers/runc/releases/tag/v1.1.10) |
| Flannel | [v0.22.2](https://github.com/flannel-io/flannel/releases/tag/v0.22.2) | 
| Metrics-server | [v0.6.3](https://github.com/kubernetes-sigs/metrics-server/releases/tag/v0.6.3) |
| Traefik | [v2.10.5](https://github.com/traefik/traefik/releases/tag/v2.10.5) |
| CoreDNS | [v1.10.1](https://github.com/coredns/coredns/releases/tag/v1.10.1) | 
| Helm-controller | [v0.15.4](https://github.com/k3s-io/helm-controller/releases/tag/v0.15.4) |
| Local-path-provisioner | [v0.0.24](https://github.com/rancher/local-path-provisioner/releases/tag/v0.0.24) |

## Helpful Links
As always, we welcome and appreciate feedback from our community of users. Please feel free to:
- [Open issues here](https://github.com/rancher/k3s/issues/new/choose)
- [Join our Slack channel](https://slack.rancher.io/)
- [Check out our documentation](https://rancher.com/docs/k3s/latest/en/) for guidance on how to get started or to dive deep into K3s.
- [Read how you can contribute here](https://github.com/rancher/k3s/blob/master/CONTRIBUTING.md)

-----
# Release v1.28.4+k3s2
<!-- v1.28.4+k3s2 -->

This release updates Kubernetes to v1.28.4, and fixes a number of issues.

For more details on what's new, see the [Kubernetes release notes](https://github.com/kubernetes/kubernetes/blob/master/CHANGELOG/CHANGELOG-1.28.md#changelog-since-v1283).

## Changes since v1.28.3+k3s2:

* Update channels latest to v1.27.7+k3s2 [(#8799)](https://github.com/k3s-io/k3s/pull/8799)
* Add etcd status condition [(#8724)](https://github.com/k3s-io/k3s/pull/8724)
  * Now the user can see the etcd status from each node in a simple way
* ADR for etcd status [(#8355)](https://github.com/k3s-io/k3s/pull/8355)
* Wasm shims detection [(#8751)](https://github.com/k3s-io/k3s/pull/8751)
  * Automatic discovery of WebAssembly runtimes
* Add warning for removal of multiclustercidr flag [(#8758)](https://github.com/k3s-io/k3s/pull/8758)
* Improve dualStack log [(#8798)](https://github.com/k3s-io/k3s/pull/8798)
* Optimize: Simplify and clean up Dockerfile [(#8244)](https://github.com/k3s-io/k3s/pull/8244)
* Add: timezone info in image [(#8764)](https://github.com/k3s-io/k3s/pull/8764)
  * - New timezone info in Docker image allows the use of `spec.timeZone` in CronJobs
* Bump kine to fix nats, postgres, and watch issues [(#8778)](https://github.com/k3s-io/k3s/pull/8778)
  * Bumped kine to v0.11.0 to resolve issues with postgres and NATS, fix performance of watch channels under heavy load, and improve compatibility with the reference implementation.
* QoS-class resource configuration [(#8726)](https://github.com/k3s-io/k3s/pull/8726)
  * Containerd may now be configured to use rdt or blockio configuration by defining `rdt_config.yaml` or `blockio_config.yaml` files.
* Add agent flag disable-apiserver-lb [(#8717)](https://github.com/k3s-io/k3s/pull/8717)
  * Add agent flag disable-apiserver-lb, agent will not start load balance proxy.
* Force umount for NFS mount (like with longhorn) [(#8521)](https://github.com/k3s-io/k3s/pull/8521)
* General updates to README [(#8786)](https://github.com/k3s-io/k3s/pull/8786)
* Fix wrong warning from restorecon in install script [(#8871)](https://github.com/k3s-io/k3s/pull/8871)
* Fix issue with snapshot metadata configmap [(#8835)](https://github.com/k3s-io/k3s/pull/8835)
  * Omit snapshot list configmap entries for snapshots without extra metadata
* Skip initial datastore reconcile during cluster-reset [(#8861)](https://github.com/k3s-io/k3s/pull/8861)
* Tweaked order of ingress IPs in ServiceLB [(#8711)](https://github.com/k3s-io/k3s/pull/8711)
  * Improved ingress IP ordering from ServiceLB
* Disable helm CRD installation for disable-helm-controller [(#8702)](https://github.com/k3s-io/k3s/pull/8702)
* More improves for K3s patch release docs [(#8800)](https://github.com/k3s-io/k3s/pull/8800)
* Update install.sh sha256sum [(#8885)](https://github.com/k3s-io/k3s/pull/8885)
* Add jitter to client config retry to avoid hammering servers when they are starting up [(#8863)](https://github.com/k3s-io/k3s/pull/8863)
* Handle nil pointer when runtime core is not ready in etcd [(#8886)](https://github.com/k3s-io/k3s/pull/8886)
* Bump dynamiclistener; reduce snapshot controller log spew [(#8894)](https://github.com/k3s-io/k3s/pull/8894)
  * Bumped dynamiclistener to address a race condition that could cause a server to fail to sync its certificates into the Kubernetes secret
  * Reduced etcd snapshot log spam during initial cluster startup
* Remove depends_on for e2e step; fix cert rotate e2e [(#8906)](https://github.com/k3s-io/k3s/pull/8906)
* Fix etcd snapshot S3 issues [(#8926)](https://github.com/k3s-io/k3s/pull/8926)
  * Don't apply S3 retention if S3 client failed to initialize
  * Don't request metadata when listing S3 snapshots
  * Print key instead of file path in snapshot metadata log message
* Update to v1.28.4 and Go to v1.20.11 [(#8920)](https://github.com/k3s-io/k3s/pull/8920)
* Remove s390x steps temporarily since runners are disabled [(#8983)](https://github.com/k3s-io/k3s/pull/8983)
* Remove s390x from manifest [(#8998)](https://github.com/k3s-io/k3s/pull/8998)

## Embedded Component Versions
| Component | Version |
|---|---|
| Kubernetes | [v1.28.4](https://github.com/kubernetes/kubernetes/blob/master/CHANGELOG/CHANGELOG-1.28.md#v1284) |
| Kine | [v0.11.0](https://github.com/k3s-io/kine/releases/tag/v0.11.0) |
| SQLite | [3.42.0](https://sqlite.org/releaselog/3_42_0.html) |
| Etcd | [v3.5.9-k3s1](https://github.com/k3s-io/etcd/releases/tag/v3.5.9-k3s1) |
| Containerd | [v1.7.7-k3s1](https://github.com/k3s-io/containerd/releases/tag/v1.7.7-k3s1) |
| Runc | [v1.1.8](https://github.com/opencontainers/runc/releases/tag/v1.1.8) |
| Flannel | [v0.22.2](https://github.com/flannel-io/flannel/releases/tag/v0.22.2) |
| Metrics-server | [v0.6.3](https://github.com/kubernetes-sigs/metrics-server/releases/tag/v0.6.3) |
| Traefik | [v2.10.5](https://github.com/traefik/traefik/releases/tag/v2.10.5) |
| CoreDNS | [v1.10.1](https://github.com/coredns/coredns/releases/tag/v1.10.1) |
| Helm-controller | [v0.15.4](https://github.com/k3s-io/helm-controller/releases/tag/v0.15.4) |
| Local-path-provisioner | [v0.0.24](https://github.com/rancher/local-path-provisioner/releases/tag/v0.0.24) |

## Helpful Links
As always, we welcome and appreciate feedback from our community of users. Please feel free to:
- [Open issues here](https://github.com/rancher/k3s/issues/new/choose)
- [Join our Slack channel](https://slack.rancher.io/)
- [Check out our documentation](https://rancher.com/docs/k3s/latest/en/) for guidance on how to get started or to dive deep into K3s.
- [Read how you can contribute here](https://github.com/rancher/k3s/blob/master/CONTRIBUTING.md)
-----
# Release v1.28.3+k3s2
<!-- v1.28.3+k3s2 -->

This release updates Kubernetes to v1.28.3, and fixes a number of issues.

For more details on what's new, see the [Kubernetes release notes](https://github.com/kubernetes/kubernetes/blob/master/CHANGELOG/CHANGELOG-1.28.md#changelog-since-v1283).

## Changes since v1.28.3+k3s1:

* Restore selinux context systemd unit file [(#8593)](https://github.com/k3s-io/k3s/pull/8593)
* Update channel to v1.27.7+k3s1 [(#8753)](https://github.com/k3s-io/k3s/pull/8753)
* Bump Sonobuoy version [(#8710)](https://github.com/k3s-io/k3s/pull/8710)
* Bump Trivy version [(#8739)](https://github.com/k3s-io/k3s/pull/8739)
* Fix: Access outer scope .SystemdCgroup [(#8761)](https://github.com/k3s-io/k3s/pull/8761)
  * Fixed failing to start with nvidia-container-runtime
* Upgrade traefik chart to v25.0.0 [(#8771)](https://github.com/k3s-io/k3s/pull/8771)
* Update traefik to fix registry value [(#8792)](https://github.com/k3s-io/k3s/pull/8792)
* Don't use iptables-save/iptables-restore if it will corrupt rules [(#8795)](https://github.com/k3s-io/k3s/pull/8795)

## Embedded Component Versions
| Component | Version |
|---|---|
| Kubernetes | [v1.28.3](https://github.com/kubernetes/kubernetes/blob/master/CHANGELOG/CHANGELOG-1.28.md#v1283) |
| Kine | [v0.10.3](https://github.com/k3s-io/kine/releases/tag/v0.10.3) |
| SQLite | [3.42.0](https://sqlite.org/releaselog/3_42_0.html) |
| Etcd | [v3.5.9-k3s1](https://github.com/k3s-io/etcd/releases/tag/v3.5.9-k3s1) |
| Containerd | [v1.7.7-k3s1](https://github.com/k3s-io/containerd/releases/tag/v1.7.7-k3s1) |
| Runc | [v1.1.8](https://github.com/opencontainers/runc/releases/tag/v1.1.8) |
| Flannel | [v0.22.2](https://github.com/flannel-io/flannel/releases/tag/v0.22.2) | 
| Metrics-server | [v0.6.3](https://github.com/kubernetes-sigs/metrics-server/releases/tag/v0.6.3) |
| Traefik | [v2.10.5](https://github.com/traefik/traefik/releases/tag/v2.10.5) |
| CoreDNS | [v1.10.1](https://github.com/coredns/coredns/releases/tag/v1.10.1) | 
| Helm-controller | [v0.15.4](https://github.com/k3s-io/helm-controller/releases/tag/v0.15.4) |
| Local-path-provisioner | [v0.0.24](https://github.com/rancher/local-path-provisioner/releases/tag/v0.0.24) |

## Helpful Links
As always, we welcome and appreciate feedback from our community of users. Please feel free to:
- [Open issues here](https://github.com/rancher/k3s/issues/new/choose)
- [Join our Slack channel](https://slack.rancher.io/)
- [Check out our documentation](https://rancher.com/docs/k3s/latest/en/) for guidance on how to get started or to dive deep into K3s.
- [Read how you can contribute here](https://github.com/rancher/k3s/blob/master/CONTRIBUTING.md)

-----
# Release v1.28.3+k3s1
<!-- v1.28.3+k3s1 -->

This release updates Kubernetes to v1.28.3, and fixes a number of issues.

For more details on what's new, see the [Kubernetes release notes](https://github.com/kubernetes/kubernetes/blob/master/CHANGELOG/CHANGELOG-1.28.md#changelog-since-v1282).

## Changes since v1.28.2+k3s1:

* Fix error reporting [(#8250)](https://github.com/k3s-io/k3s/pull/8250)
* Add context to flannel errors [(#8284)](https://github.com/k3s-io/k3s/pull/8284)
* Update channel, September patch release [(#8397)](https://github.com/k3s-io/k3s/pull/8397)
* Add missing link to drone in documentation [(#8295)](https://github.com/k3s-io/k3s/pull/8295)
* Include the interface name in the error message [(#8346)](https://github.com/k3s-io/k3s/pull/8346)
* Add extraArgs to vpn provider [(#8354)](https://github.com/k3s-io/k3s/pull/8354)
  * Allow to pass extra args to the vpn provider
* Disable HTTP on main etcd client port [(#8402)](https://github.com/k3s-io/k3s/pull/8402)
  * Embedded etcd no longer serves http requests on the client port, only grpc. This addresses a performance issue that could cause watch stream starvation under load. For more information, see https://github.com/etcd-io/etcd/issues/15402
* Server token rotation [(#8215)](https://github.com/k3s-io/k3s/pull/8215)
* Fix issues with etcd member removal after reset [(#8392)](https://github.com/k3s-io/k3s/pull/8392)
  * Fixed an issue that could cause k3s to attempt to remove members from the etcd cluster immediately following a cluster-reset/restore, if they were queued for removal at the time the snapshot was taken.
* Fix gofmt error [(#8439)](https://github.com/k3s-io/k3s/pull/8439)
* Added advertise address integration test [(#8344)](https://github.com/k3s-io/k3s/pull/8344)
* Added cluster reset from non bootstrap nodes on snapshot restore e2e test [(#8292)](https://github.com/k3s-io/k3s/pull/8292)
* Fix .github regex to skip drone runs on gh action bumps [(#8433)](https://github.com/k3s-io/k3s/pull/8433)
* Added error when cluster reset while using server flag [(#8385)](https://github.com/k3s-io/k3s/pull/8385)
  * The user will receive a error when --cluster-reset with the --server flag
* Update kube-router [(#8423)](https://github.com/k3s-io/k3s/pull/8423)
  * Update kube-router to v2.0.0-rc7 to fix performance issues
* Add SHA256 signatures of the install script [(#8312)](https://github.com/k3s-io/k3s/pull/8312)
  * - Add SHA256 signatures of the install script.
* Add --image-service-endpoint flag [(#8279)](https://github.com/k3s-io/k3s/pull/8279)
  * Add `--image-service-endpoint` flag to specify an external image service socket.
* Don't ignore assets in home dir if system assets exist [(#8458)](https://github.com/k3s-io/k3s/pull/8458)
* Pass SystemdCgroup setting through to nvidia runtime options [(#8470)](https://github.com/k3s-io/k3s/pull/8470)
  * Fixed issue that would cause pods using nvidia container runtime to be killed after a few seconds, when using newer versions of nvidia-container-toolkit.
* Improve release docs - updated [(#8414)](https://github.com/k3s-io/k3s/pull/8414)
* Take IPFamily precedence based on order [(#8460)](https://github.com/k3s-io/k3s/pull/8460)
* Fix spellcheck problem [(#8507)](https://github.com/k3s-io/k3s/pull/8507)
* Network defaults are duplicated, remove one [(#8523)](https://github.com/k3s-io/k3s/pull/8523)
* Fix slemicro check for selinux [(#8526)](https://github.com/k3s-io/k3s/pull/8526)
* Update install.sh.sha256sum [(#8566)](https://github.com/k3s-io/k3s/pull/8566)
* System agent push tags fix [(#8568)](https://github.com/k3s-io/k3s/pull/8568)
* Fixed tailscale node IP dualstack mode in case of IPv4 only node [(#8524)](https://github.com/k3s-io/k3s/pull/8524)
* Server Token Rotation [(#8265)](https://github.com/k3s-io/k3s/pull/8265)
  * Users can now rotate the server token using `k3s token rotate -t <OLD_TOKEN> --new-token <NEW_TOKEN>`. After command succeeds, all server nodes must be restarted with the new token.
* E2E Domain Drone Cleanup [(#8579)](https://github.com/k3s-io/k3s/pull/8579)
* Bump containerd to v1.7.7-k3s1 [(#8604)](https://github.com/k3s-io/k3s/pull/8604)
* Bump busybox to v1.36.1 [(#8602)](https://github.com/k3s-io/k3s/pull/8602)
* Migrate to using custom resource to store etcd snapshot metadata [(#8064)](https://github.com/k3s-io/k3s/pull/8064)
* Switch build target from main.go to a package. [(#8342)](https://github.com/k3s-io/k3s/pull/8342)
* Use IPv6 in case is the first configured IP with dualstack [(#8581)](https://github.com/k3s-io/k3s/pull/8581)
* Bump traefik, golang.org/x/net, google.golang.org/grpc [(#8624)](https://github.com/k3s-io/k3s/pull/8624)
* Update kube-router package in build script [(#8630)](https://github.com/k3s-io/k3s/pull/8630)
* Add etcd-only/control-plane-only server test and fix control-plane-only server crash [(#8638)](https://github.com/k3s-io/k3s/pull/8638)
* Use `version.Program` not K3s in token rotate logs [(#8653)](https://github.com/k3s-io/k3s/pull/8653)
* [Windows Port [(#7259)](https://github.com/k3s-io/k3s/pull/7259)
* Fix CloudDualStackNodeIPs feature-gate inconsistency [(#8667)](https://github.com/k3s-io/k3s/pull/8667)
* Re-enable etcd endpoint auto-sync [(#8675)](https://github.com/k3s-io/k3s/pull/8675)
* Manually requeue configmap reconcile when no nodes have reconciled snapshots [(#8683)](https://github.com/k3s-io/k3s/pull/8683)
* Update to v1.28.3 and Go to v1.20.10 [(#8682)](https://github.com/k3s-io/k3s/pull/8682)
* Fix s3 snapshot restore [(#8729)](https://github.com/k3s-io/k3s/pull/8729)

## Embedded Component Versions
| Component | Version |
|---|---|
| Kubernetes | [v1.28.3](https://github.com/kubernetes/kubernetes/blob/master/CHANGELOG/CHANGELOG-1.28.md#v1283) |
| Kine | [v0.10.3](https://github.com/k3s-io/kine/releases/tag/v0.10.3) |
| SQLite | [3.42.0](https://sqlite.org/releaselog/3_42_0.html) |
| Etcd | [v3.5.9-k3s1](https://github.com/k3s-io/etcd/releases/tag/v3.5.9-k3s1) |
| Containerd | [v1.7.7-k3s1](https://github.com/k3s-io/containerd/releases/tag/v1.7.7-k3s1) |
| Runc | [v1.1.8](https://github.com/opencontainers/runc/releases/tag/v1.1.8) |
| Flannel | [v0.22.2](https://github.com/flannel-io/flannel/releases/tag/v0.22.2) | 
| Metrics-server | [v0.6.3](https://github.com/kubernetes-sigs/metrics-server/releases/tag/v0.6.3) |
| Traefik | [v2.10.5](https://github.com/traefik/traefik/releases/tag/v2.10.5) |
| CoreDNS | [v1.10.1](https://github.com/coredns/coredns/releases/tag/v1.10.1) | 
| Helm-controller | [v0.15.4](https://github.com/k3s-io/helm-controller/releases/tag/v0.15.4) |
| Local-path-provisioner | [v0.0.24](https://github.com/rancher/local-path-provisioner/releases/tag/v0.0.24) |

## Helpful Links
As always, we welcome and appreciate feedback from our community of users. Please feel free to:
- [Open issues here](https://github.com/rancher/k3s/issues/new/choose)
- [Join our Slack channel](https://slack.rancher.io/)
- [Check out our documentation](https://rancher.com/docs/k3s/latest/en/) for guidance on how to get started or to dive deep into K3s.
- [Read how you can contribute here](https://github.com/rancher/k3s/blob/master/CONTRIBUTING.md)
-----
# Release v1.28.2+k3s1
<!-- v1.28.2+k3s1 -->

This release updates Kubernetes to v1.28.2, and fixes a number of issues.

For more details on what's new, see the [Kubernetes release notes](https://github.com/kubernetes/kubernetes/blob/master/CHANGELOG/CHANGELOG-1.28.md#changelog-since-v1281).

## Changes since v1.28.1+k3s1:

* Update channel for version v1.28 [(#8305)](https://github.com/k3s-io/k3s/pull/8305)
* Bump kine to v0.10.3 [(#8323)](https://github.com/k3s-io/k3s/pull/8323)
* Update to v1.28.2 and go v1.20.8 [(#8364)](https://github.com/k3s-io/k3s/pull/8364)
  * Bump embedded containerd to v1.7.6
  * Bump embedded stargz-snapshotter plugin to latest
  * Fixed intermittent drone CI failures due to race conditions in test environment setup scripts
  * Fixed CI failures due to changes to api discovery changes in Kubernetes 1.28

## Embedded Component Versions
| Component | Version |
|---|---|
| Kubernetes | [v1.28.2](https://github.com/kubernetes/kubernetes/blob/master/CHANGELOG/CHANGELOG-1.28.md#v1282) |
| Kine | [v0.10.3](https://github.com/k3s-io/kine/releases/tag/v0.10.3) |
| SQLite | [3.42.0](https://sqlite.org/releaselog/3_42_0.html) |
| Etcd | [v3.5.9-k3s1](https://github.com/k3s-io/etcd/releases/tag/v3.5.9-k3s1) |
| Containerd | [v1.7.6-k3s1](https://github.com/k3s-io/containerd/releases/tag/v1.7.6-k3s1) |
| Runc | [v1.1.8](https://github.com/opencontainers/runc/releases/tag/v1.1.8) |
| Flannel | [v0.22.2](https://github.com/flannel-io/flannel/releases/tag/v0.22.2) | 
| Metrics-server | [v0.6.3](https://github.com/kubernetes-sigs/metrics-server/releases/tag/v0.6.3) |
| Traefik | [v2.9.10](https://github.com/traefik/traefik/releases/tag/v2.9.10) |
| CoreDNS | [v1.10.1](https://github.com/coredns/coredns/releases/tag/v1.10.1) | 
| Helm-controller | [v0.15.4](https://github.com/k3s-io/helm-controller/releases/tag/v0.15.4) |
| Local-path-provisioner | [v0.0.24](https://github.com/rancher/local-path-provisioner/releases/tag/v0.0.24) |

## Helpful Links
As always, we welcome and appreciate feedback from our community of users. Please feel free to:
- [Open issues here](https://github.com/rancher/k3s/issues/new/choose)
- [Join our Slack channel](https://slack.rancher.io/)
- [Check out our documentation](https://rancher.com/docs/k3s/latest/en/) for guidance on how to get started or to dive deep into K3s.
- [Read how you can contribute here](https://github.com/rancher/k3s/blob/master/CONTRIBUTING.md)

-----
# Release v1.28.1+k3s1
<!-- v1.28.1+k3s1 -->
This release is K3S's first in the v1.28 line. This release updates Kubernetes to v1.28.1.

⚠️ IMPORTANT: This release includes remediation for CVE-2023-32187, a potential Denial of Service attack vector on K3s servers. See https://github.com/k3s-io/k3s/security/advisories/GHSA-m4hf-6vgr-75r2 for more information, including documentation on changes in behavior that harden clusters against this vulnerability.

Kubernetes v1.28 contains a critical regression ([kubernetes/kubernetes#120247](https://github.com/kubernetes/kubernetes/issues/120247)) that causes init containers to run at the same time as app containers following a restart of the node. This issue will be fixed in v1.28.2. We do not recommend using K3s v1.28 at this time if your application depends on init containers.

For more details on what's new, see the [Kubernetes release notes](https://github.com/kubernetes/kubernetes/blob/master/CHANGELOG/CHANGELOG-1.28.md#changelog-since-v1270).

## Changes since v1.27.5+k3s1:

* Update to v1.28.1 [(#8239)](https://github.com/k3s-io/k3s/pull/8239)
* CLI Removal for v1.28.0 [(#8203)](https://github.com/k3s-io/k3s/pull/8203)
* Secrets Encryption V3 [(#8111)](https://github.com/k3s-io/k3s/pull/8111)
* Add new CLI flag to disable TLS SAN CN filtering [(#8252)](https://github.com/k3s-io/k3s/pull/8252)
  * Added a new `--tls-san-security` option.
* Add RWMutex to address controller [(#8268)](https://github.com/k3s-io/k3s/pull/8268)

## Embedded Component Versions
| Component | Version |
|---|---|
| Kubernetes | [v1.28.1](https://github.com/kubernetes/kubernetes/blob/master/CHANGELOG/CHANGELOG-1.28.md#v1281) |
| Kine | [v0.10.3](https://github.com/k3s-io/kine/releases/tag/v0.10.3) |
| SQLite | [3.42.0](https://sqlite.org/releaselog/3_42_0.html) |
| Etcd | [v3.5.9-k3s1](https://github.com/k3s-io/etcd/releases/tag/v3.5.9-k3s1) |
| Containerd | [v1.7.3-k3s2](https://github.com/k3s-io/containerd/releases/tag/v1.7.3-k3s2) |
| Runc | [v1.1.8](https://github.com/opencontainers/runc/releases/tag/v1.1.8) |
| Flannel | [v0.22.2](https://github.com/flannel-io/flannel/releases/tag/v0.22.2) | 
| Metrics-server | [v0.6.3](https://github.com/kubernetes-sigs/metrics-server/releases/tag/v0.6.3) |
| Traefik | [v2.9.10](https://github.com/traefik/traefik/releases/tag/v2.9.10) |
| CoreDNS | [v1.10.1](https://github.com/coredns/coredns/releases/tag/v1.10.1) | 
| Helm-controller | [v0.15.4](https://github.com/k3s-io/helm-controller/releases/tag/v0.15.4) |
| Local-path-provisioner | [v0.0.24](https://github.com/rancher/local-path-provisioner/releases/tag/v0.0.24) |

## Helpful Links
As always, we welcome and appreciate feedback from our community of users. Please feel free to:
- [Open issues here](https://github.com/rancher/k3s/issues/new/choose)
- [Join our Slack channel](https://slack.rancher.io/)
- [Check out our documentation](https://rancher.com/docs/k3s/latest/en/) for guidance on how to get started or to dive deep into K3s.
- [Read how you can contribute here](https://github.com/rancher/k3s/blob/master/CONTRIBUTING.md)
-----
