| k3s version| Kubernetes | Kine | SQLite | Etcd | Containerd | Runc | Flannel | Metrics-server | Traefik | CoreDNS | Helm-controller | Local-path-provisioner  |
| ----- | ----- | ----- | ----- | ----- | ----- | ----- | ----- | ----- | ----- | ----- | ----- | -----  |
| v1.25.14+k3s1 | [v1.25.14](https://github.com/kubernetes/kubernetes/blob/master/CHANGELOG/CHANGELOG-1.25.md#v12514) | [v0.10.3](https://github.com/k3s-io/kine/releases/tag/v0.10.3) | [3.42.0](https://sqlite.org/releaselog/3_42_0.html) | [v3.5.3-k3s1](https://github.com/k3s-io/etcd/releases/tag/v3.5.3-k3s1) | [v1.7.6-k3s1](https://github.com/k3s-io/containerd/releases/tag/v1.7.6-k3s1) | [v1.1.8](https://github.com/opencontainers/runc/releases/tag/v1.1.8) | [v0.22.2](https://github.com/flannel-io/flannel/releases/tag/v0.22.2) | [v0.6.3](https://github.com/kubernetes-sigs/metrics-server/releases/tag/v0.6.3) | [v2.9.10](https://github.com/traefik/traefik/releases/tag/v2.9.10) | [v1.10.1](https://github.com/coredns/coredns/releases/tag/v1.10.1) | [v0.15.4](https://github.com/k3s-io/helm-controller/releases/tag/v0.15.4) | [v0.0.24](https://github.com/rancher/local-path-provisioner/releases/tag/v0.0.24)  |
| v1.25.13+k3s1 | [v1.25.13](https://github.com/kubernetes/kubernetes/blob/master/CHANGELOG/CHANGELOG-1.25.md#v12513) | [v0.10.2](https://github.com/k3s-io/kine/releases/tag/v0.10.2) | [3.42.0](https://sqlite.org/releaselog/3_42_0.html) | [v3.5.3-k3s1](https://github.com/k3s-io/etcd/releases/tag/v3.5.3-k3s1) | [v1.7.3-k3s1](https://github.com/k3s-io/containerd/releases/tag/v1.7.3-k3s1) | [v1.1.8](https://github.com/opencontainers/runc/releases/tag/v1.1.8) | [v0.22.2](https://github.com/flannel-io/flannel/releases/tag/v0.22.2) | [v0.6.3](https://github.com/kubernetes-sigs/metrics-server/releases/tag/v0.6.3) | [v2.9.10](https://github.com/traefik/traefik/releases/tag/v2.9.10) | [v1.10.1](https://github.com/coredns/coredns/releases/tag/v1.10.1) | [v0.15.4](https://github.com/k3s-io/helm-controller/releases/tag/v0.15.4) | [v0.0.24](https://github.com/rancher/local-path-provisioner/releases/tag/v0.0.24)  |
| v1.25.12+k3s1 | [v1.25.12](https://github.com/kubernetes/kubernetes/blob/master/CHANGELOG/CHANGELOG-1.25.md#v12512) | [v0.10.1](https://github.com/k3s-io/kine/releases/tag/v0.10.1) | [3.39.2](https://sqlite.org/releaselog/3_39_2.html) | [v3.5.3-k3s1](https://github.com/k3s-io/etcd/releases/tag/v3.5.3-k3s1) | [v1.7.1-k3s1](https://github.com/k3s-io/containerd/releases/tag/v1.7.1-k3s1) | [v1.1.7](https://github.com/opencontainers/runc/releases/tag/v1.1.7) | [v0.22.0](https://github.com/flannel-io/flannel/releases/tag/v0.22.0) | [v0.6.3](https://github.com/kubernetes-sigs/metrics-server/releases/tag/v0.6.3) | [v2.9.10](https://github.com/traefik/traefik/releases/tag/v2.9.10) | [v1.10.1](https://github.com/coredns/coredns/releases/tag/v1.10.1) | [v0.15.2](https://github.com/k3s-io/helm-controller/releases/tag/v0.15.2) | [v0.0.24](https://github.com/rancher/local-path-provisioner/releases/tag/v0.0.24)  |
| v1.25.11+k3s1 | [v1.25.11](https://github.com/kubernetes/kubernetes/blob/master/CHANGELOG/CHANGELOG-1.25.md#v12511) | [v0.10.1](https://github.com/k3s-io/kine/releases/tag/v0.10.1) | [3.39.2](https://sqlite.org/releaselog/3_39_2.html) | [v3.5.3-k3s1](https://github.com/k3s-io/etcd/releases/tag/v3.5.3-k3s1) | [v1.7.1-k3s1](https://github.com/k3s-io/containerd/releases/tag/v1.7.1-k3s1) | [v1.1.7](https://github.com/opencontainers/runc/releases/tag/v1.1.7) | [v0.22.0](https://github.com/flannel-io/flannel/releases/tag/v0.22.0) | [v0.6.3](https://github.com/kubernetes-sigs/metrics-server/releases/tag/v0.6.3) | [v2.9.10](https://github.com/traefik/traefik/releases/tag/v2.9.10) | [v1.10.1](https://github.com/coredns/coredns/releases/tag/v1.10.1) | [v0.15.0](https://github.com/k3s-io/helm-controller/releases/tag/v0.15.0) | [v0.0.24](https://github.com/rancher/local-path-provisioner/releases/tag/v0.0.24)  |
| v1.25.10+k3s1 | [v1.25.10](https://github.com/kubernetes/kubernetes/blob/master/CHANGELOG/CHANGELOG-1.25.md#v12510) | [v0.10.1](https://github.com/k3s-io/kine/releases/tag/v0.10.1) | [3.39.2](https://sqlite.org/releaselog/3_39_2.html) | [v3.5.3-k3s1](https://github.com/k3s-io/etcd/releases/tag/v3.5.3-k3s1) | [v1.7.1-k3s1](https://github.com/k3s-io/containerd/releases/tag/v1.7.1-k3s1) | [v1.1.7](https://github.com/opencontainers/runc/releases/tag/v1.1.7) | [v0.21.4](https://github.com/flannel-io/flannel/releases/tag/v0.21.4) | [v0.6.2](https://github.com/kubernetes-sigs/metrics-server/releases/tag/v0.6.2) | [v2.9.10](https://github.com/traefik/traefik/releases/tag/v2.9.10) | [v1.10.1](https://github.com/coredns/coredns/releases/tag/v1.10.1) | [v0.14.0](https://github.com/k3s-io/helm-controller/releases/tag/v0.14.0) | [v0.0.24](https://github.com/rancher/local-path-provisioner/releases/tag/v0.0.24)  |
| v1.25.9+k3s1 | [v1.25.9](https://github.com/kubernetes/kubernetes/blob/master/CHANGELOG/CHANGELOG-1.25.md#v1259) | [v0.9.9](https://github.com/k3s-io/kine/releases/tag/v0.9.9) | [3.39.2](https://sqlite.org/releaselog/3_39_2.html) | [v3.5.3-k3s1](https://github.com/k3s-io/etcd/releases/tag/v3.5.3-k3s1) | [v1.6.19-k3s1](https://github.com/k3s-io/containerd/releases/tag/v1.6.19-k3s1) | [v1.1.5](https://github.com/opencontainers/runc/releases/tag/v1.1.5) | [v0.21.4](https://github.com/flannel-io/flannel/releases/tag/v0.21.4) | [v0.6.2](https://github.com/kubernetes-sigs/metrics-server/releases/tag/v0.6.2) | [v2.9.4](https://github.com/traefik/traefik/releases/tag/v2.9.4) | [v1.10.1](https://github.com/coredns/coredns/releases/tag/v1.10.1) | [v0.13.3](https://github.com/k3s-io/helm-controller/releases/tag/v0.13.3) | [v0.0.24](https://github.com/rancher/local-path-provisioner/releases/tag/v0.0.24)  |
| v1.25.8+k3s1 | [v1.25.8](https://github.com/kubernetes/kubernetes/blob/master/CHANGELOG/CHANGELOG-1.25.md#v1258) | [v0.9.9](https://github.com/k3s-io/kine/releases/tag/v0.9.9) | [3.39.2](https://sqlite.org/releaselog/3_39_2.html) | [v3.5.3-k3s1](https://github.com/k3s-io/etcd/releases/tag/v3.5.3-k3s1) | [v1.6.19-k3s1](https://github.com/k3s-io/containerd/releases/tag/v1.6.19-k3s1) | [v1.1.4](https://github.com/opencontainers/runc/releases/tag/v1.1.4) | [v0.21.4](https://github.com/flannel-io/flannel/releases/tag/v0.21.4) | [v0.6.2](https://github.com/kubernetes-sigs/metrics-server/releases/tag/v0.6.2) | [v2.9.4](https://github.com/traefik/traefik/releases/tag/v2.9.4) | [v1.9.4](https://github.com/coredns/coredns/releases/tag/v1.9.4) | [v0.13.1](https://github.com/k3s-io/helm-controller/releases/tag/v0.13.1) | [v0.0.23](https://github.com/rancher/local-path-provisioner/releases/tag/v0.0.23)  |
| v1.25.7+k3s1 | [v1.25.7](https://github.com/kubernetes/kubernetes/blob/master/CHANGELOG/CHANGELOG-1.25.md#v1257) | [v0.9.9](https://github.com/k3s-io/kine/releases/tag/v0.9.9) | [3.39.2](https://sqlite.org/releaselog/3_39_2.html) | [v3.5.3-k3s1](https://github.com/k3s-io/etcd/releases/tag/v3.5.3-k3s1) | [v1.6.15-k3s1](https://github.com/k3s-io/containerd/releases/tag/v1.6.15-k3s1) | [v1.1.4](https://github.com/opencontainers/runc/releases/tag/v1.1.4) | [v0.21.1](https://github.com/flannel-io/flannel/releases/tag/v0.21.1) | [v0.6.2](https://github.com/kubernetes-sigs/metrics-server/releases/tag/v0.6.2) | [v2.9.4](https://github.com/traefik/traefik/releases/tag/v2.9.4) | [v1.9.4](https://github.com/coredns/coredns/releases/tag/v1.9.4) | [v0.13.1](https://github.com/k3s-io/helm-controller/releases/tag/v0.13.1) | [v0.0.23](https://github.com/rancher/local-path-provisioner/releases/tag/v0.0.23)  |
| v1.25.6+k3s1 | [v1.25.6](https://github.com/kubernetes/kubernetes/blob/master/CHANGELOG/CHANGELOG-1.25.md#v1256) | [v0.9.6](https://github.com/k3s-io/kine/releases/tag/v0.9.6) | [3.39.2](https://sqlite.org/releaselog/3_39_2.html) | [v3.5.3-k3s1](https://github.com/k3s-io/etcd/releases/tag/v3.5.3-k3s1) | [v1.6.15-k3s1](https://github.com/k3s-io/containerd/releases/tag/v1.6.15-k3s1) | [v1.1.4](https://github.com/opencontainers/runc/releases/tag/v1.1.4) | [v0.20.2](https://github.com/flannel-io/flannel/releases/tag/v0.20.2) | [v0.6.2](https://github.com/kubernetes-sigs/metrics-server/releases/tag/v0.6.2) | [v2.9.4](https://github.com/traefik/traefik/releases/tag/v2.9.4) | [v1.9.4](https://github.com/coredns/coredns/releases/tag/v1.9.4) | [v0.13.1](https://github.com/k3s-io/helm-controller/releases/tag/v0.13.1) | [v0.0.23](https://github.com/rancher/local-path-provisioner/releases/tag/v0.0.23)  |
| v1.25.5+k3s2 | [v1.25.5](https://github.com/kubernetes/kubernetes/blob/master/CHANGELOG/CHANGELOG-1.25.md#v1255) | [v0.9.6](https://github.com/k3s-io/kine/releases/tag/v0.9.6) | [3.39.2](https://sqlite.org/releaselog/3_39_2.html) | [v3.5.3-k3s1](https://github.com/k3s-io/etcd/releases/tag/v3.5.3-k3s1) | [v1.6.14-k3s1](https://github.com/k3s-io/containerd/releases/tag/v1.6.14-k3s1) | [v1.1.4](https://github.com/opencontainers/runc/releases/tag/v1.1.4) | [v0.20.2](https://github.com/flannel-io/flannel/releases/tag/v0.20.2) | [v0.6.2](https://github.com/kubernetes-sigs/metrics-server/releases/tag/v0.6.2) | [v2.9.4](https://github.com/traefik/traefik/releases/tag/v2.9.4) | [v1.9.4](https://github.com/coredns/coredns/releases/tag/v1.9.4) | [v0.13.1](https://github.com/k3s-io/helm-controller/releases/tag/v0.13.1) | [v0.0.23](https://github.com/rancher/local-path-provisioner/releases/tag/v0.0.23)  |
| v1.25.5+k3s1 | [v1.25.5](https://github.com/kubernetes/kubernetes/blob/master/CHANGELOG/CHANGELOG-1.25.md#v1255) | [v0.9.6](https://github.com/k3s-io/kine/releases/tag/v0.9.6) | [3.39.2](https://sqlite.org/releaselog/3_39_2.html) | [v3.5.3-k3s1](https://github.com/k3s-io/etcd/releases/tag/v3.5.3-k3s1) | [v1.6.12-k3s1](https://github.com/k3s-io/containerd/releases/tag/v1.6.12-k3s1) | [v1.1.4](https://github.com/opencontainers/runc/releases/tag/v1.1.4) | [v0.20.2](https://github.com/flannel-io/flannel/releases/tag/v0.20.2) | [v0.6.2](https://github.com/kubernetes-sigs/metrics-server/releases/tag/v0.6.2) | [v2.9.4](https://github.com/traefik/traefik/releases/tag/v2.9.4) | [v1.9.4](https://github.com/coredns/coredns/releases/tag/v1.9.4) | [v0.13.1](https://github.com/k3s-io/helm-controller/releases/tag/v0.13.1) | [v0.0.23](https://github.com/rancher/local-path-provisioner/releases/tag/v0.0.23)  |
| v1.25.4+k3s1 | [v1.25.4](https://github.com/kubernetes/kubernetes/blob/master/CHANGELOG/CHANGELOG-1.25.md#v1254) | [v0.9.6](https://github.com/k3s-io/kine/releases/tag/v0.9.6) | [3.39.2](https://sqlite.org/releaselog/3_39_2.html) | [v3.5.3-k3s1](https://github.com/k3s-io/etcd/releases/tag/v3.5.3-k3s1) | [v1.6.8-k3s1](https://github.com/k3s-io/containerd/releases/tag/v1.6.8-k3s1) | [v1.1.4](https://github.com/opencontainers/runc/releases/tag/v1.1.4) | [v0.20.1](https://github.com/flannel-io/flannel/releases/tag/v0.20.1) | [v0.6.1](https://github.com/kubernetes-sigs/metrics-server/releases/tag/v0.6.1) | [v2.9.4](https://github.com/traefik/traefik/releases/tag/v2.9.4) | [v1.9.4](https://github.com/coredns/coredns/releases/tag/v1.9.4) | [v0.13.0](https://github.com/k3s-io/helm-controller/releases/tag/v0.13.0) | [v0.0.23](https://github.com/rancher/local-path-provisioner/releases/tag/v0.0.23)  |
| v1.25.3+k3s1 | [v1.25.3](https://github.com/kubernetes/kubernetes/blob/master/CHANGELOG/CHANGELOG-1.25.md#v1253) | [v0.9.3](https://github.com/k3s-io/kine/releases/tag/v0.9.3) | [3.36.0](https://sqlite.org/releaselog/3_36_0.html) | [v3.5.3-k3s1](https://github.com/k3s-io/etcd/releases/tag/v3.5.3-k3s1) | [v1.6.8-k3s1](https://github.com/k3s-io/containerd/releases/tag/v1.6.8-k3s1) | [v1.1.4](https://github.com/opencontainers/runc/releases/tag/v1.1.4) | [v0.19.2](https://github.com/flannel-io/flannel/releases/tag/v0.19.2) | [v0.6.1](https://github.com/kubernetes-sigs/metrics-server/releases/tag/v0.6.1) | [v2.9.1](https://github.com/traefik/traefik/releases/tag/v2.9.1) | [v1.9.1](https://github.com/coredns/coredns/releases/tag/v1.9.1) | [v0.12.3](https://github.com/k3s-io/helm-controller/releases/tag/v0.12.3) | [v0.0.21](https://github.com/rancher/local-path-provisioner/releases/tag/v0.0.21)  |
| v1.25.2+k3s1 | [v1.25.2](https://github.com/kubernetes/kubernetes/blob/master/CHANGELOG/CHANGELOG-1.25.md#v1252) | [v0.9.3](https://github.com/k3s-io/kine/releases/tag/v0.9.3) | [3.36.0](https://sqlite.org/releaselog/3_36_0.html) | [v3.5.3-k3s1](https://github.com/k3s-io/etcd/releases/tag/v3.5.3-k3s1) | [v1.6.8-k3s1](https://github.com/k3s-io/containerd/releases/tag/v1.6.8-k3s1) | [v1.1.4](https://github.com/opencontainers/runc/releases/tag/v1.1.4) | [v0.19.2](https://github.com/flannel-io/flannel/releases/tag/v0.19.2) | [v0.5.2](https://github.com/kubernetes-sigs/metrics-server/releases/tag/v0.5.2) | [v2.6.2](https://github.com/traefik/traefik/releases/tag/v2.6.2) | [v1.9.1](https://github.com/coredns/coredns/releases/tag/v1.9.1) | [v0.12.3](https://github.com/k3s-io/helm-controller/releases/tag/v0.12.3) | [v0.0.21](https://github.com/rancher/local-path-provisioner/releases/tag/v0.0.21)  |
| v1.25.0+k3s1 | [v1.25.0](https://github.com/kubernetes/kubernetes/blob/master/CHANGELOG/CHANGELOG-1.25.md#v1250) | [v0.9.3](https://github.com/k3s-io/kine/releases/tag/v0.9.3) | [3.36.0](https://sqlite.org/releaselog/3_36_0.html) | [v3.5.3-k3s1](https://github.com/k3s-io/etcd/releases/tag/v3.5.3-k3s1) | [v1.5.13-k3s2](https://github.com/k3s-io/containerd/releases/tag/v1.5.13-k3s2) | [v1.1.3](https://github.com/opencontainers/runc/releases/tag/v1.1.3) | [v0.19.1](https://github.com/flannel-io/flannel/releases/tag/v0.19.1) | [v0.5.2](https://github.com/kubernetes-sigs/metrics-server/releases/tag/v0.5.2) | [v2.6.2](https://github.com/traefik/traefik/releases/tag/v2.6.2) | [v1.9.1](https://github.com/coredns/coredns/releases/tag/v1.9.1) | [v0.12.3](https://github.com/k3s-io/helm-controller/releases/tag/v0.12.3) | [v0.0.21](https://github.com/rancher/local-path-provisioner/releases/tag/v0.0.21)  |



| Version | Release date | US date | EU date | Upstream release date | US date | EU date | Days since upstream |
| ----- | ----- | ----- | ----- | ----- | ----- | ----- | ----- |
| [v1.25.14+k3s1](k3s-v1.25.md#release-v12514k3s1) | Sep 20 2023 | 09/20/23 | 2023-09-20 | Sep 13 2023 | 09/13/23 | 2023-09-13 | 7 days |
| [v1.25.13+k3s1](k3s-v1.25.md#release-v12513k3s1) | Sep 05 2023 | 09/05/23 | 2023-09-05 | Aug 24 2023 | 08/24/23 | 2023-08-24 | 12 days |
| [v1.25.12+k3s1](k3s-v1.25.md#release-v12512k3s1) | Jul 27 2023 | 07/27/23 | 2023-07-27 | Jul 19 2023 | 07/19/23 | 2023-07-19 | 8 days |
| [v1.25.11+k3s1](k3s-v1.25.md#release-v12511k3s1) | Jun 26 2023 | 06/26/23 | 2023-06-26 | Jun 14 2023 | 06/14/23 | 2023-06-14 | 12 days |
| [v1.25.10+k3s1](k3s-v1.25.md#release-v12510k3s1) | May 26 2023 | 05/26/23 | 2023-05-26 | May 18 2023 | 05/18/23 | 2023-05-18 | 8 days |
| [v1.25.9+k3s1](k3s-v1.25.md#release-v1259k3s1) | Apr 20 2023 | 04/20/23 | 2023-04-20 | Apr 12 2023 | 04/12/23 | 2023-04-12 | 8 days |
| [v1.25.8+k3s1](k3s-v1.25.md#release-v1258k3s1) | Mar 27 2023 | 03/27/23 | 2023-03-27 | Mar 17 2023 | 03/17/23 | 2023-03-17 | 10 days |
| [v1.25.7+k3s1](k3s-v1.25.md#release-v1257k3s1) | Mar 10 2023 | 03/10/23 | 2023-03-10 | Feb 28 2023 | 02/28/23 | 2023-02-28 | 10 days |
| [v1.25.6+k3s1](k3s-v1.25.md#release-v1256k3s1) | Jan 26 2023 | 01/26/23 | 2023-01-26 | Jan 19 2023 | 01/19/23 | 2023-01-19 | 7 days |
| [v1.25.5+k3s2](k3s-v1.25.md#release-v1255k3s2) | Jan 11 2023 | 01/11/23 | 2023-01-11 | Dec 08 2022 | 12/08/22 | 2022-12-08 | 34 days |
| [v1.25.5+k3s1](k3s-v1.25.md#release-v1255k3s1) | Dec 20 2022 | 12/20/22 | 2022-12-20 | Dec 08 2022 | 12/08/22 | 2022-12-08 | 12 days |
| [v1.25.4+k3s1](k3s-v1.25.md#release-v1254k3s1) | Nov 18 2022 | 11/18/22 | 2022-11-18 | Nov 10 2022 | 11/10/22 | 2022-11-10 | 8 days |
| [v1.25.3+k3s1](k3s-v1.25.md#release-v1253k3s1) | Oct 25 2022 | 10/25/22 | 2022-10-25 | Oct 13 2022 | 10/13/22 | 2022-10-13 | 12 days |
| [v1.25.2+k3s1](k3s-v1.25.md#release-v1252k3s1) | Sep 28 2022 | 09/28/22 | 2022-09-28 | Sep 21 2022 | 09/21/22 | 2022-09-21 | 7 days |
| [v1.25.0+k3s1](k3s-v1.25.md#release-v1250k3s1) | Sep 12 2022 | 09/12/22 | 2022-09-12 | Aug 23 2022 | 08/23/22 | 2022-08-23 | 20 days |



# Release v1.25.14+k3s1
<!-- v1.25.14+k3s1 -->

This release updates Kubernetes to v1.25.14, and fixes a number of issues.

For more details on what's new, see the [Kubernetes release notes](https://github.com/kubernetes/kubernetes/blob/master/CHANGELOG/CHANGELOG-1.25.md#changelog-since-v12513).

## Changes since v1.25.13+k3s1:

* Bump kine to v0.10.3 [(#8326)](https://github.com/k3s-io/k3s/pull/8326)
* Update Kubernetes to v1.25.14 and go to 1.20.8 [(#8350)](https://github.com/k3s-io/k3s/pull/8350)
* Backport containerd bump and and test fixes [(#8384)](https://github.com/k3s-io/k3s/pull/8384)
  * Bump embedded containerd to v1.7.6
  * Bump embedded stargz-snapshotter plugin to latest
  * Fixed intermittent drone CI failures due to race conditions in test environment setup scripts
  * Fixed CI failures due to changes to api discovery changes in Kubernetes 1.28

## Embedded Component Versions
| Component | Version |
|---|---|
| Kubernetes | [v1.25.14](https://github.com/kubernetes/kubernetes/blob/master/CHANGELOG/CHANGELOG-1.25.md#v12514) |
| Kine | [v0.10.3](https://github.com/k3s-io/kine/releases/tag/v0.10.3) |
| SQLite | [3.42.0](https://sqlite.org/releaselog/3_42_0.html) |
| Etcd | [v3.5.3-k3s1](https://github.com/k3s-io/etcd/releases/tag/v3.5.3-k3s1) |
| Containerd | [v1.7.6-k3s1](https://github.com/k3s-io/containerd/releases/tag/v1.7.6-k3s1) |
| Runc | [v1.1.8](https://github.com/opencontainers/runc/releases/tag/v1.1.8) |
| Flannel | [v0.22.2](https://github.com/flannel-io/flannel/releases/tag/v0.22.2) | 
| Metrics-server | [v0.6.3](https://github.com/kubernetes-sigs/metrics-server/releases/tag/v0.6.3) |
| Traefik | [v2.9.10](https://github.com/traefik/traefik/releases/tag/v2.9.10) |
| CoreDNS | [v1.10.1](https://github.com/coredns/coredns/releases/tag/v1.10.1) | 
| Helm-controller | [v0.15.4](https://github.com/k3s-io/helm-controller/releases/tag/v0.15.4) |
| Local-path-provisioner | [v0.0.24](https://github.com/rancher/local-path-provisioner/releases/tag/v0.0.24) |

## Helpful Links
As always, we welcome and appreciate feedback from our community of users. Please feel free to:
- [Open issues here](https://github.com/rancher/k3s/issues/new/choose)
- [Join our Slack channel](https://slack.rancher.io/)
- [Check out our documentation](https://rancher.com/docs/k3s/latest/en/) for guidance on how to get started or to dive deep into K3s.
- [Read how you can contribute here](https://github.com/rancher/k3s/blob/master/CONTRIBUTING.md)

-----
# Release v1.25.13+k3s1
<!-- v1.25.13+k3s1 -->
This release updates Kubernetes to v1.25.13, and fixes a number of issues.

⚠️ IMPORTANT: This release includes support for remediating CVE-2023-32187, a potential Denial of Service attack vector on K3s servers. See https://github.com/k3s-io/k3s/security/advisories/GHSA-m4hf-6vgr-75r2 for more information, including mandatory steps necessary to harden clusters against this vulnerability.

For more details on what's new, see the [Kubernetes release notes](https://github.com/kubernetes/kubernetes/blob/master/CHANGELOG/CHANGELOG-1.25.md#changelog-since-v12512).

## Changes since v1.25.12+k3s1:

* Update flannel and plugins [(#8076)](https://github.com/k3s-io/k3s/pull/8076)
* Fix tailscale bug with ip modes [(#8098)](https://github.com/k3s-io/k3s/pull/8098)
* Etcd snapshots retention when node name changes [(#8123)](https://github.com/k3s-io/k3s/pull/8123)
* August Test Backports [(#8127)](https://github.com/k3s-io/k3s/pull/8127)
* Backports for 2023-08 release [(#8132)](https://github.com/k3s-io/k3s/pull/8132)
  * K3s's external apiserver listener now declines to add to its certificate any subject names not associated with the kubernetes apiserver service, server nodes, or values of the --tls-san option. This prevents the certificate's SAN list from being filled with unwanted entries.
  * K3s no longer enables the apiserver's `enable-aggregator-routing` flag when the egress proxy is not being used to route connections to in-cluster endpoints.
  * Updated the embedded containerd to v1.7.3+k3s1
  * Updated the embedded runc to v1.1.8
  * User-provided containerd config templates may now use `{{ template "base" . }}` to include the default K3s template content. This makes it easier to maintain user configuration if the only need is to add additional sections to the file.
  * Bump docker/docker module version to fix issues with cri-dockerd caused by recent releases of golang rejecting invalid host headers sent by the docker client.
  * Updated kine to v0.10.2
* K3s etcd-snapshot delete fail to delete local file when called with s3 flag [(#8145)](https://github.com/k3s-io/k3s/pull/8145)
* Fix for cluster-reset backup from s3 when etcd snapshots are disabled [(#8169)](https://github.com/k3s-io/k3s/pull/8169)
* Fixed the etcd retention to delete orphaned snapshots based on the date [(#8190)](https://github.com/k3s-io/k3s/pull/8190)
* Additional backports for 2023-08 release [(#8213)](https://github.com/k3s-io/k3s/pull/8213)
  * The version of `helm` used by the bundled helm controller's job image has been updated to v3.12.3
  * Bumped dynamiclistener to address an issue that could cause the apiserver/supervisor listener on 6443 to stop serving requests on etcd-only nodes.
  * The K3s external apiserver/supervisor listener on 6443 now sends a complete certificate chain in the TLS handshake.
* Move flannel to 0.22.2 [(#8223)](https://github.com/k3s-io/k3s/pull/8223)
* Update to v1.25.13 [(#8241)](https://github.com/k3s-io/k3s/pull/8241)
* Fix runc version bump [(#8246)](https://github.com/k3s-io/k3s/pull/8246)
* Add new CLI flag to enable TLS SAN CN filtering [(#8259)](https://github.com/k3s-io/k3s/pull/8259)
  * Added a new `--tls-san-security` option. This flag defaults to false, but can be set to true to disable automatically adding SANs to the server's TLS certificate to satisfy any hostname requested by a client.
* Add RWMutex to address controller [(#8275)](https://github.com/k3s-io/k3s/pull/8275)

## Embedded Component Versions
| Component | Version |
|---|---|
| Kubernetes | [v1.25.13](https://github.com/kubernetes/kubernetes/blob/master/CHANGELOG/CHANGELOG-1.25.md#v12513) |
| Kine | [v0.10.2](https://github.com/k3s-io/kine/releases/tag/v0.10.2) |
| SQLite | [3.42.0](https://sqlite.org/releaselog/3_42_0.html) |
| Etcd | [v3.5.3-k3s1](https://github.com/k3s-io/etcd/releases/tag/v3.5.3-k3s1) |
| Containerd | [v1.7.3-k3s1](https://github.com/k3s-io/containerd/releases/tag/v1.7.3-k3s1) |
| Runc | [v1.1.8](https://github.com/opencontainers/runc/releases/tag/v1.1.8) |
| Flannel | [v0.22.2](https://github.com/flannel-io/flannel/releases/tag/v0.22.2) | 
| Metrics-server | [v0.6.3](https://github.com/kubernetes-sigs/metrics-server/releases/tag/v0.6.3) |
| Traefik | [v2.9.10](https://github.com/traefik/traefik/releases/tag/v2.9.10) |
| CoreDNS | [v1.10.1](https://github.com/coredns/coredns/releases/tag/v1.10.1) | 
| Helm-controller | [v0.15.4](https://github.com/k3s-io/helm-controller/releases/tag/v0.15.4) |
| Local-path-provisioner | [v0.0.24](https://github.com/rancher/local-path-provisioner/releases/tag/v0.0.24) |

## Helpful Links
As always, we welcome and appreciate feedback from our community of users. Please feel free to:
- [Open issues here](https://github.com/rancher/k3s/issues/new/choose)
- [Join our Slack channel](https://slack.rancher.io/)
- [Check out our documentation](https://rancher.com/docs/k3s/latest/en/) for guidance on how to get started or to dive deep into K3s.
- [Read how you can contribute here](https://github.com/rancher/k3s/blob/master/CONTRIBUTING.md)
-----
# Release v1.25.12+k3s1
<!-- v1.25.12+k3s1 -->
This release updates Kubernetes to v1.25.12, and fixes a number of issues.    
​
For more details on what's new, see the [Kubernetes release notes](https://github.com/kubernetes/kubernetes/blob/master/CHANGELOG/CHANGELOG-1.25.md#changelog-since-v12511).
​
## Changes since v1.25.11+k3s1:
​
* Remove file_windows.go [(#7856)](https://github.com/k3s-io/k3s/pull/7856)
* Fix code spell check [(#7860)](https://github.com/k3s-io/k3s/pull/7860)
* Allow k3s to customize apiServerPort on helm-controller [(#7873)](https://github.com/k3s-io/k3s/pull/7873)
* Check if we are on ipv4, ipv6 or dualStack when doing tailscale [(#7883)](https://github.com/k3s-io/k3s/pull/7883)
* Support setting control server URL for Tailscale. [(#7894)](https://github.com/k3s-io/k3s/pull/7894)
* S3 and Startup tests [(#7886)](https://github.com/k3s-io/k3s/pull/7886)
* Fix rootless node password [(#7900)](https://github.com/k3s-io/k3s/pull/7900)
* Backports for 2023-07 release [(#7909)](https://github.com/k3s-io/k3s/pull/7909)
  * Resolved an issue that caused agents joined with kubeadm-style bootstrap tokens to fail to rejoin the cluster when their node object is deleted.
  * The `k3s certificate rotate-ca` command now supports the data-dir flag.
* Adding cli to custom klipper helm image [(#7915)](https://github.com/k3s-io/k3s/pull/7915)
  * The default helm-controller job image can now be overridden with the --helm-job-image CLI flag
* Generation of certs and keys for etcd gated if etcd is disabled [(#7945)](https://github.com/k3s-io/k3s/pull/7945)
* Don't use zgrep in `check-config` if apparmor profile is enforced [(#7954)](https://github.com/k3s-io/k3s/pull/7954)
* Fix image_scan.sh script and download trivy version (#7950) [(#7969)](https://github.com/k3s-io/k3s/pull/7969)
* Adjust default kubeconfig file permissions [(#7984)](https://github.com/k3s-io/k3s/pull/7984)
* Update to v1.25.12 [(#8021)](https://github.com/k3s-io/k3s/pull/8021)
​
## Embedded Component Versions
| Component | Version |
|---|---|
| Kubernetes | [v1.25.12](https://github.com/kubernetes/kubernetes/blob/master/CHANGELOG/CHANGELOG-1.25.md#v12512) |
| Kine | [v0.10.1](https://github.com/k3s-io/kine/releases/tag/v0.10.1) |
| SQLite | [3.39.2](https://sqlite.org/releaselog/3_39_2.html) |
| Etcd | [v3.5.3-k3s1](https://github.com/k3s-io/etcd/releases/tag/v3.5.3-k3s1) |
| Containerd | [v1.7.1-k3s1](https://github.com/k3s-io/containerd/releases/tag/v1.7.1-k3s1) |
| Runc | [v1.1.7](https://github.com/opencontainers/runc/releases/tag/v1.1.7) |
| Flannel | [v0.22.0](https://github.com/flannel-io/flannel/releases/tag/v0.22.0) | 
| Metrics-server | [v0.6.3](https://github.com/kubernetes-sigs/metrics-server/releases/tag/v0.6.3) |
| Traefik | [v2.9.10](https://github.com/traefik/traefik/releases/tag/v2.9.10) |
| CoreDNS | [v1.10.1](https://github.com/coredns/coredns/releases/tag/v1.10.1) | 
| Helm-controller | [v0.15.2](https://github.com/k3s-io/helm-controller/releases/tag/v0.15.2) |
| Local-path-provisioner | [v0.0.24](https://github.com/rancher/local-path-provisioner/releases/tag/v0.0.24) |
​
## Helpful Links
As always, we welcome and appreciate feedback from our community of users. Please feel free to:
- [Open issues here](https://github.com/rancher/k3s/issues/new/choose)
- [Join our Slack channel](https://slack.rancher.io/)
- [Check out our documentation](https://rancher.com/docs/k3s/latest/en/) for guidance on how to get started or to dive deep into K3s.
- [Read how you can contribute here](https://github.com/rancher/k3s/blob/master/CONTRIBUTING.md)
-----
# Release v1.25.11+k3s1
<!-- v1.25.11+k3s1 -->
This release updates Kubernetes to v1.25.11, and fixes a number of issues.

For more details on what's new, see the [Kubernetes release notes](https://github.com/kubernetes/kubernetes/blob/master/CHANGELOG/CHANGELOG-1.25.md#changelog-since-v12510).

## Changes since v1.25.10+k3s1:

* Update flannel version [(#7649)](https://github.com/k3s-io/k3s/pull/7649)
* Bump vagrant libvirt with fix for plugin installs [(#7659)](https://github.com/k3s-io/k3s/pull/7659)
* E2E Backports - June [(#7705)](https://github.com/k3s-io/k3s/pull/7705)
  * Shortcircuit commands with version or help flags #7683
  * Add Rotation certification Check, remove func to restart agents #7097
  * E2E: Sudo for RunCmdOnNode #7686
* Add private registry e2e test [(#7722)](https://github.com/k3s-io/k3s/pull/7722)
* VPN integration [(#7728)](https://github.com/k3s-io/k3s/pull/7728)
* Fix spelling test [(#7752)](https://github.com/k3s-io/k3s/pull/7752)
* Remove unused libvirt config [(#7758)](https://github.com/k3s-io/k3s/pull/7758)
* Backport version bumps and bugfixes [(#7718)](https://github.com/k3s-io/k3s/pull/7718)
  * The bundled metrics-server has been bumped to v0.6.3, and now uses only secure TLS ciphers by default.
  * The `coredns-custom` ConfigMap now allows for `*.override` sections to be included in the `.:53` default server block.
  * The K3s core controllers (supervisor, deploy, and helm) no longer use the admin kubeconfig. This makes it easier to determine from access and audit logs which actions are performed by the system, and which are performed by an administrative user.
  * Bumped klipper-lb image to v0.4.4 to resolve an issue that prevented access to ServiceLB ports from localhost when the Service ExternalTrafficPolicy was set to Local.
  * Make LB image configurable when compiling k3s
  * K3s now allows nodes to join the cluster even if the node password secret cannot be created at the time the node joins. The secret create will be retried in the background. This resolves a potential deadlock created by fail-closed validating webhooks that block secret creation, where the webhook is unavailable until new nodes join the cluster to run the webhook pod.
  * The bundled containerd's aufs/devmapper/zfs snapshotter plugins have been restored. These were unintentionally omitted when moving containerd back into the k3s multicall binary in the previous release.
  * The embedded helm controller has been bumped to v0.15.0, and now supports creating the chart's target namespace if it does not exist.
* Add format command on Makefile [(#7763)](https://github.com/k3s-io/k3s/pull/7763)
* Fix logging and cleanup in Tailscale [(#7784)](https://github.com/k3s-io/k3s/pull/7784)
* Update Kubernetes to v1.25.11 [(#7788)](https://github.com/k3s-io/k3s/pull/7788)
* Path normalization affecting kubectl proxy conformance test for /api endpoint [(#7818)](https://github.com/k3s-io/k3s/pull/7818)

## Embedded Component Versions
| Component | Version |
|---|---|
| Kubernetes | [v1.25.11](https://github.com/kubernetes/kubernetes/blob/master/CHANGELOG/CHANGELOG-1.25.md#v12511) |
| Kine | [v0.10.1](https://github.com/k3s-io/kine/releases/tag/v0.10.1) |
| SQLite | [3.39.2](https://sqlite.org/releaselog/3_39_2.html) |
| Etcd | [v3.5.3-k3s1](https://github.com/k3s-io/etcd/releases/tag/v3.5.3-k3s1) |
| Containerd | [v1.7.1-k3s1](https://github.com/k3s-io/containerd/releases/tag/v1.7.1-k3s1) |
| Runc | [v1.1.7](https://github.com/opencontainers/runc/releases/tag/v1.1.7) |
| Flannel | [v0.22.0](https://github.com/flannel-io/flannel/releases/tag/v0.22.0) | 
| Metrics-server | [v0.6.3](https://github.com/kubernetes-sigs/metrics-server/releases/tag/v0.6.3) |
| Traefik | [v2.9.10](https://github.com/traefik/traefik/releases/tag/v2.9.10) |
| CoreDNS | [v1.10.1](https://github.com/coredns/coredns/releases/tag/v1.10.1) | 
| Helm-controller | [v0.15.0](https://github.com/k3s-io/helm-controller/releases/tag/v0.15.0) |
| Local-path-provisioner | [v0.0.24](https://github.com/rancher/local-path-provisioner/releases/tag/v0.0.24) |

## Helpful Links
As always, we welcome and appreciate feedback from our community of users. Please feel free to:
- [Open issues here](https://github.com/rancher/k3s/issues/new/choose)
- [Join our Slack channel](https://slack.rancher.io/)
- [Check out our documentation](https://rancher.com/docs/k3s/latest/en/) for guidance on how to get started or to dive deep into K3s.
- [Read how you can contribute here](https://github.com/rancher/k3s/blob/master/CONTRIBUTING.md)
-----
# Release v1.25.10+k3s1
<!-- v1.25.10+k3s1 -->
This release updates Kubernetes to v1.25.10, and fixes a number of issues.

For more details on what's new, see the [Kubernetes release notes](https://github.com/kubernetes/kubernetes/blob/master/CHANGELOG/CHANGELOG-1.25.md#changelog-since-v1259).

## Changes since v1.25.9+k3s1:

* Ensure that klog verbosity is set to the same level as logrus [(#7361)](https://github.com/k3s-io/k3s/pull/7361)
* Add E2E testing in Drone [(#7375)](https://github.com/k3s-io/k3s/pull/7375)
* Add integration tests for etc-snapshot server flags #7377 [(#7378)](https://github.com/k3s-io/k3s/pull/7378)
* CLI + Config Enhancement [(#7404)](https://github.com/k3s-io/k3s/pull/7404)
  * `--Tls-sans` now accepts multiple arguments: `--tls-sans="foo,bar"`
  * `Prefer-bundled-bin: true` now works properly when set in `config.yaml.d` files
* Migrate netutil methods into /utils/net.go [(#7433)](https://github.com/k3s-io/k3s/pull/7433)
* Bump Runc + Containerd + Docker for CVE fixes [(#7452)](https://github.com/k3s-io/k3s/pull/7452)
* Bump kube-router version to fix a bug when a port name is used [(#7461)](https://github.com/k3s-io/k3s/pull/7461)
* Kube flags and longhorn storage tests 1.25 [(#7466)](https://github.com/k3s-io/k3s/pull/7466)
* Local-storage: Fix permission [(#7473)](https://github.com/k3s-io/k3s/pull/7473)
* Backport version bumps and bugfixes [(#7515)](https://github.com/k3s-io/k3s/pull/7515)
  * K3s now retries the cluster join operation when receiving a "too many learners" error from etcd. This most frequently occurred when attempting to add multiple servers at the same time.
  * K3s once again supports aarch64 nodes with page size > 4k
  * The packaged Traefik version has been bumped to v2.9.10 / chart 21.2.0
  * K3s now prints a more meaningful error when attempting to run from a filesystem mounted `noexec`.
  * K3s now exits with a proper error message when the server token uses a bootstrap token `id.secret` format.
  * Fixed an issue where Addon, HelmChart, and HelmChartConfig CRDs were created without structural schema, allowing the creation of custom resources of these types with invalid content.
  * Servers started with the (experimental) --disable-agent flag no longer attempt to run the tunnel authorizer agent component.
  * Fixed an regression that prevented the pod and cluster egress-selector modes from working properly.
  * K3s now correctly passes through etcd-args to the temporary etcd that is used to extract cluster bootstrap data when restarting managed etcd nodes.
  * K3s now properly handles errors obtaining the current etcd cluster member list when a new server is joining the managed etcd cluster.
  * The embedded kine version has been bumped to v0.10.1. This replaces the legacy `lib/pq` postgres driver with `pgx`.
  * The bundled CNI plugins have been upgraded to v1.2.0-k3s1. The bandwidth and firewall plugins are now included in the bundle.
  * The embedded Helm controller now supports authenticating to chart repositories via credentials stored in a Secret, as well as passing repo CAs via ConfigMap.
* Bump containerd/runc to v1.7.1-k3s1/v1.1.7 [(#7535)](https://github.com/k3s-io/k3s/pull/7535)
  * The bundled containerd and runc versions have been bumped to v1.7.1-k3s1/v1.1.7
* Wrap error stating that it is coming from netpol [(#7548)](https://github.com/k3s-io/k3s/pull/7548)
* Add '-all' flag to apply to inactive units [(#7574)](https://github.com/k3s-io/k3s/pull/7574)
* Update to v1.25.10-k3s1 [(#7582)](https://github.com/k3s-io/k3s/pull/7582)

## Embedded Component Versions
| Component | Version |
|---|---|
| Kubernetes | [v1.25.10](https://github.com/kubernetes/kubernetes/blob/master/CHANGELOG/CHANGELOG-1.25.md#v12510) |
| Kine | [v0.10.1](https://github.com/k3s-io/kine/releases/tag/v0.10.1) |
| SQLite | [3.39.2](https://sqlite.org/releaselog/3_39_2.html) |
| Etcd | [v3.5.3-k3s1](https://github.com/k3s-io/etcd/releases/tag/v3.5.3-k3s1) |
| Containerd | [v1.7.1-k3s1](https://github.com/k3s-io/containerd/releases/tag/v1.7.1-k3s1) |
| Runc | [v1.1.7](https://github.com/opencontainers/runc/releases/tag/v1.1.7) |
| Flannel | [v0.21.4](https://github.com/flannel-io/flannel/releases/tag/v0.21.4) | 
| Metrics-server | [v0.6.2](https://github.com/kubernetes-sigs/metrics-server/releases/tag/v0.6.2) |
| Traefik | [v2.9.10](https://github.com/traefik/traefik/releases/tag/v2.9.10) |
| CoreDNS | [v1.10.1](https://github.com/coredns/coredns/releases/tag/v1.10.1) | 
| Helm-controller | [v0.14.0](https://github.com/k3s-io/helm-controller/releases/tag/v0.14.0) |
| Local-path-provisioner | [v0.0.24](https://github.com/rancher/local-path-provisioner/releases/tag/v0.0.24) |

## Helpful Links
As always, we welcome and appreciate feedback from our community of users. Please feel free to:
- [Open issues here](https://github.com/rancher/k3s/issues/new/choose)
- [Join our Slack channel](https://slack.rancher.io/)
- [Check out our documentation](https://rancher.com/docs/k3s/latest/en/) for guidance on how to get started or to dive deep into K3s.
- [Read how you can contribute here](https://github.com/rancher/k3s/blob/master/CONTRIBUTING.md)

-----
# Release v1.25.9+k3s1
<!-- v1.25.9+k3s1 -->
This release updates Kubernetes to v1.25.9, and fixes a number of issues.

For more details on what's new, see the [Kubernetes release notes](https://github.com/kubernetes/kubernetes/blob/master/CHANGELOG/CHANGELOG-1.25.md#changelog-since-v1258).

## Changes since v1.25.8+k3s1:

* Enhance `check-config` [(#7164)](https://github.com/k3s-io/k3s/pull/7164)
* Remove deprecated nodeSelector label beta.kubernetes.io/os (#6970) [(#7121)](https://github.com/k3s-io/k3s/pull/7121)
* Backport version bumps and bugfixes [(#7228)](https://github.com/k3s-io/k3s/pull/7228)
  * The bundled local-path-provisioner version has been bumped to v0.0.24
  * The bundled runc version has been bumped to v1.1.5
  * The bundled coredns version has been bumped to v1.10.1
  * When using an external datastore, K3s now locks the bootstrap key while creating initial cluster bootstrap data, preventing a race condition when multiple servers attempted to initialize the cluster simultaneously.
  * The client load-balancer that maintains connections to active server nodes now closes connections to servers when they are removed from the cluster. This ensures that agent components immediately reconnect to a current cluster member.
  * Fixed a race condition during cluster reset that could cause the operation to hang and time out.
* Updated kube-router to move the default ACCEPT rule at the end of the chain [(#7221)](https://github.com/k3s-io/k3s/pull/7221)
  * The embedded kube-router controller has been updated to fix a regression that caused traffic from pods to be blocked by any default drop/deny rules present on the host. Users should still confirm that any externally-managed firewall rules explicitly allow traffic to/from pod and service networks, but this returns the old behavior that was relied upon by some users.
* Update klipper lb and helm-controller [(#7240)](https://github.com/k3s-io/k3s/pull/7240)
* Update Kube-router ACCEPT rule insertion and install script to clean rules before start [(#7276)](https://github.com/k3s-io/k3s/pull/7276)
  * The embedded kube-router controller has been updated to fix a regression that caused traffic from pods to be blocked by any default drop/deny rules present on the host. Users should still confirm that any externally-managed firewall rules explicitly allow traffic to/from pod and service networks, but this returns the old behavior that was relied upon by some users.
* Update to v1.25.9-k3s1 [(#7283)](https://github.com/k3s-io/k3s/pull/7283)

## Embedded Component Versions
| Component | Version |
|---|---|
| Kubernetes | [v1.25.9](https://github.com/kubernetes/kubernetes/blob/master/CHANGELOG/CHANGELOG-1.25.md#v1259) |
| Kine | [v0.9.9](https://github.com/k3s-io/kine/releases/tag/v0.9.9) |
| SQLite | [3.39.2](https://sqlite.org/releaselog/3_39_2.html) |
| Etcd | [v3.5.3-k3s1](https://github.com/k3s-io/etcd/releases/tag/v3.5.3-k3s1) |
| Containerd | [v1.6.19-k3s1](https://github.com/k3s-io/containerd/releases/tag/v1.6.19-k3s1) |
| Runc | [v1.1.5](https://github.com/opencontainers/runc/releases/tag/v1.1.5) |
| Flannel | [v0.21.4](https://github.com/flannel-io/flannel/releases/tag/v0.21.4) | 
| Metrics-server | [v0.6.2](https://github.com/kubernetes-sigs/metrics-server/releases/tag/v0.6.2) |
| Traefik | [v2.9.4](https://github.com/traefik/traefik/releases/tag/v2.9.4) |
| CoreDNS | [v1.10.1](https://github.com/coredns/coredns/releases/tag/v1.10.1) | 
| Helm-controller | [v0.13.3](https://github.com/k3s-io/helm-controller/releases/tag/v0.13.3) |
| Local-path-provisioner | [v0.0.24](https://github.com/rancher/local-path-provisioner/releases/tag/v0.0.24) |

## Helpful Links
As always, we welcome and appreciate feedback from our community of users. Please feel free to:
- [Open issues here](https://github.com/rancher/k3s/issues/new/choose)
- [Join our Slack channel](https://slack.rancher.io/)
- [Check out our documentation](https://rancher.com/docs/k3s/latest/en/) for guidance on how to get started or to dive deep into K3s.
- [Read how you can contribute here](https://github.com/rancher/k3s/blob/master/CONTRIBUTING.md)
-----
# Release v1.25.8+k3s1
<!-- v1.25.8+k3s1 -->
This release updates Kubernetes to v1.25.8, and fixes a number of issues.

For more details on what's new, see the [Kubernetes release notes](https://github.com/kubernetes/kubernetes/blob/master/CHANGELOG/CHANGELOG-1.25.md#changelog-since-v1257).

## Changes since v1.25.7+k3s1:

* Update flannel and kube-router [(#7061)](https://github.com/k3s-io/k3s/pull/7061)
* Bump various dependencies for CVEs [(#7043)](https://github.com/k3s-io/k3s/pull/7043)
* Enable dependabot [(#7045)](https://github.com/k3s-io/k3s/pull/7045)
* Wait for kubelet port to be ready before setting [(#7064)](https://github.com/k3s-io/k3s/pull/7064)
  * The agent tunnel authorizer now waits for the kubelet to be ready before reading the kubelet port from the node object.
* Adds a warning about editing to the containerd config.toml file [(#7075)](https://github.com/k3s-io/k3s/pull/7075)
* Improve support for rotating the default self-signed certs [(#7079)](https://github.com/k3s-io/k3s/pull/7079)
  * The `k3s certificate rotate-ca` checks now support rotating self-signed certificates without the `--force` option.
* Update to v1.25.8-k3s1 [(#7106)](https://github.com/k3s-io/k3s/pull/7106)
* Update flannel to fix NAT issue with old iptables version [(#7138)](https://github.com/k3s-io/k3s/pull/7138)

## Embedded Component Versions
| Component | Version |
|---|---|
| Kubernetes | [v1.25.8](https://github.com/kubernetes/kubernetes/blob/master/CHANGELOG/CHANGELOG-1.25.md#v1258) |
| Kine | [v0.9.9](https://github.com/k3s-io/kine/releases/tag/v0.9.9) |
| SQLite | [3.39.2](https://sqlite.org/releaselog/3_39_2.html) |
| Etcd | [v3.5.3-k3s1](https://github.com/k3s-io/etcd/releases/tag/v3.5.3-k3s1) |
| Containerd | [v1.6.19-k3s1](https://github.com/k3s-io/containerd/releases/tag/v1.6.19-k3s1) |
| Runc | [v1.1.4](https://github.com/opencontainers/runc/releases/tag/v1.1.4) |
| Flannel | [v0.21.4](https://github.com/flannel-io/flannel/releases/tag/v0.21.4) | 
| Metrics-server | [v0.6.2](https://github.com/kubernetes-sigs/metrics-server/releases/tag/v0.6.2) |
| Traefik | [v2.9.4](https://github.com/traefik/traefik/releases/tag/v2.9.4) |
| CoreDNS | [v1.9.4](https://github.com/coredns/coredns/releases/tag/v1.9.4) | 
| Helm-controller | [v0.13.1](https://github.com/k3s-io/helm-controller/releases/tag/v0.13.1) |
| Local-path-provisioner | [v0.0.23](https://github.com/rancher/local-path-provisioner/releases/tag/v0.0.23) |

## Helpful Links
As always, we welcome and appreciate feedback from our community of users. Please feel free to:
- [Open issues here](https://github.com/rancher/k3s/issues/new/choose)
- [Join our Slack channel](https://slack.rancher.io/)
- [Check out our documentation](https://rancher.com/docs/k3s/latest/en/) for guidance on how to get started or to dive deep into K3s.
- [Read how you can contribute here](https://github.com/rancher/k3s/blob/master/CONTRIBUTING.md)
-----
# Release v1.25.7+k3s1
<!-- v1.25.7+k3s1 -->
This release updates Kubernetes to v1.25.7, and fixes a number of issues.

For more details on what's new, see the [Kubernetes release notes](https://github.com/kubernetes/kubernetes/blob/master/CHANGELOG/CHANGELOG-1.25.md#changelog-since-v1256).

## Changes since v1.25.6+k3s1:

* Add jitter to scheduled snapshots and retry harder on conflicts [(#6782)](https://github.com/k3s-io/k3s/pull/6782)
  * Scheduled etcd snapshots are now offset by a short random delay of up to several seconds. This should prevent multi-server clusters from executing pathological behavior when attempting to simultaneously update the snapshot list ConfigMap. The snapshot controller will also be more persistent in attempting to update the snapshot list.
* Bump cri-dockerd [(#6798)](https://github.com/k3s-io/k3s/pull/6798)
  * The embedded cri-dockerd has been updated to v0.3.1
* Bugfix: do not break cert-manager when pprof is enabled [(#6837)](https://github.com/k3s-io/k3s/pull/6837)
* Wait for cri-dockerd socket [(#6853)](https://github.com/k3s-io/k3s/pull/6853)
* Bump vagrant boxes to fedora37 [(#6858)](https://github.com/k3s-io/k3s/pull/6858)
* Fix cronjob example [(#6864)](https://github.com/k3s-io/k3s/pull/6864)
* Ensure flag type consistency [(#6867)](https://github.com/k3s-io/k3s/pull/6867)
* Consolidate E2E tests [(#6887)](https://github.com/k3s-io/k3s/pull/6887)
* Ignore value conflicts when reencrypting secrets [(#6919)](https://github.com/k3s-io/k3s/pull/6919)
* Use default address family when adding kubernetes service address to SAN list [(#6904)](https://github.com/k3s-io/k3s/pull/6904)
  * The apiserver advertised address and IP SAN entry are now set correctly on clusters that use IPv6 as the default IP family.
* Allow ServiceLB to honor `ExternalTrafficPolicy=Local` [(#6907)](https://github.com/k3s-io/k3s/pull/6907)
  * ServiceLB now honors the Service's ExternalTrafficPolicy. When set to Local, the LoadBalancer will only advertise addresses of Nodes with a Pod for the Service, and will not forward traffic to other cluster members.
* Fix issue with servicelb startup failure when validating webhooks block creation [(#6916)](https://github.com/k3s-io/k3s/pull/6916)
  * The embedded cloud controller manager will no longer attempt to unconditionally re-create its namespace and serviceaccount on startup. This resolves an issue that could cause a deadlocked cluster when fail-closed webhooks are in use.
* Backport user-provided CA cert and `kubeadm` bootstrap token support [(#6929)](https://github.com/k3s-io/k3s/pull/6929)
  * K3s now functions properly when the cluster CA certificates are signed by an existing root or intermediate CA. You can find a sample script for generating such certificates before K3s starts in the github repo at [contrib/util/certs.sh](https://github.com/k3s-io/k3s/blob/master/contrib/util/certs.sh).
  * K3s now supports `kubeadm` style join tokens. `k3s token create` now creates join token secrets, optionally with a limited TTL.
  * K3s agents joined with an expired or deleted token stay in the cluster using existing client certificates via the NodeAuthorization admission plugin, unless their Node object is deleted from the cluster.
* Fix access to hostNetwork port on NodeIP when egress-selector-mode=agent [(#6936)](https://github.com/k3s-io/k3s/pull/6936)
  * Fixed an issue that would cause the apiserver egress proxy to attempt to use the agent tunnel to connect to service endpoints even in agent or disabled mode.
* Updated flannel version to v0.21.1 [(#6915)](https://github.com/k3s-io/k3s/pull/6915)
* Allow for multiple sets of leader-elected controllers [(#6941)](https://github.com/k3s-io/k3s/pull/6941)
  * Fixed an issue where leader-elected controllers for managed etcd did not run on etcd-only nodes
* Fix etcd and ca-cert rotate issues [(#6954)](https://github.com/k3s-io/k3s/pull/6954)
* Fix ServiceLB dual-stack ingress IP listing [(#6987)](https://github.com/k3s-io/k3s/pull/6987)
  * Resolved an issue with ServiceLB that would cause it to advertise node IPv6 addresses, even if the cluster or service was not enabled for dual-stack operation.
* Bump kine to v0.9.9 [(#6975)](https://github.com/k3s-io/k3s/pull/6975)
  * The embedded kine version has been bumped to v0.9.9. Compaction log messages are now omitted at `info` level for increased visibility.
* Update to v1.25.7-k3s1 [(#7010)](https://github.com/k3s-io/k3s/pull/7010)

## Embedded Component Versions
| Component | Version |
|---|---|
| Kubernetes | [v1.25.7](https://github.com/kubernetes/kubernetes/blob/master/CHANGELOG/CHANGELOG-1.25.md#v1257) |
| Kine | [v0.9.9](https://github.com/k3s-io/kine/releases/tag/v0.9.9) |
| SQLite | [3.39.2](https://sqlite.org/releaselog/3_39_2.html) |
| Etcd | [v3.5.3-k3s1](https://github.com/k3s-io/etcd/releases/tag/v3.5.3-k3s1) |
| Containerd | [v1.6.15-k3s1](https://github.com/k3s-io/containerd/releases/tag/v1.6.15-k3s1) |
| Runc | [v1.1.4](https://github.com/opencontainers/runc/releases/tag/v1.1.4) |
| Flannel | [v0.21.1](https://github.com/flannel-io/flannel/releases/tag/v0.21.1) | 
| Metrics-server | [v0.6.2](https://github.com/kubernetes-sigs/metrics-server/releases/tag/v0.6.2) |
| Traefik | [v2.9.4](https://github.com/traefik/traefik/releases/tag/v2.9.4) |
| CoreDNS | [v1.9.4](https://github.com/coredns/coredns/releases/tag/v1.9.4) | 
| Helm-controller | [v0.13.1](https://github.com/k3s-io/helm-controller/releases/tag/v0.13.1) |
| Local-path-provisioner | [v0.0.23](https://github.com/rancher/local-path-provisioner/releases/tag/v0.0.23) |

## Helpful Links
As always, we welcome and appreciate feedback from our community of users. Please feel free to:
- [Open issues here](https://github.com/rancher/k3s/issues/new/choose)
- [Join our Slack channel](https://slack.rancher.io/)
- [Check out our documentation](https://rancher.com/docs/k3s/latest/en/) for guidance on how to get started or to dive deep into K3s.
- [Read how you can contribute here](https://github.com/rancher/k3s/blob/master/CONTRIBUTING.md)
-----
# Release v1.25.6+k3s1
<!-- v1.25.6+k3s1 -->
This release updates Kubernetes to v1.25.6, and fixes a number of issues.

For more details on what's new, see the [Kubernetes release notes](https://github.com/kubernetes/kubernetes/blob/master/CHANGELOG/CHANGELOG-1.25.md#changelog-since-v1255).

## Changes since v1.25.5+k3s2:

* Pass through default tls-cipher-suites [(#6730)](https://github.com/k3s-io/k3s/pull/6730)
  * The K3s default cipher suites are now explicitly passed in to kube-apiserver, ensuring that all listeners use these values.
* Bump containerd to v1.6.15-k3s1 [(#6735)](https://github.com/k3s-io/k3s/pull/6735)
  * The embedded containerd version has been bumped to v1.6.15-k3s1
* Bump action/download-artifact to v3 [(#6747)](https://github.com/k3s-io/k3s/pull/6747)
* Backport dependabot/updatecli updates [(#6761)](https://github.com/k3s-io/k3s/pull/6761)
* Fix Drone plugins/docker tag for 32 bit arm [(#6768)](https://github.com/k3s-io/k3s/pull/6768)
* Update to v1.25.6+k3s1 [(#6775)](https://github.com/k3s-io/k3s/pull/6775)

## Embedded Component Versions
| Component | Version |
|---|---|
| Kubernetes | [v1.25.6](https://github.com/kubernetes/kubernetes/blob/master/CHANGELOG/CHANGELOG-1.25.md#v1256) |
| Kine | [v0.9.6](https://github.com/k3s-io/kine/releases/tag/v0.9.6) |
| SQLite | [3.39.2](https://sqlite.org/releaselog/3_39_2.html) |
| Etcd | [v3.5.3-k3s1](https://github.com/k3s-io/etcd/releases/tag/v3.5.3-k3s1) |
| Containerd | [v1.6.15-k3s1](https://github.com/k3s-io/containerd/releases/tag/v1.6.15-k3s1) |
| Runc | [v1.1.4](https://github.com/opencontainers/runc/releases/tag/v1.1.4) |
| Flannel | [v0.20.2](https://github.com/flannel-io/flannel/releases/tag/v0.20.2) | 
| Metrics-server | [v0.6.2](https://github.com/kubernetes-sigs/metrics-server/releases/tag/v0.6.2) |
| Traefik | [v2.9.4](https://github.com/traefik/traefik/releases/tag/v2.9.4) |
| CoreDNS | [v1.9.4](https://github.com/coredns/coredns/releases/tag/v1.9.4) | 
| Helm-controller | [v0.13.1](https://github.com/k3s-io/helm-controller/releases/tag/v0.13.1) |
| Local-path-provisioner | [v0.0.23](https://github.com/rancher/local-path-provisioner/releases/tag/v0.0.23) |

## Helpful Links
As always, we welcome and appreciate feedback from our community of users. Please feel free to:
- [Open issues here](https://github.com/rancher/k3s/issues/new/choose)
- [Join our Slack channel](https://slack.rancher.io/)
- [Check out our documentation](https://rancher.com/docs/k3s/latest/en/) for guidance on how to get started or to dive deep into K3s.
- [Read how you can contribute here](https://github.com/rancher/k3s/blob/master/CONTRIBUTING.md)
-----
# Release v1.25.5+k3s2
<!-- v1.25.5+k3s2 -->

This release updates containerd to v1.6.14 to resolve an issue where pods would lose their CNI information when containerd was restarted.

## Changes since v1.25.5+k3s1:

* Bump containerd to v1.6.14-k3s1 [(#6694)](https://github.com/k3s-io/k3s/pull/6694)
  * The embedded containerd version has been bumped to v1.6.14-k3s1. This includes a backported fix for [containerd/7843](https://github.com/containerd/containerd/issues/7843) which caused pods to lose their CNI info when containerd was restarted, which in turn caused the kubelet to recreate the pod.

## Embedded Component Versions
| Component | Version |
|---|---|
| Kubernetes | [v1.25.5](https://github.com/kubernetes/kubernetes/blob/master/CHANGELOG/CHANGELOG-1.25.md#v1255) |
| Kine | [v0.9.6](https://github.com/k3s-io/kine/releases/tag/v0.9.6) |
| SQLite | [3.39.2](https://sqlite.org/releaselog/3_39_2.html) |
| Etcd | [v3.5.3-k3s1](https://github.com/k3s-io/etcd/releases/tag/v3.5.3-k3s1) |
| Containerd | [v1.6.14-k3s1](https://github.com/k3s-io/containerd/releases/tag/v1.6.14-k3s1) |
| Runc | [v1.1.4](https://github.com/opencontainers/runc/releases/tag/v1.1.4) |
| Flannel | [v0.20.2](https://github.com/flannel-io/flannel/releases/tag/v0.20.2) | 
| Metrics-server | [v0.6.2](https://github.com/kubernetes-sigs/metrics-server/releases/tag/v0.6.2) |
| Traefik | [v2.9.4](https://github.com/traefik/traefik/releases/tag/v2.9.4) |
| CoreDNS | [v1.9.4](https://github.com/coredns/coredns/releases/tag/v1.9.4) | 
| Helm-controller | [v0.13.1](https://github.com/k3s-io/helm-controller/releases/tag/v0.13.1) |
| Local-path-provisioner | [v0.0.23](https://github.com/rancher/local-path-provisioner/releases/tag/v0.0.23) |

## Helpful Links
As always, we welcome and appreciate feedback from our community of users. Please feel free to:
- [Open issues here](https://github.com/rancher/k3s/issues/new/choose)
- [Join our Slack channel](https://slack.rancher.io/)
- [Check out our documentation](https://rancher.com/docs/k3s/latest/en/) for guidance on how to get started or to dive deep into K3s.
- [Read how you can contribute here](https://github.com/rancher/k3s/blob/master/CONTRIBUTING.md)
-----
# Release v1.25.5+k3s1
<!-- v1.25.5+k3s1 -->

> ## ⚠️ WARNING
> This release is affected by https://github.com/containerd/containerd/issues/7843, which causes the kubelet to restart all pods whenever K3s is restarted. For this reason, we have removed this K3s release from the channel server. Please use `v1.25.5+k3s2` instead.

This release updates Kubernetes to v1.25.5, and fixes a number of issues.

**Breaking Change:** K3s no longer includes `swanctl` and `charon` binaries. If you are using the ipsec flannel backend, please ensure that the strongswan `swanctl` and `charon` packages are installed on your node before upgrading K3s to this release.

For more details on what's new, see the [Kubernetes release notes](https://github.com/kubernetes/kubernetes/blob/master/CHANGELOG/CHANGELOG-1.25.md#changelog-since-v1254).

## Changes since v1.25.4+k3s1:

* Fix log for flannelExternalIP use case [(#6531)](https://github.com/k3s-io/k3s/pull/6531)
* Fix Carolines github id [(#6464)](https://github.com/k3s-io/k3s/pull/6464)
* Github CI Updates [(#6522)](https://github.com/k3s-io/k3s/pull/6522)
* Add new `prefer-bundled-bin` experimental flag [(#6420)](https://github.com/k3s-io/k3s/pull/6420)
  * Added new prefer-bundled-bin flag which force K3s to use its bundle binaries over that of the host tools
* Bump containerd to v1.6.10 [(#6512)](https://github.com/k3s-io/k3s/pull/6512)
  * The embedded containerd version has been updated to v1.6.10-k3s1
* Stage the Traefik charts through k3s-charts [(#6519)](https://github.com/k3s-io/k3s/pull/6519)
* Make rootless settings configurable [(#6498)](https://github.com/k3s-io/k3s/pull/6498)
  * The rootless `port-driver`, `cidr`, `mtu`, `enable-ipv6`, and `disable-host-loopback` settings can now be configured via environment variables.
* Remove stuff which belongs in the windows executor implementation [(#6517)](https://github.com/k3s-io/k3s/pull/6517)
* Mark v1.25.4+k3s1 as stable [(#6534)](https://github.com/k3s-io/k3s/pull/6534)
* Add `prefer-bundled-bin` as an agent flag [(#6545)](https://github.com/k3s-io/k3s/pull/6545)
* Bump klipper-helm and klipper-lb versions [(#6549)](https://github.com/k3s-io/k3s/pull/6549)
  * The embedded Load-Balancer controller image has been bumped to klipper-lb:v0.4.0, which includes support for the [LoadBalancerSourceRanges](https://kubernetes.io/docs/reference/kubernetes-api/service-resources/service-v1/#:~:text=loadBalancerSourceRanges) field.
  * The embedded Helm controller image has been bumped to klipper-helm:v0.7.4-build20221121
* Switch from Google Buckets to AWS S3 Buckets [(#6497)](https://github.com/k3s-io/k3s/pull/6497)
* Fix passing AWS creds through Dapper [(#6567)](https://github.com/k3s-io/k3s/pull/6567)
* Fix artifact upload with `aws s3 cp` [(#6568)](https://github.com/k3s-io/k3s/pull/6568)
* Disable CCM metrics port when legacy CCM functionality is disabled [(#6572)](https://github.com/k3s-io/k3s/pull/6572)
  * The embedded cloud-controller-manager's metrics listener on port 10258 is now disabled when the `--disable-cloud-controller` flag is set.
* Sync packaged component Deployment config [(#6552)](https://github.com/k3s-io/k3s/pull/6552)
  * Deployments for K3s packaged components now have consistent upgrade strategy and revisionHistoryLimit settings, and will not override scaling decisions by hardcoding the replica count.
  * The packaged metrics-server has been bumped to v0.6.2
* Mark secrets-encryption flag as GA [(#6582)](https://github.com/k3s-io/k3s/pull/6582)
* Bump k3s root to v0.12.0 and remove strongswan binaries [(#6400)](https://github.com/k3s-io/k3s/pull/6400)
  * The embedded k3s-root version has been bumped to v0.12.0, based on buildroot 2022.08.1.
  * The embedded swanctl and charon binaries have been removed. If you are using the ipsec flannel backend, please ensure that the strongswan `swanctl` and `charon` packages are installed on your node before upgrading k3s.
* Update flannel to v0.20.2 [(#6588)](https://github.com/k3s-io/k3s/pull/6588)
* Add ADR for security bumps automation [(#6559)](https://github.com/k3s-io/k3s/pull/6559)
* Update node12->node16 based GH actions [(#6593)](https://github.com/k3s-io/k3s/pull/6593)
* Updating rel docs [(#6237)](https://github.com/k3s-io/k3s/pull/6237)
* Update install.sh to recommend current version of k3s-selinux [(#6453)](https://github.com/k3s-io/k3s/pull/6453)
* Update to v1.25.5-k3s1 [(#6622)](https://github.com/k3s-io/k3s/pull/6622)
* Bump containerd to v1.6.12-k3s1 [(#6631)](https://github.com/k3s-io/k3s/pull/6631)
  * The embedded containerd version has been bumped to v1.6.12
* Preload iptable_filter/ip6table_filter [(#6646)](https://github.com/k3s-io/k3s/pull/6646)

## Embedded Component Versions
| Component | Version |
|---|---|
| Kubernetes | [v1.25.5](https://github.com/kubernetes/kubernetes/blob/master/CHANGELOG/CHANGELOG-1.25.md#v1255) |
| Kine | [v0.9.6](https://github.com/k3s-io/kine/releases/tag/v0.9.6) |
| SQLite | [3.39.2](https://sqlite.org/releaselog/3_39_2.html) |
| Etcd | [v3.5.3-k3s1](https://github.com/k3s-io/etcd/releases/tag/v3.5.3-k3s1) |
| Containerd | [v1.6.12-k3s1](https://github.com/k3s-io/containerd/releases/tag/v1.6.12-k3s1) |
| Runc | [v1.1.4](https://github.com/opencontainers/runc/releases/tag/v1.1.4) |
| Flannel | [v0.20.2](https://github.com/flannel-io/flannel/releases/tag/v0.20.2) | 
| Metrics-server | [v0.6.2](https://github.com/kubernetes-sigs/metrics-server/releases/tag/v0.6.2) |
| Traefik | [v2.9.4](https://github.com/traefik/traefik/releases/tag/v2.9.4) |
| CoreDNS | [v1.9.4](https://github.com/coredns/coredns/releases/tag/v1.9.4) | 
| Helm-controller | [v0.13.1](https://github.com/k3s-io/helm-controller/releases/tag/v0.13.1) |
| Local-path-provisioner | [v0.0.23](https://github.com/rancher/local-path-provisioner/releases/tag/v0.0.23) |

## Helpful Links
As always, we welcome and appreciate feedback from our community of users. Please feel free to:
- [Open issues here](https://github.com/rancher/k3s/issues/new/choose)
- [Join our Slack channel](https://slack.rancher.io/)
- [Check out our documentation](https://rancher.com/docs/k3s/latest/en/) for guidance on how to get started or to dive deep into K3s.
- [Read how you can contribute here](https://github.com/rancher/k3s/blob/master/CONTRIBUTING.md)

-----
# Release v1.25.4+k3s1
<!-- v1.25.4+k3s1 -->
This release updates Kubernetes to v1.25.4, and fixes a number of issues.

For more details on what's new, see the [Kubernetes release notes](https://github.com/kubernetes/kubernetes/blob/master/CHANGELOG/CHANGELOG-1.25.md#changelog-since-v1253).

## Changes since v1.25.3+k3s1:

* Add the gateway parameter in netplan [(#6292)](https://github.com/k3s-io/k3s/pull/6292)
* Bumped dynamiclistener library to v0.3.5 [(#6300)](https://github.com/k3s-io/k3s/pull/6300)
* Update kube-router to v1.5.1 with extra logging [(#6345)](https://github.com/k3s-io/k3s/pull/6345)
* Update maintainers [(#6298)](https://github.com/k3s-io/k3s/pull/6298)
* Bump testing to opensuse Leap 15.4 [(#6337)](https://github.com/k3s-io/k3s/pull/6337)
* Update E2E docs with more info on ubuntu 22.04 [(#6316)](https://github.com/k3s-io/k3s/pull/6316)
* Netpol test for podSelector & ingress [(#6247)](https://github.com/k3s-io/k3s/pull/6247)
* Bump all alpine images to 3.16 [(#6334)](https://github.com/k3s-io/k3s/pull/6334)
* Bump kine to v0.9.6 / sqlite3 v3.39.2 ([CVE-2022-35737](https://nvd.nist.gov/vuln/detail/CVE-2022-35737)) [(#6317)](https://github.com/k3s-io/k3s/pull/6317)
* Add hardened cluster and upgrade tests [(#6320)](https://github.com/k3s-io/k3s/pull/6320)
* The bundled Traefik helm chart has been updated to v18.0.0 [(#6353)](https://github.com/k3s-io/k3s/pull/6353)
* Mark v1.25.3+k3s1 as stable [(#6338)](https://github.com/k3s-io/k3s/pull/6338)
* The embedded helm controller has been bumped to v0.13.0 [(#6294)](https://github.com/k3s-io/k3s/pull/6294)
* Fixed an issue that would prevent the deploy controller from handling manifests that include resource types that are no longer supported by the apiserver. [(#6295)](https://github.com/k3s-io/k3s/pull/6295)
* Replace fedora-coreos with fedora 36 for install tests [(#6315)](https://github.com/k3s-io/k3s/pull/6315)
* Convert containerd config.toml.tmpl Linux template to v2 syntax [(#6267)](https://github.com/k3s-io/k3s/pull/6267)
* Add test for node-external-ip config parameter [(#6359)](https://github.com/k3s-io/k3s/pull/6359)
* Use debugger-friendly compile settings if DEBUG is set [(#6147)](https://github.com/k3s-io/k3s/pull/6147)
* update e2e tests [(#6354)](https://github.com/k3s-io/k3s/pull/6354)
* Remove unused vagrant development scripts [(#6395)](https://github.com/k3s-io/k3s/pull/6395)
* The bundled Traefik has been updated to v2.9.4 /  helm chart v18.3.0 [(#6397)](https://github.com/k3s-io/k3s/pull/6397)
* None [(#6371)](https://github.com/k3s-io/k3s/pull/6371)
* Fix incorrect defer usage [(#6296)](https://github.com/k3s-io/k3s/pull/6296)
* Add snapshot restore e2e test [(#6396)](https://github.com/k3s-io/k3s/pull/6396)
* Fix sonobouy tests on v1.25 [(#6399)](https://github.com/k3s-io/k3s/pull/6399)
* Bump packaged component versions
 * The packaged traefik helm chart has been bumped to v19.0.0, enabling ingressClass support by default.
 * The packaged local-path-provisioner has been bumped to v0.0.23
 * The packaged coredns has been bumped to v1.9.4 [(#6408)](https://github.com/k3s-io/k3s/pull/6408)
* log kube-router version when starting netpol controller [(#6405)](https://github.com/k3s-io/k3s/pull/6405)
* Add Kairos to ADOPTERS [(#6417)](https://github.com/k3s-io/k3s/pull/6417)
* Update Flannel to 0.20.1 [(#6388)](https://github.com/k3s-io/k3s/pull/6388)
* Avoid wrong config for `flannel-external-ip` and add warning if unencrypted backend [(#6403)](https://github.com/k3s-io/k3s/pull/6403)
* Fix test-mods to allow for pinning version from k8s.io [(#6413)](https://github.com/k3s-io/k3s/pull/6413)
* Fix for metrics-server in the multi-cloud cluster env [(#6386)](https://github.com/k3s-io/k3s/pull/6386)
* K3s now indicates specifically which cluster-level configuration flags are out of sync when critical configuration differs between server nodes. [(#6409)](https://github.com/k3s-io/k3s/pull/6409)
* Convert test output  to JSON format [(#6410)](https://github.com/k3s-io/k3s/pull/6410)
* Pull traefik helm chart directly from GH [(#6468)](https://github.com/k3s-io/k3s/pull/6468)
* Nightly test fix [(#6475)](https://github.com/k3s-io/k3s/pull/6475)
* Update to v1.25.4 [(#6477)](https://github.com/k3s-io/k3s/pull/6477)
* Remove stuff which belongs in the windows executor implementation [(#6492)](https://github.com/k3s-io/k3s/pull/6492)
* The packaged traefik helm chart has been bumped to 19.0.4 [(#6494)](https://github.com/k3s-io/k3s/pull/6494)
* Move traefik chart repo again [(#6508)](https://github.com/k3s-io/k3s/pull/6508)

## Embedded Component Versions
| Component | Version |
|---|---|
| Kubernetes | [v1.25.4](https://github.com/kubernetes/kubernetes/blob/master/CHANGELOG/CHANGELOG-1.25.md#v1254) |
| Kine | [v0.9.6](https://github.com/k3s-io/kine/releases/tag/v0.9.6) |
| SQLite | [3.39.2](https://sqlite.org/releaselog/3_39_2.html) |
| Etcd | [v3.5.3-k3s1](https://github.com/k3s-io/etcd/releases/tag/v3.5.3-k3s1) |
| Containerd | [v1.6.8-k3s1](https://github.com/k3s-io/containerd/releases/tag/v1.6.8-k3s1) |
| Runc | [v1.1.4](https://github.com/opencontainers/runc/releases/tag/v1.1.4) |
| Flannel | [v0.20.1](https://github.com/flannel-io/flannel/releases/tag/v0.20.1) | 
| Metrics-server | [v0.6.1](https://github.com/kubernetes-sigs/metrics-server/releases/tag/v0.6.1) |
| Traefik | [v2.9.4](https://github.com/traefik/traefik/releases/tag/v2.9.4) |
| CoreDNS | [v1.9.4](https://github.com/coredns/coredns/releases/tag/v1.9.4) | 
| Helm-controller | [v0.13.0](https://github.com/k3s-io/helm-controller/releases/tag/v0.13.0) |
| Local-path-provisioner | [v0.0.23](https://github.com/rancher/local-path-provisioner/releases/tag/v0.0.23) |

## Helpful Links
As always, we welcome and appreciate feedback from our community of users. Please feel free to:
- [Open issues here](https://github.com/rancher/k3s/issues/new/choose)
- [Join our Slack channel](https://slack.rancher.io/)
- [Check out our documentation](https://rancher.com/docs/k3s/latest/en/) for guidance on how to get started or to dive deep into K3s.
- [Read how you can contribute here](https://github.com/rancher/k3s/blob/master/CONTRIBUTING.md)

-----
# Release v1.25.3+k3s1
<!-- v1.25.3+k3s1 -->
This release updates Kubernetes to v1.25.3, and fixes a number of issues.

For more details on what's new, see the [Kubernetes release notes](https://github.com/kubernetes/kubernetes/blob/master/CHANGELOG/CHANGELOG-1.25.md#changelog-since-v1252).

## Changes since v1.25.2+k3s1:

* E2E: Groundwork for PR runs [(#6131)](https://github.com/k3s-io/k3s/pull/6131)
* Fix flannel for deployments of nodes which do not belong to the same network and connect using their public IP [(#6180)](https://github.com/k3s-io/k3s/pull/6180)
* Mark v1.24.6+k3s1 as stable [(#6193)](https://github.com/k3s-io/k3s/pull/6193)
* Add cluster reset test [(#6161)](https://github.com/k3s-io/k3s/pull/6161)
* The embedded metrics-server version has been bumped to v0.6.1 [(#6151)](https://github.com/k3s-io/k3s/pull/6151)
* The ServiceLB (klipper-lb) service controller is now integrated into the K3s stub cloud controller manager. [(#6181)](https://github.com/k3s-io/k3s/pull/6181)
* Events recorded to the cluster by embedded controllers are now properly formatted in the service logs. [(#6203)](https://github.com/k3s-io/k3s/pull/6203)
* Fix `error dialing backend` errors in apiserver network proxy [(#6216)](https://github.com/k3s-io/k3s/pull/6216)
  * Fixed an issue with the apiserver network proxy that caused `kubectl exec` to occasionally fail with `error dialing backend: EOF`
  * Fixed an issue with the apiserver network proxy that caused `kubectl exec` and `kubectl logs` to fail when a custom kubelet port was used, and the custom port was blocked by firewall or security group rules.
* Fix the typo in the test [(#6183)](https://github.com/k3s-io/k3s/pull/6183)
* Use setup-go action to cache dependencies [(#6220)](https://github.com/k3s-io/k3s/pull/6220)
* Add journalctl logs to E2E tests [(#6224)](https://github.com/k3s-io/k3s/pull/6224)
* The embedded Traefik version has been bumped to v2.9.1 / chart 12.0.0 [(#6223)](https://github.com/k3s-io/k3s/pull/6223)
* Fix flakey etcd test [(#6232)](https://github.com/k3s-io/k3s/pull/6232)
* Replace deprecated ioutil package [(#6230)](https://github.com/k3s-io/k3s/pull/6230)
* Fix dualStack test [(#6245)](https://github.com/k3s-io/k3s/pull/6245)
* Add ServiceAccount for svclb pods [(#6253)](https://github.com/k3s-io/k3s/pull/6253)
* Update to v1.25.3-k3s1 [(#6269)](https://github.com/k3s-io/k3s/pull/6269)
* Return ProviderID in URI format [(#6284)](https://github.com/k3s-io/k3s/pull/6284)
* Corrected CCM RBAC to allow for removal of legacy service finalizer during upgrades. [(#6306)](https://github.com/k3s-io/k3s/pull/6306)
* Added a new --flannel-external-ip flag. [(#6321)](https://github.com/k3s-io/k3s/pull/6321)
  * When enabled, Flannel traffic will now use the nodes external IPs, instead of internal.
  * This is meant for use with distributed clusters that are not all on the same local network.

## Embedded Component Versions
| Component | Version |
|---|---|
| Kubernetes | [v1.25.3](https://github.com/kubernetes/kubernetes/blob/master/CHANGELOG/CHANGELOG-1.25.md#v1253) |
| Kine | [v0.9.3](https://github.com/k3s-io/kine/releases/tag/v0.9.3) |
| SQLite | [3.36.0](https://sqlite.org/releaselog/3_36_0.html) |
| Etcd | [v3.5.3-k3s1](https://github.com/k3s-io/etcd/releases/tag/v3.5.3-k3s1) |
| Containerd | [v1.6.8-k3s1](https://github.com/k3s-io/containerd/releases/tag/v1.6.8-k3s1) |
| Runc | [v1.1.4](https://github.com/opencontainers/runc/releases/tag/v1.1.4) |
| Flannel | [v0.19.2](https://github.com/flannel-io/flannel/releases/tag/v0.19.2) |
| Metrics-server | [v0.6.1](https://github.com/kubernetes-sigs/metrics-server/releases/tag/v0.6.1) |
| Traefik | [v2.9.1](https://github.com/traefik/traefik/releases/tag/v2.9.1) |
| CoreDNS | [v1.9.1](https://github.com/coredns/coredns/releases/tag/v1.9.1) |
| Helm-controller | [v0.12.3](https://github.com/k3s-io/helm-controller/releases/tag/v0.12.3) |
| Local-path-provisioner | [v0.0.21](https://github.com/rancher/local-path-provisioner/releases/tag/v0.0.21) |

## Helpful Links
As always, we welcome and appreciate feedback from our community of users. Please feel free to:
- [Open issues here](https://github.com/rancher/k3s/issues/new/choose)
- [Join our Slack channel](https://slack.rancher.io/)
- [Check out our documentation](https://rancher.com/docs/k3s/latest/en/) for guidance on how to get started or to dive deep into K3s.
- [Read how you can contribute here](https://github.com/rancher/k3s/blob/master/CONTRIBUTING.md)
-----
# Release v1.25.2+k3s1
<!-- v1.25.2+k3s1 -->
This release updates Kubernetes to v1.25.2, and fixes a number of issues.

For more details on what's new, see the [Kubernetes release notes](https://github.com/kubernetes/kubernetes/blob/master/CHANGELOG/CHANGELOG-1.25.md#changelog-since-v1250).

## Changes since v1.25.0+k3s1:

* Add k3s v1.25 to the release channel [(#6129)](https://github.com/k3s-io/k3s/pull/6129)
* Restore original INSTALL_K3S_SKIP_DOWNLOAD behavior [(#6130)](https://github.com/k3s-io/k3s/pull/6130)
* Add K3S Release Documentation [(#6135)](https://github.com/k3s-io/k3s/pull/6135)
* Update to v1.25.1 [(#6140)](https://github.com/k3s-io/k3s/pull/6140)
* Update to v1.25.2-k3s1 [(#6168)](https://github.com/k3s-io/k3s/pull/6168)

## Embedded Component Versions
| Component | Version |
|---|---|
| Kubernetes | [v1.25.2](https://github.com/kubernetes/kubernetes/blob/master/CHANGELOG/CHANGELOG-1.25.md#v1252) |
| Kine | [v0.9.3](https://github.com/k3s-io/kine/releases/tag/v0.9.3) |
| SQLite | [3.36.0](https://sqlite.org/releaselog/3_36_0.html) |
| Etcd | [v3.5.3-k3s1](https://github.com/k3s-io/etcd/releases/tag/v3.5.3-k3s1) |
| Containerd | [v1.6.8-k3s1](https://github.com/k3s-io/containerd/releases/tag/v1.6.8-k3s1) |
| Runc | [v1.1.4](https://github.com/opencontainers/runc/releases/tag/v1.1.4) |
| Flannel | [v0.19.2](https://github.com/flannel-io/flannel/releases/tag/v0.19.2) | 
| Metrics-server | [v0.5.2](https://github.com/kubernetes-sigs/metrics-server/releases/tag/v0.5.2) |
| Traefik | [v2.6.2](https://github.com/traefik/traefik/releases/tag/v2.6.2) |
| CoreDNS | [v1.9.1](https://github.com/coredns/coredns/releases/tag/v1.9.1) | 
| Helm-controller | [v0.12.3](https://github.com/k3s-io/helm-controller/releases/tag/v0.12.3) |
| Local-path-provisioner | [v0.0.21](https://github.com/rancher/local-path-provisioner/releases/tag/v0.0.21) |

## Helpful Links
As always, we welcome and appreciate feedback from our community of users. Please feel free to:
- [Open issues here](https://github.com/rancher/k3s/issues/new/choose)
- [Join our Slack channel](https://slack.rancher.io/)
- [Check out our documentation](https://rancher.com/docs/k3s/latest/en/) for guidance on how to get started or to dive deep into K3s.
- [Read how you can contribute here](https://github.com/rancher/k3s/blob/master/CONTRIBUTING.md)
-----
# Release v1.25.0+k3s1
<!-- v1.25.0+k3s1 -->
This release is K3S's first in the v1.25 line. This release updates Kubernetes to v1.25.0.

Before upgrading from earlier releases, be sure to read the Kubernetes [Urgent Upgrade Notes](https://github.com/kubernetes/kubernetes/blob/master/CHANGELOG/CHANGELOG-1.25.md#urgent-upgrade-notes).

**Important Note:** Kubernetes v1.25 removes the beta `PodSecurityPolicy` admission plugin. Please follow the [upstream documentation](https://kubernetes.io/docs/tasks/configure-pod-container/migrate-from-psp/) to migrate from PSP if using the built-in PodSecurity Admission Plugin, prior to upgrading to v1.25.0+k3s1.

## Changes since v1.24.4+k3s1:

* Update Kubernetes to v1.25.0 [(#6040)](https://github.com/k3s-io/k3s/pull/6040)
* Remove `--containerd` flag from windows kubelet args [(#6028)](https://github.com/k3s-io/k3s/pull/6028)
* E2E: Add support for CentOS 7 and Rocky 8 [(#6015)](https://github.com/k3s-io/k3s/pull/6015)
* Convert install tests to run PR build of k3s [(#6003)](https://github.com/k3s-io/k3s/pull/6003)
* CI: update Fedora 34 -> 35 [(#5996)](https://github.com/k3s-io/k3s/pull/5996)
* Fix dualStack test and change ipv6 network prefix [(#6023)](https://github.com/k3s-io/k3s/pull/6023)
* Fix e2e tests [(#6018)](https://github.com/k3s-io/k3s/pull/6018)
* Update README.md [(#6048)](https://github.com/k3s-io/k3s/pull/6048)
* Remove wireguard interfaces when deleting the cluster [(#6055)](https://github.com/k3s-io/k3s/pull/6055)
* Add validation check to confirm correct golang version for Kubernetes [(#6050)](https://github.com/k3s-io/k3s/pull/6050)
* Expand startup integration test [(#6030)](https://github.com/k3s-io/k3s/pull/6030)
* Update go.mod version to 1.19 [(#6049)](https://github.com/k3s-io/k3s/pull/6049)
* Usage of `--cluster-secret`, `--no-deploy`, and `--no-flannel` is no longer supported. Attempts to use these flags will cause fatal errors. See [the docs](https://k3s-io.github.io/docs/reference/server-config#deprecated-options) for their replacement. [(#6069)](https://github.com/k3s-io/k3s/pull/6069)
* Update Flannel version to fix older iptables version issue. [(#6090)](https://github.com/k3s-io/k3s/pull/6090)
* The bundled version of runc has been bumped to v1.1.4 [(#6071)](https://github.com/k3s-io/k3s/pull/6071)
* The embedded containerd version has been bumped to v1.6.8-k3s1 [(#6078)](https://github.com/k3s-io/k3s/pull/6078)
* Fix deprecation message [(#6112)](https://github.com/k3s-io/k3s/pull/6112)
* Added warning message for flannel backend additional options deprecation [(#6111)](https://github.com/k3s-io/k3s/pull/6111)

## Embedded Component Versions
| Component | Version |
|---|---|
| Kubernetes | [v1.25.0](https://github.com/kubernetes/kubernetes/blob/master/CHANGELOG/CHANGELOG-1.25.md#v1250) |
| Kine | [v0.9.3](https://github.com/k3s-io/kine/releases/tag/v0.9.3) |
| SQLite | [3.36.0](https://sqlite.org/releaselog/3_36_0.html) |
| Etcd | [v3.5.3-k3s1](https://github.com/k3s-io/etcd/releases/tag/v3.5.3-k3s1) |
| Containerd | [v1.5.13-k3s2](https://github.com/k3s-io/containerd/releases/tag/v1.5.13-k3s2) |
| Runc | [v1.1.3](https://github.com/opencontainers/runc/releases/tag/v1.1.3) |
| Flannel | [v0.19.1](https://github.com/flannel-io/flannel/releases/tag/v0.19.1) | 
| Metrics-server | [v0.5.2](https://github.com/kubernetes-sigs/metrics-server/releases/tag/v0.5.2) |
| Traefik | [v2.6.2](https://github.com/traefik/traefik/releases/tag/v2.6.2) |
| CoreDNS | [v1.9.1](https://github.com/coredns/coredns/releases/tag/v1.9.1) | 
| Helm-controller | [v0.12.3](https://github.com/k3s-io/helm-controller/releases/tag/v0.12.3) |
| Local-path-provisioner | [v0.0.21](https://github.com/rancher/local-path-provisioner/releases/tag/v0.0.21) |

## Helpful Links
As always, we welcome and appreciate feedback from our community of users. Please feel free to:
- [Open issues here](https://github.com/rancher/k3s/issues/new/choose)
- [Join our Slack channel](https://slack.rancher.io/)
- [Check out our documentation](https://rancher.com/docs/k3s/latest/en/) for guidance on how to get started or to dive deep into K3s.
- [Read how you can contribute here](https://github.com/rancher/k3s/blob/master/CONTRIBUTING.md)
-----
