# RKE
| Version | Date | US date | EU date |
| ------- | ---- | ------- | ------- |
| [v1.2.23](rke-v1.2.md#release-v1223) | Sep 21 2022 | 09/21/22 | 2022-09-21 |
| [v1.2.22](rke-v1.2.md#release-v1222) | Aug 17 2022 | 08/17/22 | 2022-08-17 |
| [v1.2.21](rke-v1.2.md#release-v1221) | Jun 15 2022 | 06/15/22 | 2022-06-15 |
| [v1.2.20](rke-v1.2.md#release-v1220) | Apr 29 2022 | 04/29/22 | 2022-04-29 |
| [v1.2.19](rke-v1.2.md#release-v1219) | Mar 30 2022 | 03/30/22 | 2022-03-30 |
| [v1.2.18](rke-v1.2.md#release-v1218) | Feb 08 2022 | 02/08/22 | 2022-02-08 |
| [v1.2.17](rke-v1.2.md#release-v1217) | Jan 24 2022 | 01/24/22 | 2022-01-24 |
| [v1.2.16](rke-v1.2.md#release-v1216) | Jan 05 2022 | 01/05/22 | 2022-01-05 |
| [v1.2.15](rke-v1.2.md#release-v1215) | Dec 17 2021 | 12/17/21 | 2021-12-17 |
| [v1.2.14](rke-v1.2.md#release-v1214) | Nov 03 2021 | 11/03/21 | 2021-11-03 |
| [v1.2.13](rke-v1.2.md#release-v1213) | Sep 17 2021 | 09/17/21 | 2021-09-17 |
| [v1.2.12](rke-v1.2.md#release-v1212) | Sep 01 2021 | 09/01/21 | 2021-09-01 |
| [v1.2.11](rke-v1.2.md#release-v1211) | Jul 28 2021 | 07/28/21 | 2021-07-28 |
| [v1.2.10](rke-v1.2.md#release-v1210) | Jul 26 2021 | 07/26/21 | 2021-07-26 |
| [v1.2.9](rke-v1.2.md#release-v129) | Jun 22 2021 | 06/22/21 | 2021-06-22 |
| [v1.2.8](rke-v1.2.md#release-v128) | May 03 2021 | 05/03/21 | 2021-05-03 |
| [v1.2.7](rke-v1.2.md#release-v127) | Mar 30 2021 | 03/30/21 | 2021-03-30 |
| [v1.2.6](rke-v1.2.md#release-v126) | Mar 02 2021 | 03/02/21 | 2021-03-02 |
| [v1.2.5](rke-v1.2.md#release-v125) | Jan 25 2021 | 01/25/21 | 2021-01-25 |
| [v1.2.4](rke-v1.2.md#release-v124) | Jan 07 2021 | 01/07/21 | 2021-01-07 |
| [v1.2.3](rke-v1.2.md#release-v123) | Nov 13 2020 | 11/13/20 | 2020-11-13 |
| [v1.2.2](rke-v1.2.md#release-v122) | Nov 09 2020 | 11/09/20 | 2020-11-09 |
| [v1.2.1](rke-v1.2.md#release-v121) | Oct 16 2020 | 10/16/20 | 2020-10-16 |
| [v1.2.0](rke-v1.2.md#release-v120) | Oct 05 2020 | 10/05/20 | 2020-10-05 |





| Version | Date | US date | EU date |
| ------- | ---- | ------- | ------- |
| [v1.3.24](rke-v1.3.md#release-v1324) | Sep 11 2023 | 09/11/23 | 2023-09-11 |
| [v1.3.23](rke-v1.3.md#release-v1323) | Aug 03 2023 | 08/03/23 | 2023-08-03 |
| [v1.3.22](rke-v1.3.md#release-v1322) | Jul 07 2023 | 07/07/23 | 2023-07-07 |
| [v1.3.21](rke-v1.3.md#release-v1321) | Jun 23 2023 | 06/23/23 | 2023-06-23 |
| [v1.3.20](rke-v1.3.md#release-v1320) | Apr 26 2023 | 04/26/23 | 2023-04-26 |
| [v1.3.19](rke-v1.3.md#release-v1319) | Mar 07 2023 | 03/07/23 | 2023-03-07 |
| [v1.3.18](rke-v1.3.md#release-v1318) | Jan 24 2023 | 01/24/23 | 2023-01-24 |
| [v1.3.17](rke-v1.3.md#release-v1317) | Nov 28 2022 | 11/28/22 | 2022-11-28 |
| [v1.3.16](rke-v1.3.md#release-v1316) | Nov 11 2022 | 11/11/22 | 2022-11-11 |
| [v1.3.15](rke-v1.3.md#release-v1315) | Sep 21 2022 | 09/21/22 | 2022-09-21 |
| [v1.3.14](rke-v1.3.md#release-v1314) | Aug 30 2022 | 08/30/22 | 2022-08-30 |
| [v1.3.13](rke-v1.3.md#release-v1313) | Aug 17 2022 | 08/17/22 | 2022-08-17 |
| [v1.3.12](rke-v1.3.md#release-v1312) | Jun 15 2022 | 06/15/22 | 2022-06-15 |
| [v1.3.11](rke-v1.3.md#release-v1311) | May 11 2022 | 05/11/22 | 2022-05-11 |
| [v1.3.10](rke-v1.3.md#release-v1310) | Apr 29 2022 | 04/29/22 | 2022-04-29 |
| [v1.3.9](rke-v1.3.md#release-v139) | Apr 04 2022 | 04/04/22 | 2022-04-04 |
| [v1.3.8](rke-v1.3.md#release-v138) | Mar 25 2022 | 03/25/22 | 2022-03-25 |
| [v1.3.7](rke-v1.3.md#release-v137) | Feb 08 2022 | 02/08/22 | 2022-02-08 |
| [v1.3.6](rke-v1.3.md#release-v136) | Jan 26 2022 | 01/26/22 | 2022-01-26 |
| [v1.3.5](rke-v1.3.md#release-v135) | Jan 24 2022 | 01/24/22 | 2022-01-24 |
| [v1.3.4](rke-v1.3.md#release-v134) | Jan 05 2022 | 01/05/22 | 2022-01-05 |
| [v1.3.3](rke-v1.3.md#release-v133) | Dec 17 2021 | 12/17/21 | 2021-12-17 |
| [v1.3.2](rke-v1.3.md#release-v132) | Nov 03 2021 | 11/03/21 | 2021-11-03 |
| [v1.3.1](rke-v1.3.md#release-v131) | Sep 17 2021 | 09/17/21 | 2021-09-17 |
| [v1.3.0](rke-v1.3.md#release-v130) | Aug 30 2021 | 08/30/21 | 2021-08-30 |





| Version | Date | US date | EU date |
| ------- | ---- | ------- | ------- |
| [v1.4.18](rke-v1.4.md#release-v1418) | May 13 2024 | 05/13/24 | 2024-05-13 |
| [v1.4.17](rke-v1.4.md#release-v1417) | Apr 10 2024 | 04/10/24 | 2024-04-10 |
| [v1.4.16](rke-v1.4.md#release-v1416) | Mar 07 2024 | 03/07/24 | 2024-03-07 |
| [v1.4.15](rke-v1.4.md#release-v1415) | Feb 27 2024 | 02/27/24 | 2024-02-27 |
| [v1.4.14](rke-v1.4.md#release-v1414) | Feb 13 2024 | 02/13/24 | 2024-02-13 |
| [v1.4.13](rke-v1.4.md#release-v1413) | Jan 22 2024 | 01/22/24 | 2024-01-22 |
| [v1.4.12](rke-v1.4.md#release-v1412) | Dec 19 2023 | 12/19/23 | 2023-12-19 |
| [v1.4.11](rke-v1.4.md#release-v1411) | Nov 15 2023 | 11/15/23 | 2023-11-15 |
| [v1.4.10](rke-v1.4.md#release-v1410) | Sep 19 2023 | 09/19/23 | 2023-09-19 |
| [v1.4.9](rke-v1.4.md#release-v149) | Sep 11 2023 | 09/11/23 | 2023-09-11 |
| [v1.4.8](rke-v1.4.md#release-v148) | Aug 03 2023 | 08/03/23 | 2023-08-03 |
| [v1.4.7](rke-v1.4.md#release-v147) | Jul 06 2023 | 07/06/23 | 2023-07-06 |
| [v1.4.6](rke-v1.4.md#release-v146) | Jun 23 2023 | 06/23/23 | 2023-06-23 |
| [v1.4.5](rke-v1.4.md#release-v145) | Apr 26 2023 | 04/26/23 | 2023-04-26 |
| [v1.4.4](rke-v1.4.md#release-v144) | Apr 07 2023 | 04/07/23 | 2023-04-07 |
| [v1.4.3](rke-v1.4.md#release-v143) | Mar 07 2023 | 03/07/23 | 2023-03-07 |
| [v1.4.2](rke-v1.4.md#release-v142) | Jan 24 2023 | 01/24/23 | 2023-01-24 |
| [v1.4.1](rke-v1.4.md#release-v141) | Nov 28 2022 | 11/28/22 | 2022-11-28 |
| [v1.4.0](rke-v1.4.md#release-v140) | Nov 11 2022 | 11/11/22 | 2022-11-11 |





| Version | Date | US date | EU date |
| ------- | ---- | ------- | ------- |
| [v1.5.9](rke-v1.5.md#release-v159) | May 13 2024 | 05/13/24 | 2024-05-13 |
| [v1.5.8](rke-v1.5.md#release-v158) | Apr 10 2024 | 04/10/24 | 2024-04-10 |
| [v1.5.7](rke-v1.5.md#release-v157) | Mar 27 2024 | 03/27/24 | 2024-03-27 |
| [v1.5.6](rke-v1.5.md#release-v156) | Mar 07 2024 | 03/07/24 | 2024-03-07 |
| [v1.5.5](rke-v1.5.md#release-v155) | Feb 13 2024 | 02/13/24 | 2024-02-13 |
| [v1.5.3](rke-v1.5.md#release-v153) | Jan 22 2024 | 01/22/24 | 2024-01-22 |
| [v1.5.2](rke-v1.5.md#release-v152) | Jan 17 2024 | 01/17/24 | 2024-01-17 |
| [v1.5.1](rke-v1.5.md#release-v151) | Dec 19 2023 | 12/19/23 | 2023-12-19 |
| [v1.5.0](rke-v1.5.md#release-v150) | Dec 01 2023 | 12/01/23 | 2023-12-01 |





| Version | Date | US date | EU date |
| ------- | ---- | ------- | ------- |





| Version | Date | US date | EU date |
| ------- | ---- | ------- | ------- |





# Rancher
| Version | Date | US date | EU date |
| ------- | ---- | ------- | ------- |
| [v2.5.17](rancher-v2.5.md#release-v2517) | Jan 24 2023 | 01/24/23 | 2023-01-24 |
| [v2.5.16](rancher-v2.5.md#release-v2516) | Aug 18 2022 | 08/18/22 | 2022-08-18 |
| [v2.5.15](rancher-v2.5.md#release-v2515) | Jun 30 2022 | 06/30/22 | 2022-06-30 |
| [v2.5.14](rancher-v2.5.md#release-v2514) | May 24 2022 | 05/24/22 | 2022-05-24 |
| [v2.5.13](rancher-v2.5.md#release-v2513) | Apr 15 2022 | 04/15/22 | 2022-04-15 |
| [v2.5.12-patch1](rancher-v2.5.md#release-v2512-patch1) | Mar 14 2022 | 03/14/22 | 2022-03-14 |
| [v2.5.12-debug1](rancher-v2.5.md#release-v2512-debug1) | Feb 11 2022 | 02/11/22 | 2022-02-11 |
| [v2.5.12](rancher-v2.5.md#release-v2512) | Jan 25 2022 | 01/25/22 | 2022-01-25 |
| [v2.5.11-patch1](rancher-v2.5.md#release-v2511-patch1) | Nov 22 2021 | 11/22/21 | 2021-11-22 |
| [v2.5.11](rancher-v2.5.md#release-v2511) | Nov 03 2021 | 11/03/21 | 2021-11-03 |
| [v2.5.10](rancher-v2.5.md#release-v2510) | Oct 14 2021 | 10/14/21 | 2021-10-14 |
| [v2.5.9](rancher-v2.5.md#release-v259) | Jul 15 2021 | 07/15/21 | 2021-07-15 |
| [v2.5.8-patch1](rancher-v2.5.md#release-v258-patch1) | May 26 2021 | 05/26/21 | 2021-05-26 |
| [v2.5.8](rancher-v2.5.md#release-v258) | May 06 2021 | 05/06/21 | 2021-05-06 |
| [v2.5.7-patch1](rancher-v2.5.md#release-v257-patch1) | May 05 2021 | 05/05/21 | 2021-05-05 |
| [v2.5.7](rancher-v2.5.md#release-v257) | Mar 13 2021 | 03/13/21 | 2021-03-13 |
| [v2.5.6](rancher-v2.5.md#release-v256) | Mar 04 2021 | 03/04/21 | 2021-03-04 |
| [v2.5.5](rancher-v2.5.md#release-v255) | Jan 09 2021 | 01/09/21 | 2021-01-09 |
| [v2.5.4](rancher-v2.5.md#release-v254) | Jan 07 2021 | 01/07/21 | 2021-01-07 |
| [v2.5.3](rancher-v2.5.md#release-v253) | Nov 30 2020 | 11/30/20 | 2020-11-30 |
| [v2.5.2](rancher-v2.5.md#release-v252) | Nov 10 2020 | 11/10/20 | 2020-11-10 |
| [v2.5.1](rancher-v2.5.md#release-v251) | Oct 08 2020 | 10/08/20 | 2020-10-08 |
| [v2.5.0](rancher-v2.5.md#release-v250) | Oct 06 2020 | 10/06/20 | 2020-10-06 |





| Version | Date | US date | EU date |
| ------- | ---- | ------- | ------- |
| [v2.6.14](rancher-v2.6.md#release-v2614) | Feb 08 2024 | 02/08/24 | 2024-02-08 |
| [v2.6.13](rancher-v2.6.md#release-v2613) | May 31 2023 | 05/31/23 | 2023-05-31 |
| [v2.6.12](rancher-v2.6.md#release-v2612) | Apr 27 2023 | 04/27/23 | 2023-04-27 |
| [v2.6.11](rancher-v2.6.md#release-v2611) | Mar 08 2023 | 03/08/23 | 2023-03-08 |
| [v2.6.10](rancher-v2.6.md#release-v2610) | Jan 24 2023 | 01/24/23 | 2023-01-24 |
| [v2.6.9](rancher-v2.6.md#release-v269) | Oct 18 2022 | 10/18/22 | 2022-10-18 |
| [v2.6.8](rancher-v2.6.md#release-v268) | Aug 30 2022 | 08/30/22 | 2022-08-30 |
| [v2.6.7](rancher-v2.6.md#release-v267) | Aug 19 2022 | 08/19/22 | 2022-08-19 |
| [v2.6.6](rancher-v2.6.md#release-v266) | Jun 30 2022 | 06/30/22 | 2022-06-30 |
| [v2.6.5](rancher-v2.6.md#release-v265) | May 12 2022 | 05/12/22 | 2022-05-12 |
| [v2.6.4](rancher-v2.6.md#release-v264) | Mar 31 2022 | 03/31/22 | 2022-03-31 |
| [v2.6.3-patch2](rancher-v2.6.md#release-v263-patch2) | Mar 16 2022 | 03/16/22 | 2022-03-16 |
| [v2.6.3-patch1](rancher-v2.6.md#release-v263-patch1) | Jan 28 2022 | 01/28/22 | 2022-01-28 |
| [v2.6.3](rancher-v2.6.md#release-v263) | Dec 21 2021 | 12/21/21 | 2021-12-21 |
| [v2.6.2](rancher-v2.6.md#release-v262) | Oct 20 2021 | 10/20/21 | 2021-10-20 |
| [v2.6.1](rancher-v2.6.md#release-v261) | Oct 11 2021 | 10/11/21 | 2021-10-11 |
| [v2.6.0](rancher-v2.6.md#release-v260) | Aug 31 2021 | 08/31/21 | 2021-08-31 |





| Version | Date | US date | EU date |
| ------- | ---- | ------- | ------- |
| [v2.7.12](rancher-v2.7.md#release-v2712) | Mar 28 2024 | 03/28/24 | 2024-03-28 |
| [v2.7.11](rancher-v2.7.md#release-v2711) | Mar 01 2024 | 03/01/24 | 2024-03-01 |
| [v2.7.10](rancher-v2.7.md#release-v2710) | Feb 08 2024 | 02/08/24 | 2024-02-08 |
| [v2.7.9](rancher-v2.7.md#release-v279) | Oct 26 2023 | 10/26/23 | 2023-10-26 |
| [v2.7.8](rancher-v2.7.md#release-v278) | Oct 05 2023 | 10/05/23 | 2023-10-05 |
| [v2.7.7](rancher-v2.7.md#release-v277) | Sep 28 2023 | 09/28/23 | 2023-09-28 |
| [v2.7.6](rancher-v2.7.md#release-v276) | Aug 30 2023 | 08/30/23 | 2023-08-30 |
| [v2.7.5](rancher-v2.7.md#release-v275) | Jun 29 2023 | 06/29/23 | 2023-06-29 |
| [v2.7.4](rancher-v2.7.md#release-v274) | May 31 2023 | 05/31/23 | 2023-05-31 |
| [v2.7.3](rancher-v2.7.md#release-v273) | Apr 24 2023 | 04/24/23 | 2023-04-24 |
| [v2.7.2](rancher-v2.7.md#release-v272) | Apr 12 2023 | 04/12/23 | 2023-04-12 |
| [v2.7.1](rancher-v2.7.md#release-v271) | Jan 24 2023 | 01/24/23 | 2023-01-24 |
| [v2.7.0](rancher-v2.7.md#release-v270) | Nov 16 2022 | 11/16/22 | 2022-11-16 |





| Version | Date | US date | EU date |
| ------- | ---- | ------- | ------- |
| [v2.8.4](rancher-v2.8.md#release-v284) | May 16 2024 | 05/16/24 | 2024-05-16 |
| [v2.8.3](rancher-v2.8.md#release-v283) | Mar 28 2024 | 03/28/24 | 2024-03-28 |
| [v2.8.2](rancher-v2.8.md#release-v282) | Feb 08 2024 | 02/08/24 | 2024-02-08 |
| [v2.8.1](rancher-v2.8.md#release-v281) | Jan 22 2024 | 01/22/24 | 2024-01-22 |
| [v2.8.0](rancher-v2.8.md#release-v280) | Dec 06 2023 | 12/06/23 | 2023-12-06 |





| Version | Date | US date | EU date |
| ------- | ---- | ------- | ------- |





| Version | Date | US date | EU date |
| ------- | ---- | ------- | ------- |





# RKE2
| Version | Release date | US date | EU date | Upstream release date | US date | EU date | Days since upstream |
| ----- | ----- | ----- | ----- | ----- | ----- | ----- | ----- |
| [v1.20.15+rke2r2](rke2-v1.20.md#release-v12015rke2r2) | Feb 23 2022 | 02/23/22 | 2022-02-23 | Jan 19 2022 | 01/19/22 | 2022-01-19 | 35 days |
| [v1.20.15+rke2r1](rke2-v1.20.md#release-v12015rke2r1) | Jan 26 2022 | 01/26/22 | 2022-01-26 | Jan 19 2022 | 01/19/22 | 2022-01-19 | 7 days |
| [v1.20.14+rke2r2](rke2-v1.20.md#release-v12014rke2r2) | Jan 11 2022 | 01/11/22 | 2022-01-11 | Dec 15 2021 | 12/15/21 | 2021-12-15 | 27 days |
| [v1.20.14+rke2r1](rke2-v1.20.md#release-v12014rke2r1) | Dec 23 2021 | 12/23/21 | 2021-12-23 | Dec 15 2021 | 12/15/21 | 2021-12-15 | 8 days |
| [v1.20.13+rke2r1](rke2-v1.20.md#release-v12013rke2r1) | Dec 02 2021 | 12/02/21 | 2021-12-02 | Nov 17 2021 | 11/17/21 | 2021-11-17 | 15 days |
| [v1.20.12+rke2r1](rke2-v1.20.md#release-v12012rke2r1) | Oct 30 2021 | 10/30/21 | 2021-10-30 | Oct 28 2021 | 10/28/21 | 2021-10-28 | 2 days |
| [v1.20.11+rke2r2](rke2-v1.20.md#release-v12011rke2r2) | Oct 07 2021 | 10/07/21 | 2021-10-07 | Sep 15 2021 | 09/15/21 | 2021-09-15 | 22 days |
| [v1.20.11+rke2r1](rke2-v1.20.md#release-v12011rke2r1) | Sep 23 2021 | 09/23/21 | 2021-09-23 | Sep 15 2021 | 09/15/21 | 2021-09-15 | 8 days |
| [v1.20.10+rke2r1](rke2-v1.20.md#release-v12010rke2r1) | Aug 26 2021 | 08/26/21 | 2021-08-26 | Aug 11 2021 | 08/11/21 | 2021-08-11 | 15 days |
| [v1.20.9+rke2r2](rke2-v1.20.md#release-v1209rke2r2) | Aug 09 2021 | 08/09/21 | 2021-08-09 | Jul 15 2021 | 07/15/21 | 2021-07-15 | 25 days |
| [v1.20.8+rke2r1](rke2-v1.20.md#release-v1208rke2r1) | Jun 23 2021 | 06/23/21 | 2021-06-23 | Jun 17 2021 | 06/17/21 | 2021-06-17 | 6 days |
| [v1.20.7+rke2r2](rke2-v1.20.md#release-v1207rke2r2) | May 26 2021 | 05/26/21 | 2021-05-26 | May 12 2021 | 05/12/21 | 2021-05-12 | 14 days |
| [v1.20.7+rke2r1](rke2-v1.20.md#release-v1207rke2r1) | May 22 2021 | 05/22/21 | 2021-05-22 | May 12 2021 | 05/12/21 | 2021-05-12 | 10 days |
| [v1.20.6+rke2r1](rke2-v1.20.md#release-v1206rke2r1) | Apr 21 2021 | 04/21/21 | 2021-04-21 | Apr 15 2021 | 04/15/21 | 2021-04-15 | 6 days |
| [v1.20.5+rke2r1](rke2-v1.20.md#release-v1205rke2r1) | Apr 02 2021 | 04/02/21 | 2021-04-02 | Mar 18 2021 | 03/18/21 | 2021-03-18 | 15 days |
| [v1.20.4+rke2r1](rke2-v1.20.md#release-v1204rke2r1) | Mar 09 2021 | 03/09/21 | 2021-03-09 | Feb 18 2021 | 02/18/21 | 2021-02-18 | 19 days |





| Version | Release date | US date | EU date | Upstream release date | US date | EU date | Days since upstream |
| ----- | ----- | ----- | ----- | ----- | ----- | ----- | ----- |
| [v1.21.14+rke2r1](rke2-v1.21.md#release-v12114rke2r1) | Jul 05 2022 | 07/05/22 | 2022-07-05 | Jun 17 2022 | 06/17/22 | 2022-06-17 | 18 days |
| [v1.21.13+rke2r2](rke2-v1.21.md#release-v12113rke2r2) | Jun 13 2022 | 06/13/22 | 2022-06-13 | May 25 2022 | 05/25/22 | 2022-05-25 | 19 days |
| [v1.21.12+rke2r2](rke2-v1.21.md#release-v12112rke2r2) | May 05 2022 | 05/05/22 | 2022-05-05 | Apr 20 2022 | 04/20/22 | 2022-04-20 | 15 days |
| [v1.21.12+rke2r1](rke2-v1.21.md#release-v12112rke2r1) | Apr 28 2022 | 04/28/22 | 2022-04-28 | Apr 20 2022 | 04/20/22 | 2022-04-20 | 8 days |
| [v1.21.11+rke2r1](rke2-v1.21.md#release-v12111rke2r1) | Mar 31 2022 | 03/31/22 | 2022-03-31 | Mar 16 2022 | 03/16/22 | 2022-03-16 | 15 days |
| [v1.21.10+rke2r2](rke2-v1.21.md#release-v12110rke2r2) | Mar 15 2022 | 03/15/22 | 2022-03-15 | Feb 17 2022 | 02/17/22 | 2022-02-17 | 26 days |
| [v1.21.10+rke2r1](rke2-v1.21.md#release-v12110rke2r1) | Feb 23 2022 | 02/23/22 | 2022-02-23 | Feb 17 2022 | 02/17/22 | 2022-02-17 | 6 days |
| [v1.21.9+rke2r1](rke2-v1.21.md#release-v1219rke2r1) | Jan 26 2022 | 01/26/22 | 2022-01-26 | Jan 19 2022 | 01/19/22 | 2022-01-19 | 7 days |
| [v1.21.8+rke2r2](rke2-v1.21.md#release-v1218rke2r2) | Jan 11 2022 | 01/11/22 | 2022-01-11 | Dec 15 2021 | 12/15/21 | 2021-12-15 | 27 days |
| [v1.21.8+rke2r1](rke2-v1.21.md#release-v1218rke2r1) | Dec 23 2021 | 12/23/21 | 2021-12-23 | Dec 15 2021 | 12/15/21 | 2021-12-15 | 8 days |
| [v1.21.7+rke2r2](rke2-v1.21.md#release-v1217rke2r2) | Dec 06 2021 | 12/06/21 | 2021-12-06 | Nov 17 2021 | 11/17/21 | 2021-11-17 | 19 days |
| [v1.21.7+rke2r1](rke2-v1.21.md#release-v1217rke2r1) | Dec 02 2021 | 12/02/21 | 2021-12-02 | Nov 17 2021 | 11/17/21 | 2021-11-17 | 15 days |
| [v1.21.6+rke2r1](rke2-v1.21.md#release-v1216rke2r1) | Oct 30 2021 | 10/30/21 | 2021-10-30 | Oct 28 2021 | 10/28/21 | 2021-10-28 | 2 days |
| [v1.21.5+rke2r2](rke2-v1.21.md#release-v1215rke2r2) | Oct 07 2021 | 10/07/21 | 2021-10-07 | Sep 15 2021 | 09/15/21 | 2021-09-15 | 22 days |
| [v1.21.5+rke2r1](rke2-v1.21.md#release-v1215rke2r1) | Sep 23 2021 | 09/23/21 | 2021-09-23 | Sep 15 2021 | 09/15/21 | 2021-09-15 | 8 days |
| [v1.21.4+rke2r3](rke2-v1.21.md#release-v1214rke2r3) | Sep 02 2021 | 09/02/21 | 2021-09-02 | Aug 11 2021 | 08/11/21 | 2021-08-11 | 22 days |
| [v1.21.4+rke2r2](rke2-v1.21.md#release-v1214rke2r2) | Aug 30 2021 | 08/30/21 | 2021-08-30 | Aug 11 2021 | 08/11/21 | 2021-08-11 | 19 days |
| [v1.21.4+rke2r1](rke2-v1.21.md#release-v1214rke2r1) | Aug 26 2021 | 08/26/21 | 2021-08-26 | Aug 11 2021 | 08/11/21 | 2021-08-11 | 15 days |
| [v1.21.3+rke2r1](rke2-v1.21.md#release-v1213rke2r1) | Jul 22 2021 | 07/22/21 | 2021-07-22 | Jul 15 2021 | 07/15/21 | 2021-07-15 | 7 days |
| [v1.21.2+rke2r1](rke2-v1.21.md#release-v1212rke2r1) | Jun 24 2021 | 06/24/21 | 2021-06-24 | Jun 17 2021 | 06/17/21 | 2021-06-17 | 7 days |





| Version | Release date | US date | EU date | Upstream release date | US date | EU date | Days since upstream |
| ----- | ----- | ----- | ----- | ----- | ----- | ----- | ----- |
| [v1.22.17+rke2r1](rke2-v1.22.md#release-v12217rke2r1) | Dec 20 2022 | 12/20/22 | 2022-12-20 | Dec 08 2022 | 12/08/22 | 2022-12-08 | 12 days |
| [v1.22.16+rke2r1](rke2-v1.22.md#release-v12216rke2r1) | Nov 18 2022 | 11/18/22 | 2022-11-18 | Nov 10 2022 | 11/10/22 | 2022-11-10 | 8 days |
| [v1.22.15+rke2r2](rke2-v1.22.md#release-v12215rke2r2) | Oct 13 2022 | 10/13/22 | 2022-10-13 | Sep 21 2022 | 09/21/22 | 2022-09-21 | 22 days |
| [v1.22.15+rke2r1](rke2-v1.22.md#release-v12215rke2r1) | Sep 27 2022 | 09/27/22 | 2022-09-27 | Sep 21 2022 | 09/21/22 | 2022-09-21 | 6 days |
| [v1.22.13+rke2r1](rke2-v1.22.md#release-v12213rke2r1) | Aug 26 2022 | 08/26/22 | 2022-08-26 | Aug 17 2022 | 08/17/22 | 2022-08-17 | 9 days |
| [v1.22.12+rke2r1](rke2-v1.22.md#release-v12212rke2r1) | Jul 21 2022 | 07/21/22 | 2022-07-21 | Jul 13 2022 | 07/13/22 | 2022-07-13 | 8 days |
| [v1.22.11+rke2r1](rke2-v1.22.md#release-v12211rke2r1) | Jul 05 2022 | 07/05/22 | 2022-07-05 | Jun 16 2022 | 06/16/22 | 2022-06-16 | 19 days |
| [v1.22.10+rke2r2](rke2-v1.22.md#release-v12210rke2r2) | Jun 13 2022 | 06/13/22 | 2022-06-13 | May 25 2022 | 05/25/22 | 2022-05-25 | 19 days |
| [v1.22.9+rke2r2](rke2-v1.22.md#release-v1229rke2r2) | May 05 2022 | 05/05/22 | 2022-05-05 | Apr 20 2022 | 04/20/22 | 2022-04-20 | 15 days |
| [v1.22.9+rke2r1](rke2-v1.22.md#release-v1229rke2r1) | Apr 28 2022 | 04/28/22 | 2022-04-28 | Apr 20 2022 | 04/20/22 | 2022-04-20 | 8 days |
| [v1.22.8+rke2r1](rke2-v1.22.md#release-v1228rke2r1) | Mar 31 2022 | 03/31/22 | 2022-03-31 | Mar 16 2022 | 03/16/22 | 2022-03-16 | 15 days |
| [v1.22.7+rke2r2](rke2-v1.22.md#release-v1227rke2r2) | Mar 14 2022 | 03/14/22 | 2022-03-14 | Feb 17 2022 | 02/17/22 | 2022-02-17 | 25 days |
| [v1.22.7+rke2r1](rke2-v1.22.md#release-v1227rke2r1) | Feb 23 2022 | 02/23/22 | 2022-02-23 | Feb 17 2022 | 02/17/22 | 2022-02-17 | 6 days |
| [v1.22.6+rke2r1](rke2-v1.22.md#release-v1226rke2r1) | Jan 26 2022 | 01/26/22 | 2022-01-26 | Jan 19 2022 | 01/19/22 | 2022-01-19 | 7 days |
| [v1.22.5+rke2r2](rke2-v1.22.md#release-v1225rke2r2) | Jan 11 2022 | 01/11/22 | 2022-01-11 | Dec 16 2021 | 12/16/21 | 2021-12-16 | 26 days |
| [v1.22.5+rke2r1](rke2-v1.22.md#release-v1225rke2r1) | Dec 23 2021 | 12/23/21 | 2021-12-23 | Dec 16 2021 | 12/16/21 | 2021-12-16 | 7 days |
| [v1.22.4+rke2r2](rke2-v1.22.md#release-v1224rke2r2) | Dec 06 2021 | 12/06/21 | 2021-12-06 | Nov 17 2021 | 11/17/21 | 2021-11-17 | 19 days |
| [v1.22.4+rke2r1](rke2-v1.22.md#release-v1224rke2r1) | Dec 02 2021 | 12/02/21 | 2021-12-02 | Nov 17 2021 | 11/17/21 | 2021-11-17 | 15 days |
| [v1.22.3+rke2r1](rke2-v1.22.md#release-v1223rke2r1) | Nov 06 2021 | 11/06/21 | 2021-11-06 | Oct 28 2021 | 10/28/21 | 2021-10-28 | 9 days |





| Version | Release date | US date | EU date | Upstream release date | US date | EU date | Days since upstream |
| ----- | ----- | ----- | ----- | ----- | ----- | ----- | ----- |
| [v1.23.17+rke2r1](rke2-v1.23.md#release-v12317rke2r1) | Mar 10 2023 | 03/10/23 | 2023-03-10 | Feb 28 2023 | 02/28/23 | 2023-02-28 | 10 days |
| [v1.23.16+rke2r1](rke2-v1.23.md#release-v12316rke2r1) | Jan 27 2023 | 01/27/23 | 2023-01-27 | Jan 18 2023 | 01/18/23 | 2023-01-18 | 9 days |
| [v1.23.15+rke2r1](rke2-v1.23.md#release-v12315rke2r1) | Dec 20 2022 | 12/20/22 | 2022-12-20 | Dec 08 2022 | 12/08/22 | 2022-12-08 | 12 days |
| [v1.23.14+rke2r1](rke2-v1.23.md#release-v12314rke2r1) | Nov 18 2022 | 11/18/22 | 2022-11-18 | Nov 10 2022 | 11/10/22 | 2022-11-10 | 8 days |
| [v1.23.13+rke2r1](rke2-v1.23.md#release-v12313rke2r1) | Oct 20 2022 | 10/20/22 | 2022-10-20 | Oct 13 2022 | 10/13/22 | 2022-10-13 | 7 days |
| [v1.23.12+rke2r1](rke2-v1.23.md#release-v12312rke2r1) | Sep 27 2022 | 09/27/22 | 2022-09-27 | Sep 21 2022 | 09/21/22 | 2022-09-21 | 6 days |
| [v1.23.10+rke2r1](rke2-v1.23.md#release-v12310rke2r1) | Aug 26 2022 | 08/26/22 | 2022-08-26 | Aug 17 2022 | 08/17/22 | 2022-08-17 | 9 days |
| [v1.23.9+rke2r1](rke2-v1.23.md#release-v1239rke2r1) | Jul 21 2022 | 07/21/22 | 2022-07-21 | Jul 13 2022 | 07/13/22 | 2022-07-13 | 8 days |
| [v1.23.8+rke2r1](rke2-v1.23.md#release-v1238rke2r1) | Jul 05 2022 | 07/05/22 | 2022-07-05 | Jun 16 2022 | 06/16/22 | 2022-06-16 | 19 days |
| [v1.23.7+rke2r2](rke2-v1.23.md#release-v1237rke2r2) | Jun 13 2022 | 06/13/22 | 2022-06-13 | May 25 2022 | 05/25/22 | 2022-05-25 | 19 days |
| [v1.23.6+rke2r2](rke2-v1.23.md#release-v1236rke2r2) | May 05 2022 | 05/05/22 | 2022-05-05 | Apr 20 2022 | 04/20/22 | 2022-04-20 | 15 days |
| [v1.23.6+rke2r1](rke2-v1.23.md#release-v1236rke2r1) | Apr 28 2022 | 04/28/22 | 2022-04-28 | Apr 20 2022 | 04/20/22 | 2022-04-20 | 8 days |
| [v1.23.5+rke2r1](rke2-v1.23.md#release-v1235rke2r1) | Mar 31 2022 | 03/31/22 | 2022-03-31 | Mar 16 2022 | 03/16/22 | 2022-03-16 | 15 days |
| [v1.23.4+rke2r2](rke2-v1.23.md#release-v1234rke2r2) | Mar 14 2022 | 03/14/22 | 2022-03-14 | Feb 17 2022 | 02/17/22 | 2022-02-17 | 25 days |
| [v1.23.4+rke2r1](rke2-v1.23.md#release-v1234rke2r1) | Feb 23 2022 | 02/23/22 | 2022-02-23 | Feb 17 2022 | 02/17/22 | 2022-02-17 | 6 days |
| [v1.23.3+rke2r1](rke2-v1.23.md#release-v1233rke2r1) | Jan 27 2022 | 01/27/22 | 2022-01-27 | Jan 26 2022 | 01/26/22 | 2022-01-26 | 1 days |
| [v1.23.1+rke2r2](rke2-v1.23.md#release-v1231rke2r2) | Jan 11 2022 | 01/11/22 | 2022-01-11 | Dec 16 2021 | 12/16/21 | 2021-12-16 | 26 days |
| [v1.23.1+rke2r1](rke2-v1.23.md#release-v1231rke2r1) | Jan 05 2022 | 01/05/22 | 2022-01-05 | Dec 16 2021 | 12/16/21 | 2021-12-16 | 20 days |





| Version | Release date | US date | EU date | Upstream release date | US date | EU date | Days since upstream |
| ----- | ----- | ----- | ----- | ----- | ----- | ----- | ----- |
| [v1.24.17+rke2r1](rke2-v1.24.md#release-v12417rke2r1) | Sep 06 2023 | 09/06/23 | 2023-09-06 | Aug 24 2023 | 08/24/23 | 2023-08-24 | 13 days |
| [v1.24.16+rke2r1](rke2-v1.24.md#release-v12416rke2r1) | Jul 28 2023 | 07/28/23 | 2023-07-28 | Jul 19 2023 | 07/19/23 | 2023-07-19 | 9 days |
| [v1.24.15+rke2r1](rke2-v1.24.md#release-v12415rke2r1) | Jun 27 2023 | 06/27/23 | 2023-06-27 | Jun 14 2023 | 06/14/23 | 2023-06-14 | 13 days |
| [v1.24.14+rke2r1](rke2-v1.24.md#release-v12414rke2r1) | May 30 2023 | 05/30/23 | 2023-05-30 | May 17 2023 | 05/17/23 | 2023-05-17 | 13 days |
| [v1.24.13+rke2r1](rke2-v1.24.md#release-v12413rke2r1) | Apr 21 2023 | 04/21/23 | 2023-04-21 | Apr 12 2023 | 04/12/23 | 2023-04-12 | 9 days |
| [v1.24.12+rke2r1](rke2-v1.24.md#release-v12412rke2r1) | Mar 27 2023 | 03/27/23 | 2023-03-27 | Mar 17 2023 | 03/17/23 | 2023-03-17 | 10 days |
| [v1.24.11+rke2r1](rke2-v1.24.md#release-v12411rke2r1) | Mar 10 2023 | 03/10/23 | 2023-03-10 | Feb 28 2023 | 02/28/23 | 2023-02-28 | 10 days |
| [v1.24.10+rke2r1](rke2-v1.24.md#release-v12410rke2r1) | Jan 27 2023 | 01/27/23 | 2023-01-27 | Jan 19 2023 | 01/19/23 | 2023-01-19 | 8 days |
| [v1.24.9+rke2r2](rke2-v1.24.md#release-v1249rke2r2) | Jan 10 2023 | 01/10/23 | 2023-01-10 | Dec 08 2022 | 12/08/22 | 2022-12-08 | 33 days |
| [v1.24.9+rke2r1](rke2-v1.24.md#release-v1249rke2r1) | Dec 20 2022 | 12/20/22 | 2022-12-20 | Dec 08 2022 | 12/08/22 | 2022-12-08 | 12 days |
| [v1.24.8+rke2r1](rke2-v1.24.md#release-v1248rke2r1) | Nov 18 2022 | 11/18/22 | 2022-11-18 | Nov 10 2022 | 11/10/22 | 2022-11-10 | 8 days |
| [v1.24.7+rke2r1](rke2-v1.24.md#release-v1247rke2r1) | Oct 20 2022 | 10/20/22 | 2022-10-20 | Oct 13 2022 | 10/13/22 | 2022-10-13 | 7 days |
| [v1.24.6+rke2r1](rke2-v1.24.md#release-v1246rke2r1) | Sep 27 2022 | 09/27/22 | 2022-09-27 | Sep 21 2022 | 09/21/22 | 2022-09-21 | 6 days |
| [v1.24.4+rke2r1](rke2-v1.24.md#release-v1244rke2r1) | Aug 26 2022 | 08/26/22 | 2022-08-26 | Aug 17 2022 | 08/17/22 | 2022-08-17 | 9 days |
| [v1.24.3+rke2r1](rke2-v1.24.md#release-v1243rke2r1) | Jul 21 2022 | 07/21/22 | 2022-07-21 | Jul 13 2022 | 07/13/22 | 2022-07-13 | 8 days |
| [v1.24.2+rke2r1](rke2-v1.24.md#release-v1242rke2r1) | Jul 05 2022 | 07/05/22 | 2022-07-05 | Jun 17 2022 | 06/17/22 | 2022-06-17 | 18 days |
| [v1.24.1+rke2r2](rke2-v1.24.md#release-v1241rke2r2) | Jun 13 2022 | 06/13/22 | 2022-06-13 | May 26 2022 | 05/26/22 | 2022-05-26 | 18 days |





| Version | Release date | US date | EU date | Upstream release date | US date | EU date | Days since upstream |
| ----- | ----- | ----- | ----- | ----- | ----- | ----- | ----- |
| [v1.25.16+rke2r2](rke2-v1.25.md#release-v12516rke2r2) | Feb 28 2024 | 02/28/24 | 2024-02-28 | Nov 16 2023 | 11/16/23 | 2023-11-16 | 104 days |
| [v1.25.16+rke2r1](rke2-v1.25.md#release-v12516rke2r1) | Dec 05 2023 | 12/05/23 | 2023-12-05 | Nov 16 2023 | 11/16/23 | 2023-11-16 | 19 days |
| [v1.25.15+rke2r2](rke2-v1.25.md#release-v12515rke2r2) | Nov 08 2023 | 11/08/23 | 2023-11-08 | Oct 18 2023 | 10/18/23 | 2023-10-18 | 21 days |
| [v1.25.15+rke2r1](rke2-v1.25.md#release-v12515rke2r1) | Oct 31 2023 | 10/31/23 | 2023-10-31 | Oct 18 2023 | 10/18/23 | 2023-10-18 | 13 days |
| [v1.25.14+rke2r1](rke2-v1.25.md#release-v12514rke2r1) | Sep 18 2023 | 09/18/23 | 2023-09-18 | Sep 13 2023 | 09/13/23 | 2023-09-13 | 5 days |
| [v1.25.13+rke2r1](rke2-v1.25.md#release-v12513rke2r1) | Sep 06 2023 | 09/06/23 | 2023-09-06 | Aug 24 2023 | 08/24/23 | 2023-08-24 | 13 days |
| [v1.25.12+rke2r1](rke2-v1.25.md#release-v12512rke2r1) | Jul 28 2023 | 07/28/23 | 2023-07-28 | Jul 19 2023 | 07/19/23 | 2023-07-19 | 9 days |
| [v1.25.11+rke2r1](rke2-v1.25.md#release-v12511rke2r1) | Jun 27 2023 | 06/27/23 | 2023-06-27 | Jun 14 2023 | 06/14/23 | 2023-06-14 | 13 days |
| [v1.25.10+rke2r1](rke2-v1.25.md#release-v12510rke2r1) | May 30 2023 | 05/30/23 | 2023-05-30 | May 18 2023 | 05/18/23 | 2023-05-18 | 12 days |
| [v1.25.9+rke2r1](rke2-v1.25.md#release-v1259rke2r1) | Apr 21 2023 | 04/21/23 | 2023-04-21 | Apr 12 2023 | 04/12/23 | 2023-04-12 | 9 days |
| [v1.25.8+rke2r1](rke2-v1.25.md#release-v1258rke2r1) | Mar 27 2023 | 03/27/23 | 2023-03-27 | Mar 17 2023 | 03/17/23 | 2023-03-17 | 10 days |
| [v1.25.7+rke2r1](rke2-v1.25.md#release-v1257rke2r1) | Mar 10 2023 | 03/10/23 | 2023-03-10 | Feb 28 2023 | 02/28/23 | 2023-02-28 | 10 days |
| [v1.25.6+rke2r1](rke2-v1.25.md#release-v1256rke2r1) | Jan 26 2023 | 01/26/23 | 2023-01-26 | Jan 19 2023 | 01/19/23 | 2023-01-19 | 7 days |
| [v1.25.5+rke2r2](rke2-v1.25.md#release-v1255rke2r2) | Jan 10 2023 | 01/10/23 | 2023-01-10 | Dec 08 2022 | 12/08/22 | 2022-12-08 | 33 days |
| [v1.25.5+rke2r1](rke2-v1.25.md#release-v1255rke2r1) | Dec 20 2022 | 12/20/22 | 2022-12-20 | Dec 08 2022 | 12/08/22 | 2022-12-08 | 12 days |
| [v1.25.4+rke2r1](rke2-v1.25.md#release-v1254rke2r1) | Nov 18 2022 | 11/18/22 | 2022-11-18 | Nov 10 2022 | 11/10/22 | 2022-11-10 | 8 days |
| [v1.25.3+rke2r1](rke2-v1.25.md#release-v1253rke2r1) | Oct 20 2022 | 10/20/22 | 2022-10-20 | Oct 13 2022 | 10/13/22 | 2022-10-13 | 7 days |
| [v1.25.2+rke2r1](rke2-v1.25.md#release-v1252rke2r1) | Sep 27 2022 | 09/27/22 | 2022-09-27 | Sep 21 2022 | 09/21/22 | 2022-09-21 | 6 days |
| [v1.25.0+rke2r1](rke2-v1.25.md#release-v1250rke2r1) | Sep 15 2022 | 09/15/22 | 2022-09-15 | Aug 23 2022 | 08/23/22 | 2022-08-23 | 23 days |





| Version | Release date | US date | EU date | Upstream release date | US date | EU date | Days since upstream |
| ----- | ----- | ----- | ----- | ----- | ----- | ----- | ----- |
| [v1.26.15+rke2r1](rke2-v1.26.md#release-v12615rke2r1) | Mar 20 2024 | 03/20/24 | 2024-03-20 | Mar 14 2024 | 03/14/24 | 2024-03-14 | 6 days |
| [v1.26.14+rke2r1](rke2-v1.26.md#release-v12614rke2r1) | Feb 29 2024 | 02/29/24 | 2024-02-29 | Feb 14 2024 | 02/14/24 | 2024-02-14 | 15 days |
| [v1.26.13+rke2r1](rke2-v1.26.md#release-v12613rke2r1) | Feb 06 2024 | 02/06/24 | 2024-02-06 | Jan 17 2024 | 01/17/24 | 2024-01-17 | 20 days |
| [v1.26.12+rke2r1](rke2-v1.26.md#release-v12612rke2r1) | Dec 26 2023 | 12/26/23 | 2023-12-26 | Dec 20 2023 | 12/20/23 | 2023-12-20 | 6 days |
| [v1.26.11+rke2r1](rke2-v1.26.md#release-v12611rke2r1) | Dec 05 2023 | 12/05/23 | 2023-12-05 | Nov 15 2023 | 11/15/23 | 2023-11-15 | 20 days |
| [v1.26.10+rke2r2](rke2-v1.26.md#release-v12610rke2r2) | Nov 08 2023 | 11/08/23 | 2023-11-08 | Oct 18 2023 | 10/18/23 | 2023-10-18 | 21 days |
| [v1.26.10+rke2r1](rke2-v1.26.md#release-v12610rke2r1) | Oct 31 2023 | 10/31/23 | 2023-10-31 | Oct 18 2023 | 10/18/23 | 2023-10-18 | 13 days |
| [v1.26.9+rke2r1](rke2-v1.26.md#release-v1269rke2r1) | Sep 18 2023 | 09/18/23 | 2023-09-18 | Sep 13 2023 | 09/13/23 | 2023-09-13 | 5 days |
| [v1.26.8+rke2r1](rke2-v1.26.md#release-v1268rke2r1) | Sep 06 2023 | 09/06/23 | 2023-09-06 | Aug 24 2023 | 08/24/23 | 2023-08-24 | 13 days |
| [v1.26.7+rke2r1](rke2-v1.26.md#release-v1267rke2r1) | Jul 28 2023 | 07/28/23 | 2023-07-28 | Jul 19 2023 | 07/19/23 | 2023-07-19 | 9 days |
| [v1.26.6+rke2r1](rke2-v1.26.md#release-v1266rke2r1) | Jun 27 2023 | 06/27/23 | 2023-06-27 | Jun 14 2023 | 06/14/23 | 2023-06-14 | 13 days |
| [v1.26.5+rke2r1](rke2-v1.26.md#release-v1265rke2r1) | May 30 2023 | 05/30/23 | 2023-05-30 | May 17 2023 | 05/17/23 | 2023-05-17 | 13 days |
| [v1.26.4+rke2r1](rke2-v1.26.md#release-v1264rke2r1) | Apr 21 2023 | 04/21/23 | 2023-04-21 | Apr 12 2023 | 04/12/23 | 2023-04-12 | 9 days |
| [v1.26.3+rke2r1](rke2-v1.26.md#release-v1263rke2r1) | Mar 27 2023 | 03/27/23 | 2023-03-27 | Mar 17 2023 | 03/17/23 | 2023-03-17 | 10 days |
| [v1.26.2+rke2r1](rke2-v1.26.md#release-v1262rke2r1) | Mar 10 2023 | 03/10/23 | 2023-03-10 | Feb 28 2023 | 02/28/23 | 2023-02-28 | 10 days |
| [v1.26.1+rke2r1](rke2-v1.26.md#release-v1261rke2r1) | Jan 26 2023 | 01/26/23 | 2023-01-26 | Jan 18 2023 | 01/18/23 | 2023-01-18 | 8 days |
| [v1.26.0+rke2r2](rke2-v1.26.md#release-v1260rke2r2) | Jan 10 2023 | 01/10/23 | 2023-01-10 | Dec 09 2022 | 12/09/22 | 2022-12-09 | 32 days |
| [v1.26.0+rke2r1](rke2-v1.26.md#release-v1260rke2r1) | Dec 15 2022 | 12/15/22 | 2022-12-15 | Dec 09 2022 | 12/09/22 | 2022-12-09 | 6 days |





| Version | Release date | US date | EU date | Upstream release date | US date | EU date | Days since upstream |
| ----- | ----- | ----- | ----- | ----- | ----- | ----- | ----- |
| [v1.27.13+rke2r1](rke2-v1.27.md#release-v12713rke2r1) | Apr 29 2024 | 04/29/24 | 2024-04-29 | Apr 16 2024 | 04/16/24 | 2024-04-16 | 13 days |
| [v1.27.12+rke2r1](rke2-v1.27.md#release-v12712rke2r1) | Mar 20 2024 | 03/20/24 | 2024-03-20 | Mar 15 2024 | 03/15/24 | 2024-03-15 | 5 days |
| [v1.27.11+rke2r1](rke2-v1.27.md#release-v12711rke2r1) | Feb 29 2024 | 02/29/24 | 2024-02-29 | Feb 14 2024 | 02/14/24 | 2024-02-14 | 15 days |
| [v1.27.10+rke2r1](rke2-v1.27.md#release-v12710rke2r1) | Feb 06 2024 | 02/06/24 | 2024-02-06 | Jan 17 2024 | 01/17/24 | 2024-01-17 | 20 days |
| [v1.27.9+rke2r1](rke2-v1.27.md#release-v1279rke2r1) | Dec 26 2023 | 12/26/23 | 2023-12-26 | Dec 20 2023 | 12/20/23 | 2023-12-20 | 6 days |
| [v1.27.8+rke2r1](rke2-v1.27.md#release-v1278rke2r1) | Dec 05 2023 | 12/05/23 | 2023-12-05 | Nov 15 2023 | 11/15/23 | 2023-11-15 | 20 days |
| [v1.27.7+rke2r2](rke2-v1.27.md#release-v1277rke2r2) | Nov 08 2023 | 11/08/23 | 2023-11-08 | Oct 18 2023 | 10/18/23 | 2023-10-18 | 21 days |
| [v1.27.7+rke2r1](rke2-v1.27.md#release-v1277rke2r1) | Oct 31 2023 | 10/31/23 | 2023-10-31 | Oct 18 2023 | 10/18/23 | 2023-10-18 | 13 days |
| [v1.27.6+rke2r1](rke2-v1.27.md#release-v1276rke2r1) | Sep 18 2023 | 09/18/23 | 2023-09-18 | Sep 13 2023 | 09/13/23 | 2023-09-13 | 5 days |
| [v1.27.5+rke2r1](rke2-v1.27.md#release-v1275rke2r1) | Sep 06 2023 | 09/06/23 | 2023-09-06 | Aug 24 2023 | 08/24/23 | 2023-08-24 | 13 days |
| [v1.27.4+rke2r1](rke2-v1.27.md#release-v1274rke2r1) | Jul 28 2023 | 07/28/23 | 2023-07-28 | Jul 19 2023 | 07/19/23 | 2023-07-19 | 9 days |
| [v1.27.3+rke2r1](rke2-v1.27.md#release-v1273rke2r1) | Jun 27 2023 | 06/27/23 | 2023-06-27 | Jun 14 2023 | 06/14/23 | 2023-06-14 | 13 days |
| [v1.27.2+rke2r1](rke2-v1.27.md#release-v1272rke2r1) | May 30 2023 | 05/30/23 | 2023-05-30 | May 17 2023 | 05/17/23 | 2023-05-17 | 13 days |
| [v1.27.1+rke2r1](rke2-v1.27.md#release-v1271rke2r1) | Apr 27 2023 | 04/27/23 | 2023-04-27 | Apr 14 2023 | 04/14/23 | 2023-04-14 | 13 days |





| Version | Release date | US date | EU date | Upstream release date | US date | EU date | Days since upstream |
| ----- | ----- | ----- | ----- | ----- | ----- | ----- | ----- |
| [v1.28.9+rke2r1](rke2-v1.28.md#release-v1289rke2r1) | Apr 29 2024 | 04/29/24 | 2024-04-29 | Apr 16 2024 | 04/16/24 | 2024-04-16 | 13 days |
| [v1.28.8+rke2r1](rke2-v1.28.md#release-v1288rke2r1) | Mar 20 2024 | 03/20/24 | 2024-03-20 | Mar 15 2024 | 03/15/24 | 2024-03-15 | 5 days |
| [v1.28.7+rke2r1](rke2-v1.28.md#release-v1287rke2r1) | Feb 29 2024 | 02/29/24 | 2024-02-29 | Feb 14 2024 | 02/14/24 | 2024-02-14 | 15 days |
| [v1.28.6+rke2r1](rke2-v1.28.md#release-v1286rke2r1) | Feb 06 2024 | 02/06/24 | 2024-02-06 | Jan 17 2024 | 01/17/24 | 2024-01-17 | 20 days |
| [v1.28.5+rke2r1](rke2-v1.28.md#release-v1285rke2r1) | Dec 26 2023 | 12/26/23 | 2023-12-26 | Dec 20 2023 | 12/20/23 | 2023-12-20 | 6 days |
| [v1.28.4+rke2r1](rke2-v1.28.md#release-v1284rke2r1) | Dec 05 2023 | 12/05/23 | 2023-12-05 | Nov 15 2023 | 11/15/23 | 2023-11-15 | 20 days |
| [v1.28.3+rke2r2](rke2-v1.28.md#release-v1283rke2r2) | Nov 08 2023 | 11/08/23 | 2023-11-08 | Oct 18 2023 | 10/18/23 | 2023-10-18 | 21 days |
| [v1.28.3+rke2r1](rke2-v1.28.md#release-v1283rke2r1) | Oct 31 2023 | 10/31/23 | 2023-10-31 | Oct 18 2023 | 10/18/23 | 2023-10-18 | 13 days |
| [v1.28.2+rke2r1](rke2-v1.28.md#release-v1282rke2r1) | Sep 18 2023 | 09/18/23 | 2023-09-18 | Sep 13 2023 | 09/13/23 | 2023-09-13 | 5 days |





| Version | Release date | US date | EU date | Upstream release date | US date | EU date | Days since upstream |
| ----- | ----- | ----- | ----- | ----- | ----- | ----- | ----- |
| [v1.29.4+rke2r1](rke2-v1.29.md#release-v1294rke2r1) | Apr 29 2024 | 04/29/24 | 2024-04-29 | Apr 16 2024 | 04/16/24 | 2024-04-16 | 13 days |
| [v1.29.3+rke2r1](rke2-v1.29.md#release-v1293rke2r1) | Mar 20 2024 | 03/20/24 | 2024-03-20 | Mar 15 2024 | 03/15/24 | 2024-03-15 | 5 days |
| [v1.29.2+rke2r1](rke2-v1.29.md#release-v1292rke2r1) | Feb 29 2024 | 02/29/24 | 2024-02-29 | Feb 14 2024 | 02/14/24 | 2024-02-14 | 15 days |
| [v1.29.1+rke2r1](rke2-v1.29.md#release-v1291rke2r1) | Feb 06 2024 | 02/06/24 | 2024-02-06 | Jan 17 2024 | 01/17/24 | 2024-01-17 | 20 days |
| [v1.29.0+rke2r1](rke2-v1.29.md#release-v1290rke2r1) | Dec 22 2023 | 12/22/23 | 2023-12-22 | Dec 13 2023 | 12/13/23 | 2023-12-13 | 9 days |





| Version | Release date | US date | EU date | Upstream release date | US date | EU date | Days since upstream |
| ----- | ----- | ----- | ----- | ----- | ----- | ----- | ----- |
| [v1.30.0+rke2r1](rke2-v1.30.md#release-v1300rke2r1) | May 09 2024 | 05/09/24 | 2024-05-09 | Apr 17 2024 | 04/17/24 | 2024-04-17 | 22 days |





# k3s
| Version | Release date | US date | EU date | Upstream release date | US date | EU date | Days since upstream |
| ----- | ----- | ----- | ----- | ----- | ----- | ----- | ----- |
| [v1.20.15+k3s1](k3s-v1.20.md#release-v12015k3s1) | Jan 25 2022 | 01/25/22 | 2022-01-25 | Jan 19 2022 | 01/19/22 | 2022-01-19 | 6 days |
| [v1.20.14+k3s2](k3s-v1.20.md#release-v12014k3s2) | Jan 14 2022 | 01/14/22 | 2022-01-14 | Dec 15 2021 | 12/15/21 | 2021-12-15 | 30 days |
| [v1.20.14+k3s1](k3s-v1.20.md#release-v12014k3s1) | Dec 18 2021 | 12/18/21 | 2021-12-18 | Dec 15 2021 | 12/15/21 | 2021-12-15 | 3 days |
| [v1.20.13+k3s1](k3s-v1.20.md#release-v12013k3s1) | Nov 29 2021 | 11/29/21 | 2021-11-29 | Nov 17 2021 | 11/17/21 | 2021-11-17 | 12 days |
| [v1.20.12+k3s1](k3s-v1.20.md#release-v12012k3s1) | Nov 04 2021 | 11/04/21 | 2021-11-04 | Oct 28 2021 | 10/28/21 | 2021-10-28 | 7 days |
| [v1.20.11+k3s2](k3s-v1.20.md#release-v12011k3s2) | Oct 05 2021 | 10/05/21 | 2021-10-05 | Sep 15 2021 | 09/15/21 | 2021-09-15 | 20 days |
| [v1.20.11+k3s1](k3s-v1.20.md#release-v12011k3s1) | Sep 20 2021 | 09/20/21 | 2021-09-20 | Sep 15 2021 | 09/15/21 | 2021-09-15 | 5 days |
| [v1.20.10+k3s1](k3s-v1.20.md#release-v12010k3s1) | Aug 20 2021 | 08/20/21 | 2021-08-20 | Aug 11 2021 | 08/11/21 | 2021-08-11 | 9 days |
| [v1.20.9+k3s1](k3s-v1.20.md#release-v1209k3s1) | Jul 22 2021 | 07/22/21 | 2021-07-22 | Jul 15 2021 | 07/15/21 | 2021-07-15 | 7 days |
| [v1.20.8+k3s1](k3s-v1.20.md#release-v1208k3s1) | Jun 21 2021 | 06/21/21 | 2021-06-21 | Jun 17 2021 | 06/17/21 | 2021-06-17 | 4 days |
| [v1.20.7+k3s1](k3s-v1.20.md#release-v1207k3s1) | May 20 2021 | 05/20/21 | 2021-05-20 | May 12 2021 | 05/12/21 | 2021-05-12 | 8 days |
| [v1.20.6+k3s1](k3s-v1.20.md#release-v1206k3s1) | Apr 16 2021 | 04/16/21 | 2021-04-16 | Apr 15 2021 | 04/15/21 | 2021-04-15 | 1 days |
| [v1.20.5+k3s1](k3s-v1.20.md#release-v1205k3s1) | Mar 31 2021 | 03/31/21 | 2021-03-31 | Mar 18 2021 | 03/18/21 | 2021-03-18 | 13 days |
| [v1.20.4+k3s1](k3s-v1.20.md#release-v1204k3s1) | Feb 22 2021 | 02/22/21 | 2021-02-22 | Feb 18 2021 | 02/18/21 | 2021-02-18 | 4 days |
| [v1.20.2+k3s1](k3s-v1.20.md#release-v1202k3s1) | Jan 14 2021 | 01/14/21 | 2021-01-14 | Jan 13 2021 | 01/13/21 | 2021-01-13 | 1 days |
| [v1.20.0+k3s2](k3s-v1.20.md#release-v1200k3s2) | Dec 22 2020 | 12/22/20 | 2020-12-22 | Dec 08 2020 | 12/08/20 | 2020-12-08 | 14 days |





| Version | Release date | US date | EU date | Upstream release date | US date | EU date | Days since upstream |
| ----- | ----- | ----- | ----- | ----- | ----- | ----- | ----- |
| [v1.21.14+k3s1](k3s-v1.21.md#release-v12114k3s1) | Jun 27 2022 | 06/27/22 | 2022-06-27 | Jun 17 2022 | 06/17/22 | 2022-06-17 | 10 days |
| [v1.21.13+k3s1](k3s-v1.21.md#release-v12113k3s1) | Jun 11 2022 | 06/11/22 | 2022-06-11 | May 25 2022 | 05/25/22 | 2022-05-25 | 17 days |
| [v1.21.12+k3s1](k3s-v1.21.md#release-v12112k3s1) | Apr 28 2022 | 04/28/22 | 2022-04-28 | Apr 20 2022 | 04/20/22 | 2022-04-20 | 8 days |
| [v1.21.11+k3s1](k3s-v1.21.md#release-v12111k3s1) | Mar 31 2022 | 03/31/22 | 2022-03-31 | Mar 16 2022 | 03/16/22 | 2022-03-16 | 15 days |
| [v1.21.10+k3s1](k3s-v1.21.md#release-v12110k3s1) | Feb 24 2022 | 02/24/22 | 2022-02-24 | Feb 17 2022 | 02/17/22 | 2022-02-17 | 7 days |
| [v1.21.9+k3s1](k3s-v1.21.md#release-v1219k3s1) | Jan 25 2022 | 01/25/22 | 2022-01-25 | Jan 19 2022 | 01/19/22 | 2022-01-19 | 6 days |
| [v1.21.8+k3s2](k3s-v1.21.md#release-v1218k3s2) | Jan 14 2022 | 01/14/22 | 2022-01-14 | Dec 15 2021 | 12/15/21 | 2021-12-15 | 30 days |
| [v1.21.8+k3s1](k3s-v1.21.md#release-v1218k3s1) | Dec 18 2021 | 12/18/21 | 2021-12-18 | Dec 15 2021 | 12/15/21 | 2021-12-15 | 3 days |
| [v1.21.7+k3s1](k3s-v1.21.md#release-v1217k3s1) | Nov 29 2021 | 11/29/21 | 2021-11-29 | Nov 17 2021 | 11/17/21 | 2021-11-17 | 12 days |
| [v1.21.6+k3s1](k3s-v1.21.md#release-v1216k3s1) | Nov 04 2021 | 11/04/21 | 2021-11-04 | Oct 28 2021 | 10/28/21 | 2021-10-28 | 7 days |
| [v1.21.5+k3s2](k3s-v1.21.md#release-v1215k3s2) | Oct 05 2021 | 10/05/21 | 2021-10-05 | Sep 15 2021 | 09/15/21 | 2021-09-15 | 20 days |
| [v1.21.5+k3s1](k3s-v1.21.md#release-v1215k3s1) | Sep 20 2021 | 09/20/21 | 2021-09-20 | Sep 15 2021 | 09/15/21 | 2021-09-15 | 5 days |
| [v1.21.4+k3s1](k3s-v1.21.md#release-v1214k3s1) | Aug 19 2021 | 08/19/21 | 2021-08-19 | Aug 11 2021 | 08/11/21 | 2021-08-11 | 8 days |
| [v1.21.3+k3s1](k3s-v1.21.md#release-v1213k3s1) | Jul 22 2021 | 07/22/21 | 2021-07-22 | Jul 15 2021 | 07/15/21 | 2021-07-15 | 7 days |
| [v1.21.2+k3s1](k3s-v1.21.md#release-v1212k3s1) | Jun 21 2021 | 06/21/21 | 2021-06-21 | Jun 17 2021 | 06/17/21 | 2021-06-17 | 4 days |
| [v1.21.1+k3s1](k3s-v1.21.md#release-v1211k3s1) | May 21 2021 | 05/21/21 | 2021-05-21 | May 12 2021 | 05/12/21 | 2021-05-12 | 9 days |
| [v1.21.0+k3s1](k3s-v1.21.md#release-v1210k3s1) | Apr 26 2021 | 04/26/21 | 2021-04-26 | Apr 08 2021 | 04/08/21 | 2021-04-08 | 18 days |





| Version | Release date | US date | EU date | Upstream release date | US date | EU date | Days since upstream |
| ----- | ----- | ----- | ----- | ----- | ----- | ----- | ----- |
| [v1.22.17+k3s1](k3s-v1.22.md#release-v12217k3s1) | Dec 21 2022 | 12/21/22 | 2022-12-21 | Dec 08 2022 | 12/08/22 | 2022-12-08 | 13 days |
| [v1.22.16+k3s1](k3s-v1.22.md#release-v12216k3s1) | Nov 18 2022 | 11/18/22 | 2022-11-18 | Nov 10 2022 | 11/10/22 | 2022-11-10 | 8 days |
| [v1.22.15+k3s1](k3s-v1.22.md#release-v12215k3s1) | Sep 28 2022 | 09/28/22 | 2022-09-28 | Sep 21 2022 | 09/21/22 | 2022-09-21 | 7 days |
| [v1.22.13+k3s1](k3s-v1.22.md#release-v12213k3s1) | Aug 25 2022 | 08/25/22 | 2022-08-25 | Aug 17 2022 | 08/17/22 | 2022-08-17 | 8 days |
| [v1.22.12+k3s1](k3s-v1.22.md#release-v12212k3s1) | Jul 19 2022 | 07/19/22 | 2022-07-19 | Jul 13 2022 | 07/13/22 | 2022-07-13 | 6 days |
| [v1.22.11+k3s2](k3s-v1.22.md#release-v12211k3s2) | Jul 06 2022 | 07/06/22 | 2022-07-06 | Jun 16 2022 | 06/16/22 | 2022-06-16 | 20 days |
| [v1.22.11+k3s1](k3s-v1.22.md#release-v12211k3s1) | Jun 27 2022 | 06/27/22 | 2022-06-27 | Jun 16 2022 | 06/16/22 | 2022-06-16 | 11 days |
| [v1.22.10+k3s1](k3s-v1.22.md#release-v12210k3s1) | Jun 11 2022 | 06/11/22 | 2022-06-11 | May 25 2022 | 05/25/22 | 2022-05-25 | 17 days |
| [v1.22.9+k3s1](k3s-v1.22.md#release-v1229k3s1) | Apr 28 2022 | 04/28/22 | 2022-04-28 | Apr 20 2022 | 04/20/22 | 2022-04-20 | 8 days |
| [v1.22.8+k3s1](k3s-v1.22.md#release-v1228k3s1) | Mar 31 2022 | 03/31/22 | 2022-03-31 | Mar 16 2022 | 03/16/22 | 2022-03-16 | 15 days |
| [v1.22.7+k3s1](k3s-v1.22.md#release-v1227k3s1) | Feb 24 2022 | 02/24/22 | 2022-02-24 | Feb 17 2022 | 02/17/22 | 2022-02-17 | 7 days |
| [v1.22.6+k3s1](k3s-v1.22.md#release-v1226k3s1) | Jan 25 2022 | 01/25/22 | 2022-01-25 | Jan 19 2022 | 01/19/22 | 2022-01-19 | 6 days |
| [v1.22.5+k3s2](k3s-v1.22.md#release-v1225k3s2) | Jan 14 2022 | 01/14/22 | 2022-01-14 | Dec 16 2021 | 12/16/21 | 2021-12-16 | 29 days |
| [v1.22.5+k3s1](k3s-v1.22.md#release-v1225k3s1) | Dec 18 2021 | 12/18/21 | 2021-12-18 | Dec 16 2021 | 12/16/21 | 2021-12-16 | 2 days |
| [v1.22.4+k3s1](k3s-v1.22.md#release-v1224k3s1) | Nov 29 2021 | 11/29/21 | 2021-11-29 | Nov 17 2021 | 11/17/21 | 2021-11-17 | 12 days |
| [v1.22.3+k3s1](k3s-v1.22.md#release-v1223k3s1) | Nov 04 2021 | 11/04/21 | 2021-11-04 | Oct 28 2021 | 10/28/21 | 2021-10-28 | 7 days |
| [v1.22.2+k3s2](k3s-v1.22.md#release-v1222k3s2) | Oct 05 2021 | 10/05/21 | 2021-10-05 | Sep 15 2021 | 09/15/21 | 2021-09-15 | 20 days |
| [v1.22.2+k3s1](k3s-v1.22.md#release-v1222k3s1) | Sep 23 2021 | 09/23/21 | 2021-09-23 | Sep 15 2021 | 09/15/21 | 2021-09-15 | 8 days |





| Version | Release date | US date | EU date | Upstream release date | US date | EU date | Days since upstream |
| ----- | ----- | ----- | ----- | ----- | ----- | ----- | ----- |
| [v1.23.17+k3s1](k3s-v1.23.md#release-v12317k3s1) | Mar 10 2023 | 03/10/23 | 2023-03-10 | Feb 28 2023 | 02/28/23 | 2023-02-28 | 10 days |
| [v1.23.16+k3s1](k3s-v1.23.md#release-v12316k3s1) | Jan 26 2023 | 01/26/23 | 2023-01-26 | Jan 18 2023 | 01/18/23 | 2023-01-18 | 8 days |
| [v1.23.15+k3s1](k3s-v1.23.md#release-v12315k3s1) | Dec 20 2022 | 12/20/22 | 2022-12-20 | Dec 08 2022 | 12/08/22 | 2022-12-08 | 12 days |
| [v1.23.14+k3s1](k3s-v1.23.md#release-v12314k3s1) | Nov 18 2022 | 11/18/22 | 2022-11-18 | Nov 10 2022 | 11/10/22 | 2022-11-10 | 8 days |
| [v1.23.13+k3s1](k3s-v1.23.md#release-v12313k3s1) | Oct 25 2022 | 10/25/22 | 2022-10-25 | Oct 13 2022 | 10/13/22 | 2022-10-13 | 12 days |
| [v1.23.12+k3s1](k3s-v1.23.md#release-v12312k3s1) | Sep 28 2022 | 09/28/22 | 2022-09-28 | Sep 21 2022 | 09/21/22 | 2022-09-21 | 7 days |
| [v1.23.10+k3s1](k3s-v1.23.md#release-v12310k3s1) | Aug 25 2022 | 08/25/22 | 2022-08-25 | Aug 17 2022 | 08/17/22 | 2022-08-17 | 8 days |
| [v1.23.9+k3s1](k3s-v1.23.md#release-v1239k3s1) | Jul 19 2022 | 07/19/22 | 2022-07-19 | Jul 13 2022 | 07/13/22 | 2022-07-13 | 6 days |
| [v1.23.8+k3s2](k3s-v1.23.md#release-v1238k3s2) | Jul 06 2022 | 07/06/22 | 2022-07-06 | Jun 16 2022 | 06/16/22 | 2022-06-16 | 20 days |
| [v1.23.8+k3s1](k3s-v1.23.md#release-v1238k3s1) | Jun 27 2022 | 06/27/22 | 2022-06-27 | Jun 16 2022 | 06/16/22 | 2022-06-16 | 11 days |
| [v1.23.7+k3s1](k3s-v1.23.md#release-v1237k3s1) | Jun 11 2022 | 06/11/22 | 2022-06-11 | May 25 2022 | 05/25/22 | 2022-05-25 | 17 days |
| [v1.23.6+k3s1](k3s-v1.23.md#release-v1236k3s1) | Apr 28 2022 | 04/28/22 | 2022-04-28 | Apr 20 2022 | 04/20/22 | 2022-04-20 | 8 days |
| [v1.23.5+k3s1](k3s-v1.23.md#release-v1235k3s1) | Mar 31 2022 | 03/31/22 | 2022-03-31 | Mar 16 2022 | 03/16/22 | 2022-03-16 | 15 days |
| [v1.23.4+k3s1](k3s-v1.23.md#release-v1234k3s1) | Feb 24 2022 | 02/24/22 | 2022-02-24 | Feb 17 2022 | 02/17/22 | 2022-02-17 | 7 days |
| [v1.23.3+k3s1](k3s-v1.23.md#release-v1233k3s1) | Jan 27 2022 | 01/27/22 | 2022-01-27 | Jan 26 2022 | 01/26/22 | 2022-01-26 | 1 days |
| [v1.23.2+k3s1](k3s-v1.23.md#release-v1232k3s1) | Jan 25 2022 | 01/25/22 | 2022-01-25 | Jan 19 2022 | 01/19/22 | 2022-01-19 | 6 days |
| [v1.23.1+k3s2](k3s-v1.23.md#release-v1231k3s2) | Jan 14 2022 | 01/14/22 | 2022-01-14 | Dec 16 2021 | 12/16/21 | 2021-12-16 | 29 days |
| [v1.23.1+k3s1](k3s-v1.23.md#release-v1231k3s1) | Jan 05 2022 | 01/05/22 | 2022-01-05 | Dec 16 2021 | 12/16/21 | 2021-12-16 | 20 days |





| Version | Release date | US date | EU date | Upstream release date | US date | EU date | Days since upstream |
| ----- | ----- | ----- | ----- | ----- | ----- | ----- | ----- |
| [v1.24.17+k3s1](k3s-v1.24.md#release-v12417k3s1) | Sep 05 2023 | 09/05/23 | 2023-09-05 | Aug 24 2023 | 08/24/23 | 2023-08-24 | 12 days |
| [v1.24.16+k3s1](k3s-v1.24.md#release-v12416k3s1) | Jul 27 2023 | 07/27/23 | 2023-07-27 | Jul 19 2023 | 07/19/23 | 2023-07-19 | 8 days |
| [v1.24.15+k3s1](k3s-v1.24.md#release-v12415k3s1) | Jun 26 2023 | 06/26/23 | 2023-06-26 | Jun 14 2023 | 06/14/23 | 2023-06-14 | 12 days |
| [v1.24.14+k3s1](k3s-v1.24.md#release-v12414k3s1) | May 26 2023 | 05/26/23 | 2023-05-26 | May 17 2023 | 05/17/23 | 2023-05-17 | 9 days |
| [v1.24.13+k3s1](k3s-v1.24.md#release-v12413k3s1) | Apr 20 2023 | 04/20/23 | 2023-04-20 | Apr 12 2023 | 04/12/23 | 2023-04-12 | 8 days |
| [v1.24.12+k3s1](k3s-v1.24.md#release-v12412k3s1) | Mar 27 2023 | 03/27/23 | 2023-03-27 | Mar 17 2023 | 03/17/23 | 2023-03-17 | 10 days |
| [v1.24.11+k3s1](k3s-v1.24.md#release-v12411k3s1) | Mar 10 2023 | 03/10/23 | 2023-03-10 | Feb 28 2023 | 02/28/23 | 2023-02-28 | 10 days |
| [v1.24.10+k3s1](k3s-v1.24.md#release-v12410k3s1) | Jan 26 2023 | 01/26/23 | 2023-01-26 | Jan 19 2023 | 01/19/23 | 2023-01-19 | 7 days |
| [v1.24.9+k3s2](k3s-v1.24.md#release-v1249k3s2) | Jan 11 2023 | 01/11/23 | 2023-01-11 | Dec 08 2022 | 12/08/22 | 2022-12-08 | 34 days |
| [v1.24.9+k3s1](k3s-v1.24.md#release-v1249k3s1) | Dec 20 2022 | 12/20/22 | 2022-12-20 | Dec 08 2022 | 12/08/22 | 2022-12-08 | 12 days |
| [v1.24.8+k3s1](k3s-v1.24.md#release-v1248k3s1) | Nov 18 2022 | 11/18/22 | 2022-11-18 | Nov 10 2022 | 11/10/22 | 2022-11-10 | 8 days |
| [v1.24.7+k3s1](k3s-v1.24.md#release-v1247k3s1) | Oct 25 2022 | 10/25/22 | 2022-10-25 | Oct 13 2022 | 10/13/22 | 2022-10-13 | 12 days |
| [v1.24.6+k3s1](k3s-v1.24.md#release-v1246k3s1) | Sep 28 2022 | 09/28/22 | 2022-09-28 | Sep 21 2022 | 09/21/22 | 2022-09-21 | 7 days |
| [v1.24.4+k3s1](k3s-v1.24.md#release-v1244k3s1) | Aug 25 2022 | 08/25/22 | 2022-08-25 | Aug 17 2022 | 08/17/22 | 2022-08-17 | 8 days |
| [v1.24.3+k3s1](k3s-v1.24.md#release-v1243k3s1) | Jul 19 2022 | 07/19/22 | 2022-07-19 | Jul 13 2022 | 07/13/22 | 2022-07-13 | 6 days |
| [v1.24.2+k3s2](k3s-v1.24.md#release-v1242k3s2) | Jul 06 2022 | 07/06/22 | 2022-07-06 | Jun 17 2022 | 06/17/22 | 2022-06-17 | 19 days |
| [v1.24.2+k3s1](k3s-v1.24.md#release-v1242k3s1) | Jun 27 2022 | 06/27/22 | 2022-06-27 | Jun 17 2022 | 06/17/22 | 2022-06-17 | 10 days |
| [v1.24.1+k3s1](k3s-v1.24.md#release-v1241k3s1) | Jun 11 2022 | 06/11/22 | 2022-06-11 | May 26 2022 | 05/26/22 | 2022-05-26 | 16 days |





| Version | Release date | US date | EU date | Upstream release date | US date | EU date | Days since upstream |
| ----- | ----- | ----- | ----- | ----- | ----- | ----- | ----- |
| [v1.25.16+k3s4](k3s-v1.25.md#release-v12516k3s4) | Dec 07 2023 | 12/07/23 | 2023-12-07 | Nov 16 2023 | 11/16/23 | 2023-11-16 | 21 days |
| [v1.25.15+k3s2](k3s-v1.25.md#release-v12515k3s2) | Nov 08 2023 | 11/08/23 | 2023-11-08 | Oct 18 2023 | 10/18/23 | 2023-10-18 | 21 days |
| [v1.25.15+k3s1](k3s-v1.25.md#release-v12515k3s1) | Oct 30 2023 | 10/30/23 | 2023-10-30 | Oct 18 2023 | 10/18/23 | 2023-10-18 | 12 days |
| [v1.25.14+k3s1](k3s-v1.25.md#release-v12514k3s1) | Sep 20 2023 | 09/20/23 | 2023-09-20 | Sep 13 2023 | 09/13/23 | 2023-09-13 | 7 days |
| [v1.25.13+k3s1](k3s-v1.25.md#release-v12513k3s1) | Sep 05 2023 | 09/05/23 | 2023-09-05 | Aug 24 2023 | 08/24/23 | 2023-08-24 | 12 days |
| [v1.25.12+k3s1](k3s-v1.25.md#release-v12512k3s1) | Jul 27 2023 | 07/27/23 | 2023-07-27 | Jul 19 2023 | 07/19/23 | 2023-07-19 | 8 days |
| [v1.25.11+k3s1](k3s-v1.25.md#release-v12511k3s1) | Jun 26 2023 | 06/26/23 | 2023-06-26 | Jun 14 2023 | 06/14/23 | 2023-06-14 | 12 days |
| [v1.25.10+k3s1](k3s-v1.25.md#release-v12510k3s1) | May 26 2023 | 05/26/23 | 2023-05-26 | May 18 2023 | 05/18/23 | 2023-05-18 | 8 days |
| [v1.25.9+k3s1](k3s-v1.25.md#release-v1259k3s1) | Apr 20 2023 | 04/20/23 | 2023-04-20 | Apr 12 2023 | 04/12/23 | 2023-04-12 | 8 days |
| [v1.25.8+k3s1](k3s-v1.25.md#release-v1258k3s1) | Mar 27 2023 | 03/27/23 | 2023-03-27 | Mar 17 2023 | 03/17/23 | 2023-03-17 | 10 days |
| [v1.25.7+k3s1](k3s-v1.25.md#release-v1257k3s1) | Mar 10 2023 | 03/10/23 | 2023-03-10 | Feb 28 2023 | 02/28/23 | 2023-02-28 | 10 days |
| [v1.25.6+k3s1](k3s-v1.25.md#release-v1256k3s1) | Jan 26 2023 | 01/26/23 | 2023-01-26 | Jan 19 2023 | 01/19/23 | 2023-01-19 | 7 days |
| [v1.25.5+k3s2](k3s-v1.25.md#release-v1255k3s2) | Jan 11 2023 | 01/11/23 | 2023-01-11 | Dec 08 2022 | 12/08/22 | 2022-12-08 | 34 days |
| [v1.25.5+k3s1](k3s-v1.25.md#release-v1255k3s1) | Dec 20 2022 | 12/20/22 | 2022-12-20 | Dec 08 2022 | 12/08/22 | 2022-12-08 | 12 days |
| [v1.25.4+k3s1](k3s-v1.25.md#release-v1254k3s1) | Nov 18 2022 | 11/18/22 | 2022-11-18 | Nov 10 2022 | 11/10/22 | 2022-11-10 | 8 days |
| [v1.25.3+k3s1](k3s-v1.25.md#release-v1253k3s1) | Oct 25 2022 | 10/25/22 | 2022-10-25 | Oct 13 2022 | 10/13/22 | 2022-10-13 | 12 days |
| [v1.25.2+k3s1](k3s-v1.25.md#release-v1252k3s1) | Sep 28 2022 | 09/28/22 | 2022-09-28 | Sep 21 2022 | 09/21/22 | 2022-09-21 | 7 days |
| [v1.25.0+k3s1](k3s-v1.25.md#release-v1250k3s1) | Sep 12 2022 | 09/12/22 | 2022-09-12 | Aug 23 2022 | 08/23/22 | 2022-08-23 | 20 days |





| Version | Release date | US date | EU date | Upstream release date | US date | EU date | Days since upstream |
| ----- | ----- | ----- | ----- | ----- | ----- | ----- | ----- |
| [v1.26.15+k3s1](k3s-v1.26.md#release-v12615k3s1) | Mar 25 2024 | 03/25/24 | 2024-03-25 | Mar 14 2024 | 03/14/24 | 2024-03-14 | 11 days |
| [v1.26.14+k3s1](k3s-v1.26.md#release-v12614k3s1) | Feb 29 2024 | 02/29/24 | 2024-02-29 | Feb 14 2024 | 02/14/24 | 2024-02-14 | 15 days |
| [v1.26.13+k3s2](k3s-v1.26.md#release-v12613k3s2) | Feb 06 2024 | 02/06/24 | 2024-02-06 | Jan 17 2024 | 01/17/24 | 2024-01-17 | 20 days |
| [v1.26.12+k3s1](k3s-v1.26.md#release-v12612k3s1) | Dec 27 2023 | 12/27/23 | 2023-12-27 | Dec 20 2023 | 12/20/23 | 2023-12-20 | 7 days |
| [v1.26.11+k3s2](k3s-v1.26.md#release-v12611k3s2) | Dec 07 2023 | 12/07/23 | 2023-12-07 | Nov 15 2023 | 11/15/23 | 2023-11-15 | 22 days |
| [v1.26.10+k3s2](k3s-v1.26.md#release-v12610k3s2) | Nov 08 2023 | 11/08/23 | 2023-11-08 | Oct 18 2023 | 10/18/23 | 2023-10-18 | 21 days |
| [v1.26.10+k3s1](k3s-v1.26.md#release-v12610k3s1) | Oct 30 2023 | 10/30/23 | 2023-10-30 | Oct 18 2023 | 10/18/23 | 2023-10-18 | 12 days |
| [v1.26.9+k3s1](k3s-v1.26.md#release-v1269k3s1) | Sep 20 2023 | 09/20/23 | 2023-09-20 | Sep 13 2023 | 09/13/23 | 2023-09-13 | 7 days |
| [v1.26.8+k3s1](k3s-v1.26.md#release-v1268k3s1) | Sep 05 2023 | 09/05/23 | 2023-09-05 | Aug 24 2023 | 08/24/23 | 2023-08-24 | 12 days |
| [v1.26.7+k3s1](k3s-v1.26.md#release-v1267k3s1) | Jul 27 2023 | 07/27/23 | 2023-07-27 | Jul 19 2023 | 07/19/23 | 2023-07-19 | 8 days |
| [v1.26.6+k3s1](k3s-v1.26.md#release-v1266k3s1) | Jun 26 2023 | 06/26/23 | 2023-06-26 | Jun 14 2023 | 06/14/23 | 2023-06-14 | 12 days |
| [v1.26.5+k3s1](k3s-v1.26.md#release-v1265k3s1) | May 26 2023 | 05/26/23 | 2023-05-26 | May 17 2023 | 05/17/23 | 2023-05-17 | 9 days |
| [v1.26.4+k3s1](k3s-v1.26.md#release-v1264k3s1) | Apr 20 2023 | 04/20/23 | 2023-04-20 | Apr 12 2023 | 04/12/23 | 2023-04-12 | 8 days |
| [v1.26.3+k3s1](k3s-v1.26.md#release-v1263k3s1) | Mar 27 2023 | 03/27/23 | 2023-03-27 | Mar 17 2023 | 03/17/23 | 2023-03-17 | 10 days |
| [v1.26.2+k3s1](k3s-v1.26.md#release-v1262k3s1) | Mar 10 2023 | 03/10/23 | 2023-03-10 | Feb 28 2023 | 02/28/23 | 2023-02-28 | 10 days |
| [v1.26.1+k3s1](k3s-v1.26.md#release-v1261k3s1) | Jan 26 2023 | 01/26/23 | 2023-01-26 | Jan 18 2023 | 01/18/23 | 2023-01-18 | 8 days |
| [v1.26.0+k3s2](k3s-v1.26.md#release-v1260k3s2) | Jan 11 2023 | 01/11/23 | 2023-01-11 | Dec 09 2022 | 12/09/22 | 2022-12-09 | 33 days |
| [v1.26.0+k3s1](k3s-v1.26.md#release-v1260k3s1) | Dec 21 2022 | 12/21/22 | 2022-12-21 | Dec 09 2022 | 12/09/22 | 2022-12-09 | 12 days |





| Version | Release date | US date | EU date | Upstream release date | US date | EU date | Days since upstream |
| ----- | ----- | ----- | ----- | ----- | ----- | ----- | ----- |
| [v1.27.13+k3s1](k3s-v1.27.md#release-v12713k3s1) | Apr 25 2024 | 04/25/24 | 2024-04-25 | Apr 16 2024 | 04/16/24 | 2024-04-16 | 9 days |
| [v1.27.12+k3s1](k3s-v1.27.md#release-v12712k3s1) | Mar 25 2024 | 03/25/24 | 2024-03-25 | Mar 15 2024 | 03/15/24 | 2024-03-15 | 10 days |
| [v1.27.11+k3s1](k3s-v1.27.md#release-v12711k3s1) | Feb 29 2024 | 02/29/24 | 2024-02-29 | Feb 14 2024 | 02/14/24 | 2024-02-14 | 15 days |
| [v1.27.10+k3s2](k3s-v1.27.md#release-v12710k3s2) | Feb 06 2024 | 02/06/24 | 2024-02-06 | Jan 17 2024 | 01/17/24 | 2024-01-17 | 20 days |
| [v1.27.9+k3s1](k3s-v1.27.md#release-v1279k3s1) | Dec 27 2023 | 12/27/23 | 2023-12-27 | Dec 20 2023 | 12/20/23 | 2023-12-20 | 7 days |
| [v1.27.8+k3s2](k3s-v1.27.md#release-v1278k3s2) | Dec 07 2023 | 12/07/23 | 2023-12-07 | Nov 15 2023 | 11/15/23 | 2023-11-15 | 22 days |
| [v1.27.7+k3s2](k3s-v1.27.md#release-v1277k3s2) | Nov 08 2023 | 11/08/23 | 2023-11-08 | Oct 18 2023 | 10/18/23 | 2023-10-18 | 21 days |
| [v1.27.7+k3s1](k3s-v1.27.md#release-v1277k3s1) | Oct 30 2023 | 10/30/23 | 2023-10-30 | Oct 18 2023 | 10/18/23 | 2023-10-18 | 12 days |
| [v1.27.6+k3s1](k3s-v1.27.md#release-v1276k3s1) | Sep 20 2023 | 09/20/23 | 2023-09-20 | Sep 13 2023 | 09/13/23 | 2023-09-13 | 7 days |
| [v1.27.5+k3s1](k3s-v1.27.md#release-v1275k3s1) | Sep 05 2023 | 09/05/23 | 2023-09-05 | Aug 24 2023 | 08/24/23 | 2023-08-24 | 12 days |
| [v1.27.4+k3s1](k3s-v1.27.md#release-v1274k3s1) | Jul 27 2023 | 07/27/23 | 2023-07-27 | Jul 19 2023 | 07/19/23 | 2023-07-19 | 8 days |
| [v1.27.3+k3s1](k3s-v1.27.md#release-v1273k3s1) | Jun 26 2023 | 06/26/23 | 2023-06-26 | Jun 14 2023 | 06/14/23 | 2023-06-14 | 12 days |
| [v1.27.2+k3s1](k3s-v1.27.md#release-v1272k3s1) | May 26 2023 | 05/26/23 | 2023-05-26 | May 17 2023 | 05/17/23 | 2023-05-17 | 9 days |
| [v1.27.1+k3s1](k3s-v1.27.md#release-v1271k3s1) | Apr 27 2023 | 04/27/23 | 2023-04-27 | Apr 14 2023 | 04/14/23 | 2023-04-14 | 13 days |





| Version | Release date | US date | EU date | Upstream release date | US date | EU date | Days since upstream |
| ----- | ----- | ----- | ----- | ----- | ----- | ----- | ----- |
| [v1.28.9+k3s1](k3s-v1.28.md#release-v1289k3s1) | Apr 25 2024 | 04/25/24 | 2024-04-25 | Apr 16 2024 | 04/16/24 | 2024-04-16 | 9 days |
| [v1.28.8+k3s1](k3s-v1.28.md#release-v1288k3s1) | Mar 25 2024 | 03/25/24 | 2024-03-25 | Mar 15 2024 | 03/15/24 | 2024-03-15 | 10 days |
| [v1.28.7+k3s1](k3s-v1.28.md#release-v1287k3s1) | Feb 29 2024 | 02/29/24 | 2024-02-29 | Feb 14 2024 | 02/14/24 | 2024-02-14 | 15 days |
| [v1.28.6+k3s2](k3s-v1.28.md#release-v1286k3s2) | Feb 06 2024 | 02/06/24 | 2024-02-06 | Jan 17 2024 | 01/17/24 | 2024-01-17 | 20 days |
| [v1.28.5+k3s1](k3s-v1.28.md#release-v1285k3s1) | Dec 27 2023 | 12/27/23 | 2023-12-27 | Dec 20 2023 | 12/20/23 | 2023-12-20 | 7 days |
| [v1.28.4+k3s2](k3s-v1.28.md#release-v1284k3s2) | Dec 06 2023 | 12/06/23 | 2023-12-06 | Nov 15 2023 | 11/15/23 | 2023-11-15 | 21 days |
| [v1.28.3+k3s2](k3s-v1.28.md#release-v1283k3s2) | Nov 08 2023 | 11/08/23 | 2023-11-08 | Oct 18 2023 | 10/18/23 | 2023-10-18 | 21 days |
| [v1.28.3+k3s1](k3s-v1.28.md#release-v1283k3s1) | Oct 30 2023 | 10/30/23 | 2023-10-30 | Oct 18 2023 | 10/18/23 | 2023-10-18 | 12 days |
| [v1.28.2+k3s1](k3s-v1.28.md#release-v1282k3s1) | Sep 20 2023 | 09/20/23 | 2023-09-20 | Sep 13 2023 | 09/13/23 | 2023-09-13 | 7 days |
| [v1.28.1+k3s1](k3s-v1.28.md#release-v1281k3s1) | Sep 08 2023 | 09/08/23 | 2023-09-08 | Aug 24 2023 | 08/24/23 | 2023-08-24 | 15 days |





| Version | Release date | US date | EU date | Upstream release date | US date | EU date | Days since upstream |
| ----- | ----- | ----- | ----- | ----- | ----- | ----- | ----- |
| [v1.29.4+k3s1](k3s-v1.29.md#release-v1294k3s1) | Apr 25 2024 | 04/25/24 | 2024-04-25 | Apr 16 2024 | 04/16/24 | 2024-04-16 | 9 days |
| [v1.29.3+k3s1](k3s-v1.29.md#release-v1293k3s1) | Mar 25 2024 | 03/25/24 | 2024-03-25 | Mar 15 2024 | 03/15/24 | 2024-03-15 | 10 days |
| [v1.29.2+k3s1](k3s-v1.29.md#release-v1292k3s1) | Feb 29 2024 | 02/29/24 | 2024-02-29 | Feb 14 2024 | 02/14/24 | 2024-02-14 | 15 days |
| [v1.29.1+k3s2](k3s-v1.29.md#release-v1291k3s2) | Feb 06 2024 | 02/06/24 | 2024-02-06 | Jan 17 2024 | 01/17/24 | 2024-01-17 | 20 days |
| [v1.29.0+k3s1](k3s-v1.29.md#release-v1290k3s1) | Dec 22 2023 | 12/22/23 | 2023-12-22 | Dec 13 2023 | 12/13/23 | 2023-12-13 | 9 days |





| Version | Release date | US date | EU date | Upstream release date | US date | EU date | Days since upstream |
| ----- | ----- | ----- | ----- | ----- | ----- | ----- | ----- |
| [v1.30.0+k3s1](k3s-v1.30.md#release-v1300k3s1) | May 10 2024 | 05/10/24 | 2024-05-10 | Apr 17 2024 | 04/17/24 | 2024-04-17 | 23 days |





