| RKE2 version| rke2-cilium | rke2-canal | rke2-calico | rke2-calico-crd | rke2-coredns | rke2-ingress-nginx | rke2-metrics-server | rancher-vsphere-csi | rancher-vsphere-cpi | harvester-cloud-provider | harvester-csi-driver | rke2-snapshot-controller | rke2-snapshot-controller-crd | rke2-snapshot-validation-webhook | Kubernetes | Etcd | Containerd | Runc | Metrics-server | CoreDNS | Ingress-Nginx | Helm-controller | Canal (Default) | Calico | Cilium | Multus  |
| ----- | ----- | ----- | ----- | ----- | ----- | ----- | ----- | ----- | ----- | ----- | ----- | ----- | ----- | ----- | ----- | ----- | ----- | ----- | ----- | ----- | ----- | ----- | ----- | ----- | ----- | -----  |
| v1.27.16+rke2r2 | [1.16.000](https://github.com/rancher/rke2-charts/raw/main/assets/rke2-cilium/rke2-cilium-1.16.000.tgz) | [v3.28.1-build2024080600](https://github.com/rancher/rke2-charts/raw/main/assets/rke2-canal/rke2-canal-v3.28.1-build2024080600.tgz) | [v3.27.300](https://github.com/rancher/rke2-charts/raw/main/assets/rke2-calico/rke2-calico-v3.27.300.tgz) | [v3.27.002](https://github.com/rancher/rke2-charts/raw/main/assets/rke2-calico/rke2-calico-crd-v3.27.002.tgz) | [1.29.002](https://github.com/rancher/rke2-charts/raw/main/assets/rke2-coredns/rke2-coredns-1.29.002.tgz) | [4.10.401](https://github.com/rancher/rke2-charts/raw/main/assets/rke2-ingress-nginx/rke2-ingress-nginx-4.10.401.tgz) | [3.12.002](https://github.com/rancher/rke2-charts/raw/main/assets/rke2-metrics-server/rke2-metrics-server-3.12.002.tgz) | [3.3.0-rancher100](https://github.com/rancher/rke2-charts/raw/main/assets/rancher-vsphere-csi/rancher-vsphere-csi-3.3.0-rancher100.tgz) | [1.8.000](https://github.com/rancher/rke2-charts/raw/main/assets/rancher-vsphere-cpi/rancher-vsphere-cpi-1.8.000.tgz) | [0.2.400](https://github.com/rancher/rke2-charts/raw/main/assets/harvester-cloud-provider/harvester-cloud-provider-0.2.400.tgz) | [0.1.1800](https://github.com/rancher/rke2-charts/raw/main/assets/harvester-cloud-provider/harvester-csi-driver-0.1.1800.tgz) | [1.7.202](https://github.com/rancher/rke2-charts/raw/main/assets/rke2-snapshot-controller/rke2-snapshot-controller-1.7.202.tgz) | [1.7.202](https://github.com/rancher/rke2-charts/raw/main/assets/rke2-snapshot-controller/rke2-snapshot-controller-crd-1.7.202.tgz) | [1.7.302](https://github.com/rancher/rke2-charts/raw/main/assets/rke2-snapshot-validation-webhook/rke2-snapshot-validation-webhook-1.7.302.tgz) | [v1.27.16](https://github.com/kubernetes/kubernetes/blob/master/CHANGELOG/CHANGELOG-1.27.md#v12716) | [v3.5.13-k3s1](https://github.com/k3s-io/etcd/releases/tag/v3.5.13-k3s1) | [v1.7.20-k3s1](https://github.com/k3s-io/containerd/releases/tag/v1.7.20-k3s1) | [v1.1.12](https://github.com/opencontainers/runc/releases/tag/v1.1.12) | [v0.7.1](https://github.com/kubernetes-sigs/metrics-server/releases/tag/v0.7.1) | [v1.11.1](https://github.com/coredns/coredns/releases/tag/v1.11.1) | [v1.10.4-hardened2](https://github.com/rancher/ingress-nginx/releases/tag/v1.10.4-hardened2) | [v0.15.10](https://github.com/k3s-io/helm-controller/releases/tag/v0.15.10) | [Flannel v0.25.5](https://github.com/flannel-io/flannel/releases/tag/v0.25.5)<br/>[Calico v3.28.1](https://docs.tigera.io/calico/latest/release-notes/#v3.28) | [v3.27.3](https://docs.tigera.io/calico/latest/release-notes/#v3.27) | [v1.16.0](https://github.com/cilium/cilium/releases/tag/v1.16.0) | [v4.0.2](https://github.com/k8snetworkplumbingwg/multus-cni/releases/tag/v4.0.2)  |
| v1.27.16+rke2r1 | [1.15.500](https://github.com/rancher/rke2-charts/raw/main/assets/rke2-cilium/rke2-cilium-1.15.500.tgz) | [v3.28.0-build2024062503](https://github.com/rancher/rke2-charts/raw/main/assets/rke2-canal/rke2-canal-v3.28.0-build2024062503.tgz) | [v3.27.300](https://github.com/rancher/rke2-charts/raw/main/assets/rke2-calico/rke2-calico-v3.27.300.tgz) | [v3.27.002](https://github.com/rancher/rke2-charts/raw/main/assets/rke2-calico/rke2-calico-crd-v3.27.002.tgz) | [1.29.002](https://github.com/rancher/rke2-charts/raw/main/assets/rke2-coredns/rke2-coredns-1.29.002.tgz) | [4.10.102](https://github.com/rancher/rke2-charts/raw/main/assets/rke2-ingress-nginx/rke2-ingress-nginx-4.10.102.tgz) | [3.12.002](https://github.com/rancher/rke2-charts/raw/main/assets/rke2-metrics-server/rke2-metrics-server-3.12.002.tgz) | [3.3.0-rancher100](https://github.com/rancher/rke2-charts/raw/main/assets/rancher-vsphere-csi/rancher-vsphere-csi-3.3.0-rancher100.tgz) | [1.8.000](https://github.com/rancher/rke2-charts/raw/main/assets/rancher-vsphere-cpi/rancher-vsphere-cpi-1.8.000.tgz) | [0.2.400](https://github.com/rancher/rke2-charts/raw/main/assets/harvester-cloud-provider/harvester-cloud-provider-0.2.400.tgz) | [0.1.1700](https://github.com/rancher/rke2-charts/raw/main/assets/harvester-cloud-provider/harvester-csi-driver-0.1.1700.tgz) | [1.7.202](https://github.com/rancher/rke2-charts/raw/main/assets/rke2-snapshot-controller/rke2-snapshot-controller-1.7.202.tgz) | [1.7.202](https://github.com/rancher/rke2-charts/raw/main/assets/rke2-snapshot-controller/rke2-snapshot-controller-crd-1.7.202.tgz) | [1.7.302](https://github.com/rancher/rke2-charts/raw/main/assets/rke2-snapshot-validation-webhook/rke2-snapshot-validation-webhook-1.7.302.tgz) | [v1.27.16](https://github.com/kubernetes/kubernetes/blob/master/CHANGELOG/CHANGELOG-1.27.md#v12716) | [v3.5.13-k3s1](https://github.com/k3s-io/etcd/releases/tag/v3.5.13-k3s1) | [v1.7.17-k3s1](https://github.com/k3s-io/containerd/releases/tag/v1.7.17-k3s1) | [v1.1.12](https://github.com/opencontainers/runc/releases/tag/v1.1.12) | [v0.7.1](https://github.com/kubernetes-sigs/metrics-server/releases/tag/v0.7.1) | [v1.11.1](https://github.com/coredns/coredns/releases/tag/v1.11.1) | [v1.10.1-hardened1](https://github.com/rancher/ingress-nginx/releases/tag/v1.10.1-hardened1) | [v0.15.10](https://github.com/k3s-io/helm-controller/releases/tag/v0.15.10) | [Flannel v0.25.4](https://github.com/flannel-io/flannel/releases/tag/v0.25.4)<br/>[Calico v3.28.0](https://docs.tigera.io/calico/latest/release-notes/#v3.28) | [v3.27.3](https://docs.tigera.io/calico/latest/release-notes/#v3.27) | [v1.15.5](https://github.com/cilium/cilium/releases/tag/v1.15.5) | [v4.0.2](https://github.com/k8snetworkplumbingwg/multus-cni/releases/tag/v4.0.2)  |
| v1.27.15+rke2r1 | [1.15.500](https://github.com/rancher/rke2-charts/raw/main/assets/rke2-cilium/rke2-cilium-1.15.500.tgz) | [v3.28.0-build2024062503](https://github.com/rancher/rke2-charts/raw/main/assets/rke2-canal/rke2-canal-v3.28.0-build2024062503.tgz) | [v3.27.300](https://github.com/rancher/rke2-charts/raw/main/assets/rke2-calico/rke2-calico-v3.27.300.tgz) | [v3.27.002](https://github.com/rancher/rke2-charts/raw/main/assets/rke2-calico/rke2-calico-crd-v3.27.002.tgz) | [1.29.002](https://github.com/rancher/rke2-charts/raw/main/assets/rke2-coredns/rke2-coredns-1.29.002.tgz) | [4.10.101](https://github.com/rancher/rke2-charts/raw/main/assets/rke2-ingress-nginx/rke2-ingress-nginx-4.10.101.tgz) | [3.12.002](https://github.com/rancher/rke2-charts/raw/main/assets/rke2-metrics-server/rke2-metrics-server-3.12.002.tgz) | [3.1.2-rancher400](https://github.com/rancher/rke2-charts/raw/main/assets/rancher-vsphere-csi/rancher-vsphere-csi-3.1.2-rancher400.tgz) | [1.7.001](https://github.com/rancher/rke2-charts/raw/main/assets/rancher-vsphere-cpi/rancher-vsphere-cpi-1.7.001.tgz) | [0.2.400](https://github.com/rancher/rke2-charts/raw/main/assets/harvester-cloud-provider/harvester-cloud-provider-0.2.400.tgz) | [0.1.1700](https://github.com/rancher/rke2-charts/raw/main/assets/harvester-cloud-provider/harvester-csi-driver-0.1.1700.tgz) | [1.7.202](https://github.com/rancher/rke2-charts/raw/main/assets/rke2-snapshot-controller/rke2-snapshot-controller-1.7.202.tgz) | [1.7.202](https://github.com/rancher/rke2-charts/raw/main/assets/rke2-snapshot-controller/rke2-snapshot-controller-crd-1.7.202.tgz) | [1.7.302](https://github.com/rancher/rke2-charts/raw/main/assets/rke2-snapshot-validation-webhook/rke2-snapshot-validation-webhook-1.7.302.tgz) | [v1.27.15](https://github.com/kubernetes/kubernetes/blob/master/CHANGELOG/CHANGELOG-1.27.md#v12715) | [v3.5.13-k3s1](https://github.com/k3s-io/etcd/releases/tag/v3.5.13-k3s1) | [v1.7.17-k3s1](https://github.com/k3s-io/containerd/releases/tag/v1.7.17-k3s1) | [v1.1.12](https://github.com/opencontainers/runc/releases/tag/v1.1.12) | [v0.7.1](https://github.com/kubernetes-sigs/metrics-server/releases/tag/v0.7.1) | [v1.11.1](https://github.com/coredns/coredns/releases/tag/v1.11.1) | [v1.10.1-hardened1](https://github.com/rancher/ingress-nginx/releases/tag/v1.10.1-hardened1) | [v0.15.10](https://github.com/k3s-io/helm-controller/releases/tag/v0.15.10) | [Flannel v0.25.4](https://github.com/flannel-io/flannel/releases/tag/v0.25.4)<br/>[Calico v3.28.0](https://docs.tigera.io/calico/latest/release-notes/#v3.28) | [v3.27.3](https://docs.tigera.io/calico/latest/release-notes/#v3.27) | [v1.15.5](https://github.com/cilium/cilium/releases/tag/v1.15.5) | [v4.0.2](https://github.com/k8snetworkplumbingwg/multus-cni/releases/tag/v4.0.2)  |
| v1.27.14+rke2r1 | [1.15.500](https://github.com/rancher/rke2-charts/raw/main/assets/rke2-cilium/rke2-cilium-1.15.500.tgz) | [v3.27.3-build2024042301](https://github.com/rancher/rke2-charts/raw/main/assets/rke2-canal/rke2-canal-v3.27.3-build2024042301.tgz) | [v3.27.300](https://github.com/rancher/rke2-charts/raw/main/assets/rke2-calico/rke2-calico-v3.27.300.tgz) | [v3.27.002](https://github.com/rancher/rke2-charts/raw/main/assets/rke2-calico/rke2-calico-crd-v3.27.002.tgz) | [1.29.002](https://github.com/rancher/rke2-charts/raw/main/assets/rke2-coredns/rke2-coredns-1.29.002.tgz) | [4.9.100](https://github.com/rancher/rke2-charts/raw/main/assets/rke2-ingress-nginx/rke2-ingress-nginx-4.9.100.tgz) | [3.12.002](https://github.com/rancher/rke2-charts/raw/main/assets/rke2-metrics-server/rke2-metrics-server-3.12.002.tgz) | [3.1.2-rancher400](https://github.com/rancher/rke2-charts/raw/main/assets/rancher-vsphere-csi/rancher-vsphere-csi-3.1.2-rancher400.tgz) | [1.7.001](https://github.com/rancher/rke2-charts/raw/main/assets/rancher-vsphere-cpi/rancher-vsphere-cpi-1.7.001.tgz) | [0.2.300](https://github.com/rancher/rke2-charts/raw/main/assets/harvester-cloud-provider/harvester-cloud-provider-0.2.300.tgz) | [0.1.1700](https://github.com/rancher/rke2-charts/raw/main/assets/harvester-cloud-provider/harvester-csi-driver-0.1.1700.tgz) | [1.7.202](https://github.com/rancher/rke2-charts/raw/main/assets/rke2-snapshot-controller/rke2-snapshot-controller-1.7.202.tgz) | [1.7.202](https://github.com/rancher/rke2-charts/raw/main/assets/rke2-snapshot-controller/rke2-snapshot-controller-crd-1.7.202.tgz) | [1.7.302](https://github.com/rancher/rke2-charts/raw/main/assets/rke2-snapshot-validation-webhook/rke2-snapshot-validation-webhook-1.7.302.tgz) | [v1.27.14](https://github.com/kubernetes/kubernetes/blob/master/CHANGELOG/CHANGELOG-1.27.md#v12714) | [v3.5.9-k3s1](https://github.com/k3s-io/etcd/releases/tag/v3.5.9-k3s1) | [v1.7.11-k3s2](https://github.com/k3s-io/containerd/releases/tag/v1.7.11-k3s2) | [v1.1.12](https://github.com/opencontainers/runc/releases/tag/v1.1.12) | [v0.7.1](https://github.com/kubernetes-sigs/metrics-server/releases/tag/v0.7.1) | [v1.11.1](https://github.com/coredns/coredns/releases/tag/v1.11.1) | [nginx-1.9.6-hardened1](https://github.com/rancher/ingress-nginx/releases/tag/nginx-1.9.6-hardened1) | [v0.15.9](https://github.com/k3s-io/helm-controller/releases/tag/v0.15.9) | [Flannel v0.25.1](https://github.com/flannel-io/flannel/releases/tag/v0.25.1)<br/>[Calico v3.27.3](https://docs.tigera.io/calico/latest/release-notes/#v3.27) | [v3.27.3](https://docs.tigera.io/calico/latest/release-notes/#v3.27) | [v1.15.5](https://github.com/cilium/cilium/releases/tag/v1.15.5) | [v4.0.2](https://github.com/k8snetworkplumbingwg/multus-cni/releases/tag/v4.0.2)  |
| v1.27.13+rke2r1 | [1.15.400](https://github.com/rancher/rke2-charts/raw/main/assets/rke2-cilium/rke2-cilium-1.15.400.tgz) | [v3.27.3-build2024042301](https://github.com/rancher/rke2-charts/raw/main/assets/rke2-canal/rke2-canal-v3.27.3-build2024042301.tgz) | [v3.27.300](https://github.com/rancher/rke2-charts/raw/main/assets/rke2-calico/rke2-calico-v3.27.300.tgz) | [v3.27.002](https://github.com/rancher/rke2-charts/raw/main/assets/rke2-calico/rke2-calico-crd-v3.27.002.tgz) | [1.29.002](https://github.com/rancher/rke2-charts/raw/main/assets/rke2-coredns/rke2-coredns-1.29.002.tgz) | [4.9.100](https://github.com/rancher/rke2-charts/raw/main/assets/rke2-ingress-nginx/rke2-ingress-nginx-4.9.100.tgz) | [3.12.002](https://github.com/rancher/rke2-charts/raw/main/assets/rke2-metrics-server/rke2-metrics-server-3.12.002.tgz) | [3.1.2-rancher400](https://github.com/rancher/rke2-charts/raw/main/assets/rancher-vsphere-csi/rancher-vsphere-csi-3.1.2-rancher400.tgz) | [1.7.001](https://github.com/rancher/rke2-charts/raw/main/assets/rancher-vsphere-cpi/rancher-vsphere-cpi-1.7.001.tgz) | [0.2.300](https://github.com/rancher/rke2-charts/raw/main/assets/harvester-cloud-provider/harvester-cloud-provider-0.2.300.tgz) | [0.1.1700](https://github.com/rancher/rke2-charts/raw/main/assets/harvester-cloud-provider/harvester-csi-driver-0.1.1700.tgz) | [1.7.202](https://github.com/rancher/rke2-charts/raw/main/assets/rke2-snapshot-controller/rke2-snapshot-controller-1.7.202.tgz) | [1.7.202](https://github.com/rancher/rke2-charts/raw/main/assets/rke2-snapshot-controller/rke2-snapshot-controller-crd-1.7.202.tgz) | [1.7.302](https://github.com/rancher/rke2-charts/raw/main/assets/rke2-snapshot-validation-webhook/rke2-snapshot-validation-webhook-1.7.302.tgz) | [v1.27.13](https://github.com/kubernetes/kubernetes/blob/master/CHANGELOG/CHANGELOG-1.27.md#v12713) | [v3.5.9-k3s1](https://github.com/k3s-io/etcd/releases/tag/v3.5.9-k3s1) | [v1.7.11-k3s2](https://github.com/k3s-io/containerd/releases/tag/v1.7.11-k3s2) | [v1.1.12](https://github.com/opencontainers/runc/releases/tag/v1.1.12) | [v0.7.1](https://github.com/kubernetes-sigs/metrics-server/releases/tag/v0.7.1) | [v1.11.1](https://github.com/coredns/coredns/releases/tag/v1.11.1) | [nginx-1.9.6-hardened1](https://github.com/rancher/ingress-nginx/releases/tag/nginx-1.9.6-hardened1) | [v0.15.9](https://github.com/k3s-io/helm-controller/releases/tag/v0.15.9) | [Flannel v0.25.1](https://github.com/flannel-io/flannel/releases/tag/v0.25.1)<br/>[Calico v3.27.3](https://docs.tigera.io/calico/latest/release-notes/#v3.27) | [v3.27.3](https://docs.tigera.io/calico/latest/release-notes/#v3.27) | [v1.15.4](https://github.com/cilium/cilium/releases/tag/v1.15.4) | [v4.0.2](https://github.com/k8snetworkplumbingwg/multus-cni/releases/tag/v4.0.2)  |
| v1.27.12+rke2r1 | [1.15.100](https://github.com/rancher/rke2-charts/raw/main/assets/rke2-cilium/rke2-cilium-1.15.100.tgz) | [v3.27.2-build2024030800](https://github.com/rancher/rke2-charts/raw/main/assets/rke2-canal/rke2-canal-v3.27.2-build2024030800.tgz) | [v3.27.200](https://github.com/rancher/rke2-charts/raw/main/assets/rke2-calico/rke2-calico-v3.27.200.tgz) | [v3.27.002](https://github.com/rancher/rke2-charts/raw/main/assets/rke2-calico/rke2-calico-crd-v3.27.002.tgz) | [1.29.002](https://github.com/rancher/rke2-charts/raw/main/assets/rke2-coredns/rke2-coredns-1.29.002.tgz) | [4.8.200](https://github.com/rancher/rke2-charts/raw/main/assets/rke2-ingress-nginx/rke2-ingress-nginx-4.8.200.tgz) | [2.11.100-build2023051513](https://github.com/rancher/rke2-charts/raw/main/assets/rke2-metrics-server/rke2-metrics-server-2.11.100-build2023051513.tgz) | [3.1.2-rancher101](https://github.com/rancher/rke2-charts/raw/main/assets/rancher-vsphere-csi/rancher-vsphere-csi-3.1.2-rancher101.tgz) | [1.7.001](https://github.com/rancher/rke2-charts/raw/main/assets/rancher-vsphere-cpi/rancher-vsphere-cpi-1.7.001.tgz) | [0.2.200](https://github.com/rancher/rke2-charts/raw/main/assets/harvester-cloud-provider/harvester-cloud-provider-0.2.200.tgz) | [0.1.1700](https://github.com/rancher/rke2-charts/raw/main/assets/harvester-cloud-provider/harvester-csi-driver-0.1.1700.tgz) | [1.7.202](https://github.com/rancher/rke2-charts/raw/main/assets/rke2-snapshot-controller/rke2-snapshot-controller-1.7.202.tgz) | [1.7.202](https://github.com/rancher/rke2-charts/raw/main/assets/rke2-snapshot-controller/rke2-snapshot-controller-crd-1.7.202.tgz) | [1.7.302](https://github.com/rancher/rke2-charts/raw/main/assets/rke2-snapshot-validation-webhook/rke2-snapshot-validation-webhook-1.7.302.tgz) | [v1.27.12](https://github.com/kubernetes/kubernetes/blob/master/CHANGELOG/CHANGELOG-1.27.md#v12712) | [v3.5.9-k3s1](https://github.com/k3s-io/etcd/releases/tag/v3.5.9-k3s1) | [v1.7.11-k3s2](https://github.com/k3s-io/containerd/releases/tag/v1.7.11-k3s2) | [v1.1.12](https://github.com/opencontainers/runc/releases/tag/v1.1.12) | [v0.6.3](https://github.com/kubernetes-sigs/metrics-server/releases/tag/v0.6.3) | [v1.11.1](https://github.com/coredns/coredns/releases/tag/v1.11.1) | [nginx-1.9.3-hardened1](https://github.com/rancher/ingress-nginx/releases/tag/nginx-1.9.3-hardened1) | [v0.15.9](https://github.com/k3s-io/helm-controller/releases/tag/v0.15.9) | [Flannel v0.24.3](https://github.com/flannel-io/flannel/releases/tag/v0.24.3)<br/>[Calico v3.27.2](https://docs.tigera.io/calico/latest/release-notes/#v3.27) | [v3.27.2](https://docs.tigera.io/calico/latest/release-notes/#v3.27) | [v1.15.1](https://github.com/cilium/cilium/releases/tag/v1.15.1) | [v4.0.2](https://github.com/k8snetworkplumbingwg/multus-cni/releases/tag/v4.0.2)  |
| v1.27.11+rke2r1 | [1.15.100](https://github.com/rancher/rke2-charts/raw/main/assets/rke2-cilium/rke2-cilium-1.15.100.tgz) | [v3.27.0-build2024020601](https://github.com/rancher/rke2-charts/raw/main/assets/rke2-canal/rke2-canal-v3.27.0-build2024020601.tgz) | [v3.27.002](https://github.com/rancher/rke2-charts/raw/main/assets/rke2-calico/rke2-calico-v3.27.002.tgz) | [v3.27.002](https://github.com/rancher/rke2-charts/raw/main/assets/rke2-calico/rke2-calico-crd-v3.27.002.tgz) | [1.29.001](https://github.com/rancher/rke2-charts/raw/main/assets/rke2-coredns/rke2-coredns-1.29.001.tgz) | [4.8.200](https://github.com/rancher/rke2-charts/raw/main/assets/rke2-ingress-nginx/rke2-ingress-nginx-4.8.200.tgz) | [2.11.100-build2023051513](https://github.com/rancher/rke2-charts/raw/main/assets/rke2-metrics-server/rke2-metrics-server-2.11.100-build2023051513.tgz) | [3.0.1-rancher101](https://github.com/rancher/rke2-charts/raw/main/assets/rancher-vsphere-csi/rancher-vsphere-csi-3.0.1-rancher101.tgz) | [1.5.100](https://github.com/rancher/rke2-charts/raw/main/assets/rancher-vsphere-cpi/rancher-vsphere-cpi-1.5.100.tgz) | [0.2.200](https://github.com/rancher/rke2-charts/raw/main/assets/harvester-cloud-provider/harvester-cloud-provider-0.2.200.tgz) | [0.1.1700](https://github.com/rancher/rke2-charts/raw/main/assets/harvester-cloud-provider/harvester-csi-driver-0.1.1700.tgz) | [1.7.202](https://github.com/rancher/rke2-charts/raw/main/assets/rke2-snapshot-controller/rke2-snapshot-controller-1.7.202.tgz) | [1.7.202](https://github.com/rancher/rke2-charts/raw/main/assets/rke2-snapshot-controller/rke2-snapshot-controller-crd-1.7.202.tgz) | [1.7.302](https://github.com/rancher/rke2-charts/raw/main/assets/rke2-snapshot-validation-webhook/rke2-snapshot-validation-webhook-1.7.302.tgz) | [v1.27.11](https://github.com/kubernetes/kubernetes/blob/master/CHANGELOG/CHANGELOG-1.27.md#v12711) | [v3.5.9-k3s1](https://github.com/k3s-io/etcd/releases/tag/v3.5.9-k3s1) | [v1.7.11-k3s2](https://github.com/k3s-io/containerd/releases/tag/v1.7.11-k3s2) | [v1.1.12](https://github.com/opencontainers/runc/releases/tag/v1.1.12) | [v0.6.3](https://github.com/kubernetes-sigs/metrics-server/releases/tag/v0.6.3) | [v1.11.1](https://github.com/coredns/coredns/releases/tag/v1.11.1) | [nginx-1.9.3-hardened1](https://github.com/rancher/ingress-nginx/releases/tag/nginx-1.9.3-hardened1) | [v0.15.8](https://github.com/k3s-io/helm-controller/releases/tag/v0.15.8) | [Flannel v0.24.2](https://github.com/flannel-io/flannel/releases/tag/v0.24.2)<br/>[Calico v3.27.0](https://docs.tigera.io/calico/latest/release-notes/#v3.27) | [v3.27.0](https://docs.tigera.io/calico/latest/release-notes/#v3.27) | [v1.15.1](https://github.com/cilium/cilium/releases/tag/v1.15.1) | [v4.0.2](https://github.com/k8snetworkplumbingwg/multus-cni/releases/tag/v4.0.2)  |
| v1.27.10+rke2r1 | [1.14.400](https://github.com/rancher/rke2-charts/raw/main/assets/rke2-cilium/rke2-cilium-1.14.400.tgz) | [v3.26.3-build2023110900](https://github.com/rancher/rke2-charts/raw/main/assets/rke2-canal/rke2-canal-v3.26.3-build2023110900.tgz) | [v3.26.300](https://github.com/rancher/rke2-charts/raw/main/assets/rke2-calico/rke2-calico-v3.26.300.tgz) | [v3.26.300](https://github.com/rancher/rke2-charts/raw/main/assets/rke2-calico/rke2-calico-crd-v3.26.300.tgz) | [1.24.008](https://github.com/rancher/rke2-charts/raw/main/assets/rke2-coredns/rke2-coredns-1.24.008.tgz) | [4.8.200](https://github.com/rancher/rke2-charts/raw/main/assets/rke2-ingress-nginx/rke2-ingress-nginx-4.8.200.tgz) | [2.11.100-build2023051511](https://github.com/rancher/rke2-charts/raw/main/assets/rke2-metrics-server/rke2-metrics-server-2.11.100-build2023051511.tgz) | [3.0.1-rancher101](https://github.com/rancher/rke2-charts/raw/main/assets/rancher-vsphere-csi/rancher-vsphere-csi-3.0.1-rancher101.tgz) | [1.5.100](https://github.com/rancher/rke2-charts/raw/main/assets/rancher-vsphere-cpi/rancher-vsphere-cpi-1.5.100.tgz) | [0.2.200](https://github.com/rancher/rke2-charts/raw/main/assets/harvester-cloud-provider/harvester-cloud-provider-0.2.200.tgz) | [0.1.1600](https://github.com/rancher/rke2-charts/raw/main/assets/harvester-cloud-provider/harvester-csi-driver-0.1.1600.tgz) | [1.7.202](https://github.com/rancher/rke2-charts/raw/main/assets/rke2-snapshot-controller/rke2-snapshot-controller-1.7.202.tgz) | [1.7.202](https://github.com/rancher/rke2-charts/raw/main/assets/rke2-snapshot-controller/rke2-snapshot-controller-crd-1.7.202.tgz) | [1.7.302](https://github.com/rancher/rke2-charts/raw/main/assets/rke2-snapshot-validation-webhook/rke2-snapshot-validation-webhook-1.7.302.tgz) | [v1.27.10](https://github.com/kubernetes/kubernetes/blob/master/CHANGELOG/CHANGELOG-1.27.md#v12710) | [v3.5.9-k3s1](https://github.com/k3s-io/etcd/releases/tag/v3.5.9-k3s1) | [v1.7.11-k3s2](https://github.com/k3s-io/containerd/releases/tag/v1.7.11-k3s2) | [v1.1.12](https://github.com/opencontainers/runc/releases/tag/v1.1.12) | [v0.6.3](https://github.com/kubernetes-sigs/metrics-server/releases/tag/v0.6.3) | [v1.10.1](https://github.com/coredns/coredns/releases/tag/v1.10.1) | [nginx-1.9.3-hardened1](https://github.com/rancher/ingress-nginx/releases/tag/nginx-1.9.3-hardened1) | [v0.15.8](https://github.com/k3s-io/helm-controller/releases/tag/v0.15.8) | [Flannel v0.23.0](https://github.com/flannel-io/flannel/releases/tag/v0.23.0)<br/>[Calico v3.26.3](https://docs.tigera.io/calico/latest/release-notes/#v3.26) | [v3.26.3](https://docs.tigera.io/calico/latest/release-notes/#v3.26) | [v1.14.4](https://github.com/cilium/cilium/releases/tag/v1.14.4) | [v4.0.2](https://github.com/k8snetworkplumbingwg/multus-cni/releases/tag/v4.0.2)  |
| v1.27.9+rke2r1 | [1.14.400](https://github.com/rancher/rke2-charts/raw/main/assets/rke2-cilium/rke2-cilium-1.14.400.tgz) | [v3.26.3-build2023110900](https://github.com/rancher/rke2-charts/raw/main/assets/rke2-canal/rke2-canal-v3.26.3-build2023110900.tgz) | [v3.26.300](https://github.com/rancher/rke2-charts/raw/main/assets/rke2-calico/rke2-calico-v3.26.300.tgz) | [v3.26.300](https://github.com/rancher/rke2-charts/raw/main/assets/rke2-calico/rke2-calico-crd-v3.26.300.tgz) | [1.24.006](https://github.com/rancher/rke2-charts/raw/main/assets/rke2-coredns/rke2-coredns-1.24.006.tgz) | [4.8.200](https://github.com/rancher/rke2-charts/raw/main/assets/rke2-ingress-nginx/rke2-ingress-nginx-4.8.200.tgz) | [2.11.100-build2023051510](https://github.com/rancher/rke2-charts/raw/main/assets/rke2-metrics-server/rke2-metrics-server-2.11.100-build2023051510.tgz) | [3.0.1-rancher101](https://github.com/rancher/rke2-charts/raw/main/assets/rancher-vsphere-csi/rancher-vsphere-csi-3.0.1-rancher101.tgz) | [1.5.100](https://github.com/rancher/rke2-charts/raw/main/assets/rancher-vsphere-cpi/rancher-vsphere-cpi-1.5.100.tgz) | [0.2.200](https://github.com/rancher/rke2-charts/raw/main/assets/harvester-cloud-provider/harvester-cloud-provider-0.2.200.tgz) | [0.1.1600](https://github.com/rancher/rke2-charts/raw/main/assets/harvester-cloud-provider/harvester-csi-driver-0.1.1600.tgz) | [1.7.202](https://github.com/rancher/rke2-charts/raw/main/assets/rke2-snapshot-controller/rke2-snapshot-controller-1.7.202.tgz) | [1.7.202](https://github.com/rancher/rke2-charts/raw/main/assets/rke2-snapshot-controller/rke2-snapshot-controller-crd-1.7.202.tgz) | [1.7.302](https://github.com/rancher/rke2-charts/raw/main/assets/rke2-snapshot-validation-webhook/rke2-snapshot-validation-webhook-1.7.302.tgz) | [v1.27.9](https://github.com/kubernetes/kubernetes/blob/master/CHANGELOG/CHANGELOG-1.27.md#v1279) | [v3.5.9-k3s1](https://github.com/k3s-io/etcd/releases/tag/v3.5.9-k3s1) | [v1.7.11-k3s2](https://github.com/k3s-io/containerd/releases/tag/v1.7.11-k3s2) | [v1.1.10](https://github.com/opencontainers/runc/releases/tag/v1.1.10) | [v0.6.3](https://github.com/kubernetes-sigs/metrics-server/releases/tag/v0.6.3) | [v1.10.1](https://github.com/coredns/coredns/releases/tag/v1.10.1) | [nginx-1.9.3-hardened1](https://github.com/rancher/ingress-nginx/releases/tag/nginx-1.9.3-hardened1) | [v0.15.4](https://github.com/k3s-io/helm-controller/releases/tag/v0.15.4) | [Flannel v0.23.0](https://github.com/flannel-io/flannel/releases/tag/v0.23.0)<br/>[Calico v3.26.3](https://docs.tigera.io/calico/latest/release-notes/#v3.26) | [v3.26.3](https://docs.tigera.io/calico/latest/release-notes/#v3.26) | [v1.14.4](https://github.com/cilium/cilium/releases/tag/v1.14.4) | [v4.0.2](https://github.com/k8snetworkplumbingwg/multus-cni/releases/tag/v4.0.2)  |
| v1.27.8+rke2r1 | [1.14.400](https://github.com/rancher/rke2-charts/raw/main/assets/rke2-cilium/rke2-cilium-1.14.400.tgz) | [v3.26.3-build2023110900](https://github.com/rancher/rke2-charts/raw/main/assets/rke2-canal/rke2-canal-v3.26.3-build2023110900.tgz) | [v3.26.300](https://github.com/rancher/rke2-charts/raw/main/assets/rke2-calico/rke2-calico-v3.26.300.tgz) | [v3.26.300](https://github.com/rancher/rke2-charts/raw/main/assets/rke2-calico/rke2-calico-crd-v3.26.300.tgz) | [1.24.006](https://github.com/rancher/rke2-charts/raw/main/assets/rke2-coredns/rke2-coredns-1.24.006.tgz) | [4.8.200](https://github.com/rancher/rke2-charts/raw/main/assets/rke2-ingress-nginx/rke2-ingress-nginx-4.8.200.tgz) | [2.11.100-build2023051510](https://github.com/rancher/rke2-charts/raw/main/assets/rke2-metrics-server/rke2-metrics-server-2.11.100-build2023051510.tgz) | [3.0.1-rancher101](https://github.com/rancher/rke2-charts/raw/main/assets/rancher-vsphere-csi/rancher-vsphere-csi-3.0.1-rancher101.tgz) | [1.5.100](https://github.com/rancher/rke2-charts/raw/main/assets/rancher-vsphere-cpi/rancher-vsphere-cpi-1.5.100.tgz) | [0.2.200](https://github.com/rancher/rke2-charts/raw/main/assets/harvester-cloud-provider/harvester-cloud-provider-0.2.200.tgz) | [0.1.1600](https://github.com/rancher/rke2-charts/raw/main/assets/harvester-cloud-provider/harvester-csi-driver-0.1.1600.tgz) | [1.7.202](https://github.com/rancher/rke2-charts/raw/main/assets/rke2-snapshot-controller/rke2-snapshot-controller-1.7.202.tgz) | [1.7.202](https://github.com/rancher/rke2-charts/raw/main/assets/rke2-snapshot-controller/rke2-snapshot-controller-crd-1.7.202.tgz) | [1.7.302](https://github.com/rancher/rke2-charts/raw/main/assets/rke2-snapshot-validation-webhook/rke2-snapshot-validation-webhook-1.7.302.tgz) | [v1.27.8](https://github.com/kubernetes/kubernetes/blob/master/CHANGELOG/CHANGELOG-1.27.md#v1278) | [v3.5.9-k3s1](https://github.com/k3s-io/etcd/releases/tag/v3.5.9-k3s1) | [v1.7.7-k3s1](https://github.com/k3s-io/containerd/releases/tag/v1.7.7-k3s1) | [v1.1.8](https://github.com/opencontainers/runc/releases/tag/v1.1.8) | [v0.6.3](https://github.com/kubernetes-sigs/metrics-server/releases/tag/v0.6.3) | [v1.10.1](https://github.com/coredns/coredns/releases/tag/v1.10.1) | [nginx-1.9.3-hardened1](https://github.com/rancher/ingress-nginx/releases/tag/nginx-1.9.3-hardened1) | [v0.15.4](https://github.com/k3s-io/helm-controller/releases/tag/v0.15.4) | [Flannel v0.23.0](https://github.com/flannel-io/flannel/releases/tag/v0.23.0)<br/>[Calico v3.26.3](https://docs.tigera.io/calico/latest/release-notes/#v3.26) | [v3.26.3](https://docs.tigera.io/calico/latest/release-notes/#v3.26) | [v1.14.4](https://github.com/cilium/cilium/releases/tag/v1.14.4) | [v4.0.2](https://github.com/k8snetworkplumbingwg/multus-cni/releases/tag/v4.0.2)  |
| v1.27.7+rke2r2 | [v1.27.7](https://github.com/kubernetes/kubernetes/blob/master/CHANGELOG/CHANGELOG-1.27.md#v1277) | [v3.5.9-k3s1](https://github.com/k3s-io/etcd/releases/tag/v3.5.9-k3s1) | [v1.7.7-k3s1](https://github.com/k3s-io/containerd/releases/tag/v1.7.7-k3s1) | [v1.1.8](https://github.com/opencontainers/runc/releases/tag/v1.1.8) | [v0.6.3](https://github.com/kubernetes-sigs/metrics-server/releases/tag/v0.6.3) | [v1.10.1](https://github.com/coredns/coredns/releases/tag/v1.10.1) | [4.8.2](https://github.com/kubernetes/ingress-nginx/releases/tag/helm-chart-4.8.2) | [v0.15.4](https://github.com/k3s-io/helm-controller/releases/tag/v0.15.4) | [Flannel v0.22.1](https://github.com/flannel-io/flannel/releases/tag/v0.22.1)<br/>[Calico v3.26.1](https://docs.tigera.io/calico/latest/release-notes/#v3.26) | [v3.26.1](https://docs.tigera.io/calico/latest/release-notes/#v3.26) | [v1.14.2](https://github.com/cilium/cilium/releases/tag/v1.14.2) | [v4.0.2](https://github.com/k8snetworkplumbingwg/multus-cni/releases/tag/v4.0.2)  |
| v1.27.7+rke2r1 | [v1.27.7](https://github.com/kubernetes/kubernetes/blob/master/CHANGELOG/CHANGELOG-1.27.md#v1277) | [v3.5.9-k3s1](https://github.com/k3s-io/etcd/releases/tag/v3.5.9-k3s1) | [v1.7.7-k3s1](https://github.com/k3s-io/containerd/releases/tag/v1.7.7-k3s1) | [v1.1.8](https://github.com/opencontainers/runc/releases/tag/v1.1.8) | [v0.6.3](https://github.com/kubernetes-sigs/metrics-server/releases/tag/v0.6.3) | [v1.10.1](https://github.com/coredns/coredns/releases/tag/v1.10.1) | [4.8.2](https://github.com/kubernetes/ingress-nginx/releases/tag/helm-chart-4.8.2) | [v0.15.4](https://github.com/k3s-io/helm-controller/releases/tag/v0.15.4) | [Flannel v0.22.1](https://github.com/flannel-io/flannel/releases/tag/v0.22.1)<br/>[Calico v3.26.1](https://docs.tigera.io/calico/latest/release-notes/#v3.26) | [v3.26.1](https://docs.tigera.io/calico/latest/release-notes/#v3.26) | [v1.14.2](https://github.com/cilium/cilium/releases/tag/v1.14.2) | [v4.0.2](https://github.com/k8snetworkplumbingwg/multus-cni/releases/tag/v4.0.2)  |
| v1.27.6+rke2r1 | [v1.27.6](https://github.com/kubernetes/kubernetes/blob/master/CHANGELOG/CHANGELOG-1.27.md#v1276) | [v3.5.9-k3s1](https://github.com/k3s-io/etcd/releases/tag/v3.5.9-k3s1) | [v1.7.3-k3s1](https://github.com/k3s-io/containerd/releases/tag/v1.7.3-k3s1) | [v1.1.8](https://github.com/opencontainers/runc/releases/tag/v1.1.8) | [v0.6.3](https://github.com/kubernetes-sigs/metrics-server/releases/tag/v0.6.3) | [v1.10.1](https://github.com/coredns/coredns/releases/tag/v1.10.1) | [4.6.1](https://github.com/kubernetes/ingress-nginx/releases/tag/helm-chart-4.6.1) | [v0.15.4](https://github.com/k3s-io/helm-controller/releases/tag/v0.15.4) | [Flannel v0.22.1](https://github.com/flannel-io/flannel/releases/tag/v0.22.1)<br/>[Calico v3.26.1](https://docs.tigera.io/calico/latest/release-notes/#v3.26) | [v3.26.1](https://docs.tigera.io/calico/latest/release-notes/#v3.26) | [v1.14.1](https://github.com/cilium/cilium/releases/tag/v1.14.1) | [v4.0.2](https://github.com/k8snetworkplumbingwg/multus-cni/releases/tag/v4.0.2)  |
| v1.27.5+rke2r1 | [v1.27.5](https://github.com/kubernetes/kubernetes/blob/master/CHANGELOG/CHANGELOG-1.27.md#v1275) | [v3.5.9-k3s1](https://github.com/k3s-io/etcd/releases/tag/v3.5.9-k3s1) | [v1.7.3-k3s1](https://github.com/k3s-io/containerd/releases/tag/v1.7.3-k3s1) | [v1.1.8](https://github.com/opencontainers/runc/releases/tag/v1.1.8) | [v0.6.3](https://github.com/kubernetes-sigs/metrics-server/releases/tag/v0.6.3) | [v1.10.1](https://github.com/coredns/coredns/releases/tag/v1.10.1) | [4.6.1](https://github.com/kubernetes/ingress-nginx/releases/tag/helm-chart-4.6.1) | [v0.15.4](https://github.com/k3s-io/helm-controller/releases/tag/v0.15.4) | [Flannel v0.22.1](https://github.com/flannel-io/flannel/releases/tag/v0.22.1)<br/>[Calico v3.26.1](https://docs.tigera.io/calico/latest/release-notes/#v3.26) | [v3.26.1](https://docs.tigera.io/calico/latest/release-notes/#v3.26) | [v1.14.0](https://github.com/cilium/cilium/releases/tag/v1.14.0) | [v4.0.2](https://github.com/k8snetworkplumbingwg/multus-cni/releases/tag/v4.0.2)  |
| v1.27.4+rke2r1 | [v1.27.4](https://github.com/kubernetes/kubernetes/blob/master/CHANGELOG/CHANGELOG-1.27.md#v1274) | [v3.5.7-k3s1](https://github.com/k3s-io/etcd/releases/tag/v3.5.7-k3s1) | [v1.7.1-k3s1](https://github.com/k3s-io/containerd/releases/tag/v1.7.1-k3s1) | [v1.1.7](https://github.com/opencontainers/runc/releases/tag/v1.1.7) | [v0.6.3](https://github.com/kubernetes-sigs/metrics-server/releases/tag/v0.6.3) | [v1.10.1](https://github.com/coredns/coredns/releases/tag/v1.10.1) | [4.6.1](https://github.com/kubernetes/ingress-nginx/releases/tag/helm-chart-4.6.1) | [v0.15.2](https://github.com/k3s-io/helm-controller/releases/tag/v0.15.2) | [Flannel v0.22.0](https://github.com/flannel-io/flannel/releases/tag/v0.22.0)<br/>[Calico v3.25.1](https://projectcalico.docs.tigera.io/archive/v3.25/release-notes/#v3251) | [v3.26.1](https://projectcalico.docs.tigera.io/archive/v3.26/release-notes/#v3261) | [v1.13.2](https://github.com/cilium/cilium/releases/tag/v1.13.2) | [v4.0.2](https://github.com/k8snetworkplumbingwg/multus-cni/releases/tag/v4.0.2)  |
| v1.27.3+rke2r1 | [v1.27.3](https://github.com/kubernetes/kubernetes/blob/master/CHANGELOG/CHANGELOG-1.27.md#v1273) | [v3.5.7-k3s1](https://github.com/k3s-io/etcd/releases/tag/v3.5.7-k3s1) | [v1.7.1-k3s1](https://github.com/k3s-io/containerd/releases/tag/v1.7.1-k3s1) | [v1.1.7](https://github.com/opencontainers/runc/releases/tag/v1.1.7) | [v0.6.3](https://github.com/kubernetes-sigs/metrics-server/releases/tag/v0.6.3) | [v1.10.1](https://github.com/coredns/coredns/releases/tag/v1.10.1) | [4.5.2](https://github.com/kubernetes/ingress-nginx/releases/tag/helm-chart-4.5.2) | [v0.15.0](https://github.com/k3s-io/helm-controller/releases/tag/v0.15.0) | [Flannel v0.22.0](https://github.com/k3s-io/flannel/releases/tag/v0.22.0)<br/>[Calico v3.25.1](https://projectcalico.docs.tigera.io/archive/v3.25/release-notes/#v3251) | [v3.25.0](https://projectcalico.docs.tigera.io/archive/v3.25/release-notes/#v3250) | [v1.13.2](https://github.com/cilium/cilium/releases/tag/v1.13.2) | [v3.9.3](https://github.com/k8snetworkplumbingwg/multus-cni/releases/tag/v3.9.3)  |
| v1.27.2+rke2r1 | [v1.27.2](https://github.com/kubernetes/kubernetes/blob/master/CHANGELOG/CHANGELOG-1.27.md#v1272) | [v3.5.7-k3s1](https://github.com/k3s-io/etcd/releases/tag/v3.5.7-k3s1) | [v1.7.1-k3s1](https://github.com/k3s-io/containerd/releases/tag/v1.7.1-k3s1) | [v1.1.7](https://github.com/opencontainers/runc/releases/tag/v1.1.7) | [v0.6.3](https://github.com/kubernetes-sigs/metrics-server/releases/tag/v0.6.3) | [v1.10.1](https://github.com/coredns/coredns/releases/tag/v1.10.1) | [4.5.2](https://github.com/kubernetes/ingress-nginx/releases/tag/helm-chart-4.5.2) | [v0.14.0](https://github.com/k3s-io/helm-controller/releases/tag/v0.14.0) | [Flannel v0.21.3](https://github.com/k3s-io/flannel/releases/tag/v0.21.3)<br/>[Calico v3.25.1](https://projectcalico.docs.tigera.io/archive/v3.25/release-notes/#v3251) | [v3.25.0](https://projectcalico.docs.tigera.io/archive/v3.25/release-notes/#v3250) | [v1.13.2](https://github.com/cilium/cilium/releases/tag/v1.13.2) | [v3.9.3](https://github.com/k8snetworkplumbingwg/multus-cni/releases/tag/v3.9.3)  |
| v1.27.1+rke2r1 | [v1.27.1](https://github.com/kubernetes/kubernetes/blob/master/CHANGELOG/CHANGELOG-1.27.md#v1271) | [v3.5.7-k3s1](https://github.com/k3s-io/etcd/releases/tag/v3.5.7-k3s1) | [v1.6.19-k3s1](https://github.com/k3s-io/containerd/releases/tag/v1.6.19-k3s1) | [v1.1.5](https://github.com/opencontainers/runc/releases/tag/v1.1.5) | [v0.6.2](https://github.com/kubernetes-sigs/metrics-server/releases/tag/v0.6.2) | [v1.10.1](https://github.com/coredns/coredns/releases/tag/v1.10.1) | [4.5.2](https://github.com/kubernetes/ingress-nginx/releases/tag/helm-chart-4.5.2) | [v0.13.2](https://github.com/k3s-io/helm-controller/releases/tag/v0.13.2) | [Flannel v0.21.3](https://github.com/k3s-io/flannel/releases/tag/v0.21.3)<br/>[Calico v3.25.0](https://projectcalico.docs.tigera.io/archive/v3.25/release-notes/#v3250) | [v3.25.0](https://projectcalico.docs.tigera.io/archive/v3.25/release-notes/#v3250) | [v1.13.0](https://github.com/cilium/cilium/releases/tag/v1.13.0) | [v3.9.3](https://github.com/k8snetworkplumbingwg/multus-cni/releases/tag/v3.9.3)  |



| Version | Release date | US date | EU date | Upstream release date | US date | EU date | Days since upstream |
| ----- | ----- | ----- | ----- | ----- | ----- | ----- | ----- |
| [v1.27.16+rke2r2](rke2-v1.27.md#release-v12716rke2r2) | Aug 26 2024 | 08/26/24 | 2024-08-26 | Jul 17 2024 | 07/17/24 | 2024-07-17 | 40 days |
| [v1.27.16+rke2r1](rke2-v1.27.md#release-v12716rke2r1) | Aug 01 2024 | 08/01/24 | 2024-08-01 | Jul 17 2024 | 07/17/24 | 2024-07-17 | 15 days |
| [v1.27.15+rke2r1](rke2-v1.27.md#release-v12715rke2r1) | Jul 01 2024 | 07/01/24 | 2024-07-01 | Jun 11 2024 | 06/11/24 | 2024-06-11 | 20 days |
| [v1.27.14+rke2r1](rke2-v1.27.md#release-v12714rke2r1) | May 22 2024 | 05/22/24 | 2024-05-22 | May 15 2024 | 05/15/24 | 2024-05-15 | 7 days |
| [v1.27.13+rke2r1](rke2-v1.27.md#release-v12713rke2r1) | Apr 29 2024 | 04/29/24 | 2024-04-29 | Apr 16 2024 | 04/16/24 | 2024-04-16 | 13 days |
| [v1.27.12+rke2r1](rke2-v1.27.md#release-v12712rke2r1) | Mar 20 2024 | 03/20/24 | 2024-03-20 | Mar 15 2024 | 03/15/24 | 2024-03-15 | 5 days |
| [v1.27.11+rke2r1](rke2-v1.27.md#release-v12711rke2r1) | Feb 29 2024 | 02/29/24 | 2024-02-29 | Feb 14 2024 | 02/14/24 | 2024-02-14 | 15 days |
| [v1.27.10+rke2r1](rke2-v1.27.md#release-v12710rke2r1) | Feb 06 2024 | 02/06/24 | 2024-02-06 | Jan 17 2024 | 01/17/24 | 2024-01-17 | 20 days |
| [v1.27.9+rke2r1](rke2-v1.27.md#release-v1279rke2r1) | Dec 26 2023 | 12/26/23 | 2023-12-26 | Dec 20 2023 | 12/20/23 | 2023-12-20 | 6 days |
| [v1.27.8+rke2r1](rke2-v1.27.md#release-v1278rke2r1) | Dec 05 2023 | 12/05/23 | 2023-12-05 | Nov 15 2023 | 11/15/23 | 2023-11-15 | 20 days |
| [v1.27.7+rke2r2](rke2-v1.27.md#release-v1277rke2r2) | Nov 08 2023 | 11/08/23 | 2023-11-08 | Oct 18 2023 | 10/18/23 | 2023-10-18 | 21 days |
| [v1.27.7+rke2r1](rke2-v1.27.md#release-v1277rke2r1) | Oct 31 2023 | 10/31/23 | 2023-10-31 | Oct 18 2023 | 10/18/23 | 2023-10-18 | 13 days |
| [v1.27.6+rke2r1](rke2-v1.27.md#release-v1276rke2r1) | Sep 18 2023 | 09/18/23 | 2023-09-18 | Sep 13 2023 | 09/13/23 | 2023-09-13 | 5 days |
| [v1.27.5+rke2r1](rke2-v1.27.md#release-v1275rke2r1) | Sep 06 2023 | 09/06/23 | 2023-09-06 | Aug 24 2023 | 08/24/23 | 2023-08-24 | 13 days |
| [v1.27.4+rke2r1](rke2-v1.27.md#release-v1274rke2r1) | Jul 28 2023 | 07/28/23 | 2023-07-28 | Jul 19 2023 | 07/19/23 | 2023-07-19 | 9 days |
| [v1.27.3+rke2r1](rke2-v1.27.md#release-v1273rke2r1) | Jun 27 2023 | 06/27/23 | 2023-06-27 | Jun 14 2023 | 06/14/23 | 2023-06-14 | 13 days |
| [v1.27.2+rke2r1](rke2-v1.27.md#release-v1272rke2r1) | May 30 2023 | 05/30/23 | 2023-05-30 | May 17 2023 | 05/17/23 | 2023-05-17 | 13 days |
| [v1.27.1+rke2r1](rke2-v1.27.md#release-v1271rke2r1) | Apr 27 2023 | 04/27/23 | 2023-04-27 | Apr 14 2023 | 04/14/23 | 2023-04-14 | 13 days |



# Release v1.27.16+rke2r2
<!-- v1.27.16+rke2r2 -->

This release updates Kubernetes to v1.27.16.

**Important Note**

If your server (control-plane) nodes were not started with the `--token` CLI flag or config file key, a randomized token was generated during initial cluster startup. This key is used both for joining new nodes to the cluster, and for encrypting cluster bootstrap data within the datastore. Ensure that you retain a copy of this token, as is required when restoring from backup.

You may retrieve the token value from any server already joined to the cluster:
```bash
cat /var/lib/rancher/rke2/server/token
```

## Changes since v1.27.16+rke2r1:

* Bump nginx to hardened2 [(#6479)](https://github.com/rancher/rke2/pull/6479)
* Update for CNI flannel, Cilium and Canal [(#6518)](https://github.com/rancher/rke2/pull/6518)
* Bump k3s and containerd [(#6527)](https://github.com/rancher/rke2/pull/6527)
* Fixed hns clean only in case of reboot [(#6541)](https://github.com/rancher/rke2/pull/6541)
* Bump containerd/crictl/runc versions [(#6555)](https://github.com/rancher/rke2/pull/6555)
* Fix for kill all to not delete the data dir [(#6566)](https://github.com/rancher/rke2/pull/6566)
* Fix windows airgap image packaging [(#6588)](https://github.com/rancher/rke2/pull/6588)
* Fixed Flannel chart to rightly disable nft [(#6610)](https://github.com/rancher/rke2/pull/6610)
* Bump ingress-nginx to v1.10.4-hardened2 [(#6614)](https://github.com/rancher/rke2/pull/6614)
* Shell completion and etcd connection fix [(#6615)](https://github.com/rancher/rke2/pull/6615)
* Update Kubernetes v1.27.16 to build 20240819 [(#6589)](https://github.com/rancher/rke2/pull/6589)
* Bump harvester csi driver v0.1.18 [(#6618)](https://github.com/rancher/rke2/pull/6618)
  * Bump Harvester-csi-driver v0.1.18


## Charts Versions
| Component | Version |
| --- | --- |
| rke2-cilium | [1.16.000](https://github.com/rancher/rke2-charts/raw/main/assets/rke2-cilium/rke2-cilium-1.16.000.tgz) |
| rke2-canal | [v3.28.1-build2024080600](https://github.com/rancher/rke2-charts/raw/main/assets/rke2-canal/rke2-canal-v3.28.1-build2024080600.tgz) |
| rke2-calico | [v3.27.300](https://github.com/rancher/rke2-charts/raw/main/assets/rke2-calico/rke2-calico-v3.27.300.tgz) |
| rke2-calico-crd | [v3.27.002](https://github.com/rancher/rke2-charts/raw/main/assets/rke2-calico/rke2-calico-crd-v3.27.002.tgz) |
| rke2-coredns | [1.29.002](https://github.com/rancher/rke2-charts/raw/main/assets/rke2-coredns/rke2-coredns-1.29.002.tgz) |
| rke2-ingress-nginx | [4.10.401](https://github.com/rancher/rke2-charts/raw/main/assets/rke2-ingress-nginx/rke2-ingress-nginx-4.10.401.tgz) |
| rke2-metrics-server | [3.12.002](https://github.com/rancher/rke2-charts/raw/main/assets/rke2-metrics-server/rke2-metrics-server-3.12.002.tgz) |
| rancher-vsphere-csi | [3.3.0-rancher100](https://github.com/rancher/rke2-charts/raw/main/assets/rancher-vsphere-csi/rancher-vsphere-csi-3.3.0-rancher100.tgz) |
| rancher-vsphere-cpi | [1.8.000](https://github.com/rancher/rke2-charts/raw/main/assets/rancher-vsphere-cpi/rancher-vsphere-cpi-1.8.000.tgz) |
| harvester-cloud-provider | [0.2.400](https://github.com/rancher/rke2-charts/raw/main/assets/harvester-cloud-provider/harvester-cloud-provider-0.2.400.tgz) |
| harvester-csi-driver | [0.1.1800](https://github.com/rancher/rke2-charts/raw/main/assets/harvester-cloud-provider/harvester-csi-driver-0.1.1800.tgz) |
| rke2-snapshot-controller | [1.7.202](https://github.com/rancher/rke2-charts/raw/main/assets/rke2-snapshot-controller/rke2-snapshot-controller-1.7.202.tgz) |
| rke2-snapshot-controller-crd | [1.7.202](https://github.com/rancher/rke2-charts/raw/main/assets/rke2-snapshot-controller/rke2-snapshot-controller-crd-1.7.202.tgz) |
| rke2-snapshot-validation-webhook | [1.7.302](https://github.com/rancher/rke2-charts/raw/main/assets/rke2-snapshot-validation-webhook/rke2-snapshot-validation-webhook-1.7.302.tgz) |


## Packaged Component Versions
| Component | Version |
| --- | --- |
| Kubernetes | [v1.27.16](https://github.com/kubernetes/kubernetes/blob/master/CHANGELOG/CHANGELOG-1.27.md#v12716) |
| Etcd | [v3.5.13-k3s1](https://github.com/k3s-io/etcd/releases/tag/v3.5.13-k3s1) |
| Containerd | [v1.7.20-k3s1](https://github.com/k3s-io/containerd/releases/tag/v1.7.20-k3s1) |
| Runc | [v1.1.12](https://github.com/opencontainers/runc/releases/tag/v1.1.12) |
| Metrics-server | [v0.7.1](https://github.com/kubernetes-sigs/metrics-server/releases/tag/v0.7.1) |
| CoreDNS | [v1.11.1](https://github.com/coredns/coredns/releases/tag/v1.11.1) |
| Ingress-Nginx | [v1.10.4-hardened2](https://github.com/rancher/ingress-nginx/releases/tag/v1.10.4-hardened2) |
| Helm-controller | [v0.15.10](https://github.com/k3s-io/helm-controller/releases/tag/v0.15.10) |

### Available CNIs
| Component | Version | FIPS Compliant |
| --- | --- | --- |
| Canal (Default) | [Flannel v0.25.5](https://github.com/flannel-io/flannel/releases/tag/v0.25.5)<br/>[Calico v3.28.1](https://docs.tigera.io/calico/latest/release-notes/#v3.28) | Yes |
| Calico | [v3.27.3](https://docs.tigera.io/calico/latest/release-notes/#v3.27) | No |
| Cilium | [v1.16.0](https://github.com/cilium/cilium/releases/tag/v1.16.0) | No |
| Multus | [v4.0.2](https://github.com/k8snetworkplumbingwg/multus-cni/releases/tag/v4.0.2) | No |

## Helpful Links

As always, we welcome and appreciate feedback from our community of users. Please feel free to:
- [Open issues here](https://github.com/rancher/rke2/issues/new)
- [Join our Slack channel](https://slack.rancher.io/)
- [Check out our documentation](https://docs.rke2.io) for guidance on how to get started.
-----
# Release v1.27.16+rke2r1
<!-- v1.27.16+rke2r1 -->

This release updates Kubernetes to v1.27.16.

**Important Note**

If your server (control-plane) nodes were not started with the `--token` CLI flag or config file key, a randomized token was generated during initial cluster startup. This key is used both for joining new nodes to the cluster, and for encrypting cluster bootstrap data within the datastore. Ensure that you retain a copy of this token, as is required when restoring from backup.

You may retrieve the token value from any server already joined to the cluster:
```bash
cat /var/lib/rancher/rke2/server/token
```

## Changes since v1.27.15+rke2r1:

* GHA Migration [(#6295)](https://github.com/rancher/rke2/pull/6295)
* Bump multus to v4.0.206 [(#6347)](https://github.com/rancher/rke2/pull/6347)
* Bump vsphere csi chart to 3.3.0-rancher100 and cpi to 1.8.000 [(#6344)](https://github.com/rancher/rke2/pull/6344)
* Version bumps and backports for 2024-07 release cycle [(#6320)](https://github.com/rancher/rke2/pull/6320)
* Fix secrets for commit id uploads [(#6369)](https://github.com/rancher/rke2/pull/6369)
* Update Kubernetes to v1.27.16 [(#6361)](https://github.com/rancher/rke2/pull/6361)
* Publish binaries in dapper [(#6382)](https://github.com/rancher/rke2/pull/6382)
* Add missing package windows step in release [(#6391)](https://github.com/rancher/rke2/pull/6391)
* Add manifest pipeline for rke2-runtime docker image [(#6401)](https://github.com/rancher/rke2/pull/6401)
* Fix dispatch script [(#6409)](https://github.com/rancher/rke2/pull/6409)


## Charts Versions
| Component | Version |
| --- | --- |
| rke2-cilium | [1.15.500](https://github.com/rancher/rke2-charts/raw/main/assets/rke2-cilium/rke2-cilium-1.15.500.tgz) |
| rke2-canal | [v3.28.0-build2024062503](https://github.com/rancher/rke2-charts/raw/main/assets/rke2-canal/rke2-canal-v3.28.0-build2024062503.tgz) |
| rke2-calico | [v3.27.300](https://github.com/rancher/rke2-charts/raw/main/assets/rke2-calico/rke2-calico-v3.27.300.tgz) |
| rke2-calico-crd | [v3.27.002](https://github.com/rancher/rke2-charts/raw/main/assets/rke2-calico/rke2-calico-crd-v3.27.002.tgz) |
| rke2-coredns | [1.29.002](https://github.com/rancher/rke2-charts/raw/main/assets/rke2-coredns/rke2-coredns-1.29.002.tgz) |
| rke2-ingress-nginx | [4.10.102](https://github.com/rancher/rke2-charts/raw/main/assets/rke2-ingress-nginx/rke2-ingress-nginx-4.10.102.tgz) |
| rke2-metrics-server | [3.12.002](https://github.com/rancher/rke2-charts/raw/main/assets/rke2-metrics-server/rke2-metrics-server-3.12.002.tgz) |
| rancher-vsphere-csi | [3.3.0-rancher100](https://github.com/rancher/rke2-charts/raw/main/assets/rancher-vsphere-csi/rancher-vsphere-csi-3.3.0-rancher100.tgz) |
| rancher-vsphere-cpi | [1.8.000](https://github.com/rancher/rke2-charts/raw/main/assets/rancher-vsphere-cpi/rancher-vsphere-cpi-1.8.000.tgz) |
| harvester-cloud-provider | [0.2.400](https://github.com/rancher/rke2-charts/raw/main/assets/harvester-cloud-provider/harvester-cloud-provider-0.2.400.tgz) |
| harvester-csi-driver | [0.1.1700](https://github.com/rancher/rke2-charts/raw/main/assets/harvester-cloud-provider/harvester-csi-driver-0.1.1700.tgz) |
| rke2-snapshot-controller | [1.7.202](https://github.com/rancher/rke2-charts/raw/main/assets/rke2-snapshot-controller/rke2-snapshot-controller-1.7.202.tgz) |
| rke2-snapshot-controller-crd | [1.7.202](https://github.com/rancher/rke2-charts/raw/main/assets/rke2-snapshot-controller/rke2-snapshot-controller-crd-1.7.202.tgz) |
| rke2-snapshot-validation-webhook | [1.7.302](https://github.com/rancher/rke2-charts/raw/main/assets/rke2-snapshot-validation-webhook/rke2-snapshot-validation-webhook-1.7.302.tgz) |


## Packaged Component Versions
| Component | Version |
| --- | --- |
| Kubernetes | [v1.27.16](https://github.com/kubernetes/kubernetes/blob/master/CHANGELOG/CHANGELOG-1.27.md#v12716) |
| Etcd | [v3.5.13-k3s1](https://github.com/k3s-io/etcd/releases/tag/v3.5.13-k3s1) |
| Containerd | [v1.7.17-k3s1](https://github.com/k3s-io/containerd/releases/tag/v1.7.17-k3s1) |
| Runc | [v1.1.12](https://github.com/opencontainers/runc/releases/tag/v1.1.12) |
| Metrics-server | [v0.7.1](https://github.com/kubernetes-sigs/metrics-server/releases/tag/v0.7.1) |
| CoreDNS | [v1.11.1](https://github.com/coredns/coredns/releases/tag/v1.11.1) |
| Ingress-Nginx | [v1.10.1-hardened1](https://github.com/rancher/ingress-nginx/releases/tag/v1.10.1-hardened1) |
| Helm-controller | [v0.15.10](https://github.com/k3s-io/helm-controller/releases/tag/v0.15.10) |

### Available CNIs
| Component | Version | FIPS Compliant |
| --- | --- | --- |
| Canal (Default) | [Flannel v0.25.4](https://github.com/flannel-io/flannel/releases/tag/v0.25.4)<br/>[Calico v3.28.0](https://docs.tigera.io/calico/latest/release-notes/#v3.28) | Yes |
| Calico | [v3.27.3](https://docs.tigera.io/calico/latest/release-notes/#v3.27) | No |
| Cilium | [v1.15.5](https://github.com/cilium/cilium/releases/tag/v1.15.5) | No |
| Multus | [v4.0.2](https://github.com/k8snetworkplumbingwg/multus-cni/releases/tag/v4.0.2) | No |

## Helpful Links

As always, we welcome and appreciate feedback from our community of users. Please feel free to:
- [Open issues here](https://github.com/rancher/rke2/issues/new)
- [Join our Slack channel](https://slack.rancher.io/)
- [Check out our documentation](https://docs.rke2.io) for guidance on how to get started.
-----
# Release v1.27.15+rke2r1
<!-- v1.27.15+rke2r1 -->

This release updates Kubernetes to v1.27.15.

**Important Note**

If your server (control-plane) nodes were not started with the `--token` CLI flag or config file key, a randomized token was generated during initial cluster startup. This key is used both for joining new nodes to the cluster, and for encrypting cluster bootstrap data within the datastore. Ensure that you retain a copy of this token, as is required when restoring from backup.

You may retrieve the token value from any server already joined to the cluster:
```bash
cat /var/lib/rancher/rke2/server/token
```

## Changes since v1.27.14+rke2r1:

* Improve rke2-uninstall.ps1 script [(#5962)](https://github.com/rancher/rke2/pull/5962)
* Update flannel chart to fix vni error (#5953) [(#5998)](https://github.com/rancher/rke2/pull/5998)
* Update cloud-provider image which now uses scratch as base (#5933) [(#5988)](https://github.com/rancher/rke2/pull/5988)
* Add cilium no proxy e2e test (#5885) [(#5968)](https://github.com/rancher/rke2/pull/5968)
* Add extra log in e2e tests [(#6021)](https://github.com/rancher/rke2/pull/6021)
* Bump flannel to v0.25.201 and canal to v3.28.0-build2024052800 [(#6049)](https://github.com/rancher/rke2/pull/6049)
* Add a Kine fix when rke2 restart apiserver [(#6006)](https://github.com/rancher/rke2/pull/6006)
* Bump multus and whereabouts version (#6015) [(#6037)](https://github.com/rancher/rke2/pull/6037)
* Bump harvester-cloud-provider v0.2.4 [(#5983)](https://github.com/rancher/rke2/pull/5983)
* Version bumps and backports for 2024-06 release cycle [(#6083)](https://github.com/rancher/rke2/pull/6083)
* Add easy support for single node sqlite with kine [(#6070)](https://github.com/rancher/rke2/pull/6070)
* Bump nginx to 1.10.1 [(#6057)](https://github.com/rancher/rke2/pull/6057)
* Bump K3s version for v1.27 [(#6114)](https://github.com/rancher/rke2/pull/6114)
* Bump containerd to correctly built tag [(#6129)](https://github.com/rancher/rke2/pull/6129)
* Bump flannel version [(#6124)](https://github.com/rancher/rke2/pull/6124)
* Update to the latest SR-IOV image versions [(#6149)](https://github.com/rancher/rke2/pull/6149)
* Bump flannel image in rke2-canal [(#6154)](https://github.com/rancher/rke2/pull/6154)
* Use `rancher/permissions` dependency [(#6141)](https://github.com/rancher/rke2/pull/6141)
* Bump K3s version for v1.27 [(#6167)](https://github.com/rancher/rke2/pull/6167)
* Improve rke2-uninstall.ps1 [(#6134)](https://github.com/rancher/rke2/pull/6134)
* June Testing Backports [(#6157)](https://github.com/rancher/rke2/pull/6157)
  * Fix loadManifests function
  * Slim down E2E artifacts
  * Support MixedOS E2E local testing
  * Add custom golang setup action for better caching
* Update flannel version to v0.25.4 [(#6179)](https://github.com/rancher/rke2/pull/6179)
* Update Kubernetes to v1.27.15 [(#6188)](https://github.com/rancher/rke2/pull/6188)
* Fix drone pipeline [(#6196)](https://github.com/rancher/rke2/pull/6196)
* Update drone build base image [(#6203)](https://github.com/rancher/rke2/pull/6203)
* Bump K3s version for v1.27 to fix regression in agent's supervisor port [(#6207)](https://github.com/rancher/rke2/pull/6207)
* Bump rke2-ingress-nginx chart to revert watchIngressWithoutClass default [(#6219)](https://github.com/rancher/rke2/pull/6219)
* Update hardened kubernetes [(#6222)](https://github.com/rancher/rke2/pull/6222)
* Bump K3s version for snapshot fix [(#6233)](https://github.com/rancher/rke2/pull/6233)
  * Fix issue that allowed multiple simultaneous snapshots to be allowed
* Revert rke2-ingress-nginx bump back to v1.9.6 [(#6242)](https://github.com/rancher/rke2/pull/6242)
* Reinstate newest rke2-ingress-nginx [(#6255)](https://github.com/rancher/rke2/pull/6255)
* Update calico image to v3.28.0-build20240625 [(#6260)](https://github.com/rancher/rke2/pull/6260)


## Charts Versions
| Component | Version |
| --- | --- |
| rke2-cilium | [1.15.500](https://github.com/rancher/rke2-charts/raw/main/assets/rke2-cilium/rke2-cilium-1.15.500.tgz) |
| rke2-canal | [v3.28.0-build2024062503](https://github.com/rancher/rke2-charts/raw/main/assets/rke2-canal/rke2-canal-v3.28.0-build2024062503.tgz) |
| rke2-calico | [v3.27.300](https://github.com/rancher/rke2-charts/raw/main/assets/rke2-calico/rke2-calico-v3.27.300.tgz) |
| rke2-calico-crd | [v3.27.002](https://github.com/rancher/rke2-charts/raw/main/assets/rke2-calico/rke2-calico-crd-v3.27.002.tgz) |
| rke2-coredns | [1.29.002](https://github.com/rancher/rke2-charts/raw/main/assets/rke2-coredns/rke2-coredns-1.29.002.tgz) |
| rke2-ingress-nginx | [4.10.101](https://github.com/rancher/rke2-charts/raw/main/assets/rke2-ingress-nginx/rke2-ingress-nginx-4.10.101.tgz) |
| rke2-metrics-server | [3.12.002](https://github.com/rancher/rke2-charts/raw/main/assets/rke2-metrics-server/rke2-metrics-server-3.12.002.tgz) |
| rancher-vsphere-csi | [3.1.2-rancher400](https://github.com/rancher/rke2-charts/raw/main/assets/rancher-vsphere-csi/rancher-vsphere-csi-3.1.2-rancher400.tgz) |
| rancher-vsphere-cpi | [1.7.001](https://github.com/rancher/rke2-charts/raw/main/assets/rancher-vsphere-cpi/rancher-vsphere-cpi-1.7.001.tgz) |
| harvester-cloud-provider | [0.2.400](https://github.com/rancher/rke2-charts/raw/main/assets/harvester-cloud-provider/harvester-cloud-provider-0.2.400.tgz) |
| harvester-csi-driver | [0.1.1700](https://github.com/rancher/rke2-charts/raw/main/assets/harvester-cloud-provider/harvester-csi-driver-0.1.1700.tgz) |
| rke2-snapshot-controller | [1.7.202](https://github.com/rancher/rke2-charts/raw/main/assets/rke2-snapshot-controller/rke2-snapshot-controller-1.7.202.tgz) |
| rke2-snapshot-controller-crd | [1.7.202](https://github.com/rancher/rke2-charts/raw/main/assets/rke2-snapshot-controller/rke2-snapshot-controller-crd-1.7.202.tgz) |
| rke2-snapshot-validation-webhook | [1.7.302](https://github.com/rancher/rke2-charts/raw/main/assets/rke2-snapshot-validation-webhook/rke2-snapshot-validation-webhook-1.7.302.tgz) |


## Packaged Component Versions
| Component | Version |
| --- | --- |
| Kubernetes | [v1.27.15](https://github.com/kubernetes/kubernetes/blob/master/CHANGELOG/CHANGELOG-1.27.md#v12715) |
| Etcd | [v3.5.13-k3s1](https://github.com/k3s-io/etcd/releases/tag/v3.5.13-k3s1) |
| Containerd | [v1.7.17-k3s1](https://github.com/k3s-io/containerd/releases/tag/v1.7.17-k3s1) |
| Runc | [v1.1.12](https://github.com/opencontainers/runc/releases/tag/v1.1.12) |
| Metrics-server | [v0.7.1](https://github.com/kubernetes-sigs/metrics-server/releases/tag/v0.7.1) |
| CoreDNS | [v1.11.1](https://github.com/coredns/coredns/releases/tag/v1.11.1) |
| Ingress-Nginx | [v1.10.1-hardened1](https://github.com/rancher/ingress-nginx/releases/tag/v1.10.1-hardened1) |
| Helm-controller | [v0.15.10](https://github.com/k3s-io/helm-controller/releases/tag/v0.15.10) |

### Available CNIs
| Component | Version | FIPS Compliant |
| --- | --- | --- |
| Canal (Default) | [Flannel v0.25.4](https://github.com/flannel-io/flannel/releases/tag/v0.25.4)<br/>[Calico v3.28.0](https://docs.tigera.io/calico/latest/release-notes/#v3.28) | Yes |
| Calico | [v3.27.3](https://docs.tigera.io/calico/latest/release-notes/#v3.27) | No |
| Cilium | [v1.15.5](https://github.com/cilium/cilium/releases/tag/v1.15.5) | No |
| Multus | [v4.0.2](https://github.com/k8snetworkplumbingwg/multus-cni/releases/tag/v4.0.2) | No |

## Helpful Links

As always, we welcome and appreciate feedback from our community of users. Please feel free to:
- [Open issues here](https://github.com/rancher/rke2/issues/new)
- [Join our Slack channel](https://slack.rancher.io/)
- [Check out our documentation](https://docs.rke2.io) for guidance on how to get started.
-----
# Release v1.27.14+rke2r1
<!-- v1.27.14+rke2r1 -->

This release updates Kubernetes to v1.27.14.

**Important Note**

If your server (control-plane) nodes were not started with the `--token` CLI flag or config file key, a randomized token was generated during initial cluster startup. This key is used both for joining new nodes to the cluster, and for encrypting cluster bootstrap data within the datastore. Ensure that you retain a copy of this token, as is required when restoring from backup.

You may retrieve the token value from any server already joined to the cluster:
```bash
cat /var/lib/rancher/rke2/server/token
```

## Changes since v1.27.13+rke2r1:

* Add mixedos BGP e2e test [(#5874)](https://github.com/rancher/rke2/pull/5874)
* Remove flannel-v6.4096 when rke2-killall.sh [(#5878)](https://github.com/rancher/rke2/pull/5878)
* Unit, Integration and Install Testing Overhaul [(#5797)](https://github.com/rancher/rke2/pull/5797)
* Remove cni parameter from agent config [(#5894)](https://github.com/rancher/rke2/pull/5894)
* Add script to validate flannel versions [(#5897)](https://github.com/rancher/rke2/pull/5897)
* Fix mixedosbgp e2e test [(#5904)](https://github.com/rancher/rke2/pull/5904)
* E2E test backports [(#5906)](https://github.com/rancher/rke2/pull/5906)
* Update k8s v1.27.14 [(#5916)](https://github.com/rancher/rke2/pull/5916)
* Windows changes [(#5920)](https://github.com/rancher/rke2/pull/5920)
* Cilium version bump to 1.15.5 [(#5941)](https://github.com/rancher/rke2/pull/5941)


## Charts Versions
| Component | Version |
| --- | --- |
| rke2-cilium | [1.15.500](https://github.com/rancher/rke2-charts/raw/main/assets/rke2-cilium/rke2-cilium-1.15.500.tgz) |
| rke2-canal | [v3.27.3-build2024042301](https://github.com/rancher/rke2-charts/raw/main/assets/rke2-canal/rke2-canal-v3.27.3-build2024042301.tgz) |
| rke2-calico | [v3.27.300](https://github.com/rancher/rke2-charts/raw/main/assets/rke2-calico/rke2-calico-v3.27.300.tgz) |
| rke2-calico-crd | [v3.27.002](https://github.com/rancher/rke2-charts/raw/main/assets/rke2-calico/rke2-calico-crd-v3.27.002.tgz) |
| rke2-coredns | [1.29.002](https://github.com/rancher/rke2-charts/raw/main/assets/rke2-coredns/rke2-coredns-1.29.002.tgz) |
| rke2-ingress-nginx | [4.9.100](https://github.com/rancher/rke2-charts/raw/main/assets/rke2-ingress-nginx/rke2-ingress-nginx-4.9.100.tgz) |
| rke2-metrics-server | [3.12.002](https://github.com/rancher/rke2-charts/raw/main/assets/rke2-metrics-server/rke2-metrics-server-3.12.002.tgz) |
| rancher-vsphere-csi | [3.1.2-rancher400](https://github.com/rancher/rke2-charts/raw/main/assets/rancher-vsphere-csi/rancher-vsphere-csi-3.1.2-rancher400.tgz) |
| rancher-vsphere-cpi | [1.7.001](https://github.com/rancher/rke2-charts/raw/main/assets/rancher-vsphere-cpi/rancher-vsphere-cpi-1.7.001.tgz) |
| harvester-cloud-provider | [0.2.300](https://github.com/rancher/rke2-charts/raw/main/assets/harvester-cloud-provider/harvester-cloud-provider-0.2.300.tgz) |
| harvester-csi-driver | [0.1.1700](https://github.com/rancher/rke2-charts/raw/main/assets/harvester-cloud-provider/harvester-csi-driver-0.1.1700.tgz) |
| rke2-snapshot-controller | [1.7.202](https://github.com/rancher/rke2-charts/raw/main/assets/rke2-snapshot-controller/rke2-snapshot-controller-1.7.202.tgz) |
| rke2-snapshot-controller-crd | [1.7.202](https://github.com/rancher/rke2-charts/raw/main/assets/rke2-snapshot-controller/rke2-snapshot-controller-crd-1.7.202.tgz) |
| rke2-snapshot-validation-webhook | [1.7.302](https://github.com/rancher/rke2-charts/raw/main/assets/rke2-snapshot-validation-webhook/rke2-snapshot-validation-webhook-1.7.302.tgz) |


## Packaged Component Versions
| Component | Version |
| --- | --- |
| Kubernetes | [v1.27.14](https://github.com/kubernetes/kubernetes/blob/master/CHANGELOG/CHANGELOG-1.27.md#v12714) |
| Etcd | [v3.5.9-k3s1](https://github.com/k3s-io/etcd/releases/tag/v3.5.9-k3s1) |
| Containerd | [v1.7.11-k3s2](https://github.com/k3s-io/containerd/releases/tag/v1.7.11-k3s2) |
| Runc | [v1.1.12](https://github.com/opencontainers/runc/releases/tag/v1.1.12) |
| Metrics-server | [v0.7.1](https://github.com/kubernetes-sigs/metrics-server/releases/tag/v0.7.1) |
| CoreDNS | [v1.11.1](https://github.com/coredns/coredns/releases/tag/v1.11.1) |
| Ingress-Nginx | [nginx-1.9.6-hardened1](https://github.com/rancher/ingress-nginx/releases/tag/nginx-1.9.6-hardened1) |
| Helm-controller | [v0.15.9](https://github.com/k3s-io/helm-controller/releases/tag/v0.15.9) |

### Available CNIs
| Component | Version | FIPS Compliant |
| --- | --- | --- |
| Canal (Default) | [Flannel v0.25.1](https://github.com/flannel-io/flannel/releases/tag/v0.25.1)<br/>[Calico v3.27.3](https://docs.tigera.io/calico/latest/release-notes/#v3.27) | Yes |
| Calico | [v3.27.3](https://docs.tigera.io/calico/latest/release-notes/#v3.27) | No |
| Cilium | [v1.15.5](https://github.com/cilium/cilium/releases/tag/v1.15.5) | No |
| Multus | [v4.0.2](https://github.com/k8snetworkplumbingwg/multus-cni/releases/tag/v4.0.2) | No |

## Helpful Links

As always, we welcome and appreciate feedback from our community of users. Please feel free to:
- [Open issues here](https://github.com/rancher/rke2/issues/new)
- [Join our Slack channel](https://slack.rancher.io/)
- [Check out our documentation](https://docs.rke2.io) for guidance on how to get started.

-----
# Release v1.27.13+rke2r1
<!-- v1.27.13+rke2r1 -->

This release updates Kubernetes to v1.27.13.

**Important Note**

If your server (control-plane) nodes were not started with the `--token` CLI flag or config file key, a randomized token was generated during initial cluster startup. This key is used both for joining new nodes to the cluster, and for encrypting cluster bootstrap data within the datastore. Ensure that you retain a copy of this token, as is required when restoring from backup.

You may retrieve the token value from any server already joined to the cluster:
```bash
cat /var/lib/rancher/rke2/server/token
```

## Changes since v1.27.12+rke2r1:

* Bump flannel version [(#5644)](https://github.com/rancher/rke2/pull/5644)
* Add kine support [(#5674)](https://github.com/rancher/rke2/pull/5674)
* Add some small fixes in flannel-windows [(#5667)](https://github.com/rancher/rke2/pull/5667)
* Bump ingress-nginx to 1.9.6 [(#5688)](https://github.com/rancher/rke2/pull/5688)
* Bump K3s version for 2024-04 release cycle [(#5716)](https://github.com/rancher/rke2/pull/5716)
* Fix Windows path setting [(#5729)](https://github.com/rancher/rke2/pull/5729)
* Update flannel to v0.25.0 [(#5732)](https://github.com/rancher/rke2/pull/5732)
* Calico and canal update [(#5739)](https://github.com/rancher/rke2/pull/5739)
* Update to Cilium v1.15.3 [(#5746)](https://github.com/rancher/rke2/pull/5746)
* Check if the kube-proxy VIP was already reserved [(#5741)](https://github.com/rancher/rke2/pull/5741)
* Update flannel to v0.25.1 [(#5749)](https://github.com/rancher/rke2/pull/5749)
* Bump harvester-cloud-provider v0.2.3 [(#5696)](https://github.com/rancher/rke2/pull/5696)
* Backports for 2024-04 release cycle [(#5753)](https://github.com/rancher/rke2/pull/5753)
* Bump vsphere csi chart to 3.1.2-rancher300 and add snapshotter image [(#5762)](https://github.com/rancher/rke2/pull/5762)
* Update to Cilium v1.15.4 [(#5774)](https://github.com/rancher/rke2/pull/5774)
* Bump metrics-server version [(#5759)](https://github.com/rancher/rke2/pull/5759)
* Vsphere csi bump [(#5803)](https://github.com/rancher/rke2/pull/5803)
* Update Kubernetes to v1.27.13 [(#5790)](https://github.com/rancher/rke2/pull/5790)
* Bump K3s version for v1.27 to pull through etcd-snapshot save fixes [(#5818)](https://github.com/rancher/rke2/pull/5818)
* Bump K3s version for dbinfo fix [(#5824)](https://github.com/rancher/rke2/pull/5824)
* Updated Calico and Flannel to fix ARM64 build [(#5829)](https://github.com/rancher/rke2/pull/5829)
* Update rke2-canal to v3.27.3-build2024042301 [(#5838)](https://github.com/rancher/rke2/pull/5838)
* Use the newer Flannel chart [(#5846)](https://github.com/rancher/rke2/pull/5846)
* Bump metrics-server chart to restore legacy label [(#5853)](https://github.com/rancher/rke2/pull/5853)


## Charts Versions
| Component | Version |
| --- | --- |
| rke2-cilium | [1.15.400](https://github.com/rancher/rke2-charts/raw/main/assets/rke2-cilium/rke2-cilium-1.15.400.tgz) |
| rke2-canal | [v3.27.3-build2024042301](https://github.com/rancher/rke2-charts/raw/main/assets/rke2-canal/rke2-canal-v3.27.3-build2024042301.tgz) |
| rke2-calico | [v3.27.300](https://github.com/rancher/rke2-charts/raw/main/assets/rke2-calico/rke2-calico-v3.27.300.tgz) |
| rke2-calico-crd | [v3.27.002](https://github.com/rancher/rke2-charts/raw/main/assets/rke2-calico/rke2-calico-crd-v3.27.002.tgz) |
| rke2-coredns | [1.29.002](https://github.com/rancher/rke2-charts/raw/main/assets/rke2-coredns/rke2-coredns-1.29.002.tgz) |
| rke2-ingress-nginx | [4.9.100](https://github.com/rancher/rke2-charts/raw/main/assets/rke2-ingress-nginx/rke2-ingress-nginx-4.9.100.tgz) |
| rke2-metrics-server | [3.12.002](https://github.com/rancher/rke2-charts/raw/main/assets/rke2-metrics-server/rke2-metrics-server-3.12.002.tgz) |
| rancher-vsphere-csi | [3.1.2-rancher400](https://github.com/rancher/rke2-charts/raw/main/assets/rancher-vsphere-csi/rancher-vsphere-csi-3.1.2-rancher400.tgz) |
| rancher-vsphere-cpi | [1.7.001](https://github.com/rancher/rke2-charts/raw/main/assets/rancher-vsphere-cpi/rancher-vsphere-cpi-1.7.001.tgz) |
| harvester-cloud-provider | [0.2.300](https://github.com/rancher/rke2-charts/raw/main/assets/harvester-cloud-provider/harvester-cloud-provider-0.2.300.tgz) |
| harvester-csi-driver | [0.1.1700](https://github.com/rancher/rke2-charts/raw/main/assets/harvester-cloud-provider/harvester-csi-driver-0.1.1700.tgz) |
| rke2-snapshot-controller | [1.7.202](https://github.com/rancher/rke2-charts/raw/main/assets/rke2-snapshot-controller/rke2-snapshot-controller-1.7.202.tgz) |
| rke2-snapshot-controller-crd | [1.7.202](https://github.com/rancher/rke2-charts/raw/main/assets/rke2-snapshot-controller/rke2-snapshot-controller-crd-1.7.202.tgz) |
| rke2-snapshot-validation-webhook | [1.7.302](https://github.com/rancher/rke2-charts/raw/main/assets/rke2-snapshot-validation-webhook/rke2-snapshot-validation-webhook-1.7.302.tgz) |


## Packaged Component Versions
| Component | Version |
| --- | --- |
| Kubernetes | [v1.27.13](https://github.com/kubernetes/kubernetes/blob/master/CHANGELOG/CHANGELOG-1.27.md#v12713) |
| Etcd | [v3.5.9-k3s1](https://github.com/k3s-io/etcd/releases/tag/v3.5.9-k3s1) |
| Containerd | [v1.7.11-k3s2](https://github.com/k3s-io/containerd/releases/tag/v1.7.11-k3s2) |
| Runc | [v1.1.12](https://github.com/opencontainers/runc/releases/tag/v1.1.12) |
| Metrics-server | [v0.7.1](https://github.com/kubernetes-sigs/metrics-server/releases/tag/v0.7.1) |
| CoreDNS | [v1.11.1](https://github.com/coredns/coredns/releases/tag/v1.11.1) |
| Ingress-Nginx | [nginx-1.9.6-hardened1](https://github.com/rancher/ingress-nginx/releases/tag/nginx-1.9.6-hardened1) |
| Helm-controller | [v0.15.9](https://github.com/k3s-io/helm-controller/releases/tag/v0.15.9) |

### Available CNIs
| Component | Version | FIPS Compliant |
| --- | --- | --- |
| Canal (Default) | [Flannel v0.25.1](https://github.com/flannel-io/flannel/releases/tag/v0.25.1)<br/>[Calico v3.27.3](https://docs.tigera.io/calico/latest/release-notes/#v3.27) | Yes |
| Calico | [v3.27.3](https://docs.tigera.io/calico/latest/release-notes/#v3.27) | No |
| Cilium | [v1.15.4](https://github.com/cilium/cilium/releases/tag/v1.15.4) | No |
| Multus | [v4.0.2](https://github.com/k8snetworkplumbingwg/multus-cni/releases/tag/v4.0.2) | No |

## Helpful Links

As always, we welcome and appreciate feedback from our community of users. Please feel free to:
- [Open issues here](https://github.com/rancher/rke2/issues/new)
- [Join our Slack channel](https://slack.rancher.io/)
- [Check out our documentation](https://docs.rke2.io) for guidance on how to get started.
-----
# Release v1.27.12+rke2r1
<!-- v1.27.12+rke2r1 -->

This release updates Kubernetes to v1.27.12.

**Important Notes**

Canal uses flannel 0.24.3 which includes a bug: every 5 seconds it tries to add ipv6 iptables rules and fails if the node does not have an ipv6 address. The consequence is the log "Failed to ensure iptables rules: error setting up rules: failed to apply partial iptables-restore unable to run iptables-restore (, ): exit status 4" appears every 5 seconds in the flannel container of the canal pod.

Flannel daemonset is not tolerating node taints: "node-role.kubernetes.io/etcd:NoExecute", "node-role.kubernetes.io/control-plane:NoSchedule" and "node.cloudprovider.kubernetes.io/uninitialized:NoSchedule" which can create problems when deploying with Rancher in certain cloud-providers (e.g. vShpere or DigitalOcean).

If your server (control-plane) nodes were not started with the `--token` CLI flag or config file key, a randomized token was generated during initial cluster startup. This key is used both for joining new nodes to the cluster, and for encrypting cluster bootstrap data within the datastore. Ensure that you retain a copy of this token, as is required when restoring from backup.

You may retrieve the token value from any server already joined to the cluster:
```bash
cat /var/lib/rancher/rke2/server/token
```

## Changes since v1.27.11+rke2r1:

* Add a multus e2e test [(#5546)](https://github.com/rancher/rke2/pull/5546)
* Bump vsphere csi chart to 3.1.2-rancher101 and cpi to 1.7.001 [(#5555)](https://github.com/rancher/rke2/pull/5555)
* Bump coredns chart [(#5562)](https://github.com/rancher/rke2/pull/5562)
* Update 1.27 to r2 [(#5565)](https://github.com/rancher/rke2/pull/5565)
* Update Calico and Canal to v3.27.2 [(#5584)](https://github.com/rancher/rke2/pull/5584)
* Bump multus chart version [(#5595)](https://github.com/rancher/rke2/pull/5595)
* Bump K3s version for v1.27 [(#5589)](https://github.com/rancher/rke2/pull/5589)
  * Fix: use correct wasm shims names
  * Bump spegel to v0.0.18-k3s3
  * Adds wildcard registry support
  * Fixes issue with excessive CPU utilization while waiting for containerd to start
  * Add env var to allow spegel mirroring of latest tag
  * Bump helm-controller/klipper-helm versions
  * Fix snapshot prune
  * Fix issue with etcd node name missing hostname
  * Fix additional corner cases in registries handling
  * RKE2 will now warn and suppress duplicate entries in the mirror endpoint list for a registry. Containerd does not support listing the same endpoint multiple times as a mirror for a single upstream registry.
* Bump K3s version for v1.27 [(#5607)](https://github.com/rancher/rke2/pull/5607)
* Update k8s to 1.27.12 and Go [(#5622)](https://github.com/rancher/rke2/pull/5622)


## Charts Versions
| Component | Version |
| --- | --- |
| rke2-cilium | [1.15.100](https://github.com/rancher/rke2-charts/raw/main/assets/rke2-cilium/rke2-cilium-1.15.100.tgz) |
| rke2-canal | [v3.27.2-build2024030800](https://github.com/rancher/rke2-charts/raw/main/assets/rke2-canal/rke2-canal-v3.27.2-build2024030800.tgz) |
| rke2-calico | [v3.27.200](https://github.com/rancher/rke2-charts/raw/main/assets/rke2-calico/rke2-calico-v3.27.200.tgz) |
| rke2-calico-crd | [v3.27.002](https://github.com/rancher/rke2-charts/raw/main/assets/rke2-calico/rke2-calico-crd-v3.27.002.tgz) |
| rke2-coredns | [1.29.002](https://github.com/rancher/rke2-charts/raw/main/assets/rke2-coredns/rke2-coredns-1.29.002.tgz) |
| rke2-ingress-nginx | [4.8.200](https://github.com/rancher/rke2-charts/raw/main/assets/rke2-ingress-nginx/rke2-ingress-nginx-4.8.200.tgz) |
| rke2-metrics-server | [2.11.100-build2023051513](https://github.com/rancher/rke2-charts/raw/main/assets/rke2-metrics-server/rke2-metrics-server-2.11.100-build2023051513.tgz) |
| rancher-vsphere-csi | [3.1.2-rancher101](https://github.com/rancher/rke2-charts/raw/main/assets/rancher-vsphere-csi/rancher-vsphere-csi-3.1.2-rancher101.tgz) |
| rancher-vsphere-cpi | [1.7.001](https://github.com/rancher/rke2-charts/raw/main/assets/rancher-vsphere-cpi/rancher-vsphere-cpi-1.7.001.tgz) |
| harvester-cloud-provider | [0.2.200](https://github.com/rancher/rke2-charts/raw/main/assets/harvester-cloud-provider/harvester-cloud-provider-0.2.200.tgz) |
| harvester-csi-driver | [0.1.1700](https://github.com/rancher/rke2-charts/raw/main/assets/harvester-cloud-provider/harvester-csi-driver-0.1.1700.tgz) |
| rke2-snapshot-controller | [1.7.202](https://github.com/rancher/rke2-charts/raw/main/assets/rke2-snapshot-controller/rke2-snapshot-controller-1.7.202.tgz) |
| rke2-snapshot-controller-crd | [1.7.202](https://github.com/rancher/rke2-charts/raw/main/assets/rke2-snapshot-controller/rke2-snapshot-controller-crd-1.7.202.tgz) |
| rke2-snapshot-validation-webhook | [1.7.302](https://github.com/rancher/rke2-charts/raw/main/assets/rke2-snapshot-validation-webhook/rke2-snapshot-validation-webhook-1.7.302.tgz) |


## Packaged Component Versions
| Component | Version |
| --- | --- |
| Kubernetes | [v1.27.12](https://github.com/kubernetes/kubernetes/blob/master/CHANGELOG/CHANGELOG-1.27.md#v12712) |
| Etcd | [v3.5.9-k3s1](https://github.com/k3s-io/etcd/releases/tag/v3.5.9-k3s1) |
| Containerd | [v1.7.11-k3s2](https://github.com/k3s-io/containerd/releases/tag/v1.7.11-k3s2) |
| Runc | [v1.1.12](https://github.com/opencontainers/runc/releases/tag/v1.1.12) |
| Metrics-server | [v0.6.3](https://github.com/kubernetes-sigs/metrics-server/releases/tag/v0.6.3) |
| CoreDNS | [v1.11.1](https://github.com/coredns/coredns/releases/tag/v1.11.1) |
| Ingress-Nginx | [nginx-1.9.3-hardened1](https://github.com/rancher/ingress-nginx/releases/tag/nginx-1.9.3-hardened1) |
| Helm-controller | [v0.15.9](https://github.com/k3s-io/helm-controller/releases/tag/v0.15.9) |

### Available CNIs
| Component | Version | FIPS Compliant |
| --- | --- | --- |
| Canal (Default) | [Flannel v0.24.3](https://github.com/flannel-io/flannel/releases/tag/v0.24.3)<br/>[Calico v3.27.2](https://docs.tigera.io/calico/latest/release-notes/#v3.27) | Yes |
| Calico | [v3.27.2](https://docs.tigera.io/calico/latest/release-notes/#v3.27) | No |
| Cilium | [v1.15.1](https://github.com/cilium/cilium/releases/tag/v1.15.1) | No |
| Multus | [v4.0.2](https://github.com/k8snetworkplumbingwg/multus-cni/releases/tag/v4.0.2) | No |

## Helpful Links

As always, we welcome and appreciate feedback from our community of users. Please feel free to:
- [Open issues here](https://github.com/rancher/rke2/issues/new)
- [Join our Slack channel](https://slack.rancher.io/)
- [Check out our documentation](https://docs.rke2.io) for guidance on how to get started.

-----
# Release v1.27.11+rke2r1
<!-- v1.27.11+rke2r1 -->

This release updates Kubernetes to v1.27.11.

**Important Note**

If your server (control-plane) nodes were not started with the `--token` CLI flag or config file key, a randomized token was generated during initial cluster startup. This key is used both for joining new nodes to the cluster, and for encrypting cluster bootstrap data within the datastore. Ensure that you retain a copy of this token, as is required when restoring from backup.

You may retrieve the token value from any server already joined to the cluster:
```bash
cat /var/lib/rancher/rke2/server/token
```

## Changes since v1.27.10+rke2r1:

* Fix validate-charts script [(#5376)](https://github.com/rancher/rke2/pull/5376)
* Windows [(#5369)](https://github.com/rancher/rke2/pull/5369)
* Avoid race condition when deleting HNS networks [(#5384)](https://github.com/rancher/rke2/pull/5384)
* Add CNI plugin flannel support for Windows [(#5395)](https://github.com/rancher/rke2/pull/5395)
* Bump coredns and multus/whereabouts versions [(#5401)](https://github.com/rancher/rke2/pull/5401)
* Fix: missing 'ip link delete cilium_wg0' in rke2-killall.sh [(#5407)](https://github.com/rancher/rke2/pull/5407)
* Update canal version [(#5417)](https://github.com/rancher/rke2/pull/5417)
* Improve calico in windows [(#5428)](https://github.com/rancher/rke2/pull/5428)
* Update Calico to v3.27.0 [(#5437)](https://github.com/rancher/rke2/pull/5437)
* Update Cilium to 1.15.0 [(#5452)](https://github.com/rancher/rke2/pull/5452)
* Backport agent containerd behavior 1.27 [(#5456)](https://github.com/rancher/rke2/pull/5456)
* Bump K3s version for v1.27 [(#5460)](https://github.com/rancher/rke2/pull/5460)
* Bump harvester-csi-driver to 0.1.7 [(#5441)](https://github.com/rancher/rke2/pull/5441)
* Update k8s and Go [(#5466)](https://github.com/rancher/rke2/pull/5466)
* Update Cilium to 1.15.1 [(#5478)](https://github.com/rancher/rke2/pull/5478)
* Bump rke2-coredns chart [(#5498)](https://github.com/rancher/rke2/pull/5498)
* Bump K3s for etcd-only fix [(#5503)](https://github.com/rancher/rke2/pull/5503)
* Add new network policy for ingress controller webhook [(#5511)](https://github.com/rancher/rke2/pull/5511)
* Backport bugfixes for 2024-02 rc [(#5532)](https://github.com/rancher/rke2/pull/5532)
  * Bump wharfie to v0.6.6 to add support for bare hostname as endpoint, fix unnecessary namespace param inclusion
  * Refactor netpol creation and add two new netpols for metrics-server and snapshot-validation-webhook


## Charts Versions
| Component | Version |
| --- | --- |
| rke2-cilium | [1.15.100](https://github.com/rancher/rke2-charts/raw/main/assets/rke2-cilium/rke2-cilium-1.15.100.tgz) |
| rke2-canal | [v3.27.0-build2024020601](https://github.com/rancher/rke2-charts/raw/main/assets/rke2-canal/rke2-canal-v3.27.0-build2024020601.tgz) |
| rke2-calico | [v3.27.002](https://github.com/rancher/rke2-charts/raw/main/assets/rke2-calico/rke2-calico-v3.27.002.tgz) |
| rke2-calico-crd | [v3.27.002](https://github.com/rancher/rke2-charts/raw/main/assets/rke2-calico/rke2-calico-crd-v3.27.002.tgz) |
| rke2-coredns | [1.29.001](https://github.com/rancher/rke2-charts/raw/main/assets/rke2-coredns/rke2-coredns-1.29.001.tgz) |
| rke2-ingress-nginx | [4.8.200](https://github.com/rancher/rke2-charts/raw/main/assets/rke2-ingress-nginx/rke2-ingress-nginx-4.8.200.tgz) |
| rke2-metrics-server | [2.11.100-build2023051513](https://github.com/rancher/rke2-charts/raw/main/assets/rke2-metrics-server/rke2-metrics-server-2.11.100-build2023051513.tgz) |
| rancher-vsphere-csi | [3.0.1-rancher101](https://github.com/rancher/rke2-charts/raw/main/assets/rancher-vsphere-csi/rancher-vsphere-csi-3.0.1-rancher101.tgz) |
| rancher-vsphere-cpi | [1.5.100](https://github.com/rancher/rke2-charts/raw/main/assets/rancher-vsphere-cpi/rancher-vsphere-cpi-1.5.100.tgz) |
| harvester-cloud-provider | [0.2.200](https://github.com/rancher/rke2-charts/raw/main/assets/harvester-cloud-provider/harvester-cloud-provider-0.2.200.tgz) |
| harvester-csi-driver | [0.1.1700](https://github.com/rancher/rke2-charts/raw/main/assets/harvester-cloud-provider/harvester-csi-driver-0.1.1700.tgz) |
| rke2-snapshot-controller | [1.7.202](https://github.com/rancher/rke2-charts/raw/main/assets/rke2-snapshot-controller/rke2-snapshot-controller-1.7.202.tgz) |
| rke2-snapshot-controller-crd | [1.7.202](https://github.com/rancher/rke2-charts/raw/main/assets/rke2-snapshot-controller/rke2-snapshot-controller-crd-1.7.202.tgz) |
| rke2-snapshot-validation-webhook | [1.7.302](https://github.com/rancher/rke2-charts/raw/main/assets/rke2-snapshot-validation-webhook/rke2-snapshot-validation-webhook-1.7.302.tgz) |


## Packaged Component Versions
| Component | Version |
| --- | --- |
| Kubernetes | [v1.27.11](https://github.com/kubernetes/kubernetes/blob/master/CHANGELOG/CHANGELOG-1.27.md#v12711) |
| Etcd | [v3.5.9-k3s1](https://github.com/k3s-io/etcd/releases/tag/v3.5.9-k3s1) |
| Containerd | [v1.7.11-k3s2](https://github.com/k3s-io/containerd/releases/tag/v1.7.11-k3s2) |
| Runc | [v1.1.12](https://github.com/opencontainers/runc/releases/tag/v1.1.12) |
| Metrics-server | [v0.6.3](https://github.com/kubernetes-sigs/metrics-server/releases/tag/v0.6.3) |
| CoreDNS | [v1.11.1](https://github.com/coredns/coredns/releases/tag/v1.11.1) |
| Ingress-Nginx | [nginx-1.9.3-hardened1](https://github.com/rancher/ingress-nginx/releases/tag/nginx-1.9.3-hardened1) |
| Helm-controller | [v0.15.8](https://github.com/k3s-io/helm-controller/releases/tag/v0.15.8) |

### Available CNIs
| Component | Version | FIPS Compliant |
| --- | --- | --- |
| Canal (Default) | [Flannel v0.24.2](https://github.com/flannel-io/flannel/releases/tag/v0.24.2)<br/>[Calico v3.27.0](https://docs.tigera.io/calico/latest/release-notes/#v3.27) | Yes |
| Calico | [v3.27.0](https://docs.tigera.io/calico/latest/release-notes/#v3.27) | No |
| Cilium | [v1.15.1](https://github.com/cilium/cilium/releases/tag/v1.15.1) | No |
| Multus | [v4.0.2](https://github.com/k8snetworkplumbingwg/multus-cni/releases/tag/v4.0.2) | No |

## Helpful Links

As always, we welcome and appreciate feedback from our community of users. Please feel free to:
- [Open issues here](https://github.com/rancher/rke2/issues/new)
- [Join our Slack channel](https://slack.rancher.io/)
- [Check out our documentation](https://docs.rke2.io) for guidance on how to get started.

-----
# Release v1.27.10+rke2r1
<!-- v1.27.10+rke2r1 -->

This release updates Kubernetes to v1.27.10.

**Important Notes**

Addresses the runc CVE: [CVE-2024-21626](https://nvd.nist.gov/vuln/detail/CVE-2024-21626) by updating runc to v1.1.12.

If your server (control-plane) nodes were not started with the `--token` CLI flag or config file key, a randomized token was generated during initial cluster startup. This key is used both for joining new nodes to the cluster, and for encrypting cluster bootstrap data within the datastore. Ensure that you retain a copy of this token, as is required when restoring from backup.

You may retrieve the token value from any server already joined to the cluster:
```bash
cat /var/lib/rancher/rke2/server/token
```

## Changes since v1.27.9+rke2r1:

* Use dl.k8s.io for getting kubectl [(#5180)](https://github.com/rancher/rke2/pull/5180)
* Ensure charts directory exists in Windows runtime image [(#5186)](https://github.com/rancher/rke2/pull/5186)
* Bump versions of different components [(#5168)](https://github.com/rancher/rke2/pull/5168)
* Update coredns chart to fix bug [(#5201)](https://github.com/rancher/rke2/pull/5201)
* Update multus chart to add optional dhcp daemonset [(#5211)](https://github.com/rancher/rke2/pull/5211)
* Add e2e test about dnscache [(#5227)](https://github.com/rancher/rke2/pull/5227)
* Update rke2-whereabouts to v0.6.3 and bump rke2-multus parent chart [(#5245)](https://github.com/rancher/rke2/pull/5245)
* Bump sriov image build versions [(#5255)](https://github.com/rancher/rke2/pull/5255)
* Enable arm64 based images for calico, multus and harvester [(#5266)](https://github.com/rancher/rke2/pull/5266)
* Improve kube-proxy and calico logging in Windows [(#5285)](https://github.com/rancher/rke2/pull/5285)
* Bump k3s for v1.27 [(#5270)](https://github.com/rancher/rke2/pull/5270)
* Update to 1.27.10 [(#5294)](https://github.com/rancher/rke2/pull/5294)
* Update base image [(#5307)](https://github.com/rancher/rke2/pull/5307)
* Bump K3s and runc versions for v1.27 [(#5351)](https://github.com/rancher/rke2/pull/5351)


## Charts Versions
| Component | Version |
| --- | --- |
| rke2-cilium | [1.14.400](https://github.com/rancher/rke2-charts/raw/main/assets/rke2-cilium/rke2-cilium-1.14.400.tgz) |
| rke2-canal | [v3.26.3-build2023110900](https://github.com/rancher/rke2-charts/raw/main/assets/rke2-canal/rke2-canal-v3.26.3-build2023110900.tgz) |
| rke2-calico | [v3.26.300](https://github.com/rancher/rke2-charts/raw/main/assets/rke2-calico/rke2-calico-v3.26.300.tgz) |
| rke2-calico-crd | [v3.26.300](https://github.com/rancher/rke2-charts/raw/main/assets/rke2-calico/rke2-calico-crd-v3.26.300.tgz) |
| rke2-coredns | [1.24.008](https://github.com/rancher/rke2-charts/raw/main/assets/rke2-coredns/rke2-coredns-1.24.008.tgz) |
| rke2-ingress-nginx | [4.8.200](https://github.com/rancher/rke2-charts/raw/main/assets/rke2-ingress-nginx/rke2-ingress-nginx-4.8.200.tgz) |
| rke2-metrics-server | [2.11.100-build2023051511](https://github.com/rancher/rke2-charts/raw/main/assets/rke2-metrics-server/rke2-metrics-server-2.11.100-build2023051511.tgz) |
| rancher-vsphere-csi | [3.0.1-rancher101](https://github.com/rancher/rke2-charts/raw/main/assets/rancher-vsphere-csi/rancher-vsphere-csi-3.0.1-rancher101.tgz) |
| rancher-vsphere-cpi | [1.5.100](https://github.com/rancher/rke2-charts/raw/main/assets/rancher-vsphere-cpi/rancher-vsphere-cpi-1.5.100.tgz) |
| harvester-cloud-provider | [0.2.200](https://github.com/rancher/rke2-charts/raw/main/assets/harvester-cloud-provider/harvester-cloud-provider-0.2.200.tgz) |
| harvester-csi-driver | [0.1.1600](https://github.com/rancher/rke2-charts/raw/main/assets/harvester-cloud-provider/harvester-csi-driver-0.1.1600.tgz) |
| rke2-snapshot-controller | [1.7.202](https://github.com/rancher/rke2-charts/raw/main/assets/rke2-snapshot-controller/rke2-snapshot-controller-1.7.202.tgz) |
| rke2-snapshot-controller-crd | [1.7.202](https://github.com/rancher/rke2-charts/raw/main/assets/rke2-snapshot-controller/rke2-snapshot-controller-crd-1.7.202.tgz) |
| rke2-snapshot-validation-webhook | [1.7.302](https://github.com/rancher/rke2-charts/raw/main/assets/rke2-snapshot-validation-webhook/rke2-snapshot-validation-webhook-1.7.302.tgz) |


## Packaged Component Versions
| Component | Version |
| --- | --- |
| Kubernetes | [v1.27.10](https://github.com/kubernetes/kubernetes/blob/master/CHANGELOG/CHANGELOG-1.27.md#v12710) |
| Etcd | [v3.5.9-k3s1](https://github.com/k3s-io/etcd/releases/tag/v3.5.9-k3s1) |
| Containerd | [v1.7.11-k3s2](https://github.com/k3s-io/containerd/releases/tag/v1.7.11-k3s2) |
| Runc | [v1.1.12](https://github.com/opencontainers/runc/releases/tag/v1.1.12) |
| Metrics-server | [v0.6.3](https://github.com/kubernetes-sigs/metrics-server/releases/tag/v0.6.3) |
| CoreDNS | [v1.10.1](https://github.com/coredns/coredns/releases/tag/v1.10.1) |
| Ingress-Nginx | [nginx-1.9.3-hardened1](https://github.com/rancher/ingress-nginx/releases/tag/nginx-1.9.3-hardened1) |
| Helm-controller | [v0.15.8](https://github.com/k3s-io/helm-controller/releases/tag/v0.15.8) |

### Available CNIs
| Component | Version | FIPS Compliant |
| --- | --- | --- |
| Canal (Default) | [Flannel v0.23.0](https://github.com/flannel-io/flannel/releases/tag/v0.23.0)<br/>[Calico v3.26.3](https://docs.tigera.io/calico/latest/release-notes/#v3.26) | Yes |
| Calico | [v3.26.3](https://docs.tigera.io/calico/latest/release-notes/#v3.26) | No |
| Cilium | [v1.14.4](https://github.com/cilium/cilium/releases/tag/v1.14.4) | No |
| Multus | [v4.0.2](https://github.com/k8snetworkplumbingwg/multus-cni/releases/tag/v4.0.2) | No |

## Helpful Links

As always, we welcome and appreciate feedback from our community of users. Please feel free to:
- [Open issues here](https://github.com/rancher/rke2/issues/new)
- [Join our Slack channel](https://slack.rancher.io/)
- [Check out our documentation](https://docs.rke2.io) for guidance on how to get started.
-----
# Release v1.27.9+rke2r1
<!-- v1.27.9+rke2r1 -->

This release updates Kubernetes to v1.27.9.

**Important Note**

If your server (control-plane) nodes were not started with the `--token` CLI flag or config file key, a randomized token was generated during initial cluster startup. This key is used both for joining new nodes to the cluster, and for encrypting cluster bootstrap data within the datastore. Ensure that you retain a copy of this token, as is required when restoring from backup.

You may retrieve the token value from any server already joined to the cluster:
```bash
cat /var/lib/rancher/rke2/server/token
```

## Changes since v1.27.8+rke2r1:

* Bump containerd and runc [(#5120)](https://github.com/rancher/rke2/pull/5120)
  * Bumped containerd/runc to v1.7.10/v1.1.10
* Bump containerd to v1.7.11 [(#5130)](https://github.com/rancher/rke2/pull/5130)
* Update to 1.27.9 for december 2023 [(#5151)](https://github.com/rancher/rke2/pull/5151)


## Charts Versions
| Component                        | Version                                                                                                                                                 |
| -------------------------------- | ------------------------------------------------------------------------------------------------------------------------------------------------------- |
| rke2-cilium                      | [1.14.400](https://github.com/rancher/rke2-charts/raw/main/assets/rke2-cilium/rke2-cilium-1.14.400.tgz)                                                 |
| rke2-canal                       | [v3.26.3-build2023110900](https://github.com/rancher/rke2-charts/raw/main/assets/rke2-canal/rke2-canal-v3.26.3-build2023110900.tgz)                     |
| rke2-calico                      | [v3.26.300](https://github.com/rancher/rke2-charts/raw/main/assets/rke2-calico/rke2-calico-v3.26.300.tgz)                                               |
| rke2-calico-crd                  | [v3.26.300](https://github.com/rancher/rke2-charts/raw/main/assets/rke2-calico/rke2-calico-crd-v3.26.300.tgz)                                           |
| rke2-coredns                     | [1.24.006](https://github.com/rancher/rke2-charts/raw/main/assets/rke2-coredns/rke2-coredns-1.24.006.tgz)                                               |
| rke2-ingress-nginx               | [4.8.200](https://github.com/rancher/rke2-charts/raw/main/assets/rke2-ingress-nginx/rke2-ingress-nginx-4.8.200.tgz)                                     |
| rke2-metrics-server              | [2.11.100-build2023051510](https://github.com/rancher/rke2-charts/raw/main/assets/rke2-metrics-server/rke2-metrics-server-2.11.100-build2023051510.tgz) |
| rancher-vsphere-csi              | [3.0.1-rancher101](https://github.com/rancher/rke2-charts/raw/main/assets/rancher-vsphere-csi/rancher-vsphere-csi-3.0.1-rancher101.tgz)                 |
| rancher-vsphere-cpi              | [1.5.100](https://github.com/rancher/rke2-charts/raw/main/assets/rancher-vsphere-cpi/rancher-vsphere-cpi-1.5.100.tgz)                                   |
| harvester-cloud-provider         | [0.2.200](https://github.com/rancher/rke2-charts/raw/main/assets/harvester-cloud-provider/harvester-cloud-provider-0.2.200.tgz)                         |
| harvester-csi-driver             | [0.1.1600](https://github.com/rancher/rke2-charts/raw/main/assets/harvester-cloud-provider/harvester-csi-driver-0.1.1600.tgz)                           |
| rke2-snapshot-controller         | [1.7.202](https://github.com/rancher/rke2-charts/raw/main/assets/rke2-snapshot-controller/rke2-snapshot-controller-1.7.202.tgz)                         |
| rke2-snapshot-controller-crd     | [1.7.202](https://github.com/rancher/rke2-charts/raw/main/assets/rke2-snapshot-controller/rke2-snapshot-controller-crd-1.7.202.tgz)                     |
| rke2-snapshot-validation-webhook | [1.7.302](https://github.com/rancher/rke2-charts/raw/main/assets/rke2-snapshot-validation-webhook/rke2-snapshot-validation-webhook-1.7.302.tgz)         |


## Packaged Component Versions
| Component       | Version                                                                                              |
| --------------- | ---------------------------------------------------------------------------------------------------- |
| Kubernetes      | [v1.27.9](https://github.com/kubernetes/kubernetes/blob/master/CHANGELOG/CHANGELOG-1.27.md#v1279)    |
| Etcd            | [v3.5.9-k3s1](https://github.com/k3s-io/etcd/releases/tag/v3.5.9-k3s1)                               |
| Containerd      | [v1.7.11-k3s2](https://github.com/k3s-io/containerd/releases/tag/v1.7.11-k3s2)                       |
| Runc            | [v1.1.10](https://github.com/opencontainers/runc/releases/tag/v1.1.10)                                   |
| Metrics-server  | [v0.6.3](https://github.com/kubernetes-sigs/metrics-server/releases/tag/v0.6.3)                      |
| CoreDNS         | [v1.10.1](https://github.com/coredns/coredns/releases/tag/v1.10.1)                                   |
| Ingress-Nginx   | [nginx-1.9.3-hardened1](https://github.com/rancher/ingress-nginx/releases/tag/nginx-1.9.3-hardened1) |
| Helm-controller | [v0.15.4](https://github.com/k3s-io/helm-controller/releases/tag/v0.15.4)                            |

### Available CNIs
| Component       | Version                                                                                                                                                   | FIPS Compliant |
| --------------- | --------------------------------------------------------------------------------------------------------------------------------------------------------- | -------------- |
| Canal (Default) | [Flannel v0.23.0](https://github.com/flannel-io/flannel/releases/tag/v0.23.0)<br/>[Calico v3.26.3](https://docs.tigera.io/calico/latest/release-notes/#v3.26) | Yes            |
| Calico          | [v3.26.3](https://docs.tigera.io/calico/latest/release-notes/#v3.26)                                                                                      | No             |
| Cilium          | [v1.14.4](https://github.com/cilium/cilium/releases/tag/v1.14.4)                                                                                          | No             |
| Multus          | [v4.0.2](https://github.com/k8snetworkplumbingwg/multus-cni/releases/tag/v4.0.2)                                                                          | No             |

## Helpful Links

As always, we welcome and appreciate feedback from our community of users. Please feel free to:
- [Open issues here](https://github.com/rancher/rke2/issues/new)
- [Join our Slack channel](https://slack.rancher.io/)
- [Check out our documentation](https://docs.rke2.io) for guidance on how to get started.
-----
# Release v1.27.8+rke2r1
<!-- v1.27.8+rke2r1 -->

This release updates Kubernetes to v1.27.8.

**Important Notes**

This release includes a version of ingress-nginx affected by [CVE-2023-5043](https://github.com/kubernetes/ingress-nginx/issues/10571) and [CVE-2023-5044](https://github.com/kubernetes/ingress-nginx/issues/10572). Ingress administrators should set the --enable-annotation-validation flag to enforce restrictions on the contents of ingress-nginx annotation fields.

If your server (control-plane) nodes were not started with the `--token` CLI flag or config file key, a randomized token was generated during initial cluster startup. This key is used both for joining new nodes to the cluster, and for encrypting cluster bootstrap data within the datastore. Ensure that you retain a copy of this token, as is required when restoring from backup.

You may retrieve the token value from any server already joined to the cluster:
```bash
cat /var/lib/rancher/rke2/server/token
```
## Changes since v1.27.7+rke2r2:

* Add chart validation tests [(#5001)](https://github.com/rancher/rke2/pull/5001)
* Update canal to v3.26.3 [(#5016)](https://github.com/rancher/rke2/pull/5016)
* Update calico to v3.26.3 [(#5026)](https://github.com/rancher/rke2/pull/5026)
* Bump cilium chart to 1.14.400 [(#5060)](https://github.com/rancher/rke2/pull/5060)
* Bump K3s version for v1.27 [(#5030)](https://github.com/rancher/rke2/pull/5030)
  * Containerd may now be configured to use rdt or blockio configuration by defining `rdt_config.yaml` or `blockio_config.yaml` files.
  * Disable helm CRD installation for disable-helm-controller
  * Omit snapshot list configmap entries for snapshots without extra metadata
  * Add jitter to client config retry to avoid hammering servers when they are starting up
* Bump K3s version for v1.27 [(#5070)](https://github.com/rancher/rke2/pull/5070)
  * Don't apply S3 retention if S3 client failed to initialize
  * Don't request metadata when listing S3 snapshots
  * Print key instead of file path in snapshot metadata log message
* Kubernetes patch release [(#5065)](https://github.com/rancher/rke2/pull/5065)
* Remove s390x steps since the runners are disabled [(#5096)](https://github.com/rancher/rke2/pull/5096)


## Charts Versions
| Component                        | Version                                                                                                                                                 |
| -------------------------------- | ------------------------------------------------------------------------------------------------------------------------------------------------------- |
