| RKE2 version| rke2-cilium | rke2-canal | rke2-calico | rke2-calico-crd | rke2-coredns | rke2-ingress-nginx | rke2-metrics-server | rancher-vsphere-csi | rancher-vsphere-cpi | harvester-cloud-provider | harvester-csi-driver | rke2-snapshot-controller | rke2-snapshot-controller-crd | rke2-snapshot-validation-webhook | Kubernetes | Etcd | Containerd | Runc | Metrics-server | CoreDNS | Ingress-Nginx | Helm-controller | Canal (Default) | Calico | Cilium | Multus  |
| ----- | ----- | ----- | ----- | ----- | ----- | ----- | ----- | ----- | ----- | ----- | ----- | ----- | ----- | ----- | ----- | ----- | ----- | ----- | ----- | ----- | ----- | ----- | ----- | ----- | ----- | -----  |
| v1.26.14+rke2r1 | [1.15.100](https://github.com/rancher/rke2-charts/raw/main/assets/rke2-cilium/rke2-cilium-1.15.100.tgz) | [v3.27.0-build2024020601](https://github.com/rancher/rke2-charts/raw/main/assets/rke2-canal/rke2-canal-v3.27.0-build2024020601.tgz) | [v3.27.002](https://github.com/rancher/rke2-charts/raw/main/assets/rke2-calico/rke2-calico-v3.27.002.tgz) | [v3.27.002](https://github.com/rancher/rke2-charts/raw/main/assets/rke2-calico/rke2-calico-crd-v3.27.002.tgz) | [1.29.001](https://github.com/rancher/rke2-charts/raw/main/assets/rke2-coredns/rke2-coredns-1.29.001.tgz) | [4.8.200](https://github.com/rancher/rke2-charts/raw/main/assets/rke2-ingress-nginx/rke2-ingress-nginx-4.8.200.tgz) | [2.11.100-build2023051513](https://github.com/rancher/rke2-charts/raw/main/assets/rke2-metrics-server/rke2-metrics-server-2.11.100-build2023051513.tgz) | [3.0.1-rancher101](https://github.com/rancher/rke2-charts/raw/main/assets/rancher-vsphere-csi/rancher-vsphere-csi-3.0.1-rancher101.tgz) | [1.5.100](https://github.com/rancher/rke2-charts/raw/main/assets/rancher-vsphere-cpi/rancher-vsphere-cpi-1.5.100.tgz) | [0.2.200](https://github.com/rancher/rke2-charts/raw/main/assets/harvester-cloud-provider/harvester-cloud-provider-0.2.200.tgz) | [0.1.1700](https://github.com/rancher/rke2-charts/raw/main/assets/harvester-cloud-provider/harvester-csi-driver-0.1.1700.tgz) | [1.7.202](https://github.com/rancher/rke2-charts/raw/main/assets/rke2-snapshot-controller/rke2-snapshot-controller-1.7.202.tgz) | [1.7.202](https://github.com/rancher/rke2-charts/raw/main/assets/rke2-snapshot-controller/rke2-snapshot-controller-crd-1.7.202.tgz) | [1.7.302](https://github.com/rancher/rke2-charts/raw/main/assets/rke2-snapshot-validation-webhook/rke2-snapshot-validation-webhook-1.7.302.tgz) | [v1.26.14](https://github.com/kubernetes/kubernetes/blob/master/CHANGELOG/CHANGELOG-1.26.md#v12614) | [v3.5.9-k3s1](https://github.com/k3s-io/etcd/releases/tag/v3.5.9-k3s1) | [v1.7.11-k3s2](https://github.com/k3s-io/containerd/releases/tag/v1.7.11-k3s2) | [v1.1.](https://github.com/opencontainers/runc/releases/tag/v1.1.) | [v0.6.3](https://github.com/kubernetes-sigs/metrics-server/releases/tag/v0.6.3) | [v1.11.1](https://github.com/coredns/coredns/releases/tag/v1.11.1) | [nginx-1.9.3-hardened1](https://github.com/rancher/ingress-nginx/releases/tag/nginx-1.9.3-hardened1) | [](https://github.com/k3s-io/helm-controller/releases/tag/) | [Flannel v0.24.2](https://github.com/flannel-io/flannel/releases/tag/v0.24.2)<br/>[Calico v3.27.0](https://docs.tigera.io/calico/latest/release-notes/#v3.27) | [v3.27.0](https://docs.tigera.io/calico/latest/release-notes/#v3.27) | [v1.15.1](https://github.com/cilium/cilium/releases/tag/v1.15.1) | [v4.0.2](https://github.com/k8snetworkplumbingwg/multus-cni/releases/tag/v4.0.2)  |
| v1.26.13+rke2r1 | [1.14.400](https://github.com/rancher/rke2-charts/raw/main/assets/rke2-cilium/rke2-cilium-1.14.400.tgz) | [v3.26.3-build2023110900](https://github.com/rancher/rke2-charts/raw/main/assets/rke2-canal/rke2-canal-v3.26.3-build2023110900.tgz) | [v3.26.300](https://github.com/rancher/rke2-charts/raw/main/assets/rke2-calico/rke2-calico-v3.26.300.tgz) | [v3.26.300](https://github.com/rancher/rke2-charts/raw/main/assets/rke2-calico/rke2-calico-crd-v3.26.300.tgz) | [1.24.008](https://github.com/rancher/rke2-charts/raw/main/assets/rke2-coredns/rke2-coredns-1.24.008.tgz) | [4.8.200](https://github.com/rancher/rke2-charts/raw/main/assets/rke2-ingress-nginx/rke2-ingress-nginx-4.8.200.tgz) | [2.11.100-build2023051511](https://github.com/rancher/rke2-charts/raw/main/assets/rke2-metrics-server/rke2-metrics-server-2.11.100-build2023051511.tgz) | [3.0.1-rancher101](https://github.com/rancher/rke2-charts/raw/main/assets/rancher-vsphere-csi/rancher-vsphere-csi-3.0.1-rancher101.tgz) | [1.5.100](https://github.com/rancher/rke2-charts/raw/main/assets/rancher-vsphere-cpi/rancher-vsphere-cpi-1.5.100.tgz) | [0.2.200](https://github.com/rancher/rke2-charts/raw/main/assets/harvester-cloud-provider/harvester-cloud-provider-0.2.200.tgz) | [0.1.1600](https://github.com/rancher/rke2-charts/raw/main/assets/harvester-cloud-provider/harvester-csi-driver-0.1.1600.tgz) | [1.7.202](https://github.com/rancher/rke2-charts/raw/main/assets/rke2-snapshot-controller/rke2-snapshot-controller-1.7.202.tgz) | [1.7.202](https://github.com/rancher/rke2-charts/raw/main/assets/rke2-snapshot-controller/rke2-snapshot-controller-crd-1.7.202.tgz) | [1.7.302](https://github.com/rancher/rke2-charts/raw/main/assets/rke2-snapshot-validation-webhook/rke2-snapshot-validation-webhook-1.7.302.tgz) | [v1.26.13](https://github.com/kubernetes/kubernetes/blob/master/CHANGELOG/CHANGELOG-1.26.md#v12613) | [v3.5.9-k3s1](https://github.com/k3s-io/etcd/releases/tag/v3.5.9-k3s1) | [v1.7.11-k3s2](https://github.com/k3s-io/containerd/releases/tag/v1.7.11-k3s2) | [v1.1.12](https://github.com/opencontainers/runc/releases/tag/v1.1.12) | [v0.6.3](https://github.com/kubernetes-sigs/metrics-server/releases/tag/v0.6.3) | [v1.10.1](https://github.com/coredns/coredns/releases/tag/v1.10.1) | [nginx-1.9.3-hardened1](https://github.com/rancher/ingress-nginx/releases/tag/nginx-1.9.3-hardened1) | [v0.15.8](https://github.com/k3s-io/helm-controller/releases/tag/v0.15.8) | [Flannel v0.23.0](https://github.com/flannel-io/flannel/releases/tag/v0.23.0)<br/>[Calico v3.26.3](https://docs.tigera.io/calico/latest/release-notes/#v3.26) | [v3.26.3](https://docs.tigera.io/calico/latest/release-notes/#v3.26) | [v1.14.4](https://github.com/cilium/cilium/releases/tag/v1.14.4) | [v4.0.2](https://github.com/k8snetworkplumbingwg/multus-cni/releases/tag/v4.0.2)  |
| v1.26.12+rke2r1 | [1.14.400](https://github.com/rancher/rke2-charts/raw/main/assets/rke2-cilium/rke2-cilium-1.14.400.tgz) | [v3.26.3-build2023110900](https://github.com/rancher/rke2-charts/raw/main/assets/rke2-canal/rke2-canal-v3.26.3-build2023110900.tgz) | [v3.26.300](https://github.com/rancher/rke2-charts/raw/main/assets/rke2-calico/rke2-calico-v3.26.300.tgz) | [v3.26.300](https://github.com/rancher/rke2-charts/raw/main/assets/rke2-calico/rke2-calico-crd-v3.26.300.tgz) | [1.24.006](https://github.com/rancher/rke2-charts/raw/main/assets/rke2-coredns/rke2-coredns-1.24.006.tgz) | [4.8.200](https://github.com/rancher/rke2-charts/raw/main/assets/rke2-ingress-nginx/rke2-ingress-nginx-4.8.200.tgz) | [2.11.100-build2023051510](https://github.com/rancher/rke2-charts/raw/main/assets/rke2-metrics-server/rke2-metrics-server-2.11.100-build2023051510.tgz) | [3.0.1-rancher101](https://github.com/rancher/rke2-charts/raw/main/assets/rancher-vsphere-csi/rancher-vsphere-csi-3.0.1-rancher101.tgz) | [1.5.100](https://github.com/rancher/rke2-charts/raw/main/assets/rancher-vsphere-cpi/rancher-vsphere-cpi-1.5.100.tgz) | [0.2.200](https://github.com/rancher/rke2-charts/raw/main/assets/harvester-cloud-provider/harvester-cloud-provider-0.2.200.tgz) | [0.1.1600](https://github.com/rancher/rke2-charts/raw/main/assets/harvester-cloud-provider/harvester-csi-driver-0.1.1600.tgz) | [1.7.202](https://github.com/rancher/rke2-charts/raw/main/assets/rke2-snapshot-controller/rke2-snapshot-controller-1.7.202.tgz) | [1.7.202](https://github.com/rancher/rke2-charts/raw/main/assets/rke2-snapshot-controller/rke2-snapshot-controller-crd-1.7.202.tgz) | [1.7.302](https://github.com/rancher/rke2-charts/raw/main/assets/rke2-snapshot-validation-webhook/rke2-snapshot-validation-webhook-1.7.302.tgz) | [v1.26.12](https://github.com/kubernetes/kubernetes/blob/master/CHANGELOG/CHANGELOG-1.26.md#v12612) | [v3.5.9-k3s1](https://github.com/k3s-io/etcd/releases/tag/v3.5.9-k3s1) | [v1.7.11-k3s2](https://github.com/k3s-io/containerd/releases/tag/v1.7.11-k3s2) | [v1.1.10](https://github.com/opencontainers/runc/releases/tag/v1.1.10) | [v0.6.3](https://github.com/kubernetes-sigs/metrics-server/releases/tag/v0.6.3) | [v1.10.1](https://github.com/coredns/coredns/releases/tag/v1.10.1) | [nginx-1.9.3-hardened1](https://github.com/rancher/ingress-nginx/releases/tag/nginx-1.9.3-hardened1) | [v0.15.4](https://github.com/k3s-io/helm-controller/releases/tag/v0.15.4) | [Flannel v0.23.0](https://github.com/flannel-io/flannel/releases/tag/v0.23.0)<br/>[Calico v3.26.3](https://docs.tigera.io/calico/latest/release-notes/#v3.26) | [v3.26.3](https://docs.tigera.io/calico/latest/release-notes/#v3.26) | [v1.14.4](https://github.com/cilium/cilium/releases/tag/v1.14.4) | [v4.0.2](https://github.com/k8snetworkplumbingwg/multus-cni/releases/tag/v4.0.2)  |
| v1.26.11+rke2r1 | [1.14.400](https://github.com/rancher/rke2-charts/raw/main/assets/rke2-cilium/rke2-cilium-1.14.400.tgz) | [v3.26.3-build2023110900](https://github.com/rancher/rke2-charts/raw/main/assets/rke2-canal/rke2-canal-v3.26.3-build2023110900.tgz) | [v3.26.300](https://github.com/rancher/rke2-charts/raw/main/assets/rke2-calico/rke2-calico-v3.26.300.tgz) | [v3.26.300](https://github.com/rancher/rke2-charts/raw/main/assets/rke2-calico/rke2-calico-crd-v3.26.300.tgz) | [1.24.006](https://github.com/rancher/rke2-charts/raw/main/assets/rke2-coredns/rke2-coredns-1.24.006.tgz) | [4.8.200](https://github.com/rancher/rke2-charts/raw/main/assets/rke2-ingress-nginx/rke2-ingress-nginx-4.8.200.tgz) | [2.11.100-build2023051510](https://github.com/rancher/rke2-charts/raw/main/assets/rke2-metrics-server/rke2-metrics-server-2.11.100-build2023051510.tgz) | [3.0.1-rancher101](https://github.com/rancher/rke2-charts/raw/main/assets/rancher-vsphere-csi/rancher-vsphere-csi-3.0.1-rancher101.tgz) | [1.5.100](https://github.com/rancher/rke2-charts/raw/main/assets/rancher-vsphere-cpi/rancher-vsphere-cpi-1.5.100.tgz) | [0.2.200](https://github.com/rancher/rke2-charts/raw/main/assets/harvester-cloud-provider/harvester-cloud-provider-0.2.200.tgz) | [0.1.1600](https://github.com/rancher/rke2-charts/raw/main/assets/harvester-cloud-provider/harvester-csi-driver-0.1.1600.tgz) | [1.7.202](https://github.com/rancher/rke2-charts/raw/main/assets/rke2-snapshot-controller/rke2-snapshot-controller-1.7.202.tgz) | [1.7.202](https://github.com/rancher/rke2-charts/raw/main/assets/rke2-snapshot-controller/rke2-snapshot-controller-crd-1.7.202.tgz) | [1.7.302](https://github.com/rancher/rke2-charts/raw/main/assets/rke2-snapshot-validation-webhook/rke2-snapshot-validation-webhook-1.7.302.tgz) | [v1.26.11](https://github.com/kubernetes/kubernetes/blob/master/CHANGELOG/CHANGELOG-1.26.md#v12611) | [v3.5.9-k3s1](https://github.com/k3s-io/etcd/releases/tag/v3.5.9-k3s1) | [v1.7.7-k3s1](https://github.com/k3s-io/containerd/releases/tag/v1.7.7-k3s1) | [v1.1.8](https://github.com/opencontainers/runc/releases/tag/v1.1.8) | [v0.6.3](https://github.com/kubernetes-sigs/metrics-server/releases/tag/v0.6.3) | [v1.10.1](https://github.com/coredns/coredns/releases/tag/v1.10.1) | [nginx-1.9.3-hardened1](https://github.com/rancher/ingress-nginx/releases/tag/nginx-1.9.3-hardened1) | [v0.15.4](https://github.com/k3s-io/helm-controller/releases/tag/v0.15.4) | [Flannel v0.23.0](https://github.com/flannel-io/flannel/releases/tag/v0.23.0)<br/>[Calico v3.26.3](https://docs.tigera.io/calico/latest/release-notes/#v3.26) | [v3.26.3](https://docs.tigera.io/calico/latest/release-notes/#v3.26) | [v1.14.4](https://github.com/cilium/cilium/releases/tag/v1.14.4) | [v4.0.2](https://github.com/k8snetworkplumbingwg/multus-cni/releases/tag/v4.0.2)  |
| v1.26.10+rke2r2 | [v1.26.10](https://github.com/kubernetes/kubernetes/blob/master/CHANGELOG/CHANGELOG-1.26.md#v12610) | [v3.5.9-k3s1](https://github.com/k3s-io/etcd/releases/tag/v3.5.9-k3s1) | [v1.7.7-k3s1](https://github.com/k3s-io/containerd/releases/tag/v1.7.7-k3s1) | [v1.1.8](https://github.com/opencontainers/runc/releases/tag/v1.1.8) | [v0.6.3](https://github.com/kubernetes-sigs/metrics-server/releases/tag/v0.6.3) | [v1.10.1](https://github.com/coredns/coredns/releases/tag/v1.10.1) | [4.8.2](https://github.com/kubernetes/ingress-nginx/releases/tag/helm-chart-4.8.2) | [v0.15.4](https://github.com/k3s-io/helm-controller/releases/tag/v0.15.4) | [Flannel v0.22.1](https://github.com/flannel-io/flannel/releases/tag/v0.22.1)<br/>[Calico v3.26.1](https://docs.tigera.io/calico/latest/release-notes/#v3.26) | [v3.26.1](https://docs.tigera.io/calico/latest/release-notes/#v3.26) | [v1.14.2](https://github.com/cilium/cilium/releases/tag/v1.14.2) | [v4.0.2](https://github.com/k8snetworkplumbingwg/multus-cni/releases/tag/v4.0.2)  |
| v1.26.10+rke2r1 | [v1.26.10](https://github.com/kubernetes/kubernetes/blob/master/CHANGELOG/CHANGELOG-1.26.md#v12610) | [v3.5.9-k3s1](https://github.com/k3s-io/etcd/releases/tag/v3.5.9-k3s1) | [v1.7.7-k3s1](https://github.com/k3s-io/containerd/releases/tag/v1.7.7-k3s1) | [v1.1.8](https://github.com/opencontainers/runc/releases/tag/v1.1.8) | [v0.6.3](https://github.com/kubernetes-sigs/metrics-server/releases/tag/v0.6.3) | [v1.10.1](https://github.com/coredns/coredns/releases/tag/v1.10.1) | [4.8.2](https://github.com/kubernetes/ingress-nginx/releases/tag/helm-chart-4.8.2) | [v0.15.4](https://github.com/k3s-io/helm-controller/releases/tag/v0.15.4) | [Flannel v0.22.1](https://github.com/flannel-io/flannel/releases/tag/v0.22.1)<br/>[Calico v3.26.1](https://docs.tigera.io/calico/latest/release-notes/#v3.26) | [v3.26.1](https://docs.tigera.io/calico/latest/release-notes/#v3.26) | [v1.14.2](https://github.com/cilium/cilium/releases/tag/v1.14.2) | [v4.0.2](https://github.com/k8snetworkplumbingwg/multus-cni/releases/tag/v4.0.2)  |
| v1.26.9+rke2r1 | [v1.26.9](https://github.com/kubernetes/kubernetes/blob/master/CHANGELOG/CHANGELOG-1.26.md#v1269) | [v3.5.9-k3s1](https://github.com/k3s-io/etcd/releases/tag/v3.5.9-k3s1) | [v1.7.3-k3s1](https://github.com/k3s-io/containerd/releases/tag/v1.7.3-k3s1) | [v1.1.8](https://github.com/opencontainers/runc/releases/tag/v1.1.8) | [v0.6.3](https://github.com/kubernetes-sigs/metrics-server/releases/tag/v0.6.3) | [v1.10.1](https://github.com/coredns/coredns/releases/tag/v1.10.1) | [4.6.1](https://github.com/kubernetes/ingress-nginx/releases/tag/helm-chart-4.6.1) | [v0.15.4](https://github.com/k3s-io/helm-controller/releases/tag/v0.15.4) | [Flannel v0.22.1](https://github.com/flannel-io/flannel/releases/tag/v0.22.1)<br/>[Calico v3.26.1](https://docs.tigera.io/calico/latest/release-notes/#v3.26) | [v3.26.1](https://docs.tigera.io/calico/latest/release-notes/#v3.26) | [v1.14.1](https://github.com/cilium/cilium/releases/tag/v1.14.1) | [v4.0.2](https://github.com/k8snetworkplumbingwg/multus-cni/releases/tag/v4.0.2)  |
| v1.26.8+rke2r1 | [v1.26.8](https://github.com/kubernetes/kubernetes/blob/master/CHANGELOG/CHANGELOG-1.26.md#v1268) | [v3.5.9-k3s1](https://github.com/k3s-io/etcd/releases/tag/v3.5.9-k3s1) | [v1.7.3-k3s1](https://github.com/k3s-io/containerd/releases/tag/v1.7.3-k3s1) | [v1.1.8](https://github.com/opencontainers/runc/releases/tag/v1.1.8) | [v0.6.3](https://github.com/kubernetes-sigs/metrics-server/releases/tag/v0.6.3) | [v1.10.1](https://github.com/coredns/coredns/releases/tag/v1.10.1) | [4.6.1](https://github.com/kubernetes/ingress-nginx/releases/tag/helm-chart-4.6.1) | [v0.15.4](https://github.com/k3s-io/helm-controller/releases/tag/v0.15.4) | [Flannel v0.22.1](https://github.com/flannel-io/flannel/releases/tag/v0.22.1)<br/>[Calico v3.26.1](https://docs.tigera.io/calico/latest/release-notes/#v3.26) | [v3.26.1](https://docs.tigera.io/calico/latest/release-notes/#v3.26) | [v1.14.0](https://github.com/cilium/cilium/releases/tag/v1.14.0) | [v4.0.2](https://github.com/k8snetworkplumbingwg/multus-cni/releases/tag/v4.0.2)  |
| v1.26.7+rke2r1 | [v1.26.7](https://github.com/kubernetes/kubernetes/blob/master/CHANGELOG/CHANGELOG-1.26.md#v1267) | [v3.5.7-k3s1](https://github.com/k3s-io/etcd/releases/tag/v3.5.7-k3s1) | [v1.7.1-k3s1](https://github.com/k3s-io/containerd/releases/tag/v1.7.1-k3s1) | [v1.1.7](https://github.com/opencontainers/runc/releases/tag/v1.1.7) | [v0.6.3](https://github.com/kubernetes-sigs/metrics-server/releases/tag/v0.6.3) | [v1.10.1](https://github.com/coredns/coredns/releases/tag/v1.10.1) | [4.6.1](https://github.com/kubernetes/ingress-nginx/releases/tag/helm-chart-4.6.1) | [v0.15.2](https://github.com/k3s-io/helm-controller/releases/tag/v0.15.2) | [Flannel v0.22.0](https://github.com/flannel-io/flannel/releases/tag/v0.22.0)<br/>[Calico v3.25.1](https://projectcalico.docs.tigera.io/archive/v3.25/release-notes/#v3251) | [v3.26.1](https://projectcalico.docs.tigera.io/archive/v3.26/release-notes/#v3261) | [v1.13.2](https://github.com/cilium/cilium/releases/tag/v1.13.2) | [v4.0.2](https://github.com/k8snetworkplumbingwg/multus-cni/releases/tag/v4.0.2)  |
| v1.26.6+rke2r1 | [v1.26.6](https://github.com/kubernetes/kubernetes/blob/master/CHANGELOG/CHANGELOG-1.26.md#v1266) | [v3.5.7-k3s1](https://github.com/k3s-io/etcd/releases/tag/v3.5.7-k3s1) | [v1.7.1-k3s1](https://github.com/k3s-io/containerd/releases/tag/v1.7.1-k3s1) | [v1.1.7](https://github.com/opencontainers/runc/releases/tag/v1.1.7) | [v0.6.3](https://github.com/kubernetes-sigs/metrics-server/releases/tag/v0.6.3) | [v1.10.1](https://github.com/coredns/coredns/releases/tag/v1.10.1) | [4.5.2](https://github.com/kubernetes/ingress-nginx/releases/tag/helm-chart-4.5.2) | [v0.15.0](https://github.com/k3s-io/helm-controller/releases/tag/v0.15.0) | [Flannel v0.22.0](https://github.com/k3s-io/flannel/releases/tag/v0.22.0)<br/>[Calico v3.25.1](https://projectcalico.docs.tigera.io/archive/v3.25/release-notes/#v3251) | [v3.25.0](https://projectcalico.docs.tigera.io/archive/v3.25/release-notes/#v3250) | [v1.13.2](https://github.com/cilium/cilium/releases/tag/v1.13.2) | [v3.9.3](https://github.com/k8snetworkplumbingwg/multus-cni/releases/tag/v3.9.3)  |
| v1.26.5+rke2r1 | [v1.26.5](https://github.com/kubernetes/kubernetes/blob/master/CHANGELOG/CHANGELOG-1.26.md#v1265) | [v3.5.7-k3s1](https://github.com/k3s-io/etcd/releases/tag/v3.5.7-k3s1) | [v1.7.1-k3s1](https://github.com/k3s-io/containerd/releases/tag/v1.7.1-k3s1) | [v1.1.7](https://github.com/opencontainers/runc/releases/tag/v1.1.7) | [v0.6.3](https://github.com/kubernetes-sigs/metrics-server/releases/tag/v0.6.3) | [v1.10.1](https://github.com/coredns/coredns/releases/tag/v1.10.1) | [4.5.2](https://github.com/kubernetes/ingress-nginx/releases/tag/helm-chart-4.5.2) | [v0.14.0](https://github.com/k3s-io/helm-controller/releases/tag/v0.14.0) | [Flannel v0.21.3](https://github.com/k3s-io/flannel/releases/tag/v0.21.3)<br/>[Calico v3.25.1](https://projectcalico.docs.tigera.io/archive/v3.25/release-notes/#v3251) | [v3.25.0](https://projectcalico.docs.tigera.io/archive/v3.25/release-notes/#v3250) | [v1.13.2](https://github.com/cilium/cilium/releases/tag/v1.13.2) | [v3.9.3](https://github.com/k8snetworkplumbingwg/multus-cni/releases/tag/v3.9.3)  |
| v1.26.4+rke2r1 | [v1.26.4](https://github.com/kubernetes/kubernetes/blob/master/CHANGELOG/CHANGELOG-1.26.md#v1264) | [v3.5.7-k3s1](https://github.com/k3s-io/etcd/releases/tag/v3.5.7-k3s1) | [v1.6.19-k3s1](https://github.com/k3s-io/containerd/releases/tag/v1.6.19-k3s1) | [v1.1.5](https://github.com/opencontainers/runc/releases/tag/v1.1.5) | [v0.6.2](https://github.com/kubernetes-sigs/metrics-server/releases/tag/v0.6.2) | [v1.10.1](https://github.com/coredns/coredns/releases/tag/v1.10.1) | [4.5.2](https://github.com/kubernetes/ingress-nginx/releases/tag/helm-chart-4.5.2) | [v0.13.2](https://github.com/k3s-io/helm-controller/releases/tag/v0.13.2) | [Flannel v0.21.3](https://github.com/k3s-io/flannel/releases/tag/v0.21.3)<br/>[Calico v3.25.0](https://projectcalico.docs.tigera.io/archive/v3.25/release-notes/#v3250) | [v3.25.0](https://projectcalico.docs.tigera.io/archive/v3.25/release-notes/#v3250) | [v1.13.0](https://github.com/cilium/cilium/releases/tag/v1.13.0) | [v3.9.3](https://github.com/k8snetworkplumbingwg/multus-cni/releases/tag/v3.9.3)  |
| v1.26.3+rke2r1 | [v1.26.3](https://github.com/kubernetes/kubernetes/blob/master/CHANGELOG/CHANGELOG-1.26.md#v1263) | [v3.5.5-k3s1](https://github.com/k3s-io/etcd/releases/tag/v3.5.5-k3s1) | [v1.6.19-k3s1](https://github.com/k3s-io/containerd/releases/tag/v1.6.19-k3s1) | [v1.1.4](https://github.com/opencontainers/runc/releases/tag/v1.1.4) | [v0.6.2](https://github.com/kubernetes-sigs/metrics-server/releases/tag/v0.6.2) | [v1.9.3](https://github.com/coredns/coredns/releases/tag/v1.9.3) | [4.1.0](https://github.com/kubernetes/ingress-nginx/releases/tag/helm-chart-4.1.0) | [v0.13.2](https://github.com/k3s-io/helm-controller/releases/tag/v0.13.2) | [Flannel v0.21.3](https://github.com/k3s-io/flannel/releases/tag/v0.21.3)<br/>[Calico v3.25.0](https://projectcalico.docs.tigera.io/archive/v3.25/release-notes/#v3250) | [v3.25.0](https://projectcalico.docs.tigera.io/archive/v3.25/release-notes/#v3250) | [v1.13.0](https://github.com/cilium/cilium/releases/tag/v1.13.0) | [v3.9.3](https://github.com/k8snetworkplumbingwg/multus-cni/releases/tag/v3.9.3)  |
| v1.26.2+rke2r1 | [v1.26.2](https://github.com/kubernetes/kubernetes/blob/master/CHANGELOG/CHANGELOG-1.26.md#v1262) | [v3.5.5-k3s1](https://github.com/k3s-io/etcd/releases/tag/v3.5.5-k3s1) | [v1.6.15-k3s1](https://github.com/k3s-io/containerd/releases/tag/v1.6.15-k3s1) | [v1.1.4](https://github.com/opencontainers/runc/releases/tag/v1.1.4) | [v0.6.2](https://github.com/kubernetes-sigs/metrics-server/releases/tag/v0.6.2) | [v1.9.3](https://github.com/coredns/coredns/releases/tag/v1.9.3) | [4.1.0](https://github.com/kubernetes/ingress-nginx/releases/tag/helm-chart-4.1.0) | [v0.13.2](https://github.com/k3s-io/helm-controller/releases/tag/v0.13.2) | [Flannel v0.21.1](https://github.com/k3s-io/flannel/releases/tag/v0.21.1)<br/>[Calico v3.25.0](https://projectcalico.docs.tigera.io/archive/v3.25/release-notes/#v3250) | [v3.25.0](https://projectcalico.docs.tigera.io/archive/v3.25/release-notes/#v3250) | [v1.12.5](https://github.com/cilium/cilium/releases/tag/v1.12.5) | [v3.9.3](https://github.com/k8snetworkplumbingwg/multus-cni/releases/tag/v3.9.3)  |
| v1.26.1+rke2r1 | [v1.26.1](https://github.com/kubernetes/kubernetes/blob/master/CHANGELOG/CHANGELOG-1.26.md#v1261) | [v3.5.5-k3s1](https://github.com/k3s-io/etcd/releases/tag/v3.5.5-k3s1) | [v1.6.15-k3s1](https://github.com/k3s-io/containerd/releases/tag/v1.6.15-k3s1) | [v1.1.4](https://github.com/opencontainers/runc/releases/tag/v1.1.4) | [v0.6.2](https://github.com/kubernetes-sigs/metrics-server/releases/tag/v0.6.2) | [v1.9.3](https://github.com/coredns/coredns/releases/tag/v1.9.3) | [4.1.0](https://github.com/kubernetes/ingress-nginx/releases/tag/helm-chart-4.1.0) | [v0.13.1](https://github.com/k3s-io/helm-controller/releases/tag/v0.13.1) | [Flannel v0.20.2](https://github.com/k3s-io/flannel/releases/tag/v0.20.2)<br/>[Calico v3.24.5](https://projectcalico.docs.tigera.io/archive/v3.24/release-notes/#v3245) | [v3.24.5](https://projectcalico.docs.tigera.io/archive/v3.24/release-notes/#v3245) | [v1.12.4](https://github.com/cilium/cilium/releases/tag/v1.12.4) | [v3.9.3](https://github.com/k8snetworkplumbingwg/multus-cni/releases/tag/v3.9.3)  |
| v1.26.0+rke2r2 | [v1.26.0](https://github.com/kubernetes/kubernetes/blob/master/CHANGELOG/CHANGELOG-1.26.md#v1260) | [v3.5.5](https://github.com/k3s-io/etcd/releases/tag/v3.5.5) | [v1.6.14-k3s1](https://github.com/k3s-io/containerd/releases/tag/v1.6.14-k3s1) | [v1.1.4](https://github.com/opencontainers/runc/releases/tag/v1.1.4) | [v0.6.2](https://github.com/kubernetes-sigs/metrics-server/releases/tag/v0.6.2) | [v1.9.3](https://github.com/coredns/coredns/releases/tag/v1.9.3) | [4.1.0](https://github.com/kubernetes/ingress-nginx/releases/tag/helm-chart-4.1.0) | [v0.13.1](https://github.com/k3s-io/helm-controller/releases/tag/v0.13.1) | [Flannel v0.20.2](https://github.com/k3s-io/flannel/releases/tag/v0.20.2)<br/>[Calico v3.24.5](https://projectcalico.docs.tigera.io/archive/v3.24/release-notes/#v3245) | [v3.24.5](https://projectcalico.docs.tigera.io/archive/v3.24/release-notes/#v3245) | [v1.12.4](https://github.com/cilium/cilium/releases/tag/v1.12.4) | [v3.9](https://github.com/k8snetworkplumbingwg/multus-cni/releases/tag/v3.9)  |
| v1.26.0+rke2r1 | [v1.26.0](https://github.com/kubernetes/kubernetes/blob/master/CHANGELOG/CHANGELOG-1.26.md#v1260) | [v3.5.5](https://github.com/k3s-io/etcd/releases/tag/v3.5.5) | [v1.6.12-k3s1](https://github.com/k3s-io/containerd/releases/tag/v1.6.12-k3s1) | [v1.1.4](https://github.com/opencontainers/runc/releases/tag/v1.1.4) | [v0.6.2](https://github.com/kubernetes-sigs/metrics-server/releases/tag/v0.6.2) | [v1.9.3](https://github.com/coredns/coredns/releases/tag/v1.9.3) | [4.1.0](https://github.com/kubernetes/ingress-nginx/releases/tag/helm-chart-4.1.0) | [v0.13.1](https://github.com/k3s-io/helm-controller/releases/tag/v0.13.1) | [Flannel v0.20.2](https://github.com/k3s-io/flannel/releases/tag/v0.20.2)<br/>[Calico v3.24.5](https://projectcalico.docs.tigera.io/archive/v3.24/release-notes/#v3245) | [v3.24.5](https://projectcalico.docs.tigera.io/archive/v3.24/release-notes/#v3245) | [v1.12.4](https://github.com/cilium/cilium/releases/tag/v1.12.4) | [v3.9](https://github.com/k8snetworkplumbingwg/multus-cni/releases/tag/v3.9)  |



| Version | Release date | US date | EU date | Upstream release date | US date | EU date | Days since upstream |
| ----- | ----- | ----- | ----- | ----- | ----- | ----- | ----- |
| [v1.26.14+rke2r1](rke2-v1.26.md#release-v12614rke2r1) | Feb 29 2024 | 02/29/24 | 2024-02-29 | Feb 14 2024 | 02/14/24 | 2024-02-14 | 15 days |
| [v1.26.13+rke2r1](rke2-v1.26.md#release-v12613rke2r1) | Feb 06 2024 | 02/06/24 | 2024-02-06 | Jan 17 2024 | 01/17/24 | 2024-01-17 | 20 days |
| [v1.26.12+rke2r1](rke2-v1.26.md#release-v12612rke2r1) | Dec 26 2023 | 12/26/23 | 2023-12-26 | Dec 20 2023 | 12/20/23 | 2023-12-20 | 6 days |
| [v1.26.11+rke2r1](rke2-v1.26.md#release-v12611rke2r1) | Dec 05 2023 | 12/05/23 | 2023-12-05 | Nov 15 2023 | 11/15/23 | 2023-11-15 | 20 days |
| [v1.26.10+rke2r2](rke2-v1.26.md#release-v12610rke2r2) | Nov 08 2023 | 11/08/23 | 2023-11-08 | Oct 18 2023 | 10/18/23 | 2023-10-18 | 21 days |
| [v1.26.10+rke2r1](rke2-v1.26.md#release-v12610rke2r1) | Oct 31 2023 | 10/31/23 | 2023-10-31 | Oct 18 2023 | 10/18/23 | 2023-10-18 | 13 days |
| [v1.26.9+rke2r1](rke2-v1.26.md#release-v1269rke2r1) | Sep 18 2023 | 09/18/23 | 2023-09-18 | Sep 13 2023 | 09/13/23 | 2023-09-13 | 5 days |
| [v1.26.8+rke2r1](rke2-v1.26.md#release-v1268rke2r1) | Sep 06 2023 | 09/06/23 | 2023-09-06 | Aug 24 2023 | 08/24/23 | 2023-08-24 | 13 days |
| [v1.26.7+rke2r1](rke2-v1.26.md#release-v1267rke2r1) | Jul 28 2023 | 07/28/23 | 2023-07-28 | Jul 19 2023 | 07/19/23 | 2023-07-19 | 9 days |
| [v1.26.6+rke2r1](rke2-v1.26.md#release-v1266rke2r1) | Jun 27 2023 | 06/27/23 | 2023-06-27 | Jun 14 2023 | 06/14/23 | 2023-06-14 | 13 days |
| [v1.26.5+rke2r1](rke2-v1.26.md#release-v1265rke2r1) | May 30 2023 | 05/30/23 | 2023-05-30 | May 17 2023 | 05/17/23 | 2023-05-17 | 13 days |
| [v1.26.4+rke2r1](rke2-v1.26.md#release-v1264rke2r1) | Apr 21 2023 | 04/21/23 | 2023-04-21 | Apr 12 2023 | 04/12/23 | 2023-04-12 | 9 days |
| [v1.26.3+rke2r1](rke2-v1.26.md#release-v1263rke2r1) | Mar 27 2023 | 03/27/23 | 2023-03-27 | Mar 17 2023 | 03/17/23 | 2023-03-17 | 10 days |
| [v1.26.2+rke2r1](rke2-v1.26.md#release-v1262rke2r1) | Mar 10 2023 | 03/10/23 | 2023-03-10 | Feb 28 2023 | 02/28/23 | 2023-02-28 | 10 days |
| [v1.26.1+rke2r1](rke2-v1.26.md#release-v1261rke2r1) | Jan 26 2023 | 01/26/23 | 2023-01-26 | Jan 18 2023 | 01/18/23 | 2023-01-18 | 8 days |
| [v1.26.0+rke2r2](rke2-v1.26.md#release-v1260rke2r2) | Jan 10 2023 | 01/10/23 | 2023-01-10 | Dec 09 2022 | 12/09/22 | 2022-12-09 | 32 days |
| [v1.26.0+rke2r1](rke2-v1.26.md#release-v1260rke2r1) | Dec 15 2022 | 12/15/22 | 2022-12-15 | Dec 09 2022 | 12/09/22 | 2022-12-09 | 6 days |



# Release v1.26.14+rke2r1
<!-- v1.26.14+rke2r1 -->

This release updates Kubernetes to v1.26.14.

**Important Note**

If your server (control-plane) nodes were not started with the `--token` CLI flag or config file key, a randomized token was generated during initial cluster startup. This key is used both for joining new nodes to the cluster, and for encrypting cluster bootstrap data within the datastore. Ensure that you retain a copy of this token, as is required when restoring from backup.

You may retrieve the token value from any server already joined to the cluster:
```bash
cat /var/lib/rancher/rke2/server/token
```

## Changes since v1.26.13+rke2r1:

* Fix validate-charts script [(#5375)](https://github.com/rancher/rke2/pull/5375)
* Windows [(#5370)](https://github.com/rancher/rke2/pull/5370)
* Avoid race condition when deleting HNS networks [(#5385)](https://github.com/rancher/rke2/pull/5385)
* Add CNI plugin flannel support for Windows [(#5396)](https://github.com/rancher/rke2/pull/5396)
* Bump coredns and multus/whereabouts versions [(#5402)](https://github.com/rancher/rke2/pull/5402)
* Fix: missing 'ip link delete cilium_wg0' in rke2-killall.sh [(#5408)](https://github.com/rancher/rke2/pull/5408)
* Update canal version [(#5418)](https://github.com/rancher/rke2/pull/5418)
* Improve calico in windows [(#5429)](https://github.com/rancher/rke2/pull/5429)
* Update Calico to v3.27.0 [(#5438)](https://github.com/rancher/rke2/pull/5438)
* Update Cilium to 1.15.0 [(#5453)](https://github.com/rancher/rke2/pull/5453)
* Backport agent containerd behavior 1.26 [(#5455)](https://github.com/rancher/rke2/pull/5455)
* Bump K3s version for v1.26 [(#5461)](https://github.com/rancher/rke2/pull/5461)
* Bump harvester-csi-driver to 0.1.7 [(#5445)](https://github.com/rancher/rke2/pull/5445)
* Update k8s and Go [(#5468)](https://github.com/rancher/rke2/pull/5468)
* Update Cilium to 1.15.1 [(#5479)](https://github.com/rancher/rke2/pull/5479)
* Bump rke2-coredns chart [(#5499)](https://github.com/rancher/rke2/pull/5499)
* Bump k3s for etcd-only fix [(#5508)](https://github.com/rancher/rke2/pull/5508)
* Add new network policy for ingress controller webhook [(#5512)](https://github.com/rancher/rke2/pull/5512)
* Backport bugfixes for 2024-02 rc [(#5533)](https://github.com/rancher/rke2/pull/5533)
  * Bump wharfie to v0.6.6 to add support for bare hostname as endpoint, fix unnecessary namespace param inclusion
  * Refactor netpol creation and add two new netpols for metrics-server and snapshot-validation-webhook


## Charts Versions
| Component | Version |
| --- | --- |
| rke2-cilium | [1.15.100](https://github.com/rancher/rke2-charts/raw/main/assets/rke2-cilium/rke2-cilium-1.15.100.tgz) |
| rke2-canal | [v3.27.0-build2024020601](https://github.com/rancher/rke2-charts/raw/main/assets/rke2-canal/rke2-canal-v3.27.0-build2024020601.tgz) |
| rke2-calico | [v3.27.002](https://github.com/rancher/rke2-charts/raw/main/assets/rke2-calico/rke2-calico-v3.27.002.tgz) |
| rke2-calico-crd | [v3.27.002](https://github.com/rancher/rke2-charts/raw/main/assets/rke2-calico/rke2-calico-crd-v3.27.002.tgz) |
| rke2-coredns | [1.29.001](https://github.com/rancher/rke2-charts/raw/main/assets/rke2-coredns/rke2-coredns-1.29.001.tgz) |
| rke2-ingress-nginx | [4.8.200](https://github.com/rancher/rke2-charts/raw/main/assets/rke2-ingress-nginx/rke2-ingress-nginx-4.8.200.tgz) |
| rke2-metrics-server | [2.11.100-build2023051513](https://github.com/rancher/rke2-charts/raw/main/assets/rke2-metrics-server/rke2-metrics-server-2.11.100-build2023051513.tgz) |
| rancher-vsphere-csi | [3.0.1-rancher101](https://github.com/rancher/rke2-charts/raw/main/assets/rancher-vsphere-csi/rancher-vsphere-csi-3.0.1-rancher101.tgz) |
| rancher-vsphere-cpi | [1.5.100](https://github.com/rancher/rke2-charts/raw/main/assets/rancher-vsphere-cpi/rancher-vsphere-cpi-1.5.100.tgz) |
| harvester-cloud-provider | [0.2.200](https://github.com/rancher/rke2-charts/raw/main/assets/harvester-cloud-provider/harvester-cloud-provider-0.2.200.tgz) |
| harvester-csi-driver | [0.1.1700](https://github.com/rancher/rke2-charts/raw/main/assets/harvester-cloud-provider/harvester-csi-driver-0.1.1700.tgz) |
| rke2-snapshot-controller | [1.7.202](https://github.com/rancher/rke2-charts/raw/main/assets/rke2-snapshot-controller/rke2-snapshot-controller-1.7.202.tgz) |
| rke2-snapshot-controller-crd | [1.7.202](https://github.com/rancher/rke2-charts/raw/main/assets/rke2-snapshot-controller/rke2-snapshot-controller-crd-1.7.202.tgz) |
| rke2-snapshot-validation-webhook | [1.7.302](https://github.com/rancher/rke2-charts/raw/main/assets/rke2-snapshot-validation-webhook/rke2-snapshot-validation-webhook-1.7.302.tgz) |


## Packaged Component Versions
| Component | Version |
| --- | --- |
| Kubernetes | [v1.26.14](https://github.com/kubernetes/kubernetes/blob/master/CHANGELOG/CHANGELOG-1.26.md#v12614) |
| Etcd | [v3.5.9-k3s1](https://github.com/k3s-io/etcd/releases/tag/v3.5.9-k3s1) |
| Containerd | [v1.7.11-k3s2](https://github.com/k3s-io/containerd/releases/tag/v1.7.11-k3s2) |
| Runc | [v1.1.](https://github.com/opencontainers/runc/releases/tag/v1.1.) |
| Metrics-server | [v0.6.3](https://github.com/kubernetes-sigs/metrics-server/releases/tag/v0.6.3) |
| CoreDNS | [v1.11.1](https://github.com/coredns/coredns/releases/tag/v1.11.1) |
| Ingress-Nginx | [nginx-1.9.3-hardened1](https://github.com/rancher/ingress-nginx/releases/tag/nginx-1.9.3-hardened1) |
| Helm-controller | [](https://github.com/k3s-io/helm-controller/releases/tag/) |

### Available CNIs
| Component | Version | FIPS Compliant |
| --- | --- | --- |
| Canal (Default) | [Flannel v0.24.2](https://github.com/flannel-io/flannel/releases/tag/v0.24.2)<br/>[Calico v3.27.0](https://docs.tigera.io/calico/latest/release-notes/#v3.27) | Yes |
| Calico | [v3.27.0](https://docs.tigera.io/calico/latest/release-notes/#v3.27) | No |
| Cilium | [v1.15.1](https://github.com/cilium/cilium/releases/tag/v1.15.1) | No |
| Multus | [v4.0.2](https://github.com/k8snetworkplumbingwg/multus-cni/releases/tag/v4.0.2) | No |

## Helpful Links

As always, we welcome and appreciate feedback from our community of users. Please feel free to:
- [Open issues here](https://github.com/rancher/rke2/issues/new)
- [Join our Slack channel](https://slack.rancher.io/)
- [Check out our documentation](https://docs.rke2.io) for guidance on how to get started.

-----
# Release v1.26.13+rke2r1
<!-- v1.26.13+rke2r1 -->

This release updates Kubernetes to v1.26.13.

**Important Notes**

Addresses the runc CVE: [CVE-2024-21626](https://nvd.nist.gov/vuln/detail/CVE-2024-21626) by updating runc to v1.1.12.

If your server (control-plane) nodes were not started with the `--token` CLI flag or config file key, a randomized token was generated during initial cluster startup. This key is used both for joining new nodes to the cluster, and for encrypting cluster bootstrap data within the datastore. Ensure that you retain a copy of this token, as is required when restoring from backup.

You may retrieve the token value from any server already joined to the cluster:
```bash
cat /var/lib/rancher/rke2/server/token
```

## Changes since v1.26.12+rke2r1:

* Use dl.k8s.io for getting kubectl [(#5179)](https://github.com/rancher/rke2/pull/5179)
* Ensure charts directory exists in Windows runtime image [(#5185)](https://github.com/rancher/rke2/pull/5185)
* Bump versions of different components [(#5170)](https://github.com/rancher/rke2/pull/5170)
* Update coredns chart to fix bug [(#5202)](https://github.com/rancher/rke2/pull/5202)
* Update multus chart to add optional dhcp daemonset [(#5212)](https://github.com/rancher/rke2/pull/5212)
* Add e2e test about dnscache [(#5228)](https://github.com/rancher/rke2/pull/5228)
* Update rke2-whereabouts to v0.6.3 and bump rke2-multus parent chart [(#5246)](https://github.com/rancher/rke2/pull/5246)
* Bump sriov image build versions [(#5257)](https://github.com/rancher/rke2/pull/5257)
* Enable arm64 based images for calico, multus and harvester [(#5267)](https://github.com/rancher/rke2/pull/5267)
* Improve kube-proxy and calico logging in Windows [(#5286)](https://github.com/rancher/rke2/pull/5286)
* Bump k3s for v1.26 [(#5271)](https://github.com/rancher/rke2/pull/5271)
* Update to 1.26.13 [(#5293)](https://github.com/rancher/rke2/pull/5293)
* Update base image [(#5308)](https://github.com/rancher/rke2/pull/5308)
* Bump K3s and runc versions for v1.26 [(#5352)](https://github.com/rancher/rke2/pull/5352)


## Charts Versions
| Component | Version |
| --- | --- |
| rke2-cilium | [1.14.400](https://github.com/rancher/rke2-charts/raw/main/assets/rke2-cilium/rke2-cilium-1.14.400.tgz) |
| rke2-canal | [v3.26.3-build2023110900](https://github.com/rancher/rke2-charts/raw/main/assets/rke2-canal/rke2-canal-v3.26.3-build2023110900.tgz) |
| rke2-calico | [v3.26.300](https://github.com/rancher/rke2-charts/raw/main/assets/rke2-calico/rke2-calico-v3.26.300.tgz) |
| rke2-calico-crd | [v3.26.300](https://github.com/rancher/rke2-charts/raw/main/assets/rke2-calico/rke2-calico-crd-v3.26.300.tgz) |
| rke2-coredns | [1.24.008](https://github.com/rancher/rke2-charts/raw/main/assets/rke2-coredns/rke2-coredns-1.24.008.tgz) |
| rke2-ingress-nginx | [4.8.200](https://github.com/rancher/rke2-charts/raw/main/assets/rke2-ingress-nginx/rke2-ingress-nginx-4.8.200.tgz) |
| rke2-metrics-server | [2.11.100-build2023051511](https://github.com/rancher/rke2-charts/raw/main/assets/rke2-metrics-server/rke2-metrics-server-2.11.100-build2023051511.tgz) |
| rancher-vsphere-csi | [3.0.1-rancher101](https://github.com/rancher/rke2-charts/raw/main/assets/rancher-vsphere-csi/rancher-vsphere-csi-3.0.1-rancher101.tgz) |
| rancher-vsphere-cpi | [1.5.100](https://github.com/rancher/rke2-charts/raw/main/assets/rancher-vsphere-cpi/rancher-vsphere-cpi-1.5.100.tgz) |
| harvester-cloud-provider | [0.2.200](https://github.com/rancher/rke2-charts/raw/main/assets/harvester-cloud-provider/harvester-cloud-provider-0.2.200.tgz) |
| harvester-csi-driver | [0.1.1600](https://github.com/rancher/rke2-charts/raw/main/assets/harvester-cloud-provider/harvester-csi-driver-0.1.1600.tgz) |
| rke2-snapshot-controller | [1.7.202](https://github.com/rancher/rke2-charts/raw/main/assets/rke2-snapshot-controller/rke2-snapshot-controller-1.7.202.tgz) |
| rke2-snapshot-controller-crd | [1.7.202](https://github.com/rancher/rke2-charts/raw/main/assets/rke2-snapshot-controller/rke2-snapshot-controller-crd-1.7.202.tgz) |
| rke2-snapshot-validation-webhook | [1.7.302](https://github.com/rancher/rke2-charts/raw/main/assets/rke2-snapshot-validation-webhook/rke2-snapshot-validation-webhook-1.7.302.tgz) |


## Packaged Component Versions
| Component | Version |
| --- | --- |
| Kubernetes | [v1.26.13](https://github.com/kubernetes/kubernetes/blob/master/CHANGELOG/CHANGELOG-1.26.md#v12613) |
| Etcd | [v3.5.9-k3s1](https://github.com/k3s-io/etcd/releases/tag/v3.5.9-k3s1) |
| Containerd | [v1.7.11-k3s2](https://github.com/k3s-io/containerd/releases/tag/v1.7.11-k3s2) |
| Runc | [v1.1.12](https://github.com/opencontainers/runc/releases/tag/v1.1.12) |
| Metrics-server | [v0.6.3](https://github.com/kubernetes-sigs/metrics-server/releases/tag/v0.6.3) |
| CoreDNS | [v1.10.1](https://github.com/coredns/coredns/releases/tag/v1.10.1) |
| Ingress-Nginx | [nginx-1.9.3-hardened1](https://github.com/rancher/ingress-nginx/releases/tag/nginx-1.9.3-hardened1) |
| Helm-controller | [v0.15.8](https://github.com/k3s-io/helm-controller/releases/tag/v0.15.8) |

### Available CNIs
| Component | Version | FIPS Compliant |
| --- | --- | --- |
| Canal (Default) | [Flannel v0.23.0](https://github.com/flannel-io/flannel/releases/tag/v0.23.0)<br/>[Calico v3.26.3](https://docs.tigera.io/calico/latest/release-notes/#v3.26) | Yes |
| Calico | [v3.26.3](https://docs.tigera.io/calico/latest/release-notes/#v3.26) | No |
| Cilium | [v1.14.4](https://github.com/cilium/cilium/releases/tag/v1.14.4) | No |
| Multus | [v4.0.2](https://github.com/k8snetworkplumbingwg/multus-cni/releases/tag/v4.0.2) | No |

## Helpful Links

As always, we welcome and appreciate feedback from our community of users. Please feel free to:
- [Open issues here](https://github.com/rancher/rke2/issues/new)
- [Join our Slack channel](https://slack.rancher.io/)
- [Check out our documentation](https://docs.rke2.io) for guidance on how to get started.

-----
# Release v1.26.12+rke2r1
<!-- v1.26.12+rke2r1 -->

This release updates Kubernetes to v1.26.12.

**Important Note**

If your server (control-plane) nodes were not started with the `--token` CLI flag or config file key, a randomized token was generated during initial cluster startup. This key is used both for joining new nodes to the cluster, and for encrypting cluster bootstrap data within the datastore. Ensure that you retain a copy of this token, as is required when restoring from backup.

You may retrieve the token value from any server already joined to the cluster:
```bash
cat /var/lib/rancher/rke2/server/token
```

## Changes since v1.26.11+rke2r1:

* Bump containerd and runc [(#5121)](https://github.com/rancher/rke2/pull/5121)
  * Bumped containerd/runc to v1.7.10/v1.1.10
* Bump containerd to v1.7.11 [(#5131)](https://github.com/rancher/rke2/pull/5131)
* Update to 1.26.12 for december 2023 [(#5149)](https://github.com/rancher/rke2/pull/5149)


## Charts Versions
| Component                        | Version                                                                                                                                                 |
| -------------------------------- | ------------------------------------------------------------------------------------------------------------------------------------------------------- |
| rke2-cilium                      | [1.14.400](https://github.com/rancher/rke2-charts/raw/main/assets/rke2-cilium/rke2-cilium-1.14.400.tgz)                                                 |
| rke2-canal                       | [v3.26.3-build2023110900](https://github.com/rancher/rke2-charts/raw/main/assets/rke2-canal/rke2-canal-v3.26.3-build2023110900.tgz)                     |
| rke2-calico                      | [v3.26.300](https://github.com/rancher/rke2-charts/raw/main/assets/rke2-calico/rke2-calico-v3.26.300.tgz)                                               |
| rke2-calico-crd                  | [v3.26.300](https://github.com/rancher/rke2-charts/raw/main/assets/rke2-calico/rke2-calico-crd-v3.26.300.tgz)                                           |
| rke2-coredns                     | [1.24.006](https://github.com/rancher/rke2-charts/raw/main/assets/rke2-coredns/rke2-coredns-1.24.006.tgz)                                               |
| rke2-ingress-nginx               | [4.8.200](https://github.com/rancher/rke2-charts/raw/main/assets/rke2-ingress-nginx/rke2-ingress-nginx-4.8.200.tgz)                                     |
| rke2-metrics-server              | [2.11.100-build2023051510](https://github.com/rancher/rke2-charts/raw/main/assets/rke2-metrics-server/rke2-metrics-server-2.11.100-build2023051510.tgz) |
| rancher-vsphere-csi              | [3.0.1-rancher101](https://github.com/rancher/rke2-charts/raw/main/assets/rancher-vsphere-csi/rancher-vsphere-csi-3.0.1-rancher101.tgz)                 |
| rancher-vsphere-cpi              | [1.5.100](https://github.com/rancher/rke2-charts/raw/main/assets/rancher-vsphere-cpi/rancher-vsphere-cpi-1.5.100.tgz)                                   |
| harvester-cloud-provider         | [0.2.200](https://github.com/rancher/rke2-charts/raw/main/assets/harvester-cloud-provider/harvester-cloud-provider-0.2.200.tgz)                         |
| harvester-csi-driver             | [0.1.1600](https://github.com/rancher/rke2-charts/raw/main/assets/harvester-cloud-provider/harvester-csi-driver-0.1.1600.tgz)                           |
| rke2-snapshot-controller         | [1.7.202](https://github.com/rancher/rke2-charts/raw/main/assets/rke2-snapshot-controller/rke2-snapshot-controller-1.7.202.tgz)                         |
| rke2-snapshot-controller-crd     | [1.7.202](https://github.com/rancher/rke2-charts/raw/main/assets/rke2-snapshot-controller/rke2-snapshot-controller-crd-1.7.202.tgz)                     |
| rke2-snapshot-validation-webhook | [1.7.302](https://github.com/rancher/rke2-charts/raw/main/assets/rke2-snapshot-validation-webhook/rke2-snapshot-validation-webhook-1.7.302.tgz)         |


## Packaged Component Versions
| Component       | Version                                                                                              |
| --------------- | ---------------------------------------------------------------------------------------------------- |
| Kubernetes      | [v1.26.12](https://github.com/kubernetes/kubernetes/blob/master/CHANGELOG/CHANGELOG-1.26.md#v12612)  |
| Etcd            | [v3.5.9-k3s1](https://github.com/k3s-io/etcd/releases/tag/v3.5.9-k3s1)                               |
| Containerd      | [v1.7.11-k3s2](https://github.com/k3s-io/containerd/releases/tag/v1.7.11-k3s2)                       |
| Runc            | [v1.1.10](https://github.com/opencontainers/runc/releases/tag/v1.1.10)                                   |
| Metrics-server  | [v0.6.3](https://github.com/kubernetes-sigs/metrics-server/releases/tag/v0.6.3)                      |
| CoreDNS         | [v1.10.1](https://github.com/coredns/coredns/releases/tag/v1.10.1)                                   |
| Ingress-Nginx   | [nginx-1.9.3-hardened1](https://github.com/rancher/ingress-nginx/releases/tag/nginx-1.9.3-hardened1) |
| Helm-controller | [v0.15.4](https://github.com/k3s-io/helm-controller/releases/tag/v0.15.4)                            |

### Available CNIs
| Component       | Version                                                                                                                                                   | FIPS Compliant |
| --------------- | --------------------------------------------------------------------------------------------------------------------------------------------------------- | -------------- |
| Canal (Default) | [Flannel v0.23.0](https://github.com/flannel-io/flannel/releases/tag/v0.23.0)<br/>[Calico v3.26.3](https://docs.tigera.io/calico/latest/release-notes/#v3.26) | Yes            |
| Calico          | [v3.26.3](https://docs.tigera.io/calico/latest/release-notes/#v3.26)                                                                                      | No             |
| Cilium          | [v1.14.4](https://github.com/cilium/cilium/releases/tag/v1.14.4)                                                                                          | No             |
| Multus          | [v4.0.2](https://github.com/k8snetworkplumbingwg/multus-cni/releases/tag/v4.0.2)                                                                          | No             |

## Helpful Links

As always, we welcome and appreciate feedback from our community of users. Please feel free to:
- [Open issues here](https://github.com/rancher/rke2/issues/new)
- [Join our Slack channel](https://slack.rancher.io/)
- [Check out our documentation](https://docs.rke2.io) for guidance on how to get started.
-----
# Release v1.26.11+rke2r1
<!-- v1.26.11+rke2r1 -->

This release updates Kubernetes to v1.26.11.

**Important Notes**

This release includes a version of ingress-nginx affected by [CVE-2023-5043](https://github.com/kubernetes/ingress-nginx/issues/10571) and [CVE-2023-5044](https://github.com/kubernetes/ingress-nginx/issues/10572). Ingress administrators should set the --enable-annotation-validation flag to enforce restrictions on the contents of ingress-nginx annotation fields.

If your server (control-plane) nodes were not started with the `--token` CLI flag or config file key, a randomized token was generated during initial cluster startup. This key is used both for joining new nodes to the cluster, and for encrypting cluster bootstrap data within the datastore. Ensure that you retain a copy of this token, as is required when restoring from backup.

You may retrieve the token value from any server already joined to the cluster:
```bash
cat /var/lib/rancher/rke2/server/token
```

## Changes since v1.26.10+rke2r2:

* Add chart validation tests [(#5003)](https://github.com/rancher/rke2/pull/5003)
* Update canal to v3.26.3 [(#5017)](https://github.com/rancher/rke2/pull/5017)
* Update calico to v3.26.3 [(#5027)](https://github.com/rancher/rke2/pull/5027)
* Bump cilium chart to 1.14.400 [(#5059)](https://github.com/rancher/rke2/pull/5059)
* Bump K3s version for v1.26 [(#5031)](https://github.com/rancher/rke2/pull/5031)
  * Containerd may now be configured to use rdt or blockio configuration by defining `rdt_config.yaml` or `blockio_config.yaml` files.
  * Disable helm CRD installation for disable-helm-controller
  * Omit snapshot list configmap entries for snapshots without extra metadata
  * Add jitter to client config retry to avoid hammering servers when they are starting up
* Bump K3s version for v1.26 [(#5074)](https://github.com/rancher/rke2/pull/5074)
  * Don't apply S3 retention if S3 client failed to initialize
  * Don't request metadata when listing S3 snapshots
  * Print key instead of file path in snapshot metadata log message
* Kubernetes patch release [(#5064)](https://github.com/rancher/rke2/pull/5064)
* Remove s390x steps temporarily since runners are disabled [(#5097)](https://github.com/rancher/rke2/pull/5097)


## Charts Versions
| Component                        | Version                                                                                                                                                 |
| -------------------------------- | ------------------------------------------------------------------------------------------------------------------------------------------------------- |
| rke2-cilium                      | [1.14.400](https://github.com/rancher/rke2-charts/raw/main/assets/rke2-cilium/rke2-cilium-1.14.400.tgz)                                                 |
| rke2-canal                       | [v3.26.3-build2023110900](https://github.com/rancher/rke2-charts/raw/main/assets/rke2-canal/rke2-canal-v3.26.3-build2023110900.tgz)                     |
| rke2-calico                      | [v3.26.300](https://github.com/rancher/rke2-charts/raw/main/assets/rke2-calico/rke2-calico-v3.26.300.tgz)                                               |
| rke2-calico-crd                  | [v3.26.300](https://github.com/rancher/rke2-charts/raw/main/assets/rke2-calico/rke2-calico-crd-v3.26.300.tgz)                                           |
| rke2-coredns                     | [1.24.006](https://github.com/rancher/rke2-charts/raw/main/assets/rke2-coredns/rke2-coredns-1.24.006.tgz)                                               |
| rke2-ingress-nginx               | [4.8.200](https://github.com/rancher/rke2-charts/raw/main/assets/rke2-ingress-nginx/rke2-ingress-nginx-4.8.200.tgz)                                     |
| rke2-metrics-server              | [2.11.100-build2023051510](https://github.com/rancher/rke2-charts/raw/main/assets/rke2-metrics-server/rke2-metrics-server-2.11.100-build2023051510.tgz) |
| rancher-vsphere-csi              | [3.0.1-rancher101](https://github.com/rancher/rke2-charts/raw/main/assets/rancher-vsphere-csi/rancher-vsphere-csi-3.0.1-rancher101.tgz)                 |
| rancher-vsphere-cpi              | [1.5.100](https://github.com/rancher/rke2-charts/raw/main/assets/rancher-vsphere-cpi/rancher-vsphere-cpi-1.5.100.tgz)                                   |
| harvester-cloud-provider         | [0.2.200](https://github.com/rancher/rke2-charts/raw/main/assets/harvester-cloud-provider/harvester-cloud-provider-0.2.200.tgz)                         |
| harvester-csi-driver             | [0.1.1600](https://github.com/rancher/rke2-charts/raw/main/assets/harvester-cloud-provider/harvester-csi-driver-0.1.1600.tgz)                           |
| rke2-snapshot-controller         | [1.7.202](https://github.com/rancher/rke2-charts/raw/main/assets/rke2-snapshot-controller/rke2-snapshot-controller-1.7.202.tgz)                         |
| rke2-snapshot-controller-crd     | [1.7.202](https://github.com/rancher/rke2-charts/raw/main/assets/rke2-snapshot-controller/rke2-snapshot-controller-crd-1.7.202.tgz)                     |
| rke2-snapshot-validation-webhook | [1.7.302](https://github.com/rancher/rke2-charts/raw/main/assets/rke2-snapshot-validation-webhook/rke2-snapshot-validation-webhook-1.7.302.tgz)         |


## Packaged Component Versions
| Component       | Version                                                                                              |
| --------------- | ---------------------------------------------------------------------------------------------------- |
| Kubernetes      | [v1.26.11](https://github.com/kubernetes/kubernetes/blob/master/CHANGELOG/CHANGELOG-1.26.md#v12611)  |
| Etcd            | [v3.5.9-k3s1](https://github.com/k3s-io/etcd/releases/tag/v3.5.9-k3s1)                               |
| Containerd      | [v1.7.7-k3s1](https://github.com/k3s-io/containerd/releases/tag/v1.7.7-k3s1)                         |
| Runc            | [v1.1.8](https://github.com/opencontainers/runc/releases/tag/v1.1.8)                                 |
| Metrics-server  | [v0.6.3](https://github.com/kubernetes-sigs/metrics-server/releases/tag/v0.6.3)                      |
| CoreDNS         | [v1.10.1](https://github.com/coredns/coredns/releases/tag/v1.10.1)                                   |
| Ingress-Nginx   | [nginx-1.9.3-hardened1](https://github.com/rancher/ingress-nginx/releases/tag/nginx-1.9.3-hardened1) |
| Helm-controller | [v0.15.4](https://github.com/k3s-io/helm-controller/releases/tag/v0.15.4)                            |

### Available CNIs
| Component       | Version                                                                                                                                                   | FIPS Compliant |
| --------------- | --------------------------------------------------------------------------------------------------------------------------------------------------------- | -------------- |
| Canal (Default) | [Flannel v0.23.0](https://github.com/flannel-io/flannel/releases/tag/v0.23.0)<br/>[Calico v3.26.3](https://docs.tigera.io/calico/latest/release-notes/#v3.26) | Yes            |
| Calico          | [v3.26.3](https://docs.tigera.io/calico/latest/release-notes/#v3.26)                                                                                      | No             |
| Cilium          | [v1.14.4](https://github.com/cilium/cilium/releases/tag/v1.14.4)                                                                                          | No             |
| Multus          | [v4.0.2](https://github.com/k8snetworkplumbingwg/multus-cni/releases/tag/v4.0.2)                                                                          | No             |

## Helpful Links

As always, we welcome and appreciate feedback from our community of users. Please feel free to:
- [Open issues here](https://github.com/rancher/rke2/issues/new)
- [Join our Slack channel](https://slack.rancher.io/)
- [Check out our documentation](https://docs.rke2.io) for guidance on how to get started.
-----
# Release v1.26.10+rke2r2
<!-- v1.26.10+rke2r2 -->

This release fixes an issue with identifying additional container runtimes.

**Important Notes**

This release includes a version of ingress-nginx affected by [CVE-2023-5043](https://github.com/kubernetes/ingress-nginx/issues/10571) and [CVE-2023-5044](https://github.com/kubernetes/ingress-nginx/issues/10572). Ingress administrators should set the --enable-annotation-validation flag to enforce restrictions on the contents of ingress-nginx annotation fields.

If your server (control-plane) nodes were not started with the `--token` CLI flag or config file key, a randomized token was generated during initial cluster startup. This key is used both for joining new nodes to the cluster, and for encrypting cluster bootstrap data within the datastore. Ensure that you retain a copy of this token, as is required when restoring from backup.

You may retrieve the token value from any server already joined to the cluster:
```bash
cat /var/lib/rancher/rke2/server/token
```

## Changes since v1.26.10+rke2r1:

* Bump k3s, include container runtime fix [(#4981)](https://github.com/rancher/rke2/pull/4981)
  * Fixed an issue with identifying additional container runtimes
* Update hardened kubernetes image [(#4986)](https://github.com/rancher/rke2/pull/4986)

## Packaged Component Versions
| Component       | Version                                                                                           |
| --------------- | ------------------------------------------------------------------------------------------------- |
| Kubernetes      | [v1.26.10](https://github.com/kubernetes/kubernetes/blob/master/CHANGELOG/CHANGELOG-1.26.md#v12610) |
| Etcd            | [v3.5.9-k3s1](https://github.com/k3s-io/etcd/releases/tag/v3.5.9-k3s1)                            |
| Containerd      | [v1.7.7-k3s1](https://github.com/k3s-io/containerd/releases/tag/v1.7.7-k3s1)                      |
| Runc            | [v1.1.8](https://github.com/opencontainers/runc/releases/tag/v1.1.8)                              |
| Metrics-server  | [v0.6.3](https://github.com/kubernetes-sigs/metrics-server/releases/tag/v0.6.3)                   |
| CoreDNS         | [v1.10.1](https://github.com/coredns/coredns/releases/tag/v1.10.1)                                |
| Ingress-Nginx   | [4.8.2](https://github.com/kubernetes/ingress-nginx/releases/tag/helm-chart-4.8.2)                |
| Helm-controller | [v0.15.4](https://github.com/k3s-io/helm-controller/releases/tag/v0.15.4)                         |

### Available CNIs
| Component       | Version                                                                                                                                                   | FIPS Compliant |
| --------------- | --------------------------------------------------------------------------------------------------------------------------------------------------------- | -------------- |
| Canal (Default) | [Flannel v0.22.1](https://github.com/flannel-io/flannel/releases/tag/v0.22.1)<br/>[Calico v3.26.1](https://docs.tigera.io/calico/latest/release-notes/#v3.26) | Yes            |
| Calico          | [v3.26.1](https://docs.tigera.io/calico/latest/release-notes/#v3.26)                                                                                      | No             |
| Cilium          | [v1.14.2](https://github.com/cilium/cilium/releases/tag/v1.14.2)                                                                                          | No             |
| Multus          | [v4.0.2](https://github.com/k8snetworkplumbingwg/multus-cni/releases/tag/v4.0.2)                                                                          | No             |

## Helpful Links

As always, we welcome and appreciate feedback from our community of users. Please feel free to:
- [Open issues here](https://github.com/rancher/rke2/issues/new)
- [Join our Slack channel](https://slack.rancher.io/)
- [Check out our documentation](https://docs.rke2.io) for guidance on how to get started.
-----
# Release v1.26.10+rke2r1
<!-- v1.26.10+rke2r1 -->

This release updates Kubernetes to v1.26.10.

**Important Notes**

This release includes a version of ingress-nginx affected by [CVE-2023-5043](https://github.com/kubernetes/ingress-nginx/issues/10571) and [CVE-2023-5044](https://github.com/kubernetes/ingress-nginx/issues/10572). Ingress administrators should set the --enable-annotation-validation flag to enforce restrictions on the contents of ingress-nginx annotation fields.

If your server (control-plane) nodes were not started with the `--token` CLI flag or config file key, a randomized token was generated during initial cluster startup. This key is used both for joining new nodes to the cluster, and for encrypting cluster bootstrap data within the datastore. Ensure that you retain a copy of this token, as is required when restoring from backup.

You may retrieve the token value from any server already joined to the cluster:
```bash
cat /var/lib/rancher/rke2/server/token
```

## Changes since v1.26.9+rke2r1:

* Add a time.Sleep in calico-win to avoid polluting the logs [(#4792)](https://github.com/rancher/rke2/pull/4792)
* Support generic "cis" profile [(#4798)](https://github.com/rancher/rke2/pull/4798)
* Update calico chart to accept felix config values [(#4815)](https://github.com/rancher/rke2/pull/4815)
* Remove unnecessary docker pull [(#4822)](https://github.com/rancher/rke2/pull/4822)
* Mirrored pause backport [(#4827)](https://github.com/rancher/rke2/pull/4827)
* Write pod-manifests as 0600 in cis mode [(#4839)](https://github.com/rancher/rke2/pull/4839)
* Bumping k3s [(#4863)](https://github.com/rancher/rke2/pull/4863)
* Filter release branches [(#4858)](https://github.com/rancher/rke2/pull/4858)
* Update charts to have ipFamilyPolicy: PreferDualStack as default [(#4846)](https://github.com/rancher/rke2/pull/4846)
* Bump K3s, Cilium, Token Rotation support [(#4870)](https://github.com/rancher/rke2/pull/4870)
* Bump containerd to v1.7.7+k3s1 [(#4881)](https://github.com/rancher/rke2/pull/4881)
* Bump K3s version for v1.26 [(#4885)](https://github.com/rancher/rke2/pull/4885)
  * RKE2 now tracks snapshots using custom resource definitions. This resolves an issue where the configmap previously used to track snapshot metadata could grow excessively large and fail to update when new snapshots were taken.
  * Fixed an issue where static pod startup checks may return false positives in the case of pod restarts.
* K3s Bump [(#4898)](https://github.com/rancher/rke2/pull/4898)
* Bump K3s version for v1.26 [(#4918)](https://github.com/rancher/rke2/pull/4918)
  * Re-enable etcd endpoint auto-sync 
  * Manually requeue configmap reconcile when no nodes have reconciled snapshots
* Update Kubernetes to v1.26.10 [(#4921)](https://github.com/rancher/rke2/pull/4921)
* Remove pod-manifests dir in killall script [(#4927)](https://github.com/rancher/rke2/pull/4927)
* Revert mirrored pause backport [(#4936)](https://github.com/rancher/rke2/pull/4936)
* Bump ingress-nginx to v1.9.3 [(#4957)](https://github.com/rancher/rke2/pull/4957)
* Bump ingress-nginx to v1.9.3 [(#4959)](https://github.com/rancher/rke2/pull/4959)
* Bump ingress-nginx to v1.9.3 [(#4960)](https://github.com/rancher/rke2/pull/4960)
* Bump K3s version for v1.26 [(#4970)](https://github.com/rancher/rke2/pull/4970)

## Packaged Component Versions
| Component       | Version                                                                                           |
| --------------- | ------------------------------------------------------------------------------------------------- |
| Kubernetes      | [v1.26.10](https://github.com/kubernetes/kubernetes/blob/master/CHANGELOG/CHANGELOG-1.26.md#v12610) |
| Etcd            | [v3.5.9-k3s1](https://github.com/k3s-io/etcd/releases/tag/v3.5.9-k3s1)                            |
| Containerd      | [v1.7.7-k3s1](https://github.com/k3s-io/containerd/releases/tag/v1.7.7-k3s1)                      |
| Runc            | [v1.1.8](https://github.com/opencontainers/runc/releases/tag/v1.1.8)                              |
| Metrics-server  | [v0.6.3](https://github.com/kubernetes-sigs/metrics-server/releases/tag/v0.6.3)                   |
| CoreDNS         | [v1.10.1](https://github.com/coredns/coredns/releases/tag/v1.10.1)                                |
| Ingress-Nginx   | [4.8.2](https://github.com/kubernetes/ingress-nginx/releases/tag/helm-chart-4.8.2)                |
| Helm-controller | [v0.15.4](https://github.com/k3s-io/helm-controller/releases/tag/v0.15.4)                         |

### Available CNIs
| Component       | Version                                                                                                                                                   | FIPS Compliant |
| --------------- | --------------------------------------------------------------------------------------------------------------------------------------------------------- | -------------- |
| Canal (Default) | [Flannel v0.22.1](https://github.com/flannel-io/flannel/releases/tag/v0.22.1)<br/>[Calico v3.26.1](https://docs.tigera.io/calico/latest/release-notes/#v3.26) | Yes            |
| Calico          | [v3.26.1](https://docs.tigera.io/calico/latest/release-notes/#v3.26)                                                                                      | No             |
| Cilium          | [v1.14.2](https://github.com/cilium/cilium/releases/tag/v1.14.2)                                                                                          | No             |
| Multus          | [v4.0.2](https://github.com/k8snetworkplumbingwg/multus-cni/releases/tag/v4.0.2)                                                                          | No             |

## Helpful Links

As always, we welcome and appreciate feedback from our community of users. Please feel free to:
- [Open issues here](https://github.com/rancher/rke2/issues/new)
- [Join our Slack channel](https://slack.rancher.io/)
- [Check out our documentation](https://docs.rke2.io) for guidance on how to get started.
-----
# Release v1.26.9+rke2r1
<!-- v1.26.9+rke2r1 -->

This release updates Kubernetes to v1.26.9.

**Important Note**

If your server (control-plane) nodes were not started with the `--token` CLI flag or config file key, a randomized token was generated during initial cluster startup. This key is used both for joining new nodes to the cluster, and for encrypting cluster bootstrap data within the datastore. Ensure that you retain a copy of this token, as is required when restoring from backup.

You may retrieve the token value from any server already joined to the cluster:
```bash
cat /var/lib/rancher/rke2/server/token
```

## Changes since v1.26.8+rke2r1:

* Update cilium to 1.14.1 [(#4757)](https://github.com/rancher/rke2/pull/4757)
* Update Kubernetes to v1.26.9 [(#4762)](https://github.com/rancher/rke2/pull/4762)

## Packaged Component Versions
| Component       | Version                                                                                           |
| --------------- | ------------------------------------------------------------------------------------------------- |
| Kubernetes      | [v1.26.9](https://github.com/kubernetes/kubernetes/blob/master/CHANGELOG/CHANGELOG-1.26.md#v1269) |
| Etcd            | [v3.5.9-k3s1](https://github.com/k3s-io/etcd/releases/tag/v3.5.9-k3s1)                            |
| Containerd      | [v1.7.3-k3s1](https://github.com/k3s-io/containerd/releases/tag/v1.7.3-k3s1)                      |
| Runc            | [v1.1.8](https://github.com/opencontainers/runc/releases/tag/v1.1.8)                              |
| Metrics-server  | [v0.6.3](https://github.com/kubernetes-sigs/metrics-server/releases/tag/v0.6.3)                   |
| CoreDNS         | [v1.10.1](https://github.com/coredns/coredns/releases/tag/v1.10.1)                                |
| Ingress-Nginx   | [4.6.1](https://github.com/kubernetes/ingress-nginx/releases/tag/helm-chart-4.6.1)                |
| Helm-controller | [v0.15.4](https://github.com/k3s-io/helm-controller/releases/tag/v0.15.4)                         |

### Available CNIs
| Component       | Version                                                                                                                                                   | FIPS Compliant |
| --------------- | --------------------------------------------------------------------------------------------------------------------------------------------------------- | -------------- |
| Canal (Default) | [Flannel v0.22.1](https://github.com/flannel-io/flannel/releases/tag/v0.22.1)<br/>[Calico v3.26.1](https://docs.tigera.io/calico/latest/release-notes/#v3.26) | Yes            |
| Calico          | [v3.26.1](https://docs.tigera.io/calico/latest/release-notes/#v3.26)                                                                                      | No             |
| Cilium          | [v1.14.1](https://github.com/cilium/cilium/releases/tag/v1.14.1)                                                                                          | No             |
| Multus          | [v4.0.2](https://github.com/k8snetworkplumbingwg/multus-cni/releases/tag/v4.0.2)                                                                          | No             |

## Helpful Links

As always, we welcome and appreciate feedback from our community of users. Please feel free to:
- [Open issues here](https://github.com/rancher/rke2/issues/new)
- [Join our Slack channel](https://slack.rancher.io/)
- [Check out our documentation](https://docs.rke2.io) for guidance on how to get started.
-----
# Release v1.26.8+rke2r1
<!-- v1.26.8+rke2r1 -->

This release updates Kubernetes to v1.26.8, and fixes a number of issues.

**Important Notes**

*  This release includes support for remediating CVE-2023-32186, a potential Denial of Service attack vector on RKE2 servers. See https://github.com/rancher/rke2/security/advisories/GHSA-p45j-vfv5-wprq for more information, including mandatory steps necessary to harden clusters against this vulnerability.

* If your server (control-plane) nodes were not started with the `--token` CLI flag or config file key, a randomized token was generated during initial cluster startup. This key is used both for joining new nodes to the cluster, and for encrypting cluster bootstrap data within the datastore. Ensure that you retain a copy of this token, as is required when restoring from backup.

  You may retrieve the token value from any server already joined to the cluster:
  ```bash
  cat /var/lib/rancher/rke2/server/token
  ```

## Changes since v1.26.7+rke2r1:

* Sync Felix and calico-node datastore [(#4576)](https://github.com/rancher/rke2/pull/4576)
* Update Calico and Flannel on Canal [(#4564)](https://github.com/rancher/rke2/pull/4564)
* Update cilium to v1.14.0 [(#4586)](https://github.com/rancher/rke2/pull/4586)
* Update to whereabouts v0.6.2 [(#4591)](https://github.com/rancher/rke2/pull/4591)
* Version bumps and backports for 2023-08 release [(#4598)](https://github.com/rancher/rke2/pull/4598)
  * Updated the embedded containerd to v1.7.3+k3s1
  * Updated the embedded runc to v1.1.8
  * Updated the embedded etcd to v3.5.9+k3s1
  * Updated the rke2-snapshot-validation-webhook chart to enable VolumeSnapshotClass validation
  * Security bump to docker/distribution
  * Fix static pod UID generation and cleanup
  * Fix default server address for rotate-ca command
* Fix wrongly formatted files [(#4612)](https://github.com/rancher/rke2/pull/4612)
* Fix repeating "cannot find file" error [(#4618)](https://github.com/rancher/rke2/pull/4618)
* Bump k3s version to recent 1.26 [(#4636)](https://github.com/rancher/rke2/pull/4636)
* Bump K3s version for v1.26 [(#4647)](https://github.com/rancher/rke2/pull/4647)
  * The version of `helm` used by the bundled helm controller's job image has been updated to v3.12.3
  * Bumped dynamiclistener to address an issue that could cause the supervisor listener on 9345 to stop serving requests on etcd-only nodes.
  * The RKE2 supervisor listener on 9345 now sends a complete certificate chain in the TLS handshake.
* Install BGP windows packages in Windows image for tests [(#4652)](https://github.com/rancher/rke2/pull/4652)
* Allow OS env variables to be consumed [(#4657)](https://github.com/rancher/rke2/pull/4657)
* Upgrade multus chart to v4.0.2-build2023081100 [(#4664)](https://github.com/rancher/rke2/pull/4664)
* Fix bug. Add VXLAN_VNI env var to Calico-node exec [(#4671)](https://github.com/rancher/rke2/pull/4671)
* Update to v1.26.8 [(#4684)](https://github.com/rancher/rke2/pull/4684)
* Bump K3s version for v1.26 [(#4702)](https://github.com/rancher/rke2/pull/4702)
  * Added a new `--tls-san-security` option. This flag defaults to false, but can be set to true to disable automatically adding SANs to the server's TLS certificate to satisfy any hostname requested by a client.
* Add additional static pod cleanup during cluster reset [(#4725)](https://github.com/rancher/rke2/pull/4725)

## Packaged Component Versions
| Component       | Version                                                                                           |
| --------------- | ------------------------------------------------------------------------------------------------- |
| Kubernetes      | [v1.26.8](https://github.com/kubernetes/kubernetes/blob/master/CHANGELOG/CHANGELOG-1.26.md#v1268) |
| Etcd            | [v3.5.9-k3s1](https://github.com/k3s-io/etcd/releases/tag/v3.5.9-k3s1)                            |
| Containerd      | [v1.7.3-k3s1](https://github.com/k3s-io/containerd/releases/tag/v1.7.3-k3s1)                      |
| Runc            | [v1.1.8](https://github.com/opencontainers/runc/releases/tag/v1.1.8)                              |
| Metrics-server  | [v0.6.3](https://github.com/kubernetes-sigs/metrics-server/releases/tag/v0.6.3)                   |
| CoreDNS         | [v1.10.1](https://github.com/coredns/coredns/releases/tag/v1.10.1)                                |
| Ingress-Nginx   | [4.6.1](https://github.com/kubernetes/ingress-nginx/releases/tag/helm-chart-4.6.1)                |
| Helm-controller | [v0.15.4](https://github.com/k3s-io/helm-controller/releases/tag/v0.15.4)                         |

### Available CNIs
| Component       | Version                                                                                                                                                   | FIPS Compliant |
| --------------- | --------------------------------------------------------------------------------------------------------------------------------------------------------- | -------------- |
| Canal (Default) | [Flannel v0.22.1](https://github.com/flannel-io/flannel/releases/tag/v0.22.1)<br/>[Calico v3.26.1](https://docs.tigera.io/calico/latest/release-notes/#v3.26) | Yes            |
| Calico          | [v3.26.1](https://docs.tigera.io/calico/latest/release-notes/#v3.26)                                                                                      | No             |
| Cilium          | [v1.14.0](https://github.com/cilium/cilium/releases/tag/v1.14.0)                                                                                          | No             |
| Multus          | [v4.0.2](https://github.com/k8snetworkplumbingwg/multus-cni/releases/tag/v4.0.2)                                                                          | No             |

## Helpful Links

As always, we welcome and appreciate feedback from our community of users. Please feel free to:
- [Open issues here](https://github.com/rancher/rke2/issues/new)
- [Join our Slack channel](https://slack.rancher.io/)
- [Check out our documentation](https://docs.rke2.io) for guidance on how to get started.
-----
# Release v1.26.7+rke2r1
<!-- v1.26.7+rke2r1 -->

This release updates Kubernetes to v1.26.7, and fixes a number of issues.

**Important Note**

If your server (control-plane) nodes were not started with the `--token` CLI flag or config file key, a randomized token was generated during initial cluster startup. This key is used both for joining new nodes to the cluster, and for encrypting cluster bootstrap data within the datastore. Ensure that you retain a copy of this token, as is required when restoring from backup.

You may retrieve the token value from any server already joined to the cluster:
```bash
cat /var/lib/rancher/rke2/server/token
```

## Changes since v1.26.6+rke2r1:

* Update Calico to v3.26.1 [(#4424)](https://github.com/rancher/rke2/pull/4424)
* Update multus version [(#4432)](https://github.com/rancher/rke2/pull/4432)
* Add log files for felix and calico [(#4438)](https://github.com/rancher/rke2/pull/4438)
* Update K3s for 2023-07 releases [(#4448)](https://github.com/rancher/rke2/pull/4448)
* Bump ingress-nginx charts to v1.7.1 [(#4454)](https://github.com/rancher/rke2/pull/4454)
* Add support for cni none on windows and initial windows-bgp backend [(#4460)](https://github.com/rancher/rke2/pull/4460)
* Updated Calico crd on Canal [(#4467)](https://github.com/rancher/rke2/pull/4467)
* Update to 1.26.7 [(#4493)](https://github.com/rancher/rke2/pull/4493)

## Packaged Component Versions
| Component       | Version                                                                                           |
| --------------- | ------------------------------------------------------------------------------------------------- |
| Kubernetes      | [v1.26.7](https://github.com/kubernetes/kubernetes/blob/master/CHANGELOG/CHANGELOG-1.26.md#v1267) |
| Etcd            | [v3.5.7-k3s1](https://github.com/k3s-io/etcd/releases/tag/v3.5.7-k3s1)                            |
| Containerd      | [v1.7.1-k3s1](https://github.com/k3s-io/containerd/releases/tag/v1.7.1-k3s1)                      |
| Runc            | [v1.1.7](https://github.com/opencontainers/runc/releases/tag/v1.1.7)                              |
| Metrics-server  | [v0.6.3](https://github.com/kubernetes-sigs/metrics-server/releases/tag/v0.6.3)                   |
| CoreDNS         | [v1.10.1](https://github.com/coredns/coredns/releases/tag/v1.10.1)                                |
| Ingress-Nginx   | [4.6.1](https://github.com/kubernetes/ingress-nginx/releases/tag/helm-chart-4.6.1)                |
| Helm-controller | [v0.15.2](https://github.com/k3s-io/helm-controller/releases/tag/v0.15.2)                         |

### Available CNIs
| Component       | Version                                                                                                                                                                     | FIPS Compliant |
| --------------- | --------------------------------------------------------------------------------------------------------------------------------------------------------------------------- | -------------- |
| Canal (Default) | [Flannel v0.22.0](https://github.com/flannel-io/flannel/releases/tag/v0.22.0)<br/>[Calico v3.25.1](https://projectcalico.docs.tigera.io/archive/v3.25/release-notes/#v3251) | Yes            |
| Calico          | [v3.26.1](https://projectcalico.docs.tigera.io/archive/v3.26/release-notes/#v3261)                                                                                          | No             |
| Cilium          | [v1.13.2](https://github.com/cilium/cilium/releases/tag/v1.13.2)                                                                                                            | No             |
| Multus          | [v4.0.2](https://github.com/k8snetworkplumbingwg/multus-cni/releases/tag/v4.0.2)                                                                                            | No             |

## Helpful Links

As always, we welcome and appreciate feedback from our community of users. Please feel free to:
- [Open issues here](https://github.com/rancher/rke2/issues/new)
- [Join our Slack channel](https://slack.rancher.io/)
- [Check out our documentation](https://docs.rke2.io) for guidance on how to get started.
-----
# Release v1.26.6+rke2r1
<!-- v1.26.6+rke2r1 -->

This release updates Kubernetes to v1.26.6, and fixes a number of issues.

**Important Note**

If your server (control-plane) nodes were not started with the `--token` CLI flag or config file key, a randomized token was generated during initial cluster startup. This key is used both for joining new nodes to the cluster, and for encrypting cluster bootstrap data within the datastore. Ensure that you retain a copy of this token, as is required when restoring from backup.

You may retrieve the token value from any server already joined to the cluster:
```bash
cat /var/lib/rancher/rke2/server/token
```

## Changes since v1.26.5+rke2r1:

* Update canal chart [(#4343)](https://github.com/rancher/rke2/pull/4343)
* Bump K3s version for v1.26 [(#4358)](https://github.com/rancher/rke2/pull/4358)
* Update rke2 [(#4368)](https://github.com/rancher/rke2/pull/4368)
* Bump harvester cloud provider 0.2.2 [(#4376)](https://github.com/rancher/rke2/pull/4376)
* Preserve mode when extracting runtime data [(#4378)](https://github.com/rancher/rke2/pull/4378)
* Use our own file copy logic instead of continuity [(#4389)](https://github.com/rancher/rke2/pull/4389)

## Packaged Component Versions
| Component       | Version                                                                                           |
| --------------- | ------------------------------------------------------------------------------------------------- |
| Kubernetes      | [v1.26.6](https://github.com/kubernetes/kubernetes/blob/master/CHANGELOG/CHANGELOG-1.26.md#v1266) |
| Etcd            | [v3.5.7-k3s1](https://github.com/k3s-io/etcd/releases/tag/v3.5.7-k3s1)                       |
| Containerd      | [v1.7.1-k3s1](https://github.com/k3s-io/containerd/releases/tag/v1.7.1-k3s1)                      |
| Runc            | [v1.1.7](https://github.com/opencontainers/runc/releases/tag/v1.1.7)                              |
| Metrics-server  | [v0.6.3](https://github.com/kubernetes-sigs/metrics-server/releases/tag/v0.6.3)                   |
| CoreDNS         | [v1.10.1](https://github.com/coredns/coredns/releases/tag/v1.10.1)                                  |
| Ingress-Nginx   | [4.5.2](https://github.com/kubernetes/ingress-nginx/releases/tag/helm-chart-4.5.2)                                  |
| Helm-controller | [v0.15.0](https://github.com/k3s-io/helm-controller/releases/tag/v0.15.0)                         |

### Available CNIs
| Component       | Version                                                                                                                                                                             | FIPS Compliant |
| --------------- | ----------------------------------------------------------------------------------------------------------------------------------------------------------------------------------- | -------------- |
| Canal (Default) | [Flannel v0.22.0](https://github.com/k3s-io/flannel/releases/tag/v0.22.0)<br/>[Calico v3.25.1](https://projectcalico.docs.tigera.io/archive/v3.25/release-notes/#v3251) | Yes            |
| Calico          | [v3.25.0](https://projectcalico.docs.tigera.io/archive/v3.25/release-notes/#v3250)                                                                    | No             |
| Cilium          | [v1.13.2](https://github.com/cilium/cilium/releases/tag/v1.13.2)                                                                                                                      | No             |
| Multus          | [v3.9.3](https://github.com/k8snetworkplumbingwg/multus-cni/releases/tag/v3.9.3)                                                                                                    | No             |

## Helpful Links

As always, we welcome and appreciate feedback from our community of users. Please feel free to:
- [Open issues here](https://github.com/rancher/rke2/issues/new)
- [Join our Slack channel](https://slack.rancher.io/)
- [Check out our documentation](https://docs.rke2.io) for guidance on how to get started.
-----
# Release v1.26.5+rke2r1
<!-- v1.26.5+rke2r1 -->

This release updates Kubernetes to v1.26.5, and fixes a number of issues.

**Important Note**

1. If your server (control-plane) nodes were not started with the `--token` CLI flag or config file key, a randomized token was generated during initial cluster startup. This key is used both for joining new nodes to the cluster, and for encrypting cluster bootstrap data within the datastore. Ensure that you retain a copy of this token, as is required when restoring from backup.

You may retrieve the token value from any server already joined to the cluster:
```bash
cat /var/lib/rancher/rke2/server/token
```

2. Many systems have updated their packages with newer version of container-selinux (> v2.191.0) which is incompatible with our rke2-selinux policy and require a change in policy. We have updated our policy; you will notice the rke2-selinux package being upgraded from version v0.11.1 to newer version v0.12.0.

## Changes since v1.26.4+rke2r1:

* Fix drone dispatch step [(#4148)](https://github.com/rancher/rke2/pull/4148)
* Update Cilium to v1.13.2 [(#4175)](https://github.com/rancher/rke2/pull/4175)
* Bump golangci-lint for golang 1.20 compat and fix warnings [(#4186)](https://github.com/rancher/rke2/pull/4186)
* Enable --with-node-id flag [(#4190)](https://github.com/rancher/rke2/pull/4190)
* Backport fixes and bump K3s/containerd/runc versions [(#4211)](https://github.com/rancher/rke2/pull/4211)
  * The bundled containerd and runc versions have been bumped to v1.7.1-k3s1/v1.1.7
  * Replace `github.com/ghodss/yaml` with `sigs.k8s.io/yaml`
  * Fix hardcoded file mount handling for default audit log filename
* Update Calico image on Canal [(#4218)](https://github.com/rancher/rke2/pull/4218)
* Move Drone dispatch pipeline [(#4205)](https://github.com/rancher/rke2/pull/4205)
* Upgrade docker/docker package (#4225) [(#4234)](https://github.com/rancher/rke2/pull/4234)
* Bump metrics-server to v0.6.3 [(#4245)](https://github.com/rancher/rke2/pull/4245)
* V1.26.5+rke2r1 [(#4260)](https://github.com/rancher/rke2/pull/4260)
* Bump vsphere csi/cpi and csi snapshot charts [(#4272)](https://github.com/rancher/rke2/pull/4272)
* Bump vsphere csi to remove duplicate CSI deployment. [(#4296)](https://github.com/rancher/rke2/pull/4296)

## Packaged Component Versions
| Component       | Version                                                                                           |
| --------------- | ------------------------------------------------------------------------------------------------- |
| Kubernetes      | [v1.26.5](https://github.com/kubernetes/kubernetes/blob/master/CHANGELOG/CHANGELOG-1.26.md#v1265) |
| Etcd            | [v3.5.7-k3s1](https://github.com/k3s-io/etcd/releases/tag/v3.5.7-k3s1)                            |
| Containerd      | [v1.7.1-k3s1](https://github.com/k3s-io/containerd/releases/tag/v1.7.1-k3s1)                      |
| Runc            | [v1.1.7](https://github.com/opencontainers/runc/releases/tag/v1.1.7)                              |
| Metrics-server  | [v0.6.3](https://github.com/kubernetes-sigs/metrics-server/releases/tag/v0.6.3)                   |
| CoreDNS         | [v1.10.1](https://github.com/coredns/coredns/releases/tag/v1.10.1)                                |
| Ingress-Nginx   | [4.5.2](https://github.com/kubernetes/ingress-nginx/releases/tag/helm-chart-4.5.2)                |
| Helm-controller | [v0.14.0](https://github.com/k3s-io/helm-controller/releases/tag/v0.14.0)                         |

### Available CNIs
| Component       | Version                                                                                                                                                                             | FIPS Compliant |
| --------------- | ----------------------------------------------------------------------------------------------------------------------------------------------------------------------------------- | -------------- |
| Canal (Default) | [Flannel v0.21.3](https://github.com/k3s-io/flannel/releases/tag/v0.21.3)<br/>[Calico v3.25.1](https://projectcalico.docs.tigera.io/archive/v3.25/release-notes/#v3251) | Yes            |
| Calico          | [v3.25.0](https://projectcalico.docs.tigera.io/archive/v3.25/release-notes/#v3250)                                                                    | No             |
| Cilium          | [v1.13.2](https://github.com/cilium/cilium/releases/tag/v1.13.2)                                                                                                                      | No             |
| Multus          | [v3.9.3](https://github.com/k8snetworkplumbingwg/multus-cni/releases/tag/v3.9.3)                                                                                                    | No             |

## Helpful Links

As always, we welcome and appreciate feedback from our community of users. Please feel free to:
- [Open issues here](https://github.com/rancher/rke2/issues/new)
- [Join our Slack channel](https://slack.rancher.io/)
- [Check out our documentation](https://docs.rke2.io) for guidance on how to get started.

-----
# Release v1.26.4+rke2r1
<!-- v1.26.4+rke2r1 -->

This release updates Kubernetes to v1.26.4, and fixes a number of issues.

**Important Note**

If your server (control-plane) nodes were not started with the `--token` CLI flag or config file key, a randomized token was generated during initial cluster startup. This key is used both for joining new nodes to the cluster, and for encrypting cluster bootstrap data within the datastore. Ensure that you retain a copy of this token, as is required when restoring from backup.

You may retrieve the token value from any server already joined to the cluster:
```bash
cat /var/lib/rancher/rke2/server/token
```

## Changes since v1.26.3+rke2r1:

* Adding decision against rc version removal [(#3155)](https://github.com/rancher/rke2/pull/3155)
* Bump to 1.24.12 [(#4064)](https://github.com/rancher/rke2/pull/4064)
* Add skipfiles step to skip drone runs based on files in PR [(#3977)](https://github.com/rancher/rke2/pull/3977)
* Update whereabouts to v0.6.1 [(#4080)](https://github.com/rancher/rke2/pull/4080)
* Automatically add volume mount for audit-log-path dir if set [(#4027)](https://github.com/rancher/rke2/pull/4027)
* Updated Calico chart to add crd missing values [(#4044)](https://github.com/rancher/rke2/pull/4044)
* Clean up static pods on etcd member removal [(#4066)](https://github.com/rancher/rke2/pull/4066)
* Add ADR for security bumps automation [(#3570)](https://github.com/rancher/rke2/pull/3570)
* Make commands for terraform automation and fix upgrade split role tests [(#4056)](https://github.com/rancher/rke2/pull/4056)
* Bump ingress-nginx to 1.6.4 [(#4090)](https://github.com/rancher/rke2/pull/4090)
* Fix wrong dependency name [(#4093)](https://github.com/rancher/rke2/pull/4093)
* Bump k3s and component versions for 2023-04 release [(#4096)](https://github.com/rancher/rke2/pull/4096)
* Update Kubernetes to v1.26.4 [(#4115)](https://github.com/rancher/rke2/pull/4115)

## Packaged Component Versions
| Component       | Version                                                                                           |
| --------------- | ------------------------------------------------------------------------------------------------- |
| Kubernetes      | [v1.26.4](https://github.com/kubernetes/kubernetes/blob/master/CHANGELOG/CHANGELOG-1.26.md#v1264) |
| Etcd            | [v3.5.7-k3s1](https://github.com/k3s-io/etcd/releases/tag/v3.5.7-k3s1)                            |
| Containerd      | [v1.6.19-k3s1](https://github.com/k3s-io/containerd/releases/tag/v1.6.19-k3s1)                    |
| Runc            | [v1.1.5](https://github.com/opencontainers/runc/releases/tag/v1.1.5)                              |
| Metrics-server  | [v0.6.2](https://github.com/kubernetes-sigs/metrics-server/releases/tag/v0.6.2)                   |
| CoreDNS         | [v1.10.1](https://github.com/coredns/coredns/releases/tag/v1.10.1)                                |
| Ingress-Nginx   | [4.5.2](https://github.com/kubernetes/ingress-nginx/releases/tag/helm-chart-4.5.2)                |
| Helm-controller | [v0.13.2](https://github.com/k3s-io/helm-controller/releases/tag/v0.13.2)                         |

### Available CNIs
| Component       | Version                                                                                                                                                                 | FIPS Compliant |
| --------------- | ----------------------------------------------------------------------------------------------------------------------------------------------------------------------- | -------------- |
| Canal (Default) | [Flannel v0.21.3](https://github.com/k3s-io/flannel/releases/tag/v0.21.3)<br/>[Calico v3.25.0](https://projectcalico.docs.tigera.io/archive/v3.25/release-notes/#v3250) | Yes            |
| Calico          | [v3.25.0](https://projectcalico.docs.tigera.io/archive/v3.25/release-notes/#v3250)                                                                                      | No             |
| Cilium          | [v1.13.0](https://github.com/cilium/cilium/releases/tag/v1.13.0)                                                                                                        | No             |
| Multus          | [v3.9.3](https://github.com/k8snetworkplumbingwg/multus-cni/releases/tag/v3.9.3)                                                                                        | No             |

## Helpful Links

As always, we welcome and appreciate feedback from our community of users. Please feel free to:
- [Open issues here](https://github.com/rancher/rke2/issues/new)
- [Join our Slack channel](https://slack.rancher.io/)
- [Check out our documentation](https://docs.rke2.io) for guidance on how to get started.
-----
# Release v1.26.3+rke2r1
<!-- v1.26.3+rke2r1 -->

This release updates Kubernetes to v1.26.3, and fixes a number of issues.

**Important Note**

If your server (control-plane) nodes were not started with the `--token` CLI flag or config file key, a randomized token was generated during initial cluster startup. This key is used both for joining new nodes to the cluster, and for encrypting cluster bootstrap data within the datastore. Ensure that you retain a copy of this token, as is required when restoring from backup.

You may retrieve the token value from any server already joined to the cluster:
```bash
cat /var/lib/rancher/rke2/server/token
```

## Changes since v1.26.2+rke2r1:

* Remove root `--debug` flag [(#3955)](https://github.com/rancher/rke2/pull/3955)
* Remove unmounts in killall script [(#3954)](https://github.com/rancher/rke2/pull/3954)
* Update Flannel version to v0.21.3 on Canal [(#3980)](https://github.com/rancher/rke2/pull/3980)
* Remove unnecessary bits from testing dockerfile [(#3975)](https://github.com/rancher/rke2/pull/3975)
* Expand SUC upgrade check to check pods as well as nodes [(#3938)](https://github.com/rancher/rke2/pull/3938)
* Don't package empty Windows folder in Linux tar [(#3970)](https://github.com/rancher/rke2/pull/3970)
* Bump K3s [(#3990)](https://github.com/rancher/rke2/pull/3990)
* Improve uninstallation on RHEL based OS [(#3919)](https://github.com/rancher/rke2/pull/3919)
* Update cilim to v1.13.0 [(#4003)](https://github.com/rancher/rke2/pull/4003)
* Bump harvester csi driver to v0.1.16 [(#3999)](https://github.com/rancher/rke2/pull/3999)
* Update stable channel to v1.24.11+rke2r1 [(#4010)](https://github.com/rancher/rke2/pull/4010)
* Bump k3s and containerd [(#4015)](https://github.com/rancher/rke2/pull/4015)
* Add automation for Restart command for Rke2 [(#3962)](https://github.com/rancher/rke2/pull/3962)
* Update 1.26 and Go [(#4033)](https://github.com/rancher/rke2/pull/4033)

## Packaged Component Versions
| Component       | Version                                                                                           |
| --------------- | ------------------------------------------------------------------------------------------------- |
| Kubernetes      | [v1.26.3](https://github.com/kubernetes/kubernetes/blob/master/CHANGELOG/CHANGELOG-1.26.md#v1263) |
| Etcd            | [v3.5.5-k3s1](https://github.com/k3s-io/etcd/releases/tag/v3.5.5-k3s1)                            |
| Containerd      | [v1.6.19-k3s1](https://github.com/k3s-io/containerd/releases/tag/v1.6.19-k3s1)                    |
| Runc            | [v1.1.4](https://github.com/opencontainers/runc/releases/tag/v1.1.4)                              |
| Metrics-server  | [v0.6.2](https://github.com/kubernetes-sigs/metrics-server/releases/tag/v0.6.2)                   |
| CoreDNS         | [v1.9.3](https://github.com/coredns/coredns/releases/tag/v1.9.3)                                  |
| Ingress-Nginx   | [4.1.0](https://github.com/kubernetes/ingress-nginx/releases/tag/helm-chart-4.1.0)                |
| Helm-controller | [v0.13.2](https://github.com/k3s-io/helm-controller/releases/tag/v0.13.2)                         |

### Available CNIs
| Component       | Version                                                                                                                                                                 | FIPS Compliant |
| --------------- | ----------------------------------------------------------------------------------------------------------------------------------------------------------------------- | -------------- |
| Canal (Default) | [Flannel v0.21.3](https://github.com/k3s-io/flannel/releases/tag/v0.21.3)<br/>[Calico v3.25.0](https://projectcalico.docs.tigera.io/archive/v3.25/release-notes/#v3250) | Yes            |
| Calico          | [v3.25.0](https://projectcalico.docs.tigera.io/archive/v3.25/release-notes/#v3250)                                                                                      | No             |
| Cilium          | [v1.13.0](https://github.com/cilium/cilium/releases/tag/v1.13.0)                                                                                                        | No             |
| Multus          | [v3.9.3](https://github.com/k8snetworkplumbingwg/multus-cni/releases/tag/v3.9.3)                                                                                        | No             |

## Helpful Links

As always, we welcome and appreciate feedback from our community of users. Please feel free to:
- [Open issues here](https://github.com/rancher/rke2/issues/new)
- [Join our Slack channel](https://slack.rancher.io/)
- [Check out our documentation](https://docs.rke2.io) for guidance on how to get started.

-----
# Release v1.26.2+rke2r1
<!-- v1.26.2+rke2r1 -->

This release updates Kubernetes to v1.26.2, and fixes a number of issues.

**Important Note**

If your server (control-plane) nodes were not started with the `--token` CLI flag or config file key, a randomized token was generated during initial cluster startup. This key is used both for joining new nodes to the cluster, and for encrypting cluster bootstrap data within the datastore. Ensure that you retain a copy of this token, as is required when restoring from backup.

You may retrieve the token value from any server already joined to the cluster:
```bash
cat /var/lib/rancher/rke2/server/token
```

## Changes since v1.26.1+rke2r1:

